source,target,title,query,index
user ask the researcher. tubaraorj gmail  not shared switch accounts. list all web queries for the task that you could recall for example keywords that. waa juin bigemsn srr. task ask the researcher. hitps docs google  forms faipqlsthh gpdelkqxyrvxjac klpgladyo hkmfsog viewform fbzx. </s>this content neither created nor endorsed google report abuse terms service privacy policy. your response has been recorded. hps docsgoogle  forms faipqlsthh gpdelkqxyrvxjic klpgladyo hkmfsog formresponse. </s>assuming you support the use cannabis for medical reasons what are the possible.  wikipedia  wiki cannabis the united kingdom. substances act csa alongside heroin this classification says that the substances have. you are joining debating society and need some notes make presentation the topic,please fill out this field. example wikipedia who int. ris reoe lse iererrs rlprovide several sources the web pages site names that you could recall for. provide estimated time when you performed task for example two days. kids are around relatives are around. you used for google search before lab test. cannabis medical use benefit. this content neither created nor endorsed google report abuse terms service privacy policy. ago wednesday last week. draft savedivour answer saving draft saved saving list all web queries for the task that you could recall for example keywords that. something else that you could recall optional for example home work. user ask the researcher. your answercanadd wikileaks fda govlaniaus hisuilal ust ushshl. task ask the researcher. provide several sources the web pages site names that you could recall for. your response has been recorded. cannabis pros cons legalized. hitps docs google  forms faipqlsintxzo fpvcrverjduohcfa wusk pgnhaxpbplyftp formresponse. canada wikileaks fda gov. hitps docsgoogle  forms faipqlsnxzo fpvcrverj uchcfa wusk pgnhaxpsplyftp viewform. list all web queries for the task that you could recall for example keywords that. your answer something else that you could recall. cannabis medical use pros and cons. kids are around relatives are around after going the grocery store etc. tubaraorj gmail  not shared switch accounts. list all web queries for the task that you could recall for example keywords that tubaraorj gmail  not shared switch accounts. example wikipedia who int newspaper,Part B - recall test - Google Chrome,,270
please fill out this field. example wikipedia who int. ris reoe lse iererrs rlprovide several sources the web pages site names that you could recall for. provide estimated time when you performed task for example two days. kids are around relatives are around. you used for google search before lab test. cannabis medical use benefit. this content neither created nor endorsed google report abuse terms service privacy policy. ago wednesday last week. draft savedivour answer saving draft saved saving list all web queries for the task that you could recall for example keywords that. something else that you could recall optional for example home work. user ask the researcher. your answercanadd wikileaks fda govlaniaus hisuilal ust ushshl. task ask the researcher. provide several sources the web pages site names that you could recall for. your response has been recorded. cannabis pros cons legalized. hitps docs google  forms faipqlsintxzo fpvcrverjduohcfa wusk pgnhaxpbplyftp formresponse. canada wikileaks fda gov. hitps docsgoogle  forms faipqlsnxzo fpvcrverj uchcfa wusk pgnhaxpsplyftp viewform. list all web queries for the task that you could recall for example keywords that. your answer something else that you could recall. cannabis medical use pros and cons. kids are around relatives are around after going the grocery store etc. tubaraorj gmail  not shared switch accounts. list all web qu, forms gle grsvzteshwspetd. junk email  forms gle jomayjhdtcqovant. your browser supports setting outlook  the default email handler try now ask again later don show aga. how anxious worried stressed calm relaxed did you feel right now for example. this content neither created nor endorsed google report abuse terms service privacy policy. high mental effort the amount mental activity that was required for example low was easy. relaxedne ask makes ense pecause time snott was tine aoing task. the amount mental activity that was required for example low was easy. hitps docs google  forms faipqlsaayotisyrf jyi zncsutkxf hkamq cokz efnbepng formresponse. whether the task was easy demanding simple plex for example given. how successful you think you were doing what asked you for. the task slow and fine rushed too fast and rushed. example could manage recall find the web queries web pages that. scheduled  forms gle qzaf dlncwwaub. hitps docs google  forms faipqlsaayotisyrf zncsutkxf hkamq cokz efnbepng viewform. task ask the researcher. your response has been recorded.  forms gle rdypxnu wgrwnps. recall questionnaire pre test part. frantic rushed the amount time pressure you felt given the time minutes was. how tired weary worn out exhausted fresh energetic did you feel for example. tracking mouse cursor and mouse movement was easy nothing really makes. user study about information refind. drafts recall questionnaire post test part. provides what wanted high was difficult recall all the web queries. because the remender system have look and down. how satisfied were you with what you acplished for example although. the task relaxing then you don feel exhausted the task tense you. tense low physical effort. physically tired high eye movement mouse movement make tired can. htips docsgoogle  forms faipqlsaayotisyrf jyi zncsutkxf hkamq cokz efnb png viewform usp send_form. the amount time pressure you felt given the time minutes was. folders vuong vuong helsinki. minutes but with without remender system whether was difficult. could not recall all web queries web content but happy with the,Workload - Task Performance - Google Chrome,,271
 forms gle grsvzteshwspetd. junk email  forms gle jomayjhdtcqovant. your browser supports setting outlook  the default email handler try now ask again later don show aga. how anxious worried stressed calm relaxed did you feel right now for example. this content neither created nor endorsed google report abuse terms service privacy policy. high mental effort the amount mental activity that was required for example low was easy. relaxedne ask makes ense pecause time snott was tine aoing task. the amount mental activity that was required for example low was easy. hitps docs google  forms faipqlsaayotisyrf jyi zncsutkxf hkamq cokz efnbepng formresponse. whether the task was easy demanding simple plex for example given. how successful you think you were doing what asked you for. the task slow and fine rushed too fast and rushed. example could manage recall find the web queries web pages that. scheduled  forms gle qzaf dlncwwaub. hitps docs google  forms faipqlsaayotisyrf zncsutkxf hkamq cokz efnbepng viewform. task ask the researcher. your response has been recorded.  forms gle rdypxnu wgrwnps. recall questionnaire pre test part. frantic rushed the amount time pressure you felt given the time minutes was. how tired weary worn out exhausted fresh energetic did you feel for example. tracking mouse cursor and mouse movement was easy nothing really makes. user study about information refind. d,the task makes tense because time short was fine doing the task. the task relaxing then you don feel exhausted the task tense you. how tired weary worn out exhausted fresh energetic did you feel for example.  docsgoogle  forms faipqlsaayotisyrf zncsu kxf hkama cokz efnespng viewform fbzx. how anxious worried stressed calm relaxed did you feel right now for example,Workload - Task Performance - Google Chrome,,275
the task makes tense because time short was fine doing the task. the task relaxing then you don feel exhausted the task tense you. how tired weary worn out exhausted fresh energetic did you feel for example.  docsgoogle  forms faipqlsaayotisyrf zncsu kxf hkama cokz efnespng viewform fbzx. how anxious worried stressed calm relaxed did you feel right now for example. </s> forms gle grsvzteshwspetd. junk email  forms gle jomayjhdtcqovant. your browser supports setting outlook  the default email handler try now ask again later don show aga. how anxious worried stressed calm relaxed did you feel right now for example. this content neither created nor endorsed google report abuse terms service privacy policy. high mental effort the amount mental activity that was required for example low was easy. relaxedne ask makes ense pecause time snott was tine aoing task. the amount mental activity that was required for example low was easy. hitps docs google  forms faipqlsaayotisyrf jyi zncsutkxf hkamq cokz efnbepng formresponse. whether the task was easy demanding simple plex for example given. how successful you think you were doing what asked you for. the task slow and fine rushed too fast and rushed. example could manage recall find the web queries web pages that. scheduled  forms gle qzaf dlncwwaub. hitps docs google  forms faipqlsaayotisyrf zncsutkxf hkamq cokz efnbepng viewform. task ask the r,user ask the researcher. tubaraorj gmail  not shared switch accounts. list all web queries for the task that you could recall for example keywords that.  docsgoogle  forms faipqlsfhh rkv gpdel kaxyrvxiic klpgladyo hkmfsog viewform fbzx. task ask the researcher,Part A - recall test - Google Chrome,,276
user ask the researcher. tubaraorj gmail  not shared switch accounts. list all web queries for the task that you could recall for example keywords that.  docsgoogle  forms faipqlsfhh rkv gpdel kaxyrvxiic klpgladyo hkmfsog viewform fbzx. task ask the researcher. </s>the task makes tense because time short was fine doing the task. the task relaxing then you don feel exhausted the task tense you. how tired weary worn out exhausted fresh energetic did you feel for example.  docsgoogle  forms faipqlsaayotisyrf zncsu kxf hkama cokz efnespng viewform fbzx. how anxious worried stressed calm relaxed did you feel right now for example. </s> forms gle grsvzteshwspetd. junk email  forms gle jomayjhdtcqovant. your browser supports setting outlook  the default email handler try now ask again later don show aga. how anxious worried stressed calm relaxed did you feel right now for example. this content neither created nor endorsed google report abuse terms service privacy policy. high mental effort the amount mental activity that was required for example low was easy. relaxedne ask makes ense pecause time snott was tine aoing task. the amount mental activity that was required for example low was easy. hitps docs google  forms faipqlsaayotisyrf jyi zncsutkxf hkamq cokz efnbepng formresponse. whether the task was easy demanding simple plex for example given. how successful you think you were doing what,list all web queries for the task that you could recall for example keywords thata tubaraorj gmail  not shared switch accounts saving. user ask the researcher. hitps docsgoogle  forms faipqlsfhh rkv gpdel koxyrvxiic utkl pgladyo hkmfsog viewform. tubaraorj gmail  not shared switch accounts. task ask the researcher tubaraorj gmail  not shared switch accounts draft saved. list all web queries for the task that you could recall for example keywords that. task ask the researcher,Part A - recall test - Google Chrome,,279
list all web queries for the task that you could recall for example keywords thata tubaraorj gmail  not shared switch accounts saving. user ask the researcher. hitps docsgoogle  forms faipqlsfhh rkv gpdel koxyrvxiic utkl pgladyo hkmfsog viewform. tubaraorj gmail  not shared switch accounts. task ask the researcher tubaraorj gmail  not shared switch accounts draft saved. list all web queries for the task that you could recall for example keywords that. task ask the researcher. </s>user ask the researcher. tubaraorj gmail  not shared switch accounts. list all web queries for the task that you could recall for example keywords that.  docsgoogle  forms faipqlsfhh rkv gpdel kaxyrvxiic klpgladyo hkmfsog viewform fbzx. task ask the researcher. </s>the task makes tense because time short was fine doing the task. the task relaxing then you don feel exhausted the task tense you. how tired weary worn out exhausted fresh energetic did you feel for example.  docsgoogle  forms faipqlsaayotisyrf zncsu kxf hkama cokz efnespng viewform fbzx. how anxious worried stressed calm relaxed did you feel right now for example,spirit the games  docs google  document ythipwykknusta ikpjvxk edit,Task 2 - Culture (No Index).docx - Google Docs - Google Chrome,,280
spirit the games  docs google  document ythipwykknusta ikpjvxk edit. </s>list all web queries for the task that you could recall for example keywords thata tubaraorj gmail  not shared switch accounts saving. user ask the researcher. hitps docsgoogle  forms faipqlsfhh rkv gpdel koxyrvxiic utkl pgladyo hkmfsog viewform. tubaraorj gmail  not shared switch accounts. task ask the researcher tubaraorj gmail  not shared switch accounts draft saved. list all web queries for the task that you could recall for example keywords that. task ask the researcher. </s>user ask the researcher. tubaraorj gmail  not shared switch accounts. list all web queries for the task that you could recall for example keywords that.  docsgoogle  forms faipqlsfhh rkv gpdel kaxyrvxiic klpgladyo hkmfsog viewform fbzx. task ask the researcher,user ask the researcher. hitps docsgoogle  forms faipqlsfhh rkv gpdel koxyrvxiic utkl pgladyo hkmfsog viewform. tubaraorj gmail  not shared switch accounts draft saved. list all web queries for the task that you could recall for example keywords that. task ask the researcher,Part A - recall test - Google Chrome,,282
user ask the researcher. hitps docsgoogle  forms faipqlsfhh rkv gpdel koxyrvxiic utkl pgladyo hkmfsog viewform. tubaraorj gmail  not shared switch accounts draft saved. list all web queries for the task that you could recall for example keywords that. task ask the researcher. </s>spirit the games  docs google  document ythipwykknusta ikpjvxk edit. </s>list all web queries for the task that you could recall for example keywords thata tubaraorj gmail  not shared switch accounts saving. user ask the researcher. hitps docsgoogle  forms faipqlsfhh rkv gpdel koxyrvxiic utkl pgladyo hkmfsog viewform. tubaraorj gmail  not shared switch accounts. task ask the researcher tubaraorj gmail  not shared switch accounts draft saved. list all web queries for the task that you could recall for example keywords that. task ask the researcher,games wants attend the events and asks you join this trip you find this invitation,Task 2 - Culture (No Index).docx - Google Docs - Google Chrome,,284
games wants attend the events and asks you join this trip you find this invitation. </s>user ask the researcher. hitps docsgoogle  forms faipqlsfhh rkv gpdel koxyrvxiic utkl pgladyo hkmfsog viewform. tubaraorj gmail  not shared switch accounts draft saved. list all web queries for the task that you could recall for example keywords that. task ask the researcher. </s>spirit the games  docs google  document ythipwykknusta ikpjvxk edit,provide estimated time when you performed task for example two days. you used for google search before lab test. this content neither created nor endorsed google report abuse terms service privacy policy. tubaraorj gmail  not shared switch accounts saving. ago wednesday last week. something else that you could recall optional for example home work. user ask the researcher. hitps docsgoogle  forms faipqlsfhh rkv gpdel koxyrvxiic utkl pgladyo hkmfsog viewform. winter olympic games wiki. your response has been recorded. task ask the researcher. provide several sources the web pages site names that you could recall for. summer olympic games wiki. list all web queries for the task that you could recall for example keywords that. top tourist attractions tokyo. list all web queries for the task that you could recall for example keywords that list all web queries for the task that you could recall for example keywords that. example wikipedia who int newspaper. your answerwikipediatokyo olympics schedule. kids are around relatives are around after went grocery store etc days ago hitps docsgoogle  forms faipqlsthh rkvegpdel kaxyrvxiic klpgladyo hkmfsog formresponse,Part A - recall test - Google Chrome,,285
provide estimated time when you performed task for example two days. you used for google search before lab test. this content neither created nor endorsed google report abuse terms service privacy policy. tubaraorj gmail  not shared switch accounts saving. ago wednesday last week. something else that you could recall optional for example home work. user ask the researcher. hitps docsgoogle  forms faipqlsfhh rkv gpdel koxyrvxiic utkl pgladyo hkmfsog viewform. winter olympic games wiki. your response has been recorded. task ask the researcher. provide several sources the web pages site names that you could recall for. summer olympic games wiki. list all web queries for the task that you could recall for example keywords that. top tourist attractions tokyo. list all web queries for the task that you could recall for example keywords that list all web queries for the task that you could recall for example keywords that. example wikipedia who int newspaper. your answerwikipediatokyo olympics schedule. kids are around relatives are around after went grocery store etc days ago hitps docsgoogle  forms faipqlsthh rkvegpdel kaxyrvxiic klpgladyo hkmfsog formresponse. </s>games wants attend the events and asks you join this trip you find this invitation. </s>user ask the researcher. hitps docsgoogle  forms faipqlsfhh rkv gpdel koxyrvxiic utkl pgladyo hkmfsog viewform. tubaraorj gmail  not shared ,hitps docsgoogle  document ythipw.  docs google  document ythipw,Task 2 - Culture (No Index).docx - Google Docs - Google Chrome,,288
hitps docsgoogle  document ythipw.  docs google  document ythipw. </s>provide estimated time when you performed task for example two days. you used for google search before lab test. this content neither created nor endorsed google report abuse terms service privacy policy. tubaraorj gmail  not shared switch accounts saving. ago wednesday last week. something else that you could recall optional for example home work. user ask the researcher. hitps docsgoogle  forms faipqlsfhh rkv gpdel koxyrvxiic utkl pgladyo hkmfsog viewform. winter olympic games wiki. your response has been recorded. task ask the researcher. provide several sources the web pages site names that you could recall for. summer olympic games wiki. list all web queries for the task that you could recall for example keywords that. top tourist attractions tokyo. list all web queries for the task that you could recall for example keywords that list all web queries for the task that you could recall for example keywords that. example wikipedia who int newspaper. your answerwikipediatokyo olympics schedule. kids are around relatives are around after went grocery store etc days ago hitps docsgoogle  forms faipqlsthh rkvegpdel kaxyrvxiic klpgladyo hkmfsog formresponse. </s>games wants attend the events and asks you join this trip you find this invitation,bax. the has the final decision the specifications each design for all olympic medals including the summer games. games pointing out that the long standing feature the front medals was mistakenly depicting the roman colosseum. designer the medal wojciech pietranik had originally featured the sydney opera house the obverse instead. larger thicker and heavier than those for the summer games. medal designs have varied considerably since the games particularly the size the medals for the summer. olympic host and numeral updated the obverse remained true the trionfo design until the summer olympics. olympic motto citius altius fortius features four winter games medals but does not appear any summer games. from wikipedia the free encyclopedia. laid out detail the olympic protocols. except for the games have been circular the shapes the winter games have been considerably more varied the. summer olympics athens this new obverse design remains use. the background the top ngm section the medal space was left for the name the olympic host and the games. the german olympic mittee nationales olympisches komitee fiir deutschland was the first summer games anizer. numeral the reverse features crowd people carrying triumphant athlete his winning design was first presented the. olympic winter games medals fron. there has been greater variety design for the winter games unlike the summer games the ioc never mandated. victory podium pdf international. the nike motif but allowed other aspects change. games athens the result controversy surrounding the use the roman colosseum rather than building. the trend ended after due the negative reaction the medal design for the summer olympics sydney the. sydney anizing mittee decided continue with the design was noting that there was insufficient time plete,Olympic medal - Wikipedia - Google Chrome,how many gold medals were made for the olympics - google-haku - google chrome,291
bax. the has the final decision the specifications each design for all olympic medals including the summer games. games pointing out that the long standing feature the front medals was mistakenly depicting the roman colosseum. designer the medal wojciech pietranik had originally featured the sydney opera house the obverse instead. larger thicker and heavier than those for the summer games. medal designs have varied considerably since the games particularly the size the medals for the summer. olympic host and numeral updated the obverse remained true the trionfo design until the summer olympics. olympic motto citius altius fortius features four winter games medals but does not appear any summer games. from wikipedia the free encyclopedia. laid out detail the olympic protocols. except for the games have been circular the shapes the winter games have been considerably more varied the. summer olympics athens this new obverse design remains use. the background the top ngm section the medal space was left for the name the olympic host and the games. the german olympic mittee nationales olympisches komitee fiir deutschland was the first summer games anizer. numeral the reverse features crowd people carrying triumphant athlete his winning design was first presented the. olympic winter games medals fron. there has been greater variety design for the winter games unlike the summer games the ioc,oymp lister winter workic task slacks extension. games wants attend the events and asks you join this trip you find this invitation,Task 2 - Culture (No Index).docx - Google Docs - Google Chrome,,293
oymp lister winter workic task slacks extension. games wants attend the events and asks you join this trip you find this invitation. </s>bax. the has the final decision the specifications each design for all olympic medals including the summer games. games pointing out that the long standing feature the front medals was mistakenly depicting the roman colosseum. designer the medal wojciech pietranik had originally featured the sydney opera house the obverse instead. larger thicker and heavier than those for the summer games. medal designs have varied considerably since the games particularly the size the medals for the summer. olympic host and numeral updated the obverse remained true the trionfo design until the summer olympics. olympic motto citius altius fortius features four winter games medals but does not appear any summer games. from wikipedia the free encyclopedia. laid out detail the olympic protocols. except for the games have been circular the shapes the winter games have been considerably more varied the. summer olympics athens this new obverse design remains use. the background the top ngm section the medal space was left for the name the olympic host and the games. the german olympic mittee nationales olympisches komitee fiir deutschland was the first summer games anizer. numeral the reverse features crowd people carrying triumphant athlete his winning design was first pr, enwikipedia  wiki winter olympic games mail bparts. lstof winter workic task. japanese will offer during the games find for instance. eski woym lstol winte work task slacks exten. find information about the events sight. how many times has japan hosted the olympics. games wants attend the events and asks you join this trip you find this invitation. how many times has japan hosted the oly. wants attend the events and asks you.  enwikipedia  wiki winter olympic games. times summer olympics oym listol winte work tsk slacks exe. eng you are not big fan the games but,Task 2 - Culture (No Index).docx - Google Docs - Google Chrome,,296
