source,target,title,query,index
that long ago but going back that process now seems archaic. tracking the phone the phone user location has bee very important facet these sensors thu. accelerometer senses direction and speed which tied movement and location however the most. and think all that can fit the palm your hand how does location tracking work. well the gps chip the phone other electronic device pletely separate chip than your cellular. did you try locate nearby roads and points interest map figure out where you were wasn. you move from place place gps updates your location real time this requires constant signals. the gps chip only responsible for receiving signals from satellites receiver does not transmit. and think all that can fit the palm your hand. wifi and bluetooth chips doesn send data cell towers your wifi network other devices other. barometer proximity sensor ambient light sensor microphone touchscreen sensors pedometer.   defendershield  gps emf why you should shouldnt worried location tracking. way back before smartphones you couldn leave for road trip without page step step. now the ability pinpoint location and provide directions wrapped the same device use. accelerometer and the values creates determine distance translated the number steps the. animal collars the list goes and. endless number apps use gps help better serve their functions much that don think. apps your phone are responsible,leap fitness step counter. task technology index saving.  forum xda developers  tags gps application. acplish new tasks provide new services.   gps forums  forums gps software,Task 4 - Technology (No Index).docx - Google Docs - Google Chrome,,126
leap fitness step counter. task technology index saving.  forum xda developers  tags gps application. acplish new tasks provide new services.   gps forums  forums gps software. </s>that long ago but going back that process now seems archaic. tracking the phone the phone user location has bee very important facet these sensors thu. accelerometer senses direction and speed which tied movement and location however the most. and think all that can fit the palm your hand how does location tracking work. well the gps chip the phone other electronic device pletely separate chip than your cellular. did you try locate nearby roads and points interest map figure out where you were wasn. you move from place place gps updates your location real time this requires constant signals. the gps chip only responsible for receiving signals from satellites receiver does not transmit. and think all that can fit the palm your hand. wifi and bluetooth chips doesn send data cell towers your wifi network other devices other. barometer proximity sensor ambient light sensor microphone touchscreen sensors pedometer.   defendershield  gps emf why you should shouldnt worried location tracking. way back before smartphones you couldn leave for road trip without page step step. now the ability pinpoint location and provide directions wrapped the same device use. accelerometer and the values creates determine distance ,leap fitness step counter. developers gps application forum. why there such such radiation threat health yes why that,Task 4 - Technology (No Index).docx - Google Docs - Google Chrome,,128
leap fitness step counter. developers gps application forum. why there such such radiation threat health yes why that. </s>leap fitness step counter. task technology index saving.  forum xda developers  tags gps application. acplish new tasks provide new services.   gps forums  forums gps software. </s>that long ago but going back that process now seems archaic. tracking the phone the phone user location has bee very important facet these sensors thu. accelerometer senses direction and speed which tied movement and location however the most. and think all that can fit the palm your hand how does location tracking work. well the gps chip the phone other electronic device pletely separate chip than your cellular. did you try locate nearby roads and points interest map figure out where you were wasn. you move from place place gps updates your location real time this requires constant signals. the gps chip only responsible for receiving signals from satellites receiver does not transmit. and think all that can fit the palm your hand. wifi and bluetooth chips doesn send data cell towers your wifi network other devices other. barometer proximity sensor ambient light sensor microphone touchscreen sensors pedometer.   defendershield  gps emf why you should shouldnt worried location tracking. way back before smartphones you couldn leave for road trip without page step step. now the ability pin,the puter systems that run our finances munications and. direction these satellite systems even guide bine harvesters. and fact that gps hugely accurate and important tool. power grids are mostly keyed gps time signals the trucks. true addiction global positioning satellite system gps. are addicted gps and this addiction puts danger. neighborhood never been before without worry delay. isn melodramatic tragic alcoholism opioid addiction.   thedailybeast  gps dangerous your health. can hear the protests already what you mean use all the. gps dangerous your health. they slash their way back and forth across the iowa cornfields. ships and aircraft that make merce possible rely gps. gps systems and apps have made getting lost thing the past but that scientists say not. such good thing for humans hardwired explore makes word dumber. time great can drive the kids their sleepover. keep watching the stars,Is GPS Dangerous to Your Health? - Google Chrome,gps radiaton health issues - google-haku - google chrome,129
the puter systems that run our finances munications and. direction these satellite systems even guide bine harvesters. and fact that gps hugely accurate and important tool. power grids are mostly keyed gps time signals the trucks. true addiction global positioning satellite system gps. are addicted gps and this addiction puts danger. neighborhood never been before without worry delay. isn melodramatic tragic alcoholism opioid addiction.   thedailybeast  gps dangerous your health. can hear the protests already what you mean use all the. gps dangerous your health. they slash their way back and forth across the iowa cornfields. ships and aircraft that make merce possible rely gps. gps systems and apps have made getting lost thing the past but that scientists say not. such good thing for humans hardwired explore makes word dumber. time great can drive the kids their sleepover. keep watching the stars. </s>leap fitness step counter. developers gps application forum. why there such such radiation threat health yes why that. </s>leap fitness step counter. task technology index saving.  forum xda developers  tags gps application. acplish new tasks provide new services.   gps forums  forums gps software,acplish new tasks provide new services. does the use gps pose radiation threats the user health.   gps forums  forums gps software,Task 4 - Technology (No Index).docx - Google Docs - Google Chrome,,130
acplish new tasks provide new services. does the use gps pose radiation threats the user health.   gps forums  forums gps software. </s>the puter systems that run our finances munications and. direction these satellite systems even guide bine harvesters. and fact that gps hugely accurate and important tool. power grids are mostly keyed gps time signals the trucks. true addiction global positioning satellite system gps. are addicted gps and this addiction puts danger. neighborhood never been before without worry delay. isn melodramatic tragic alcoholism opioid addiction.   thedailybeast  gps dangerous your health. can hear the protests already what you mean use all the. gps dangerous your health. they slash their way back and forth across the iowa cornfields. ships and aircraft that make merce possible rely gps. gps systems and apps have made getting lost thing the past but that scientists say not. such good thing for humans hardwired explore makes word dumber. time great can drive the kids their sleepover. keep watching the stars. </s>leap fitness step counter. developers gps application forum. why there such such radiation threat health yes why that,  idagov radiation emitting products cell phones radio frequency radiation and cell phones. cell phones emit low levels non ionizing radiation while use. for more detailed description radio frequency radiation see microwaves. phones and smart radio frequency radiation type electromagnetic radiation which. phones radar remole bulb bed machine elements. recognized biological effect radiofrequency radiation humans heating. for more information about radio frequency safety see the fcc safety. electric heater operates heating metal wires and the wires radiate that energy. radiowaves microwaves infrared ultraviolet. radiation not carcinogen and below the radio frequency exposure limit. for more information about the electromagnetic spectrum see nasa tour. non ionizing radiation increases cancer risk humans the only consistently. stated the national cancer institute there currently consistent evidence. medical devices ray images for diagnosis lot ionizing radiation needed kill. official website the united states government here how you know. bonds strip electrons from atoms scientific consensus shows that non ionizir. radiation emitted cell phones also referred radio frequency. radio frequency radiation and cell phc. cell radiation energy that es from source and travels through space for example. radio frequency radiation and cell phones. pacemaker and bination electric and magnetic fields that move through space together. contrast non ionizing radiation does not have enough energy break chemi. about fda website policies privacy. waves and other types radiofrequency radiation from the american car. home radiation emitting products radiation emitting products and procedures home business and entertainment products cell. electromagnetic spectrum ray radioactive. eda archive visitor information. medical devices   idagov radiation emitting products cell phones radio frequency radiation and cell phones. raq ation emitrea cell pnones also rererred raaio irequency. share tweet linkedin email print. the fcc non ionizing radiation has not been shown cause any harm peopls. other implanted electromagnetic radiation falls into two categories,Radio Frequency Radiation and Cell Phones | FDA - Google Chrome,gps radiaton health issues - google-haku - google chrome,131
  idagov radiation emitting products cell phones radio frequency radiation and cell phones. cell phones emit low levels non ionizing radiation while use. for more detailed description radio frequency radiation see microwaves. phones and smart radio frequency radiation type electromagnetic radiation which. phones radar remole bulb bed machine elements. recognized biological effect radiofrequency radiation humans heating. for more information about radio frequency safety see the fcc safety. electric heater operates heating metal wires and the wires radiate that energy. radiowaves microwaves infrared ultraviolet. radiation not carcinogen and below the radio frequency exposure limit. for more information about the electromagnetic spectrum see nasa tour. non ionizing radiation increases cancer risk humans the only consistently. stated the national cancer institute there currently consistent evidence. medical devices ray images for diagnosis lot ionizing radiation needed kill. official website the united states government here how you know. bonds strip electrons from atoms scientific consensus shows that non ionizir. radiation emitted cell phones also referred radio frequency. radio frequency radiation and cell phc. cell radiation energy that es from source and travels through space for example. radio frequency radiation and cell phones. pacemaker and bination electric and magnetic fields t,hitps  healthtechzone  topics healthcare articles gps our health htm hitps  healthtechzone  topics healthcare articles gps our health htmhome,https://www.healthtechzone.com/topics/healthcare/articles/2019/08/12/442948-gps-our-health.htm - Google Chrome,gps radiation health issues - google-haku - google chrome,132
hitps  healthtechzone  topics healthcare articles gps our health htm hitps  healthtechzone  topics healthcare articles gps our health htmhome. </s>  idagov radiation emitting products cell phones radio frequency radiation and cell phones. cell phones emit low levels non ionizing radiation while use. for more detailed description radio frequency radiation see microwaves. phones and smart radio frequency radiation type electromagnetic radiation which. phones radar remole bulb bed machine elements. recognized biological effect radiofrequency radiation humans heating. for more information about radio frequency safety see the fcc safety. electric heater operates heating metal wires and the wires radiate that energy. radiowaves microwaves infrared ultraviolet. radiation not carcinogen and below the radio frequency exposure limit. for more information about the electromagnetic spectrum see nasa tour. non ionizing radiation increases cancer risk humans the only consistently. stated the national cancer institute there currently consistent evidence. medical devices ray images for diagnosis lot ionizing radiation needed kill. official website the united states government here how you know. bonds strip electrons from atoms scientific consensus shows that non ionizir. radiation emitted cell phones also referred radio frequency. radio frequency radiation and cell phc. cell radiation energy that es ,acplish new tasks provide new services. does the use gps pose radiation threats the user health.   gps forums  forums gps software,Task 4 - Technology (No Index).docx - Google Docs - Google Chrome,,134
acplish new tasks provide new services. does the use gps pose radiation threats the user health.   gps forums  forums gps software. </s>hitps  healthtechzone  topics healthcare articles gps our health htm hitps  healthtechzone  topics healthcare articles gps our health htmhome. </s>  idagov radiation emitting products cell phones radio frequency radiation and cell phones. cell phones emit low levels non ionizing radiation while use. for more detailed description radio frequency radiation see microwaves. phones and smart radio frequency radiation type electromagnetic radiation which. phones radar remole bulb bed machine elements. recognized biological effect radiofrequency radiation humans heating. for more information about radio frequency safety see the fcc safety. electric heater operates heating metal wires and the wires radiate that energy. radiowaves microwaves infrared ultraviolet. radiation not carcinogen and below the radio frequency exposure limit. for more information about the electromagnetic spectrum see nasa tour. non ionizing radiation increases cancer risk humans the only consistently. stated the national cancer institute there currently consistent evidence. medical devices ray images for diagnosis lot ionizing radiation needed kill. official website the united states government here how you know. bonds strip electrons from atoms scientific consensus shows that non ioni,leap fitness step counter. fact that the gps device only receives signals doesn transmit them the signals. true gps has few dozen satellites its possession which happen orbit around the,Task 4 - Technology (No Index).docx - Google Docs - Google Chrome,,136
leap fitness step counter. fact that the gps device only receives signals doesn transmit them the signals. true gps has few dozen satellites its possession which happen orbit around the. </s>acplish new tasks provide new services. does the use gps pose radiation threats the user health.   gps forums  forums gps software. </s>hitps  healthtechzone  topics healthcare articles gps our health htm hitps  healthtechzone  topics healthcare articles gps our health htmhome, support google  answer check this page.   smartertravel  use nna tama page,Task 4 - Technology (No Index).docx - Google Docs - Google Chrome,mobile phone gps tips - google-haku - google chrome,137
 support google  answer check this page.   smartertravel  use nna tama page. </s>leap fitness step counter. fact that the gps device only receives signals doesn transmit them the signals. true gps has few dozen satellites its possession which happen orbit around the. </s>acplish new tasks provide new services. does the use gps pose radiation threats the user health.   gps forums  forums gps software,weil uie gis gillp pioie outet bieguonig uevige goitpisiety separate,Task 4 - Technology (No Index).docx - Google Docs - Google Chrome,reduce mobile phone radiation - google-haku - google chrome,138
weil uie gis gillp pioie outet bieguonig uevige goitpisiety separate. </s> support google  answer check this page.   smartertravel  use nna tama page. </s>leap fitness step counter. fact that the gps device only receives signals doesn transmit them the signals. true gps has few dozen satellites its possession which happen orbit around the,use airplane mode for gaming for your child. gives you departure and arrival times for driving. limit calls low network area. change link sharing options,Task 4 - Technology (No Index).docx - Google Docs - Google Chrome,reduce mobile phone radiation - google-haku - google chrome,139
use airplane mode for gaming for your child. gives you departure and arrival times for driving. limit calls low network area. change link sharing options. </s>weil uie gis gillp pioie outet bieguonig uevige goitpisiety separate. </s> support google  answer check this page.   smartertravel  use nna tama page,clipboard font alignment number styles cells. version created last time the user. ones you wish keep. calibri ditch siwepted general. paste merge center conditional formats cell insert delete. format painter formatting table styles. version created from the last. excel ecovered olwng fles savethe,Microsoft Excel (Product Activation Failed) - Book1,,140
clipboard font alignment number styles cells. version created last time the user. ones you wish keep. calibri ditch siwepted general. paste merge center conditional formats cell insert delete. format painter formatting table styles. version created from the last. excel ecovered olwng fles savethe. </s>use airplane mode for gaming for your child. gives you departure and arrival times for driving. limit calls low network area. change link sharing options. </s>weil uie gis gillp pioie outet bieguonig uevige goitpisiety separate,betfair __deplwithdr _saldo __tot winning days days day. cipboard font alignment number styles cells. clipboard font alignment number styles cells. verslan creatad from tha last tat. blz merge center rnvam. uay toe vrn jegays gddys oay. ones you wish keep. _da betfair __deplwithdr _saldo __tot winning avg day days days day. virslon cratod from the taee alt tat. versioerestad from the last. covered the following files save the. excel has recovered the following files save the. sion created last time the use. aial wrap text number. ecowerd the liing hisagsavetia. soicraatatt the iac tat. new you can use. paiter merge center foimals. you need format the. vsl reatod from task tat. _da betfair __deplwithdr _saldo __tot winning avg day days days. verslan creatad from tha last. ssoicrantart froh the iast tat. version created last time the user. sion created from the last aut. ditional formatas cell insert delete,Microsoft Excel (Product Activation Failed) - betting_betfairmaven.xlsx,,141
betfair __deplwithdr _saldo __tot winning days days day. cipboard font alignment number styles cells. clipboard font alignment number styles cells. verslan creatad from tha last tat. blz merge center rnvam. uay toe vrn jegays gddys oay. ones you wish keep. _da betfair __deplwithdr _saldo __tot winning avg day days days day. virslon cratod from the taee alt tat. versioerestad from the last. covered the following files save the. excel has recovered the following files save the. sion created last time the use. aial wrap text number. ecowerd the liing hisagsavetia. soicraatatt the iac tat. new you can use. paiter merge center foimals. you need format the. vsl reatod from task tat. _da betfair __deplwithdr _saldo __tot winning avg day days days. verslan creatad from tha last. ssoicrantart froh the iast tat. version created last time the user. sion created from the last aut. ditional formatas cell insert delete. </s>clipboard font alignment number styles cells. version created last time the user. ones you wish keep. calibri ditch siwepted general. paste merge center conditional formats cell insert delete. format painter formatting table styles. version created from the last. excel ecovered olwng fles savethe. </s>use airplane mode for gaming for your child. gives you departure and arrival times for driving. limit calls low network area. change link sharing options,style painter merge center foials. eaeiyas ecwets memiowiog res. clipboard font alignment number styles cells. version created last time the user. gir aial swraptext number. _da betfsir __deplwithdr balance __tot winning avg day days days day. version created from tha last tat,Microsoft Excel (Product Activation Failed) - betting_betfairmaven.xlsx,,144
style painter merge center foials. eaeiyas ecwets memiowiog res. clipboard font alignment number styles cells. version created last time the user. gir aial swraptext number. _da betfsir __deplwithdr balance __tot winning avg day days days day. version created from tha last tat. </s>betfair __deplwithdr _saldo __tot winning days days day. cipboard font alignment number styles cells. clipboard font alignment number styles cells. verslan creatad from tha last tat. blz merge center rnvam. uay toe vrn jegays gddys oay. ones you wish keep. _da betfair __deplwithdr _saldo __tot winning avg day days days day. virslon cratod from the taee alt tat. versioerestad from the last. covered the following files save the. excel has recovered the following files save the. sion created last time the use. aial wrap text number. ecowerd the liing hisagsavetia. soicraatatt the iac tat. new you can use. paiter merge center foimals. you need format the. vsl reatod from task tat. _da betfair __deplwithdr _saldo __tot winning avg day days days. verslan creatad from tha last. ssoicrantart froh the iast tat. version created last time the user. sion created from the last aut. ditional formatas cell insert delete. </s>clipboard font alignment number styles cells. version created last time the user. ones you wish keep. calibri ditch siwepted general. paste merge center conditional formats cell insert delete. format ,style painter merge center foials. eaeiyas ecwets memiowiog res. clipboard font alignment number styles cells. version created last time the user. _da betfsir __deplwithdr balance __tot winning avg day days days day. arial already swapren number. version created from tha last tat,Microsoft Excel (Product Activation Failed) - betting_betfairmaven.xlsx,,148
style painter merge center foials. eaeiyas ecwets memiowiog res. clipboard font alignment number styles cells. version created last time the user. _da betfsir __deplwithdr balance __tot winning avg day days days day. arial already swapren number. version created from tha last tat. </s>style painter merge center foials. eaeiyas ecwets memiowiog res. clipboard font alignment number styles cells. version created last time the user. gir aial swraptext number. _da betfsir __deplwithdr balance __tot winning avg day days days day. version created from tha last tat. </s>betfair __deplwithdr _saldo __tot winning days days day. cipboard font alignment number styles cells. clipboard font alignment number styles cells. verslan creatad from tha last tat. blz merge center rnvam. uay toe vrn jegays gddys oay. ones you wish keep. _da betfair __deplwithdr _saldo __tot winning avg day days days day. virslon cratod from the taee alt tat. versioerestad from the last. covered the following files save the. excel has recovered the following files save the. sion created last time the use. aial wrap text number. ecowerd the liing hisagsavetia. soicraatatt the iac tat. new you can use. paiter merge center foimals. you need format the. vsl reatod from task tat. _da betfair __deplwithdr _saldo __tot winning avg day days days. verslan creatad from tha last. ssoicrantart froh the iast tat. version created last tim,value your privacy choices. new item open fselectal. examples and descriptions applications that use gps for devices such mobile. you would like explore new killer applications for mobile devices therefore you are looking. dot hyper connectivity truly upon our. gives you departure and arrival times for driving. works for many forms transportation. anize new open select. and the possibilities offered this technology have caught your interest. real time etas based traffic conditions. akai professional androidstudiopr audacity. tells you about traffic issues. phones pdas personal desktop assistants and other wireless and mobile devices. insert format tools help see new changes. ove copy delete rename new. one your friends has recently bought small handheld global positioning system gps unit,Task 4 - Technology (No Index).docx - Google Docs - Google Chrome,,150
