source,target,title,query,index
fears regarding the drugs social influence among people color led politicians criminalize across. finally proved link between cannabis and mental health anti social behavior india but the. wasn until that cannabis became prohibited substance the when mounting racist. put that the lunatic asylums india are filled with ganja smokers official inquiry. with our muceril ngeergfy further mipplcs.   dazeddigital  life culture article medicinal cannabis legalise law drugs. british government still tried ban four times before the turn the century logge code goog the called dish wilm down freef rekno how new. rticldo you miss crm. occupied territories and then eventually britain itself politicians the late century had. the british government still tried ban four times before the turn the century   dazeddigital  life culture article medicinal cannabis legalise law drugs. advertisement via antique cannabis book you miss crm. with twist you miss crm.   dazeddigital . hopkins witua new york. became obsessed with what they claimed madness caused cannabis the colonies one. </s>assuming you support the use cannabis for medical reasons what are the possible. cannabis for medical purposes what would your arguments. </s>yyou are joining debating society and need some notes make presentation the topic. which cannabis good bad. assuming you support the use cannabis for medical reasons what are the possible,was secor. wasn until that cannabis became prohibited substance the when mounting,Task 1 - Health (No Index).docx - Google Docs - Google Chrome,,14
was secor. wasn until that cannabis became prohibited substance the when mounting. </s>fears regarding the drugs social influence among people color led politicians criminalize across. finally proved link between cannabis and mental health anti social behavior india but the. wasn until that cannabis became prohibited substance the when mounting racist. put that the lunatic asylums india are filled with ganja smokers official inquiry. with our muceril ngeergfy further mipplcs.   dazeddigital  life culture article medicinal cannabis legalise law drugs. british government still tried ban four times before the turn the century logge code goog the called dish wilm down freef rekno how new. rticldo you miss crm. occupied territories and then eventually britain itself politicians the late century had. the british government still tried ban four times before the turn the century   dazeddigital  life culture article medicinal cannabis legalise law drugs. advertisement via antique cannabis book you miss crm. with twist you miss crm.   dazeddigital . hopkins witua new york. became obsessed with what they claimed madness caused cannabis the colonies one. </s>assuming you support the use cannabis for medical reasons what are the possible. cannabis for medical purposes what would your arguments,fears regarding the drugs social influence among people color led politicians criminalize acros. finally proved link between cannabis and mental health anti social behavior india but the. wasn until that cannabis became prohibited substance the when mounting racist. put that the lunatic asylums india are filled with ganja smokers official inquiry.  docs google  document. mail logge code google the called dish wilm down freef rekno how. occupied territories and then eventually britain itself politicians the late century had. hopkins witun new york.   dazeddigital  life culture article medicinal cannabis legalise law. the british government still tried ban four times before the turn the century. british government still tried ban four times before the turn the century. became obsessed with what they claimed madness caused cannabis the colonies one,A brief history of the UK law’s relationship with medicinal cannabis | Dazed - Google Chrome,,15
fears regarding the drugs social influence among people color led politicians criminalize acros. finally proved link between cannabis and mental health anti social behavior india but the. wasn until that cannabis became prohibited substance the when mounting racist. put that the lunatic asylums india are filled with ganja smokers official inquiry.  docs google  document. mail logge code google the called dish wilm down freef rekno how. occupied territories and then eventually britain itself politicians the late century had. hopkins witun new york.   dazeddigital  life culture article medicinal cannabis legalise law. the british government still tried ban four times before the turn the century. british government still tried ban four times before the turn the century. became obsessed with what they claimed madness caused cannabis the colonies one. </s>was secor. wasn until that cannabis became prohibited substance the when mounting. </s>fears regarding the drugs social influence among people color led politicians criminalize across. finally proved link between cannabis and mental health anti social behavior india but the. wasn until that cannabis became prohibited substance the when mounting racist. put that the lunatic asylums india are filled with ganja smokers official inquiry. with our muceril ngeergfy further mipplcs.   dazeddigital  life culture article medicinal cannabis legalis,eventually britain itself politicians the late century had bee,Task 1 - Health (No Index).docx - Google Docs - Google Chrome,,17
eventually britain itself politicians the late century had bee. </s>fears regarding the drugs social influence among people color led politicians criminalize acros. finally proved link between cannabis and mental health anti social behavior india but the. wasn until that cannabis became prohibited substance the when mounting racist. put that the lunatic asylums india are filled with ganja smokers official inquiry.  docs google  document. mail logge code google the called dish wilm down freef rekno how. occupied territories and then eventually britain itself politicians the late century had. hopkins witun new york.   dazeddigital  life culture article medicinal cannabis legalise law. the british government still tried ban four times before the turn the century. british government still tried ban four times before the turn the century. became obsessed with what they claimed madness caused cannabis the colonies one. </s>was secor. wasn until that cannabis became prohibited substance the when mounting,you are hitps youtu ryaxgyti. step download the software here. british government still tried ban four times before the turn the century. became obsessed with what they claimed madness caused cannabis the colonies one,Logger Installation Instruction - Google Docs - Google Chrome,,18
you are hitps youtu ryaxgyti. step download the software here. british government still tried ban four times before the turn the century. became obsessed with what they claimed madness caused cannabis the colonies one. </s>eventually britain itself politicians the late century had bee. </s>fears regarding the drugs social influence among people color led politicians criminalize acros. finally proved link between cannabis and mental health anti social behavior india but the. wasn until that cannabis became prohibited substance the when mounting racist. put that the lunatic asylums india are filled with ganja smokers official inquiry.  docs google  document. mail logge code google the called dish wilm down freef rekno how. occupied territories and then eventually britain itself politicians the late century had. hopkins witun new york.   dazeddigital  life culture article medicinal cannabis legalise law. the british government still tried ban four times before the turn the century. british government still tried ban four times before the turn the century. became obsessed with what they claimed madness caused cannabis the colonies one,  dazeddigital  life culture article medicinal cannabis lega. why was cannabis made illegal the. which cannabis good bad. ganja smokers official inquiry finally proved link between,Task 1 - Health (No Index).docx - Google Docs - Google Chrome,cannabis cons - google-haku - google chrome,19
  dazeddigital  life culture article medicinal cannabis lega. why was cannabis made illegal the. which cannabis good bad. ganja smokers official inquiry finally proved link between. </s>you are hitps youtu ryaxgyti. step download the software here. british government still tried ban four times before the turn the century. became obsessed with what they claimed madness caused cannabis the colonies one. </s>eventually britain itself politicians the late century had bee,sam y health  condition chronic pain marijuana benefits risks. get the latest updates firstr mail. amanda macmillan updated march,Marijuana Benefits and Risks: 11 Things to Know | Health.com - Google Chrome,cannabis cons - google-haku - google chrome,20
sam y health  condition chronic pain marijuana benefits risks. get the latest updates firstr mail. amanda macmillan updated march. </s>  dazeddigital  life culture article medicinal cannabis lega. why was cannabis made illegal the. which cannabis good bad. ganja smokers official inquiry finally proved link between. </s>you are hitps youtu ryaxgyti. step download the software here. british government still tried ban four times before the turn the century. became obsessed with what they claimed madness caused cannabis the colonies one,with your permission and our partners may use precise geolocation data and identification through device.   huffpost  entry real reasons marijuana banned_b_. grow operations throughout the state photographer luke sharrett bloomberg via getty images. scanning you may click consent our and our partners processing described above alternatively you may click. cocopandat adkauppa  digisha. measurement and audience insights well develop and improve products. gooc called astiz wilm dow free recnc how new mari. somebody worked all out our best interest. higher states with legalized get the latest updates first cun. study the insurance institute get the latest updates first. what are you thinking kind tasta. cardiovascular effects are low especially for healthy people but they say that. people who are high risk for heart related plications should avoid the. akentucky national guardsmen throws bushel illegal marijuana plants seized the kentucky state police cannabis. that some processing your personal data may not require your consent but you have right object such. use cannabis since can have temporary effects the cardiovascular. national guardsmen throws bushel illegal marijuana plants seized the kentucky state police cannabis.   health  condition chronic pain marijuana benefits risks. health conditions news coronavirus diet nutrition. refuse consent access more detailed information and change your preferences before consenting please note. somebody worked all out our best interest   huffpost  entry real reasons marijuana. kentucky state troopers and kentucky army national guard work together enforce marijuana laws including destroying illegal. hitps  huffpost  entry real reasons marijuana banned_b_. study the insurance institute for nghway safety found that insw. opp continue wele privacy erfor. orocess your preferences will anplv aroun websites you can chanae vour preferences anv time bvr mail loge gooc called astiz wilm dow free rekne how new mar. somebody worked all out our best interest loge conl gooc called astic wil dow free rekn how new mari. are people still sent prison for using selling. why marijuana banned the real. beauty products melta finland largest. the researchers concluded that the absolute risk cannabis related. orocess your preferences will anplv aroun websites you can chanae vour preferences anv time  huffpost  entry real reasons marijuana banned_b. beauty products melta finland biggest lazjaval. but when started through the official archives researching book chasing. eees nhst siisg gero loge conl gooc called astic wil. are worse than you think. dpailing ability count selection akikuia eloktront. across the world more and more people are asking why marijuana banned why. related surprising ways people are using cbd oil and what. cocopanda akkukauppa  digisho. what you rule swish swish. time like alcohol and cigarettes. suppression branch onto fire bronston kentucky wednesday sept funded federal grant money the. unique identifiers and standard information sent device for personalized ads and content and content. most assume because someone somewhere sat down with the scientific.  huffpost  entry real reasons marijuana banned_b.   huffpost  entry real reasons marijuana banned_b. not safe use marijuana and drive. somebody worked all out our best interest logc coal gooc called astic wil dow free rekne how new mari. claim rates for motor vehicles. doctors really think about. and our store and access information device such cookies and process personal data such. the full spectrum human relations with drugs. evidence and figured out that cannabis more harmful than other drugs use all the,Why Is Marijuana Banned? The Real Reasons Are Worse Than You Think | HuffPost - Google Chrome,why is cannabis use forbidden - google-haku - google chrome,21
with your permission and our partners may use precise geolocation data and identification through device.   huffpost  entry real reasons marijuana banned_b_. grow operations throughout the state photographer luke sharrett bloomberg via getty images. scanning you may click consent our and our partners processing described above alternatively you may click. cocopandat adkauppa  digisha. measurement and audience insights well develop and improve products. gooc called astiz wilm dow free recnc how new mari. somebody worked all out our best interest. higher states with legalized get the latest updates first cun. study the insurance institute get the latest updates first. what are you thinking kind tasta. cardiovascular effects are low especially for healthy people but they say that. people who are high risk for heart related plications should avoid the. akentucky national guardsmen throws bushel illegal marijuana plants seized the kentucky state police cannabis. that some processing your personal data may not require your consent but you have right object such. use cannabis since can have temporary effects the cardiovascular. national guardsmen throws bushel illegal marijuana plants seized the kentucky state police cannabis.   health  condition chronic pain marijuana benefits risks. health conditions news coronavirus diet nutrition. refuse consent access more detailed information and chang,reduction increased appreciation the arts including humor and music especially discerning its. cannabis and driving review the literature and mentary the united kingdom department. y wikipedia  wiki effects_of cannabis. especially dopamine and norepinephrine neurotransmitters which are closely associated with the. marijuana between and percent recreational users experience intense anxiety and. cannabis usage has been shown some studies have negative effect driving ability the bri. the largest and most precisely controlled study its kind carried out the department trans. the cannabinoid receptors results changes the levels various neurotransmitters. pensate they review driving simulator studies researchers note that even those. lasting for average four six hours after consumption llunreliable medical source  ingestion. the influence drugs alcohol,Effects of cannabis - Wikipedia - Google Chrome,cannabis cons wiki - google-haku - google chrome,22
reduction increased appreciation the arts including humor and music especially discerning its. cannabis and driving review the literature and mentary the united kingdom department. y wikipedia  wiki effects_of cannabis. especially dopamine and norepinephrine neurotransmitters which are closely associated with the. marijuana between and percent recreational users experience intense anxiety and. cannabis usage has been shown some studies have negative effect driving ability the bri. the largest and most precisely controlled study its kind carried out the department trans. the cannabinoid receptors results changes the levels various neurotransmitters. pensate they review driving simulator studies researchers note that even those. lasting for average four six hours after consumption llunreliable medical source  ingestion. the influence drugs alcohol. </s>with your permission and our partners may use precise geolocation data and identification through device.   huffpost  entry real reasons marijuana banned_b_. grow operations throughout the state photographer luke sharrett bloomberg via getty images. scanning you may click consent our and our partners processing described above alternatively you may click. cocopandat adkauppa  digisha. measurement and audience insights well develop and improve products. gooc called astiz wilm dow free recnc how new mari. somebody worked all out our best in,this week senator cory booker introduced legislation legalize. with racially disparate arrest incarceration rates for marijuana. why the made marijuana. related crimes according the washine post. would expunge federal marijuana convictions and penalize the state. marijuana nationwide passed the new jersey democrat bill. fear mexican immigrants led the criminalization. updated aug original aug. would expunge federal marijuana convictions and penalize state updated aug original aug,Why the US Made Marijuana Illegal - HISTORY - Google Chrome,why is cannabis use forbidden - google-haku - google chrome,23
this week senator cory booker introduced legislation legalize. with racially disparate arrest incarceration rates for marijuana. why the made marijuana. related crimes according the washine post. would expunge federal marijuana convictions and penalize the state. marijuana nationwide passed the new jersey democrat bill. fear mexican immigrants led the criminalization. updated aug original aug. would expunge federal marijuana convictions and penalize state updated aug original aug. </s>reduction increased appreciation the arts including humor and music especially discerning its. cannabis and driving review the literature and mentary the united kingdom department. y wikipedia  wiki effects_of cannabis. especially dopamine and norepinephrine neurotransmitters which are closely associated with the. marijuana between and percent recreational users experience intense anxiety and. cannabis usage has been shown some studies have negative effect driving ability the bri. the largest and most precisely controlled study its kind carried out the department trans. the cannabinoid receptors results changes the levels various neurotransmitters. pensate they review driving simulator studies researchers note that even those. lasting for average four six hours after consumption llunreliable medical source  ingestion. the influence drugs alcohol. </s>with your permission and our partners may use precise ,mail loge coal gooc called astic. the long term risks cannabis use. find resources substance use and addiction. the effects cannabis young_people health. cannabis contains substances that affect the brain and body including delta. canada health drugs and health products drugs and medication cannabis. find resources substance use and addiction mail loge coal gooc called astic. tetrahydrocannabinol thc and cannabidiol cbd thc causes the intoxicating. find resources substance use and addiction tetrahydrocannabinol thc and cannabidiol cbd thc causes the intoxicating. lowering_ your risks when consuming_cannabis. cannabis for medical purposes. wil dow free rekn how new effec. cannabis and your health. the short term effects cannabis use. the effects cannabis pregnancy and breastfeeding. cbd not intoxicating but can still have effects the brain.   canada services health campaigns cannabis health effects htm,Cannabis health effects - Canada.ca - Google Chrome,cannabis health concerns - google-haku - google chrome,24
mail loge coal gooc called astic. the long term risks cannabis use. find resources substance use and addiction. the effects cannabis young_people health. cannabis contains substances that affect the brain and body including delta. canada health drugs and health products drugs and medication cannabis. find resources substance use and addiction mail loge coal gooc called astic. tetrahydrocannabinol thc and cannabidiol cbd thc causes the intoxicating. find resources substance use and addiction tetrahydrocannabinol thc and cannabidiol cbd thc causes the intoxicating. lowering_ your risks when consuming_cannabis. cannabis for medical purposes. wil dow free rekn how new effec. cannabis and your health. the short term effects cannabis use. the effects cannabis pregnancy and breastfeeding. cbd not intoxicating but can still have effects the brain.   canada services health campaigns cannabis health effects htm. </s>this week senator cory booker introduced legislation legalize. with racially disparate arrest incarceration rates for marijuana. why the made marijuana. related crimes according the washine post. would expunge federal marijuana convictions and penalize the state. marijuana nationwide passed the new jersey democrat bill. fear mexican immigrants led the criminalization. updated aug original aug. would expunge federal marijuana convictions and penalize state updated aug original aug. <,your ability drive safely operate equipment saving. cannabis can impair your thinking concentration memory and decision making and can. paranoia having disanized thoughts and some cases hallucinating. attention and impair coordinationfootnote using cannabis and then driving. rannahic far medical niirnacee what wetild valie aranimente. why the use cannabis restricted. task health index savedtodrive. cannabis can impair your thinking concentration memory and decision making. the use cannabis restricted. rerent veare eame rniintriec far evamnle arietrial have lenalized thearial. rannahic far medical niirnacee what wetild valie aranimente lise law drugs,Task 1 - Health (No Index).docx - Google Docs - Google Chrome,,27
your ability drive safely operate equipment saving. cannabis can impair your thinking concentration memory and decision making and can. paranoia having disanized thoughts and some cases hallucinating. attention and impair coordinationfootnote using cannabis and then driving. rannahic far medical niirnacee what wetild valie aranimente. why the use cannabis restricted. task health index savedtodrive. cannabis can impair your thinking concentration memory and decision making. the use cannabis restricted. rerent veare eame rniintriec far evamnle arietrial have lenalized thearial. rannahic far medical niirnacee what wetild valie aranimente lise law drugs. </s>mail loge coal gooc called astic. the long term risks cannabis use. find resources substance use and addiction. the effects cannabis young_people health. cannabis contains substances that affect the brain and body including delta. canada health drugs and health products drugs and medication cannabis. find resources substance use and addiction mail loge coal gooc called astic. tetrahydrocannabinol thc and cannabidiol cbd thc causes the intoxicating. find resources substance use and addiction tetrahydrocannabinol thc and cannabidiol cbd thc causes the intoxicating. lowering_ your risks when consuming_cannabis. cannabis for medical purposes. wil dow free rekn how new effec. cannabis and your health. the short term effects cannabis use. t,leader chuck schumer released draft bill which would. national government europe supports legalization cannabis sale for recreational use. and all countries have prison sentences for illegal supply. and europe still lagging behind for now there. june mexico supreme court ruled that the government.   emcdda europa html nna tdma page. country territory recreational medicine. should legalize the recreational use cannabis bringing the y prohibitionpartners  adult use cannabis legalisation europe the final countdown. europe cannabis sector poised for take off brink news.   brinknews  euro anna tdma page. adult use cannabis legalization picking pace the. americas wednesday the july senate majority.   google  search sxsrf aoaemvlm adkxglnpsb ucf krimq weed.  wikipedia  wiki lega nna tamé page. country step closer being the largest legal market. the ball rolling the legalization process switzerland and.  prohibitionpartners  adult use cannabis legalisation europe the final countdown. cannabis policy status and recent developments. ralintrv the ell that allowe far the legal nradiiction mail log coal gooc called astic. should legalize the recreational use cannabis bringing the. dow free rekn how new effec. year new york joined the ever growing collection. adult use cannabis legalization europe prohibition. luxembourg switzerland and the netherlands have all passed regulation get.  prohibitionpartners  adult page. mail log coal gooc called astic. ralintrv the ell that allowe far the legal nradiictionrohibition. states which adult use cannabis already fully legal load. federally legalize cannabis the united states earlier this. for adult use cannabis the world. barbara pastori director strategy data prohibition,Adult-Use Cannabis Legalisation in Europe: The Final Countdown Begins - Google Chrome,weed legalization in europe - google-haku - google chrome,28
