source,target,title,query,index
places you could visit activities you could relation the japanese culture the. how many gold medals were made for the olympicsf.  wikipedia  wiki list_of_olympic_games_host_cities. olympics and gangwon province for the winter youth olympics. </s>are the olympics still being held despite the pandemics. for the winter olympics paris for the summer olympics milan cortina. the olympic games which begin friday july the paralympics begin tuesday. five cities have been chosen the host the uping olympic games beijing. </s>with the most gold medals when all was said and done. more day day schedule events for the olympics. spectators weren allowed venues fans the olympics tuned hitpsy  sportingnews  athletics news olympics medal count standings kkmrwok ler lsh coj. pos country gold silver bronze total. spectators weren allowed venues fans the olympics tuned tob log goc called until wilr rekr hov effe rek sep. athletes from across the world traveled japan representing their. hitpsy  sportingnews  athletics news olympics medal count standings kkmrwok ler lsh coj.   sportingnews  athletics news olympics medal count standings kkmrwok ler lshscoj. hitsps  sportingnews  athletics news olympics medal count standings kkmrwok ler lshscoj. but how did the final medal tally shape which countries came away. the olympics are the books. during the tokyo games the table below sorted most gold. sporting news t,made gold most popt. nkas greh werf gcre. the top accolades sought after athletes worldwide are already being. medals made how many. dished out winners the tokyo olympic games but they are actually.   scotsman  news world what are olympic gold medals made how many can won the. made gold nkas greh werf gcre. can won the tokyo. news coronavirus edinburghfestivals opinion sport artsandculture lifestyle. what are olympic gold,What are Olympic gold medals made of? How many can be won at the Tokyo Olympics 2020? | The Scotsman - Google Chrome,how many gold medals were made for the olympics - google-haku - google chrome,60
made gold most popt. nkas greh werf gcre. the top accolades sought after athletes worldwide are already being. medals made how many. dished out winners the tokyo olympic games but they are actually.   scotsman  news world what are olympic gold medals made how many can won the. made gold nkas greh werf gcre. can won the tokyo. news coronavirus edinburghfestivals opinion sport artsandculture lifestyle. what are olympic gold. </s>places you could visit activities you could relation the japanese culture the. how many gold medals were made for the olympicsf.  wikipedia  wiki list_of_olympic_games_host_cities. olympics and gangwon province for the winter youth olympics. </s>are the olympics still being held despite the pandemics. for the winter olympics paris for the summer olympics milan cortina. the olympic games which begin friday july the paralympics begin tuesday. five cities have been chosen the host the uping olympic games beijing,the olympic gold medals while having shiny gold exterior and status. gold medals being least. what are olympic gold medals made. the olympic gold medals   scotsman  news world what are olympic gold medals made how many can won the. measure least diameter and three millimeters thick.   scotsman  news world what are olympic gold medals made how many can won the. that would suggest they are cut largely from the luxury metal are actually. mostly posed silver with the required ratio silver olympic. when the next full moon date august full moon what hundreds axed scotrail. however give them that gilded gold edge that makes them sought after. sturgeon moon and how see ple. after the gold medals must also contain least six grams gold and. the olympic gold medals. designs for the medals,What are Olympic gold medals made of? How many can be won at the Tokyo Olympics 2020? | The Scotsman - Google Chrome,how many gold medals were made for the olympics - google-haku - google chrome,61
the olympic gold medals while having shiny gold exterior and status. gold medals being least. what are olympic gold medals made. the olympic gold medals   scotsman  news world what are olympic gold medals made how many can won the. measure least diameter and three millimeters thick.   scotsman  news world what are olympic gold medals made how many can won the. that would suggest they are cut largely from the luxury metal are actually. mostly posed silver with the required ratio silver olympic. when the next full moon date august full moon what hundreds axed scotrail. however give them that gilded gold edge that makes them sought after. sturgeon moon and how see ple. after the gold medals must also contain least six grams gold and. the olympic gold medals. designs for the medals. </s>made gold most popt. nkas greh werf gcre. the top accolades sought after athletes worldwide are already being. medals made how many. dished out winners the tokyo olympic games but they are actually.   scotsman  news world what are olympic gold medals made how many can won the. made gold nkas greh werf gcre. can won the tokyo. news coronavirus edinburghfestivals opinion sport artsandculture lifestyle. what are olympic gold. </s>places you could visit activities you could relation the japanese culture the. how many gold medals were made for the olympicsf.  wikipedia  wiki list_of_olympic_games_host_cities. o,gymnastics firefighting and shooting many sports however medals were not awarded with. blo nkas qwi gre wer gre gin. retroactively assigned gold silver and bronze medals the three best placed athletes each event. italiano the olive wreath was the prize for the winner the ancient olympic games was olive. when the modem olympic games began medals started given successful. designed frédérique vernon gilt silver medals were awarded for place shooting lifesaving. listed prizes being cups and other trophies. htips enwikipedia  wiki olympicmedal. vat blo nkas qwi gre wer gre gin. bxe branch off the wild olive tree that grew olympia intertwined form circle horse shoe. gymnastics sabre fencing equestrian and athletics with place bronze medals being awarded. introduction and early history edi. the summer olympics unique being the only olympic games feature rectangular medals. the custom the sequence gold silver and bronze for the first three places all events dates from. according pausanias was introduced heracles prize for the winner the running. olympic petitors however gold medals were not awarded the inaugural olympics. racing and gymnastics whilst place silver medals were awarded shooting rowing yachting. athens greece the winners were instead given silver medal and olive branch while. runners received laurel branch and copper bronze medal. summer olympics louis missouri the united states the international olympic mittee,Olympic medal - Wikipedia - Google Chrome,how many gold medals were made for the olympics - google-haku - google chrome,62
gymnastics firefighting and shooting many sports however medals were not awarded with. blo nkas qwi gre wer gre gin. retroactively assigned gold silver and bronze medals the three best placed athletes each event. italiano the olive wreath was the prize for the winner the ancient olympic games was olive. when the modem olympic games began medals started given successful. designed frédérique vernon gilt silver medals were awarded for place shooting lifesaving. listed prizes being cups and other trophies. htips enwikipedia  wiki olympicmedal. vat blo nkas qwi gre wer gre gin. bxe branch off the wild olive tree that grew olympia intertwined form circle horse shoe. gymnastics sabre fencing equestrian and athletics with place bronze medals being awarded. introduction and early history edi. the summer olympics unique being the only olympic games feature rectangular medals. the custom the sequence gold silver and bronze for the first three places all events dates from. according pausanias was introduced heracles prize for the winner the running. olympic petitors however gold medals were not awarded the inaugural olympics. racing and gymnastics whilst place silver medals were awarded shooting rowing yachting. athens greece the winners were instead given silver medal and olive branch while. runners received laurel branch and copper bronze medal. summer olympics louis missouri the united states ,see also olympic medal table. information provided the ioc the ioc itself does not recognize endorse any ranking. modern presentation the case manufactured from japanese ash wood dyed with the same color. the public the ribbon uses the traditional japanese design motifs found ichimatsu moyo. consideration next and then the number bronze medals after the above countries are still. the design for the olympic medals for the summer olympics was created junichi kawanishi. around their necks dignitary. the medals were manufactured using metal extracted from recycled small electronic devices donated. this the table the medal count the summer olympics based the medal count. panathenaic stadium and the olympic rings. put them themselves each other case team winners rather than having them placed. harmonized checkered pattern and kasane irome traditional kimono layering technique. htips enwikipedia  wiki _summer_olympics_medal_table. the international olympic mittee ioc these rankings sort the number gold medals. due the covid pandemic athletes were presented with their medals trays and were asked. see also olympic medal. the olympic emblem the circular lid and the body the case can opened like ring connected. equal ranking given and they are listed alphabetically country code although this. named national olympic mittee noc the number silver medals taken into. magnet the obverse the medals features nike the greek goddess victory front,2020 Summer Olympics medal table - Wikipedia - Google Chrome,how many medals in tokyo 2020 - google-haku - google chrome,63
see also olympic medal table. information provided the ioc the ioc itself does not recognize endorse any ranking. modern presentation the case manufactured from japanese ash wood dyed with the same color. the public the ribbon uses the traditional japanese design motifs found ichimatsu moyo. consideration next and then the number bronze medals after the above countries are still. the design for the olympic medals for the summer olympics was created junichi kawanishi. around their necks dignitary. the medals were manufactured using metal extracted from recycled small electronic devices donated. this the table the medal count the summer olympics based the medal count. panathenaic stadium and the olympic rings. put them themselves each other case team winners rather than having them placed. harmonized checkered pattern and kasane irome traditional kimono layering technique. htips enwikipedia  wiki _summer_olympics_medal_table. the international olympic mittee ioc these rankings sort the number gold medals. due the covid pandemic athletes were presented with their medals trays and were asked. see also olympic medal. the olympic emblem the circular lid and the body the case can opened like ring connected. equal ranking given and they are listed alphabetically country code although this. named national olympic mittee noc the number silver medals taken into. magnet the obverse the medals fea,olympics medal count sert format tools help last editwas.  wikipedia  wiki list_of_olympic_games_host_cities,Task 2 - Culture (No Index).docx - Google Docs - Google Chrome,,64
olympics medal count sert format tools help last editwas.  wikipedia  wiki list_of_olympic_games_host_cities. </s>see also olympic medal table. information provided the ioc the ioc itself does not recognize endorse any ranking. modern presentation the case manufactured from japanese ash wood dyed with the same color. the public the ribbon uses the traditional japanese design motifs found ichimatsu moyo. consideration next and then the number bronze medals after the above countries are still. the design for the olympic medals for the summer olympics was created junichi kawanishi. around their necks dignitary. the medals were manufactured using metal extracted from recycled small electronic devices donated. this the table the medal count the summer olympics based the medal count. panathenaic stadium and the olympic rings. put them themselves each other case team winners rather than having them placed. harmonized checkered pattern and kasane irome traditional kimono layering technique. htips enwikipedia  wiki _summer_olympics_medal_table. the international olympic mittee ioc these rankings sort the number gold medals. due the covid pandemic athletes were presented with their medals trays and were asked. see also olympic medal. the olympic emblem the circular lid and the body the case can opened like ring connected. equal ranking given and they are listed alphabetically country code altho,also one the easiest get around thanks its superb rail and subway. hitps  planetware  tourist attractions tokyo jpn thtm. east central honshu the largest japan main islands this heavily. attractions including museums festivals internationally noted cuisine and. the cultural side tokyo famous for its numerous things and top. y  planetware  tourist attractions tokyo jpn thtm. may earn mission from affiliate links. numerous venues featuring everything from japanese modern dramas. see also where stay tokyo. tour the imperial palace. explore the city and start with our list the top things tokyo. explore other parts the country holds the title the world most expensive city which live fortunately. top rated tourist attractions bele. home the imperial palace and the seat government and parliament located. the asakusa district tokyo the exquisite sens temple kinryd zan. ebony and wood toys kimonos fabrics and precious paper goodsburlec lac. pursuits like sumo wrestling also city rich music and theater with. populated city well worth visiting and serves great base from which. note some businesses may temporarily closed due recent global health and safety. street market hosting vendors selling masks carvings bs made. applications such gaming photography. senso the city most famous shrine stands the end long. professional sports clubs including baseball football and traditional japanese. symphony orchestras and pop and rock concerts. shop til you drop the ginza district. explore other parts the country loc algv. storage for desktop mobile devices and. tokyo the capital city japan and one the best places visit asia also,12 Top-Rated Tourist Attractions & Things to Do in Tokyo | PlanetWare - Google Chrome,top 10 tourist attractions in tokyo - google-haku - google chrome,65
also one the easiest get around thanks its superb rail and subway. hitps  planetware  tourist attractions tokyo jpn thtm. east central honshu the largest japan main islands this heavily. attractions including museums festivals internationally noted cuisine and. the cultural side tokyo famous for its numerous things and top. y  planetware  tourist attractions tokyo jpn thtm. may earn mission from affiliate links. numerous venues featuring everything from japanese modern dramas. see also where stay tokyo. tour the imperial palace. explore the city and start with our list the top things tokyo. explore other parts the country holds the title the world most expensive city which live fortunately. top rated tourist attractions bele. home the imperial palace and the seat government and parliament located. the asakusa district tokyo the exquisite sens temple kinryd zan. ebony and wood toys kimonos fabrics and precious paper goodsburlec lac. pursuits like sumo wrestling also city rich music and theater with. populated city well worth visiting and serves great base from which. note some businesses may temporarily closed due recent global health and safety. street market hosting vendors selling masks carvings bs made. applications such gaming photography. senso the city most famous shrine stands the end long. professional sports clubs including baseball football and traditional japanese. symphony,the size its mother but females can grow about pounds. part the bamboo they are eating they use their enlarged wrist. special significance for wwf because has been our logo since our population. despite their exalted status and relative lack natural predators pandas are still risk severe threats from. special significance for wwf because has been our logo since our. continue reading wild pandas get boost. ratis weg   worldwildlife  species giant panda. wild panda numbers are finally rebounding after years decline september the. bones that function opposable thumbs. ratis weg egiant panda. upgraded from endangered vulnerable. the panda with its distinctive black and white coat adored the jzm.   worldwildlife  species giant panda. newborn panda about the size stick butter about. wild pandas get boost. must eat around pounds every day depending what. southwest china where they subsist almost entirely bamboo they. pandas live mainly temperate forests high the mountains. international union for conservation nature announced that pandas have been. the panda with its distinctive black and white coat adored the. world and considered national treasure china this bear also has,Giant Panda | Species | WWF - Google Chrome,panda animal protection - google-haku - google chrome,68
the size its mother but females can grow about pounds. part the bamboo they are eating they use their enlarged wrist. special significance for wwf because has been our logo since our population. despite their exalted status and relative lack natural predators pandas are still risk severe threats from. special significance for wwf because has been our logo since our. continue reading wild pandas get boost. ratis weg   worldwildlife  species giant panda. wild panda numbers are finally rebounding after years decline september the. bones that function opposable thumbs. ratis weg egiant panda. upgraded from endangered vulnerable. the panda with its distinctive black and white coat adored the jzm.   worldwildlife  species giant panda. newborn panda about the size stick butter about. wild pandas get boost. must eat around pounds every day depending what. southwest china where they subsist almost entirely bamboo they. pandas live mainly temperate forests high the mountains. international union for conservation nature announced that pandas have been. the panda with its distinctive black and white coat adored the. world and considered national treasure china this bear also has. </s>also one the easiest get around thanks its superb rail and subway. hitps  planetware  tourist attractions tokyo jpn thtm. east central honshu the largest japan main islands this heavily. attractions including museums,and has asked you help summarize document according specific questions that could. china yangtze basin region holds the panda primary habitat infrastructure. which countries are making such efforts hle. panda population lives reserves with the total habitat area being protected index,Task 3 - Wildlife (No Index).docx - Google Docs - Google Chrome,,71
and has asked you help summarize document according specific questions that could. china yangtze basin region holds the panda primary habitat infrastructure. which countries are making such efforts hle. panda population lives reserves with the total habitat area being protected index. </s>the size its mother but females can grow about pounds. part the bamboo they are eating they use their enlarged wrist. special significance for wwf because has been our logo since our population. despite their exalted status and relative lack natural predators pandas are still risk severe threats from. special significance for wwf because has been our logo since our. continue reading wild pandas get boost. ratis weg   worldwildlife  species giant panda. wild panda numbers are finally rebounding after years decline september the. bones that function opposable thumbs. ratis weg egiant panda. upgraded from endangered vulnerable. the panda with its distinctive black and white coat adored the jzm.   worldwildlife  species giant panda. newborn panda about the size stick butter about. wild pandas get boost. must eat around pounds every day depending what. southwest china where they subsist almost entirely bamboo they. pandas live mainly temperate forests high the mountains. international union for conservation nature announced that pandas have been. the panda with its distinctive black and white coat adored ,ganja smokers official inquiry finally proved link between. you are joining debating society and need some notes make presentation the topic,Task 1 - Health (No Index).docx - Google Docs - Google Chrome,,73
ganja smokers official inquiry finally proved link between. you are joining debating society and need some notes make presentation the topic. </s>and has asked you help summarize document according specific questions that could. china yangtze basin region holds the panda primary habitat infrastructure. which countries are making such efforts hle. panda population lives reserves with the total habitat area being protected index. </s>the size its mother but females can grow about pounds. part the bamboo they are eating they use their enlarged wrist. special significance for wwf because has been our logo since our population. despite their exalted status and relative lack natural predators pandas are still risk severe threats from. special significance for wwf because has been our logo since our. continue reading wild pandas get boost. ratis weg   worldwildlife  species giant panda. wild panda numbers are finally rebounding after years decline september the. bones that function opposable thumbs. ratis weg egiant panda. upgraded from endangered vulnerable. the panda with its distinctive black and white coat adored the jzm.   worldwildlife  species giant panda. newborn panda about the size stick butter about. wild pandas get boost. must eat around pounds every day depending what. southwest china where they subsist almost entirely bamboo they. pandas live mainly temperate forests high the m,isolating panda populations preventing pandas from finding new bamboo forests. and has asked you help summarize document according specific questions that could. china yangtze basin region holds the panda primary habitat infrastructure,Task 3 - Wildlife (No Index).docx - Google Docs - Google Chrome,,74
isolating panda populations preventing pandas from finding new bamboo forests. and has asked you help summarize document according specific questions that could. china yangtze basin region holds the panda primary habitat infrastructure. </s>ganja smokers official inquiry finally proved link between. you are joining debating society and need some notes make presentation the topic. </s>and has asked you help summarize document according specific questions that could. china yangtze basin region holds the panda primary habitat infrastructure. which countries are making such efforts hle. panda population lives reserves with the total habitat area being protected index,isolating panda populations preventing pandas from finding new bamboo forests. and has asked you help summarize document according specific questions that could. china yangtze basin region holds the panda primary habitat infrastructure,Task 3 - Wildlife (No Index).docx - Google Docs - Google Chrome,are pandas endangered - google-haku - google chrome,75
isolating panda populations preventing pandas from finding new bamboo forests. and has asked you help summarize document according specific questions that could. china yangtze basin region holds the panda primary habitat infrastructure. </s>isolating panda populations preventing pandas from finding new bamboo forests. and has asked you help summarize document according specific questions that could. china yangtze basin region holds the panda primary habitat infrastructure. </s>ganja smokers official inquiry finally proved link between. you are joining debating society and need some notes make presentation the topic,home sign news sport reel worklife travel future. let know you agree use cookies give you the best online experience please let know you.   bbc  news world asia china. july   bbc  news world asia china hitps bbe  news world asia china. giant pandas longer top stories. agree all these cookies. julyc   bbc  news world asia china. endangered but still netw yol,"Giant pandas no longer endangered but still vulnerable, says China - BBC News - Google Chrome",are pandas endangered - google-haku - google chrome,76
home sign news sport reel worklife travel future. let know you agree use cookies give you the best online experience please let know you.   bbc  news world asia china. july   bbc  news world asia china hitps bbe  news world asia china. giant pandas longer top stories. agree all these cookies. julyc   bbc  news world asia china. endangered but still netw yol. </s>isolating panda populations preventing pandas from finding new bamboo forests. and has asked you help summarize document according specific questions that could. china yangtze basin region holds the panda primary habitat infrastructure. </s>isolating panda populations preventing pandas from finding new bamboo forests. and has asked you help summarize document according specific questions that could. china yangtze basin region holds the panda primary habitat infrastructure,isolating panda populations preventing pandas from finding new bamboo forests. and has asked you help summarize document according specific questions that could. china yangtze basin region holds the panda primary habitat infrastructure,Task 3 - Wildlife (No Index).docx - Google Docs - Google Chrome,,77
