source,target,title,query,index
lower back pain near buttock yes. right middle back pain. google  search dau that lung duoi ben phai dau that lung duoi aqs chrome sourceid. </s>these extensions can see and change information. caused the nature work life pressure. matching ghghgh minutes ago editor vuong hit ghe minutes. happy world teachers day. how prevent angina arthritis degeneration. task health index docx. waiting for docs google  arthritis arthritis osteoarthritis. </s>this local disk program files microsoft reknow activity surveillance source. response synh support gxd foxit reader. answer reply all forward. fob certificate sar use new folder. anti drug hinh anh.  mail yahoo  folders. citi bank tmkt teamviewer,below are some the main positions that patients with back pain pain suffer from lower right side back pain. here are some the main positions that patients with back pain often experience pain. back pain location causes symptoms and references.  syt bacgiang gov content. nguyen has lower back pain the right side,,,4
below are some the main positions that patients with back pain pain suffer from lower right side back pain. here are some the main positions that patients with back pain often experience pain. back pain location causes symptoms and references.  syt bacgiang gov content. nguyen has lower back pain the right side. </s>lower back pain near buttock yes. right middle back pain. google  search dau that lung duoi ben phai dau that lung duoi aqs chrome sourceid. </s>these extensions can see and change information. caused the nature work life pressure. matching ghghgh minutes ago editor vuong hit ghe minutes. happy world teachers day. how prevent angina arthritis degeneration. task health index,such health covid test medical declaration. feel pain the lower left side back abdomen and back for covid test medical declaration. covid test medical declaration. likely that the disease has entered the chronic stage. covid handbook for covid testing medical declaration for covid testing medical declaration covid test medical declaration,,google search - google chrome,5
such health covid test medical declaration. feel pain the lower left side back abdomen and back for covid test medical declaration. covid test medical declaration. likely that the disease has entered the chronic stage. covid handbook for covid testing medical declaration for covid testing medical declaration covid test medical declaration. </s>below are some the main positions that patients with back pain pain suffer from lower right side back pain. here are some the main positions that patients with back pain often experience pain. back pain location causes symptoms and references.  syt bacgiang gov content. nguyen has lower back pain the right side. </s>lower back pain near buttock y,caused the nature work life pressure. what the problem google search. just that occurs people younger age,Task 1 - Health (No Index).docx - Google Docs- Google Chrome,,7
caused the nature work life pressure. what the problem google search. just that occurs people younger age. </s>such health covid test medical declaration. feel pain the lower left side back abdomen and back for covid test medical declaration. covid test medical declaration. likely that the disease has entered the chronic stage. covid handbook for covid testing medical declaration for covid testing medical declaration covid test medical declaration. </s>below are some the main positions that patients with back pain pain suffer from lower right side back pain. here are some the main positions that patients with back pain often experience pain. back pain location causes symptoms and refer,which part people who often suffer from lower back pain should careful because they may lose their.  medlatec tin tuc dau lung eger. related work the majority lower back pain the result. low back pain one the most mon causes health related problems. diseases related the kidneys urinary tract pancreas could urinary tract infection. lower back can reveal the cause the disease overwork. sports activities tailors offices reception and sales. apps write online according. why you have lower back pain near your buttocks vinmec.   vinmec  xuong khop edar. google  search dau that lung duoi ddau that lung duoi aqs chrome sourceid chrome utf. due the characteristics some professions workers must sit for long time rarely change positions have little luck.   vinmec  xuong khop egr. lower back pain causes treatment vinmec. vinmec  xuong khop dau lung duoi nguyen nhan dieu tri.  medlatec health information. list recipients biogas project. what are the symptoms lower back pain. lower back pain dangerous and how fix. where lower back pain mon characteristics and location angina. urethritis pancreatitis kidney stone disease. due the characteristics some professions that require workers sit for long time rarely change positions less,,,8
which part people who often suffer from lower back pain should careful because they may lose their.  medlatec tin tuc dau lung eger. related work the majority lower back pain the result. low back pain one the most mon causes health related problems. diseases related the kidneys urinary tract pancreas could urinary tract infection. lower back can reveal the cause the disease overwork. sports activities tailors offices reception and sales. apps write online according. why you have lower back pain near your buttocks vinmec.   vinmec  xuong khop edar. google  search dau that lung duoi ddau that lung duoi aqs chrome sourceid chrome utf. due the characteristics some professions workers must ,connection extras help feedback. ready connect secure connection. free license non mercial use only user. start teamviewer with windows,TeamViewer,,10
connection extras help feedback. ready connect secure connection. free license non mercial use only user. start teamviewer with windows. </s>which part people who often suffer from lower back pain should careful because they may lose their.  medlatec tin tuc dau lung eger. related work the majority lower back pain the result. low back pain one the most mon causes health related problems. diseases related the kidneys urinary tract pancreas could urinary tract infection. lower back can reveal the cause the disease overwork. sports activities tailors offices reception and sales. apps write online according. why you have lower back pain near your buttocks vinmec.   vinmec  xuong khop edar.,task health index docx. articulation candywang yahoo . list people biogas projects,Task 1 - Health (No Index).docx - Google Docs- Google Chrome,,13
task health index docx. articulation candywang yahoo . list people biogas projects. </s>connection extras help feedback. ready connect secure connection. free license non mercial use only user. start teamviewer with windows. </s>which part people who often suffer from lower back pain should careful because they may lose their.  medlatec tin tuc dau lung eger. related work the majority lower back pain the result. low back pain one the most mon causes health related problems. diseases related the kidneys urinary tract pancreas could urinary tract infection. lower back can reveal the cause the disease overwork. sports activities tailors offices reception and sales. apps write online accor,diseases that are difficult treat and seriously affect. health disease very important the pain acute onset. low back pain one the most mon causes health related problems. related work most lower back pain the result. apps write online according. urology pancreas could infection. what wrong with that. people who often suffer from lower back pain should careful. google  search dau that lung duoi benh ddau tha aqs chrome sourceid chrome utf.   vinmec  xuong khop eea. there are about real results search time seconds.   vinmec  xuong khop eearác received lower back pain due labor. lower back pain causes treatment vinmec. low back pain causes symptoms and effective treatment. because you can suffer from kidney related diseases.  medlatec health information. urinary tract infection pancreatitis kidney stone disease these are all. list recipients biogas project. what are the symptoms lower back pain.   vinmec  xuong khop eear. what low back pain pain terminology.  pacificcross  dau that lun. what lifestyle habits help you limit the progression low back pain lower back pain,,,14
diseases that are difficult treat and seriously affect. health disease very important the pain acute onset. low back pain one the most mon causes health related problems. related work most lower back pain the result. apps write online according. urology pancreas could infection. what wrong with that. people who often suffer from lower back pain should careful. google  search dau that lung duoi benh ddau tha aqs chrome sourceid chrome utf.   vinmec  xuong khop eea. there are about real results search time seconds.   vinmec  xuong khop eearác received lower back pain due labor. lower back pain causes treatment vinmec. low back pain causes symptoms and effective treatment. because you can,occurs suddenly with sharp sensation like electric shock causing the patient. overwork makes the muscles and ligaments the lower back stretch and stretch. the most mon cause this condition software injury,Task 1 - Health (No Index).docx - Google Docs- Google Chrome,,16
occurs suddenly with sharp sensation like electric shock causing the patient. overwork makes the muscles and ligaments the lower back stretch and stretch. the most mon cause this condition software injury. </s>diseases that are difficult treat and seriously affect. health disease very important the pain acute onset. low back pain one the most mon causes health related problems. related work most lower back pain the result. apps write online according. urology pancreas could infection. what wrong with that. people who often suffer from lower back pain should careful. google  search dau that lung duoi benh ddau tha aqs chrome sourceid chrome utf.   vinmec  xuong khop eea. there are about,e suddenly with sharp electric shock like sensation.  soyte binhduong gov lists giaducsuckhoe dispform aspx. back the patient causing very unfortable yin feeling sometimes even. working too hard causes the muscles and cords the lower back tight. the most mon cause this condition software injury. overwork makes the muscles and ligaments the lower back stretch and stretch. the most mon cause this condition trauma. occurs suddenly with sharp sensation like electric shock causing the patient,Task 1 - Health (No Index).docx - Google Docs- Google Chrome,,18
e suddenly with sharp electric shock like sensation.  soyte binhduong gov lists giaducsuckhoe dispform aspx. back the patient causing very unfortable yin feeling sometimes even. working too hard causes the muscles and cords the lower back tight. the most mon cause this condition software injury. overwork makes the muscles and ligaments the lower back stretch and stretch. the most mon cause this condition trauma. occurs suddenly with sharp sensation like electric shock causing the patient. </s>occurs suddenly with sharp sensation like electric shock causing the patient. overwork makes the muscles and ligaments the lower back stretch and stretch. the most mon cause this condition softwar, soyte binhduong gov lists giaducsuckhoe dispform aspx. happy world teachers day. the most mon cause this condition software injury. task health index docx. overwork makes the muscles and ligaments the lower back stretch and stretch,Task 1 - Health (No Index).docx - Google Docs- Google Chrome,,20
 soyte binhduong gov lists giaducsuckhoe dispform aspx. happy world teachers day. the most mon cause this condition software injury. task health index docx. overwork makes the muscles and ligaments the lower back stretch and stretch. </s>e suddenly with sharp electric shock like sensation.  soyte binhduong gov lists giaducsuckhoe dispform aspx. back the patient causing very unfortable yin feeling sometimes even. working too hard causes the muscles and cords the lower back tight. the most mon cause this condition software injury. overwork makes the muscles and ligaments the lower back stretch and stretch. the most mon cause this condition trauma. occurs suddenly with sharp sensation lik,postpartum pelvic floor occurs when the discs are inserted. squeeze and bulge rupture causing low back pain. choose the location closest you. waiting for  vinmec . first and last name. date birth yyyy ddo improperly lifting objects lifting objects too much. squeeze and pop burst causing low back pain. improperly twisting lifting objects lifting objects too much. send request occurs when disks are inserted. date birth yyyy occurs one side the body affects all part the hip,"Lower back pain: Causes, treatment | Vinmec - Google Chrome",what is it - google search - google chrome,21
postpartum pelvic floor occurs when the discs are inserted. squeeze and bulge rupture causing low back pain. choose the location closest you. waiting for  vinmec . first and last name. date birth yyyy ddo improperly lifting objects lifting objects too much. squeeze and pop burst causing low back pain. improperly twisting lifting objects lifting objects too much. send request occurs when disks are inserted. date birth yyyy occurs one side the body affects all part the hip. </s> soyte binhduong gov lists giaducsuckhoe dispform aspx. happy world teachers day. the most mon cause this condition software injury. task health index docx. overwork makes the muscles and ligaments the lower back ,rita task health index docx.  soyte binhduong gov lists giaducsuckhoe dispform aspx. when lifting heavy objects. work related health most lower back pain the result. iii appears around the area appears around the area. the most mon cause this condition software injury. low back pain one the most mon causes health problems. overwork makes the muscles and ligaments the lower back stretch and stretch. occurs suddenly with sharp sensation like electric shock causing the patient. trauma such muscle sprains sudden movements poor posture. while lifting heavy objects. the most mon cause this condition software diagnostics.  docs google  document fas gqj lym ekg rciry dhkbnxq edit,Task 1 - Health (No Index).docx - Google Docs- Google Chrome,,22
rita task health index docx.  soyte binhduong gov lists giaducsuckhoe dispform aspx. when lifting heavy objects. work related health most lower back pain the result. iii appears around the area appears around the area. the most mon cause this condition software injury. low back pain one the most mon causes health problems. overwork makes the muscles and ligaments the lower back stretch and stretch. occurs suddenly with sharp sensation like electric shock causing the patient. trauma such muscle sprains sudden movements poor posture. while lifting heavy objects. the most mon cause this condition software diagnostics.  docs google  document fas gqj lym ekg rciry dhkbnxq edit. </s>postpart, docs google  document fas gqj lym ekg rciry dhkbnxq edit,Task 1 - Health (No Index).docx - Google Docs - Google Chrome,,24
 docs google  document fas gqj lym ekg rciry dhkbnxq edit. </s>rita task health index docx.  soyte binhduong gov lists giaducsuckhoe dispform aspx. when lifting heavy objects. work related health most lower back pain the result. iii appears around the area appears around the area. the most mon cause this condition software injury. low back pain one the most mon causes health problems. overwork makes the muscles and ligaments the lower back stretch and stretch. occurs suddenly with sharp sensation like electric shock causing the patient. trauma such muscle sprains sudden movements poor posture. while lifting heavy objects. the most mon cause this condition software diagnostics.  docs go, soyte binhduong gov lists giaducsuckhoe dispform aspx. the most mon cause this condition software injury. low back pain one the most mon causes health problems.  docs google  document fas gqj lym ekg rciry dhkbnxq spine. overwork makes the muscles and ligaments the lower back stretch and stretch. occurs one side the body affecting all part the hip. occurs suddenly with sharp sensation like electric shock causing the patient. when you get old.  docs google  document fas gqj lym ekg rciry dhkbnxqledit.  docs google  document fas gqj lym ekg rciry dhkbnxq edit,Task 1 - Health (No Index).docx - Google Docs- Google Chrome,,26
 soyte binhduong gov lists giaducsuckhoe dispform aspx. the most mon cause this condition software injury. low back pain one the most mon causes health problems.  docs google  document fas gqj lym ekg rciry dhkbnxq spine. overwork makes the muscles and ligaments the lower back stretch and stretch. occurs one side the body affecting all part the hip. occurs suddenly with sharp sensation like electric shock causing the patient. when you get old.  docs google  document fas gqj lym ekg rciry dhkbnxqledit.  docs google  document fas gqj lym ekg rciry dhkbnxq edit. </s> docs google  document fas gqj lym ekg rciry dhkbnxq edit. </s>rita task health index docx.  soyte binhduong gov lists giadu,when you get old.  docs google  document fas gqj lym ekg rciry dhkbnxqledit.  docs google  document fas gqj lym ekg rciry dhkbnxq edit,Task 1 - Health (No Index).docx - Google Docs- Google Chrome,,28
when you get old.  docs google  document fas gqj lym ekg rciry dhkbnxqledit.  docs google  document fas gqj lym ekg rciry dhkbnxq edit. </s> soyte binhduong gov lists giaducsuckhoe dispform aspx. the most mon cause this condition software injury. low back pain one the most mon causes health problems.  docs google  document fas gqj lym ekg rciry dhkbnxq spine. overwork makes the muscles and ligaments the lower back stretch and stretch. occurs one side the body affecting all part the hip. occurs suddenly with sharp sensation like electric shock causing the patient. when you get old.  docs google  document fas gqj lym ekg rciry dhkbnxqledit.  docs google  document fas gqj lym ekg rciry dh,when you get old some examples mechanical causes lower back pain include.  docs google  document fas gqj lym ekg rciry dhkbnxqledit,Task 1 - Health (No Index).docx - Google Docs- Google Chrome,,30
when you get old some examples mechanical causes lower back pain include.  docs google  document fas gqj lym ekg rciry dhkbnxqledit. </s>when you get old.  docs google  document fas gqj lym ekg rciry dhkbnxqledit.  docs google  document fas gqj lym ekg rciry dhkbnxq edit. </s> soyte binhduong gov lists giaducsuckhoe dispform aspx. the most mon cause this condition software injury. low back pain one the most mon causes health problems.  docs google  document fas gqj lym ekg rciry dhkbnxq spine. overwork makes the muscles and ligaments the lower back stretch and stretch. occurs one side the body affecting all part the hip. occurs suddenly with sharp sensation like electric shock causing ,occurs one side the body affecting all part the hip. when you get old some examples mechanical causes lower back pain include.  docs google  document fas gqj lym ekg rciry dhkbnxqledit. tendinopathy degenerative disc disease radiculopathy,Task 1 - Health (No Index).docx - Google Docs- Google Chrome,,32
occurs one side the body affecting all part the hip. when you get old some examples mechanical causes lower back pain include.  docs google  document fas gqj lym ekg rciry dhkbnxqledit. tendinopathy degenerative disc disease radiculopathy. </s>when you get old some examples mechanical causes lower back pain include.  docs google  document fas gqj lym ekg rciry dhkbnxqledit. </s>when you get old.  docs google  document fas gqj lym ekg rciry dhkbnxqledit.  docs google  document fas gqj lym ekg rciry dhkbnxq edit,was seconds. when you get old one.  docs google  document fas gqj lym ekg rciry dhkbnxqledit,Task 1 - Health (No Index).docx - Google Docs- Google Chrome,,33
was seconds. when you get old one.  docs google  document fas gqj lym ekg rciry dhkbnxqledit. </s>occurs one side the body affecting all part the hip. when you get old some examples mechanical causes lower back pain include.  docs google  document fas gqj lym ekg rciry dhkbnxqledit. tendinopathy degenerative disc disease radiculopathy. </s>when you get old some examples mechanical causes lower back pain include.  docs google  document fas gqj lym ekg rciry dhkbnxqledit,happy world teachers day. tendons degenerative disc disease radiculopathy sports injuries. list people biogas projects. task health index docx. when you get old some examples mechanical causes lower back pain include,Task 1 - Health (No Index).docx - Google Docs- Google Chrome,,35
happy world teachers day. tendons degenerative disc disease radiculopathy sports injuries. list people biogas projects. task health index docx. when you get old some examples mechanical causes lower back pain include. </s>was seconds. when you get old one.  docs google  document fas gqj lym ekg rciry dhkbnxqledit. </s>occurs one side the body affecting all part the hip. when you get old some examples mechanical causes lower back pain include.  docs google  document fas gqj lym ekg rciry dhkbnxqledit. tendinopathy degenerative disc disease radiculopathy,tendons degenerative disc disease radiculopathy sports injuries. when you get old some examples mechanical causes lower back pain include.  docs google  document fas gqj lym ekg rciry dhkbnxqledit,Task 1 - Health (No Index).docx - Google File - Google Chrome,google - google chrome,36
tendons degenerative disc disease radiculopathy sports injuries. when you get old some examples mechanical causes lower back pain include.  docs google  document fas gqj lym ekg rciry dhkbnxqledit. </s>happy world teachers day. tendons degenerative disc disease radiculopathy sports injuries. list people biogas projects. task health index docx. when you get old some examples mechanical causes lower back pain include. </s>was seconds. when you get old one.  docs google  document fas gqj lym ekg rciry dhkbnxqledit,orvna joint due aging due age nct previously used. traumatized due occupation sports accident who has had and having disease the urinary system stones tumors tuberculosis etc. the military physician and the. kidney pathology the stomach inflammation ulcer tumor which caused degenerative lumbar spine due age. because herniated disc either alone bination both more important. joint pain due aging previous history,Back pain cause - Google Chrome,nguyen nhan dau that lung - google search - google chrome,37
orvna joint due aging due age nct previously used. traumatized due occupation sports accident who has had and having disease the urinary system stones tumors tuberculosis etc. the military physician and the. kidney pathology the stomach inflammation ulcer tumor which caused degenerative lumbar spine due age. because herniated disc either alone bination both more important. joint pain due aging previous history. </s>tendons degenerative disc disease radiculopathy sports injuries. when you get old some examples mechanical causes lower back pain include.  docs google  document fas gqj lym ekg rciry dhkbnxqledit. </s>happy world teachers day. tendons degenerative disc disease radiculopathy,disc degeneration radiculopathy sports injuries spinal stenosis. tendons degenerative disc disease radiculopathy sports injuries. when you get old some examples mechanical causes lower back pain include.  docs google  document fas gqj lym ekg rciry dhkbnxqledit,Task 1 - Health (No Index).docx - Google File - Google Chrome,,38
disc degeneration radiculopathy sports injuries spinal stenosis. tendons degenerative disc disease radiculopathy sports injuries. when you get old some examples mechanical causes lower back pain include.  docs google  document fas gqj lym ekg rciry dhkbnxqledit. </s>orvna joint due aging due age nct previously used. traumatized due occupation sports accident who has had and having disease the urinary system stones tumors tuberculosis etc. the military physician and the. kidney pathology the stomach inflammation ulcer tumor which caused degenerative lumbar spine due age. because herniated disc either alone bination both more important. joint pain due aging previous history. </s>tendons ,down the lumbar region causing low back pain especially. being the elderly also causes drinking. are the elderly drinking the lumbar region causes low back pain especially. tumor tuberculosis fluid retention pus stasis show. drinking the lumbar region causes low back pain especially. being the elderly also causes lower back pain drinking the lumbar region causes low back pain especially,Task 1 - Health (No Index).docx - Google File - Google Chrome,,40
