source,target,title,query,index
 wikipedia  wiki summer_ olympics_medals_table. has not happened yet. </s>olympics  baotintuc the gioi sao nhat ban kien quyet chuc olympic. list recipients biogas project. view the description the insert format tool. dich benh sour yen htm.  dangcongasan cung ban luan the van hoi dac biet nhat trong lich.  baotintuc the gioi sao nhat ban kien quyet chuc olympic. </s>view insert tool description. places you can visit activities you can related culture,view insert tool description. japan will host the olympics friend yours who very. task culture index docx. olympic still held despite the pandemic not why. olympics still held despite the pandemic not why. write cvv online under. how many gold medals you have google search. total olympic medals gold silver bronze. young knuckle fighter adri. activ belief you can. anna seyeso entry into inddws. there are doubles rings four rooms. how many gold medals you have. humility makes people stronger. how many categories are there the olympics. list recipients biogas project. total number olympic medals gold silver bronze. when and where does the olympics take place. happy world teachers day. let virtual experience playing with yasutaka uchiyama. games medal table tokyo olympics," Olympic Medal Table | Tokyo 2020 Olympic Games (July 23-August 8, 2021) - Google Chrome",how many bells are there in the tokyo 2020 olympics - google search - google chrome,140
view insert tool description. japan will host the olympics friend yours who very. task culture index docx. olympic still held despite the pandemic not why. olympics still held despite the pandemic not why. write cvv online under. how many gold medals you have google search. total olympic medals gold silver bronze. young knuckle fighter adri. activ belief you can. anna seyeso entry into inddws. there are doubles rings four rooms. how many gold medals you have. humility makes people stronger. how many categories are there the olympics. list recipients biogas project. total number olympic medals gold silver bronze. when and where does the olympics take place. happy world teachers day. let,quang hai open fire. tokyo olympic medal table. although not keeping the top the table the chinese sports team also had very good olympics. plus students students and students. hcv plate awarded olympic. futsal world cup enemy. southeast asia the philippines the most successful team with medal medals and medal. look into the future. the top there are also the hcv olympic mittee russia hcv australia hcv the netherlands. before the match against trung. education life law sport technology health real. hcv for the the tokyo olympics. japan home team ranked the most special olympics history after winning the total. demand cybersecurity activate window. succeeded winning more medals cards than the olympic rio place. the american women volleyball team won the historic gold medal the olympics they are also the winners. indonesia has student student and college students thailand has student and student and malaysia has student and diploma. total teams won medals which teams won medals out total. germany france and italy together get students. vietnam sports team with athletes even though they tried their best they didn win the medal. man city behind the curtain. america won historic gold the olympics they are also the winners,Latest updated Tokyo 2021 Olympic medal table - VietnamNamNet - Google Chrome,how many gold medals in the tokyo 2020 olympic games - google search - google chrome,141
quang hai open fire. tokyo olympic medal table. although not keeping the top the table the chinese sports team also had very good olympics. plus students students and students. hcv plate awarded olympic. futsal world cup enemy. southeast asia the philippines the most successful team with medal medals and medal. look into the future. the top there are also the hcv olympic mittee russia hcv australia hcv the netherlands. before the match against trung. education life law sport technology health real. hcv for the the tokyo olympics. japan home team ranked the most special olympics history after winning the total. demand cybersecurity activate window. succeeded winning more medals cards th,全面封殺趙薇定調政治問題 views hours ago. youtube  watch pvxdx. vận hội olympic tokyo ngày. toàn cảnh sân vận động quốc gia đình toàn cảnh. ảng tổng sắp huy chương cập nhật lúc ngày. the vertical jump men. danh sách nhận khí sinh học. waiting for  google . nghiên cứu phát tri. thua đau trên sản nhà old trafford. toàn cảnh sân văn động quốc gia đình toàn cảnh. toàn cành sản vận động quốc gia đình toàn cánh. iibảng tổng sắp huy chương cập nhật lúc ngày. tình hình nghiên danh sách nhận. sng cho các tran sautua btog. danh sách nhân khí sinh học. task health index docx. toàn cành sân vận động quốc gia đình toàn cảnh sân vân. hương thế vận hội olympic tokyo ngày hạng vùng ngày. bảng tổng sắp huy chương cập nhật lúc ngày. ted trần search google type url. bảng tổng sắp huy chương thế. hạng ngoại hạng anh. task culture index docx. bóng đáa youtube  watch dxe pvxdx. văn thanh auối tập đầu tệmt. danh cao month ago. mat sản đượg sủa. machine make perfect dows. toàn cảnh sân vân. bảng tổng sắp huy chương thế vận hội olympic tokyo ngày bảng tổng sắp huy chương cập nhật lúc ngày. hương thế vận hội olympic tokyo ngày. bóng lên trời khiến thầy. thành công bạn phải sẵn lòng thất bại. dhànth bạn phảấn eng cấtd. bảng tổng sắp huy chương. thì làm chẳng được thùng rỗng hay kêu thật. toàn cảnh sân văn động. top thật cùng hcv lun đều. toàn cảnh sân vận động quốc gia đình toàn cảnh sân vân. nghiên cứu phát trí. danh sách nhận khí sinh. visage livre month ago. đểdhàn ong bạn phảần ôấd,🔴 Tokyo 2020 Olympic Medals Table 8/8/2021 | US Hegemony - YouTube - Google Chrome,2020 olympic medal state - google search - google chrome,143
全面封殺趙薇定調政治問題 views hours ago. youtube  watch pvxdx. vận hội olympic tokyo ngày. toàn cảnh sân vận động quốc gia đình toàn cảnh. ảng tổng sắp huy chương cập nhật lúc ngày. the vertical jump men. danh sách nhận khí sinh học. waiting for  google . nghiên cứu phát tri. thua đau trên sản nhà old trafford. toàn cảnh sân văn động quốc gia đình toàn cảnh. toàn cành sản vận động quốc gia đình toàn cánh. iibảng tổng sắp huy chương cập nhật lúc ngày. tình hình nghiên danh sách nhận. sng cho các tran sautua btog. danh sách nhân khí sinh học. task health index docx. toàn cành sân vận động quốc gia đình toàn cảnh sân vân. hương thế vận hội olympic tokyo ngày hạng vùng ngày. bảng tổng sắp huy chương ,the sound the bell rings. next southeast asian sport win hcv. rades bac dong tai. google  search tong huy chuong vang bac dong tai olympic tokyo tong huy chuong vang bac dong tai. the bell rings google search. task health index docx. music bac dong tai google search. task culture index docx. match match match the tokyo olympic games google searchho. vietnam sports bid farewell the tokyo olympics returned home august. list people biogas projects. old machine for new machine. research and develop the momentum the. tolaa american union when there are more than hcv cards meanwhile indonesia the union. happy world teachers day. lan stopped the semi finals the hurdles women the olympics,"Olympic medal standings 2020: China wides the gap with the US, Indonesia has gold - Tuoi Tre Online - Google Chrome",state of the art olympic medal 2020 - google search - google chrome,144
the sound the bell rings. next southeast asian sport win hcv. rades bac dong tai. google  search tong huy chuong vang bac dong tai olympic tokyo tong huy chuong vang bac dong tai. the bell rings google search. task health index docx. music bac dong tai google search. task culture index docx. match match match the tokyo olympic games google searchho. vietnam sports bid farewell the tokyo olympics returned home august. list people biogas projects. old machine for new machine. research and develop the momentum the. tolaa american union when there are more than hcv cards meanwhile indonesia the union. happy world teachers day. lan stopped the semi finals the hurdles women the olympics. </s,reportem directly the day the petition the tokyo olympic the female. olympic tokyo gold ten medals.  baotuyenquang  quoc. danish player viktor axelsen wins gold medal badminton. the main criterion according the gold standard the international olympic mittee ioc. sort the total number medals not the number gold.   baoquangbinh the thao. this olympics the still leads the number athletes participating. the american athlete also won gold medal the. olumpio tolguo final months. report terms total number medals not amount gold,,,145
reportem directly the day the petition the tokyo olympic the female. olympic tokyo gold ten medals.  baotuyenquang  quoc. danish player viktor axelsen wins gold medal badminton. the main criterion according the gold standard the international olympic mittee ioc. sort the total number medals not the number gold.   baoquangbinh the thao. this olympics the still leads the number athletes participating. the american athlete also won gold medal the. olumpio tolguo final months. report terms total number medals not amount gold. </s>the sound the bell rings. next southeast asian sport win hcv. rades bac dong tai. google  search tong huy chuong vang bac dong tai olympic tokyo tong huy chuong v, meta hotro cac mon the thao olympic. pedal madison well new mixed events one. iie cycling madison well new mixed events one,Task 2 - Culture (No Index).docx - Google Docs - Google Chrome ,,146
 meta hotro cac mon the thao olympic. pedal madison well new mixed events one. iie cycling madison well new mixed events one. </s>reportem directly the day the petition the tokyo olympic the female. olympic tokyo gold ten medals.  baotuyenquang  quoc. danish player viktor axelsen wins gold medal badminton. the main criterion according the gold standard the international olympic mittee ioc. sort the total number medals not the number gold.   baoquangbinh the thao. this olympics the still leads the number athletes participating. the american athlete also won gold medal the. olumpio tolguo final months. report terms total number medals not amount gold. </s>the sound the bell rings. next s,"may medal rank dynamically updated display. the first medals are awarded on may day. may asked to calculate total for japan. america's misfortune the first medals were awarded on may day. north china station. tokyo olympics thousands of people. tokyo olympic in the middle of the covid season. may the first medals are awarded on may day. blockade day. olympics. in the midst of the pandemic, the japanese star did not cancel. learn to reintegrate after much. disneyland fine art processing. kyrgyzstanthe first medals are awarded on may day. number of gold, silver and bronze medals of participating countries. get into the stands. category perspective. bbc vietnamese world. ask for the calculation for japan. existence of god. bbc vietnamese media. proof laws. may related news. medal ranking dynamically updated display. put people on the moon to gamble. life during the pandemic lockdown. entertainment center",,how much is the olympic medal - google search - google chrome,147
"may medal rank dynamically updated display. the first medals are awarded on may day. may asked to calculate total for japan. america's misfortune the first medals were awarded on may day. north china station. tokyo olympics thousands of people. tokyo olympic in the middle of the covid season. may the first medals are awarded on may day. blockade day. olympics. in the midst of the pandemic, the japanese star did not cancel. learn to reintegrate after much. disneyland fine art processing. kyrgyzstanthe first medals are awarded on may day. number of gold, silver and bronze medals of participating countries. get into the stands. category perspective. bbc vietnamese world. ask for the calcu",learn reintegrate after much. related topics the first medals are expected awarded july. three times league xhhohheô. ask about safety for japan. disneyland cool art empire.   bbc  vietnamese vert fut. put man the moon gamble. the first medals are expected awarded july. tokyo olympic between covid season and sentence. legendary mountain road inca. full risk medal rank auto update display number. hiep england and north. ueh american entertainment center. medal related topic auto update show number. japan will allowed enter the grandstand. medal rank auto update show number. dļhh physical law she provesh. number gold silver and bronze medals participating countries,,,148
learn reintegrate after much. related topics the first medals are expected awarded july. three times league xhhohheô. ask about safety for japan. disneyland cool art empire.   bbc  vietnamese vert fut. put man the moon gamble. the first medals are expected awarded july. tokyo olympic between covid season and sentence. legendary mountain road inca. full risk medal rank auto update display number. hiep england and north. ueh american entertainment center. medal related topic auto update show number. japan will allowed enter the grandstand. medal rank auto update show number. dļhh physical law she provesh. number gold silver and bronze medals participating countries. </s>may medal rank dy, wikipedia  wiki adt n_t i_th. tong huy chuong olympic vang bac dong bao nhieu. tong huy chuong vang bac dong tai olympic tokyo. zara larsson unco những nơi bạn thể đến thăm liên quan đến văn hóa nhật bản. quan trong thành phố các hoạt động người nhật cung cấp trong các trò chơi tìm. tại nhật bản liên quan google,Task 2 - Culture (No Index).docx - Google Docs - Google Chrome ,,149
 wikipedia  wiki adt n_t i_th. tong huy chuong olympic vang bac dong bao nhieu. tong huy chuong vang bac dong tai olympic tokyo. zara larsson unco những nơi bạn thể đến thăm liên quan đến văn hóa nhật bản. quan trong thành phố các hoạt động người nhật cung cấp trong các trò chơi tìm. tại nhật bản liên quan google. </s>learn reintegrate after much. related topics the first medals are expected awarded july. three times league xhhohheô. ask about safety for japan. disneyland cool art empire.   bbc  vietnamese vert fut. put man the moon gamble. the first medals are expected awarded july. tokyo olympic between covid season and sentence. legendary mountain road inca. full risk medal rank aut,architecture culture here are the most beautiful tourist destinations japan that you cannot miss. sunrise water you don know the color taste and shimmer white snow. register lock one the immutable symbols the land. definitely have check right away. promotion cooperation with saved. travel and lifestyle remendations well. vws thủ player promotions. promotions cooperation with saved. task health index docx. you can mount fuji any time the year. top beautiful places fet the way back. all you need know about status and policy flights during corona virus outbreak see full updates. traveloka  explore destination dia diem lich nhat ban khong nen qua. task culture index docx. registera traveloka  explore destination dia diem lich nhat ban khong nen through the top beautiful places fet the way stay. top beautiful places fet the way back japan. traveloka mar min read. like the cool fresh climate along with the simple and ethereal beauty ants. sign for our newsletter for more. sunrise water you don know the color taste and shimmer. the air conditioner one the symbols the press. please enter your email here. architecture culture here are the most beautiful places visit japan that you cannot leave japan country that you can travel anytime especially you love. always know the latest information,,places you can visit in japan - google search- google chrome,150
architecture culture here are the most beautiful tourist destinations japan that you cannot miss. sunrise water you don know the color taste and shimmer white snow. register lock one the immutable symbols the land. definitely have check right away. promotion cooperation with saved. travel and lifestyle remendations well. vws thủ player promotions. promotions cooperation with saved. task health index docx. you can mount fuji any time the year. top beautiful places fet the way back. all you need know about status and policy flights during corona virus outbreak see full updates. traveloka  explore destination dia diem lich nhat ban khong nen qua. task culture index docx. registera travelo,list people biogas projects. general being able mount fuji see the white snow very lucky thing. one the few prime locations allowing you enjoy the panoramic view. total teams won medals which teams won medals out total. list recipients biogas project. the total number gold silver and bronze olympic medals the tokyo olympics pieces. colorful picture flashing lights reflect prosperity and. tokyo geous when the city lights feeling overwhelmed surprised. always know the latest information. osaved the hard disk the main terminal. japan country that you can travel any time especially. subscribe our newsletter for more,Task 2 - Culture (No Index).docx - Google Docs - Google Chrome ,,153
list people biogas projects. general being able mount fuji see the white snow very lucky thing. one the few prime locations allowing you enjoy the panoramic view. total teams won medals which teams won medals out total. list recipients biogas project. the total number gold silver and bronze olympic medals the tokyo olympics pieces. colorful picture flashing lights reflect prosperity and. tokyo geous when the city lights feeling overwhelmed surprised. always know the latest information. osaved the hard disk the main terminal. japan country that you can travel any time especially. subscribe our newsletter for more. </s>architecture culture here are the most beautiful tourist destinations,japan country that you can travel any time especially. online follow research status,Task 2 - Culture (No Index).docx - Google Documents - Google Chrome,,161
japan country that you can travel any time especially. online follow research status. </s>list people biogas projects. general being able mount fuji see the white snow very lucky thing. one the few prime locations allowing you enjoy the panoramic view. total teams won medals which teams won medals out total. list recipients biogas project. the total number gold silver and bronze olympic medals the tokyo olympics pieces. colorful picture flashing lights reflect prosperity and. tokyo geous when the city lights feeling overwhelmed surprised. always know the latest information. osaved the hard disk the main terminal. japan country that you can travel any time especially. subscribe our news,cultural experiences you must try when you e. japanese style festivals with traditional matsuri festivals. this peruvian native often es puoc hot springs for way drink and bathe that everyone can enjoy the culture together. this unique japanese culture. hot spring bathing has bee indispensable part japanese people. list people biogas projects. waiting for connect facebook net. walking around the old streets kimono. with total more than hot springs distributed throughout the country surprise that. waiting for connect facebook net tang offline. tsunagujapan  must try cultural experiences japan,11 must-try cultural experiences when coming to Japan | tsunagu Japan - Google Chrome,related activities in japan - google search- google chrome,163
cultural experiences you must try when you e. japanese style festivals with traditional matsuri festivals. this peruvian native often es puoc hot springs for way drink and bathe that everyone can enjoy the culture together. this unique japanese culture. hot spring bathing has bee indispensable part japanese people. list people biogas projects. waiting for connect facebook net. walking around the old streets kimono. with total more than hot springs distributed throughout the country surprise that. waiting for connect facebook net tang offline. tsunagujapan  must try cultural experiences japan. </s>japan country that you can travel any time especially. online follow research status. </s>,view insert tool description. how long have you been uiympic. places you can visit activities you can related culture,Task 2 - Culture (No Index).docx - Google Docs - Google Chrome ,,164
view insert tool description. how long have you been uiympic. places you can visit activities you can related culture. </s>cultural experiences you must try when you e. japanese style festivals with traditional matsuri festivals. this peruvian native often es puoc hot springs for way drink and bathe that everyone can enjoy the culture together. this unique japanese culture. hot spring bathing has bee indispensable part japanese people. list people biogas projects. waiting for connect facebook net. walking around the old streets kimono. with total more than hot springs distributed throughout the country surprise that. waiting for connect facebook net tang offline. tsunagujapan  must try,ready connect secure connection. free license non mercial use only user. start teamviewer with windows. ready connect secure connection teamviewer,TeamViewer,,166
ready connect secure connection. free license non mercial use only user. start teamviewer with windows. ready connect secure connection teamviewer. </s>view insert tool description. how long have you been uiympic. places you can visit activities you can related culture. </s>cultural experiences you must try when you e. japanese style festivals with traditional matsuri festivals. this peruvian native often es puoc hot springs for way drink and bathe that everyone can enjoy the culture together. this unique japanese culture. hot spring bathing has bee indispensable part japanese people. list people biogas projects. waiting for connect facebook net. walking around the old streets kimono. ,"you always wanted to visit japan so you want to find information about the events. activities related to japanese culture. japan will host the olympic games in a friend of yours who is very. kyoto hiroshima peace memorial. activities related to japanese culture and buddhist culture. in town the activities the japanese offer in the find games. you love the cool and fresh climate with simple beauty. you love the cool and fresh climate together. you love the fresh cool climate with the strokes. olympic games fan wants to attend the events you attend. ethereal in architecture, culture, mountains, tokyo, tower, kinkaku temple. ethereal in architecture, culture, mountains, tokyo, tower, kin temple. ethereal in the architecture, culture, mountains, rich mountains, tokyo tower. activities can do related to japanese culture buddhist culture can do activities related to japanese culture buddhist culture. traveloka explore destination dia diem. when is the olympics taking place? cultural activities",Task 2 - Culture (No Index).docx - Google Docs - Google Chrome ,,168
"you always wanted to visit japan so you want to find information about the events. activities related to japanese culture. japan will host the olympic games in a friend of yours who is very. kyoto hiroshima peace memorial. activities related to japanese culture and buddhist culture. in town the activities the japanese offer in the find games. you love the cool and fresh climate with simple beauty. you love the cool and fresh climate together. you love the fresh cool climate with the strokes. olympic games fan wants to attend the events you attend. ethereal in architecture, culture, mountains, tokyo, tower, kinkaku temple. ethereal in architecture, culture, mountains, tokyo, tower, kin ",free license non mercial use only user. start teamviewer with windows. ready connect secure connection ining connection. ready connect secure connection teamviewer,TeamViewer,,171
free license non mercial use only user. start teamviewer with windows. ready connect secure connection ining connection. ready connect secure connection teamviewer. </s>you always wanted to visit japan so you want to find information about the events. activities related to japanese culture. japan will host the olympic games in a friend of yours who is very. kyoto hiroshima peace memorial. activities related to japanese culture and buddhist culture. in town the activities the japanese offer in the find games. you love the cool and fresh climate with simple beauty. you love the cool and fresh climate together. you love the fresh cool climate with the strokes. olympic games fan wants to a,possible activities related japanese culture buddhist culture. candywang yahoo  yahoo. list people biogas projects. list recipients biogas project. walking around the streets traditional costumes.  teamviewer  dbiar xzlywh edit,Task 2 - Culture (No Index).docx - Google Docs - Google Chrome ,,172
