source,target,title,query,index
"this system can reduce logistics costs as well as optimize operational schedules. geodetic device is in storage. use gps pda integrated devices for die-oriented car exploration. last edited last minute. sites google view truongmyphuong.com sites google view nguyenthanhthai. gps applications are used in many territories. they are too dependent on the turning point of science. switch the display on the screen in case of an emergency the user can. many stars are in high-earth orbit. microwaves can cause. iliem the great turning point of science brought. tps dienmay xanh experience or gps. gps applications are used in many areas. abbreviation for global positioning system. using the mind, ",set when one the two parties has data and needs build postal transport management program using gps technology. case data transmission location and time. when you need send message. the left side the capital city million. received big pandas photo. the number satellites receiving the signal. the post and telemunications group vnpt being carried out according the following process. maintain constant connection the connection always available for the transmission location and time data private postal performs link initialization operations every. management off line method building postal transport management program using gps technology. the controller can operate one the following modes. global positioning system gps network navstar satellites. sunxing that anywhere the earth can find least point the ground thanks gps satellite tickets for postal transportation the international and international postal panies vps belonging the group,Application of GPS navigation technology for vehicle management - Google Chrome,viendongtelecom.com.vn/tin-tuc-407-ung-dung-cong-nghe-dinh-en-gps-quan-ly-phuong-tien traffic - search google - google chrome,415
set when one the two parties has data and needs build postal transport management program using gps technology. case data transmission location and time. when you need send message. the left side the capital city million. received big pandas photo. the number satellites receiving the signal. the post and telemunications group vnpt being carried out according the following process. maintain constant connection the connection always available for the transmission location and time data private postal performs link initialization operations every. management off line method building postal transport management program using gps technology. the controller can operate one the following mode,gps navigation system was born. health and fitness smartwatches and smart wearables can track evil. gps builds postal transport management program using gps technology. build postal transportation management program. according data from consulting anization. building postal transport management program technology. according data from consulting anization drno postal transport management program occurs glonass signal solution. health and fitness smartwatches and smart wearables that can track postal transportation management. consists many satellites orbit above the earth altitude. use gps navigation devices such. entertainment needs gps can integrated. according data from consulting anization build postal transport management program technology. great benefits people lives today the works. develop postal transport management program. with data from consulting anizations. application gps applied many extremes life munication. gps abbreviation the phrase global positioning system system that includes. according data from consulting anization develop postal transport management program using gps technology. collect data from consulting anizations.   dienmayxanh  kinh nghiem hay gps. collect data from consulting anization build postal transport management program using technology. replace gps will automatically sent the authorities.  nhandan khoa hoc,Task 4 - Technology (No Index).docx - Google Resources data - Google Chrome,,416
gps navigation system was born. health and fitness smartwatches and smart wearables can track evil. gps builds postal transport management program using gps technology. build postal transportation management program. according data from consulting anization. building postal transport management program technology. according data from consulting anization drno postal transport management program occurs glonass signal solution. health and fitness smartwatches and smart wearables that can track postal transportation management. consists many satellites orbit above the earth altitude. use gps navigation devices such. entertainment needs gps can integrated. according data from consulting an,occurs the glonass signal solution. entertainment needs gps can integrated. health and fitness smartwatches and smart wearables can track happening glonass signals solution. replace gps will automatically sent the authorities. health and fitness smartwatches and smart wearables that can track,Task 4 - Technology (No Index).docx - Google Resources data - Google Chrome,,418
occurs the glonass signal solution. entertainment needs gps can integrated. health and fitness smartwatches and smart wearables can track happening glonass signals solution. replace gps will automatically sent the authorities. health and fitness smartwatches and smart wearables that can track. </s>gps navigation system was born. health and fitness smartwatches and smart wearables can track evil. gps builds postal transport management program using gps technology. build postal transportation management program. according data from consulting anization. building postal transport management program technology. according data from consulting anization drno postal transport management progr,the consequences this excessive use gps are mental aging diseases. user depending the level duration use quality the device. brain the brain will gradually lose the habit needing remember something because there are devices. travel even for those who like visit. nhem google search dong dinh tre. the user depending the level duration use quality the device will cause. use gps pda integrated devices for travel and exploration coordinates and direction. brain the brain will gradually lose the sense needing remember something because there are devices. application gps many devices least.  advantech resources case study. customize chromedonghodinhvigps  kinh. the application gps many devices will more less affect health. user depending the level the amount time used saved the drive. application gps many devices,Task 4 - Technology (No Index).docx - Google Resources data - Google Chrome,,420
the consequences this excessive use gps are mental aging diseases. user depending the level duration use quality the device. brain the brain will gradually lose the habit needing remember something because there are devices. travel even for those who like visit. nhem google search dong dinh tre. the user depending the level duration use quality the device will cause. use gps pda integrated devices for travel and exploration coordinates and direction. brain the brain will gradually lose the sense needing remember something because there are devices. application gps many devices least.  advantech resources case study. customize chromedonghodinhvigps  kinh. the application gps many device,smartphone for convenient munication everyone knows its benefits but not everyone knows its harms. locator watch for girls. cheap kids locator watch. online support settings activate windov. zalo your side because they are too busy with work parents often buy phones for their children. smartphones for easy munication the benefits are well known but its harms are not known everyone. zalo can with because they are too busy with work their parents often shop for them. find out the harmful effects mobile phones children health. gps locator with camera. gps wifi lbs locator watch. waiting for  google . locator watch for boys. with because they are too busy with work parents often buy phones for their children,,donghodinhvigps.com/ kinh-nghiem/dong-ho-dinh-vi-tre-em-nhung-tac hai-cua-dien-phone - search on google - google chrome,421
smartphone for convenient munication everyone knows its benefits but not everyone knows its harms. locator watch for girls. cheap kids locator watch. online support settings activate windov. zalo your side because they are too busy with work parents often buy phones for their children. smartphones for easy munication the benefits are well known but its harms are not known everyone. zalo can with because they are too busy with work their parents often shop for them. find out the harmful effects mobile phones children health. gps locator with camera. gps wifi lbs locator watch. waiting for  google . locator watch for boys. with because they are too busy with work parents often buy phones, lemin tac hai cua song dien den suc khoe con nguoi html.  emin tac hai cua song dien den suc khoe con nguoi htmlạ những thiết này gây đối với sức khỏe con người. hậu quả của việc lạm dung gps quá mức này những căn bệnh lão hóa tríạ. sóng cực ngắn thể gây những biến đồi chức năng bệnh các thống thần.  wikipedia  wiki _th ng_ bnh. tps suckhoedoisong phu thuoc thong dinh dao hai. được thể người hấp thụ càng nhiều tác hại đến sức khỏe càng lớn. sóng cực ngắn thể gây. gấu trúc lơn ảnh joel sartore getty images. 日au qua cua việc lạm uụng gps qua mưc riay nnưn.  emin tac hai cua song dien den suc khoe con nguoi htmlạ được. nghiên cứu phát tri tài tình. kinh tim mạch nội tiết nhiều quan khác sóng ngắn làm giảm lượng bạch cầu. các nghiên cứu cho thấy. theo liệu chức vấn. sóng cực ngắn thể gây những biến đồi chức năng bệnh các thống thẳn. tps suckhoedoisong phu thưoc thong dinh dao hai luoi htm. theo liệu chức vấn ngành công nghiệp động thế giới được thể. những thiết này gây đối với sức khỏe con người làm trầm trọng thêm tác. công nghệ điện thoại ttoong minhạ được thể người hấp. dựng vận hành quản. sóng cực ngắn thể gây những biến đổi chức năng bệnh các thống thần. theo liệu chức vấn ngành công nghiệp động thế giới được. hậu quả của việc lạm dụng. não mất dần thói quan cần. làm trầm trọng thêm tác động của stress đối với sức khỏe gia tăng nguy.  suckhoedoisong hiem hoa buc dien thoai thong minh thiet khong day. công nghệ điện thoại thông minh luôn gắn liền các thiết phần mềm ứng dụng gps được thể người hấp.  wikipedia  wiki bnh. trợ giúp chỉnh sửa lần cuối vài giây. loạn tuyến yên thượng thận tim mạch nội tiết. cửa lần cuổi vài giêy tritorây dựng vận hành quản. theo liệu chức vấn ngành công nghiệp động thế giới gsmaạ. người hấp thụ càng nhiều tác hại đến sức khỏe càng lớn. gây các rối loạn tuyến yên thượng thận tim mạch nội tiết.  static tuoitre tto gau truc jpg. qua cua việc iạm qụng gps. kinh tim mạch nội tiết nhiều quan khác sóng ngắn làm giảm lượng bạch. công nghệ điện thoaại thông minh đang lưu. sóng cực ngắn thế gây những biến đồi chức năng bệnh các thống thần. thể người hấp thụ càng nhiều tác hại đến sức khỏe càng lớn. 日au qua cua vięc. sinh nam giới cản trở giấc ngủ phục hồi sức khỏe. trợ giúp chỉnh sửa lần cuối vài. gps tên viết tắt của cụm global positioning system một thống bao. não não mất dần thôi quan cần phải ghi nhớ việc các thiết.  nhandan khoa hoc. ứng dụng của gps được dụng trên rất nhiều lãnh cực trong cuộc sống giao. mạch nội tiết nhiều quan khác sóng ngắn làm giảm lượng bạch cầu gây các rối. não mất dần thói quan.  emin tac hai cua song dien den suc khoe con nguoi htmlo lưu vào drive. sóng cực ngắn thể gây những biến đổi chức năng bệnh các thống thần kinh tim. viec rạm uụng gps. động của stress đối với sức khỏe gia tăng nguy mắc ung thư gia tăng. thụ càng nhiều tác hại đến sức khỏe càng lớn. kinh tim mạch nội tiết nhiễu quan khác sóng ngắn làm giảm lượng bạch. không thy hộã hội.  emin tac hai cua song dien den suc khoe con nguoi htmlạ được thể người hấp. 日au qua cua việc lam uụng gps qua mực riay nnưng can dện rao rioa. hậu quả của việc lạm dụng gps quá mức này những căn bệnh lão hóa trí. 日ềmạ được thể người hấp. sinh nam giới cần trở giấc ngủ phục hồi sức khỏe.  emin tac hai cua song dien den suc khoe con nguoi html. chúng đang quá phụ thuộc. công nghệ đang lưu.   dienmayxanh  kinh nghiem hay aps. công nghệ điện thoại thông minh luô được thể người hấp. công nghệ điện thoại thông minh luôn gặn liên vowi được thể người hấp.  suckhoedoisong phu thuoc thong dinh dao hai luoi htm. gồm nhiều tinh bay trên quỹ đạo phía trên trái đất cao. cầu gây các rối loạn tuyến yên thượng thận tim mạch nội tiết. qua cua việc iạm uụng gps. viec lạm qụng gps. não mất dần thói quan cần phải ghi nhớ việc các thiết. thụ càng nhiều tác hại đến sức khỏe càng lớn được thể người hấp. mắc ung thư gia tăng sinh nam giới cản trở giấc ngủ phục. ứng dụng của gps trên nhiều. não mất dần thói quan cần phài ghi nhớ việc,Task 4 - Technology (No Index) .docx - Google Docs - Google Chrome,,422
 lemin tac hai cua song dien den suc khoe con nguoi html.  emin tac hai cua song dien den suc khoe con nguoi htmlạ những thiết này gây đối với sức khỏe con người. hậu quả của việc lạm dung gps quá mức này những căn bệnh lão hóa tríạ. sóng cực ngắn thể gây những biến đồi chức năng bệnh các thống thần.  wikipedia  wiki _th ng_ bnh. tps suckhoedoisong phu thuoc thong dinh dao hai. được thể người hấp thụ càng nhiều tác hại đến sức khỏe càng lớn. sóng cực ngắn thể gây. gấu trúc lơn ảnh joel sartore getty images. 日au qua cua việc lạm uụng gps qua mưc riay nnưn.  emin tac hai cua song dien den suc khoe con nguoi htmlạ được. nghiên cứu phát tri tài tình. kinh tim mạch nội tiết nhiều quan khác ,please plete the security check access cellphones . cellphones  sforum buc buc smartphone anh huong the nao den suc khoe con people. waiting for cellphones . receiving list giant pandas photo biogas project,Attention Required! | Cloudflare - Google Chrome,how to properly use gps mobile phones to protect what is your health protection from radiation? - search on google - google chrome,423
please plete the security check access cellphones . cellphones  sforum buc buc smartphone anh huong the nao den suc khoe con people. waiting for cellphones . receiving list giant pandas photo biogas project. </s> lemin tac hai cua song dien den suc khoe con nguoi html.  emin tac hai cua song dien den suc khoe con nguoi htmlạ những thiết này gây đối với sức khỏe con người. hậu quả của việc lạm dung gps quá mức này những căn bệnh lão hóa tríạ. sóng cực ngắn thể gây những biến đồi chức năng bệnh các thống thần.  wikipedia  wiki _th ng_ bnh. tps suckhoedoisong phu thuoc thong dinh dao hai. được thể người hấp thụ càng nhiều tác hại đến sức khỏe càng lớn. sóng cực ngắn thể gây. gấu trúc lơn ,wikipedia smartphone you should know fpt. smart phone you should know ftp,,how to properly use gps mobile phones to protect what is your health protection from radiation? - search on google - google chrome,424
wikipedia smartphone you should know fpt. smart phone you should know ftp. </s>please plete the security check access cellphones . cellphones  sforum buc buc smartphone anh huong the nao den suc khoe con people. waiting for cellphones . receiving list giant pandas photo biogas project. </s> lemin tac hai cua song dien den suc khoe con nguoi html.  emin tac hai cua song dien den suc khoe con nguoi htmlạ những thiết này gây đối với sức khỏe con người. hậu quả của việc lạm dung gps quá mức này những căn bệnh lão hóa tríạ. sóng cực ngắn thể gây những biến đồi chức năng bệnh các thống thần.  wikipedia  wiki _th ng_ bnh. tps suckhoedoisong phu thuoc thong dinh dao hai. được thể người hấp thụ,many studies have proven that people tend have dangerous diseases such blood cancer thyroid cancer cancer etc. own preventive measures tend have dangerous diseases such blood cancer thyroid cancer cancer etc. too strange mobile phone. prone serious diseases such blood cancer thyroid cancer cancer. according data from consulting anization. studies have proven biu. studies have proven that people tend have serious diseases such blood cancer thyroid cancer and cancer. liliyblood has tendency have dangerous diseases such cancer blood. thyroid lung cancer breast cancer and some other ans. studies have proven from mobile phones with health therefore you should pay attention and equip. due quach phin prone serious diseases such blood cancer cancer. lung cancer breast cancer and some other parts mobile phones tend have serious diseases such blood cancer thyroid cancer cancer. self preventive measures tend have dangerous diseases such blood cancer cancer. studies have proven that people tend have serious diseases such blood cancer cancer the colon. microsoft powerpoint tend have dangerous diseases such blood cancer cancer the colon. lung cancer breast cancer and some other ans. people with serious diseases such blood cancer cancer tend have dangerous diseases such blood cancer thyroid cancer cancer etc. poor blood cancer prostate cancer. tend have dangerous diseases such blood cancer thyroid cancer cancer. iliu prone serious diseases such blood cancer,Task 4 - Technology (No Index).docx - Google Docs - Google Chrome,,426
many studies have proven that people tend have dangerous diseases such blood cancer thyroid cancer cancer etc. own preventive measures tend have dangerous diseases such blood cancer thyroid cancer cancer etc. too strange mobile phone. prone serious diseases such blood cancer thyroid cancer cancer. according data from consulting anization. studies have proven biu. studies have proven that people tend have serious diseases such blood cancer thyroid cancer and cancer. liliyblood has tendency have dangerous diseases such cancer blood. thyroid lung cancer breast cancer and some other ans. studies have proven from mobile phones with health therefore you should pay attention and equip. due qu,cancer prone serious diseases such blood cancer thyroid cancer cancer. lung cancer breast cancer and some other ans. according data from consulting anizations,Task 4 - Technology (No Index).docx - Google Resources data - Google Chrome,,428
cancer prone serious diseases such blood cancer thyroid cancer cancer. lung cancer breast cancer and some other ans. according data from consulting anizations. </s>many studies have proven that people tend have dangerous diseases such blood cancer thyroid cancer cancer etc. own preventive measures tend have dangerous diseases such blood cancer thyroid cancer cancer etc. too strange mobile phone. prone serious diseases such blood cancer thyroid cancer cancer. according data from consulting anization. studies have proven biu. studies have proven that people tend have serious diseases such blood cancer thyroid cancer and cancer. liliyblood has tendency have dangerous diseases such cancer , phongkhambnhminh tends have dangerous diseases such blood cancer thyroid cancer cancer.  nhandan khoa hoc. press the habit needing remember something because there are devices,Task 4 - Technology (No Index).docx - Google Resources data - Google Chrome,,430
 phongkhambnhminh tends have dangerous diseases such blood cancer thyroid cancer cancer.  nhandan khoa hoc. press the habit needing remember something because there are devices. </s>cancer prone serious diseases such blood cancer thyroid cancer cancer. lung cancer breast cancer and some other ans. according data from consulting anizations. </s>many studies have proven that people tend have dangerous diseases such blood cancer thyroid cancer cancer etc. own preventive measures tend have dangerous diseases such blood cancer thyroid cancer cancer etc. too strange mobile phone. prone serious diseases such blood cancer thyroid cancer cancer. according data from consulting anization. studies,what the phone with birth payment. phongkhambnhminh  cac benh khaccach ngan buc dien thoai and phone with newborn payment,,,432
what the phone with birth payment. phongkhambnhminh  cac benh khaccach ngan buc dien thoai and phone with newborn payment. </s> phongkhambnhminh tends have dangerous diseases such blood cancer thyroid cancer cancer.  nhandan khoa hoc. press the habit needing remember something because there are devices. </s>cancer prone serious diseases such blood cancer thyroid cancer cancer. lung cancer breast cancer and some other ans. according data from consulting anizations,phone calls with twins. what risc and phone with parison. who the picture and person,,,433
phone calls with twins. what risc and phone with parison. who the picture and person. </s>what the phone with birth payment. phongkhambnhminh  cac benh khaccach ngan buc dien thoai and phone with newborn payment. </s> phongkhambnhminh tends have dangerous diseases such blood cancer thyroid cancer cancer.  nhandan khoa hoc. press the habit needing remember something because there are devices, fptshop  news reviews advice. yes there are too many cell phones. smart you should know ftp lot mobile phones yes. waiting for wikipedia . smart you should know fpt from phone. tend have dangerous diseases such blood cancer thyroid cancer,,,435
 fptshop  news reviews advice. yes there are too many cell phones. smart you should know ftp lot mobile phones yes. waiting for wikipedia . smart you should know fpt from phone. tend have dangerous diseases such blood cancer thyroid cancer. </s>phone calls with twins. what risc and phone with parison. who the picture and person. </s>what the phone with birth payment. phongkhambnhminh  cac benh khaccach ngan buc dien thoai and phone with newborn payment,broken bonds smartphone not working the way. waiting for  google . waiting for  google  all the same,5 facts about smartphone radiation you should know - Fptshop.com.vn - Google Chrome,,436
broken bonds smartphone not working the way. waiting for  google . waiting for  google  all the same. </s> fptshop  news reviews advice. yes there are too many cell phones. smart you should know ftp lot mobile phones yes. waiting for wikipedia . smart you should know fpt from phone. tend have dangerous diseases such blood cancer thyroid cancer. </s>phone calls with twins. what risc and phone with parison. who the picture and person,information electromagnetic waves with wavelengths between and have. electromagnetism carries energy momentum and. for images fpt shop electromagnetic carries energy momentum and even. for images fpt shop from phone,,,437
information electromagnetic waves with wavelengths between and have. electromagnetism carries energy momentum and. for images fpt shop electromagnetic carries energy momentum and even. for images fpt shop from phone. </s>broken bonds smartphone not working the way. waiting for  google . waiting for  google  all the same. </s> fptshop  news reviews advice. yes there are too many cell phones. smart you should know ftp lot mobile phones yes. waiting for wikipedia . smart you should know fpt from phone. tend have dangerous diseases such blood cancer thyroid cancer,chrysanthemum healthy when using. according data from consulting anizations. anh huong suc show html. here are ways help you. good condition mobile phone. here are ways help you protect are ways help you keep your animals healthy when using electricity. lung cancer breast cancer and some other ans. are ways help you improve your vocabulary. here are ways help you protect your health when using mobile phones. cancer prone serious diseases such blood cancer thyroid cancer cancer. the tendency have dangerous diseases such blood cancer thyroid cancer cancer etc. anh huong suc showing html.  phongkhambnhminh  cac benh khaccach ngan buc dien thoai.  nhandan khoa hoc. extremely short exposure can cause,Task 4 - Technology (No Index) .docx - Google Docs - Google Chrome,,438
