source,target,title,query,index
windows helordegree oma supplement. name date modified type size. save astype pdf files. hide folders thispc desktop erasmus prepare. kela application microsoft edge. videos hostguyen bac hosniguyen dipl. </s>read more erasmus magazine. dilot initiative the university council. four locations campus cabinets will. from thursday you can find the cabinets the ladies toilets the erasmus pavilion the university. pilot initiative the university council. newsoverview free menstrual products ladies toilets campus. icking them ikea for the moment this project still emphatically its trial stage the products. pmenstrual hygiene products this small scale. rom thursday you can find the cabinets the ladies toilets the erasmus pavilion the university. facebook instagram linkedin twitter library the food court and the van der goot building the two council members behind the initiative. tsp parttimejob baking metropolialibrary businessdic news vieuutiset webcionar banhmi french usfulweb mocha creme cara tollets campus erasmusl. free menstrual products ladies. conantap parttimejob,you want learn more about specific course want see the current timetable you can fill out. conantip parttimejob baking metropolia library businessdic news vie uutiset webcionsy banhmi french usefulweb mocha creme cara. premaster media creative industries. the course code the online course guide. study program course code. term media systems parative perspective. introduction social science research. antip parttmejob baking metropolialibrary busiessdic news vieuutietl webcionary banhmi french usefulweb mocha creme cara. iterm introduction statistical analysis. grades and study progress. media and munication theory. term premaster research project paper cmo. qualitative methods media and munication. premaster research project paper. premaster media culture society. premaster research project proposal. term media and munication theory. erasmus school history culture and munication media munication premaster media studies program curriculum study program. apps conantap parttimejob boking metropolialibrary businessdic news yle uutiset webcionay  banhmi french dtssr,,,284
you want learn more about specific course want see the current timetable you can fill out. conantip parttimejob baking metropolia library businessdic news vie uutiset webcionsy banhmi french usefulweb mocha creme cara. premaster media creative industries. the course code the online course guide. study program course code. term media systems parative perspective. introduction social science research. antip parttmejob baking metropolialibrary busiessdic news vieuutietl webcionary banhmi french usefulweb mocha creme cara. iterm introduction statistical analysis. grades and study progress. media and munication theory. term premaster research project paper cmo. qualitative methods media and munication. premaster research project paper. premaster media culture society. premaster research project proposal. term media and munication theory. erasmus school history culture and munication media munication premaster media studies program curriculum study program. apps conantap parttimejob boking metropolialibrary businessdic news yle uutiset webcionay  banhmi french dtssr. <,you want learn more about specific course want see the current timetable you can fill out. term premaster research project paper. the course code the online course guide. term media systems parative perspective. term munication and anizations erogramme. introduction social science research timetables. term grades and study progress. apps conantep parttmejob boking metropolialibrary businessdic news vie uutiset webcionary  banhmi french uscfulweb mocha creme cara. term media and munication theory mittee. term premaster research project paper cmo. skills skills academic schedules. qualitative methods media and munication. introduction social science research program. premaster media culture society. study program course code premaster thesis. premaster research project proposal. term media and munication theory. erasmus school history culture and munication media munication premaster media studies program curriculum study program. term munication and anizations efe. temi introduction statistical analysis. total premaster research project proposal,,,286
you want learn more about specific course want see the current timetable you can fill out. term premaster research project paper. the course code the online course guide. term media systems parative perspective. term munication and anizations erogramme. introduction social science research timetables. term grades and study progress. apps conantep parttmejob boking metropolialibrary businessdic news vie uutiset webcionary  banhmi french uscfulweb mocha creme cara. term media and munication theory mittee. term premaster research project paper cmo. skills skills academic schedules. qualitative methods media and munication. introduction social science research program. premaster media culture society. study program course code premaster thesis. premaster research project proposal. term media and munication theory. erasmus school history culture and munication media munication premaster media studies program curriculum study program. term munication and anizations efe. temi introduction statistical analysis. total premaster research project proposal. </s>you want lear,nguyen hoa nguyen hoa nguyen. show startupuan hoa nguyen hoa nguyen,Google Chrome,,290
nguyen hoa nguyen hoa nguyen. show startupuan hoa nguyen hoa nguyen. </s>you want learn more about specific course want see the current timetable you can fill out. term premaster research project paper. the course code the online course guide. term media systems parative perspective. term munication and anizations erogramme. introduction social science research timetables. term grades and study progress. apps conantep parttmejob boking metropolialibrary businessdic news vie uutiset webcionary  banhmi french uscfulweb mocha creme cara. term media and munication theory mittee. term premaster research project paper cmo. skills skills academic schedules. qualitative methods media and munication. introduction social science research program. premaster media culture society. study program course code premaster thesis. premaster research project proposal. term media and munication theory. erasmus school history culture and munication media munication premaster media studies program curriculum study program. term munication and anizations efe. temi introduction statistic,businessdic news vieustiset webcionary bonhmi french uscfulweb mocha creme cora jobstep net amm. curricula premaster media studies. term media and munication theory mittee. introduction social science research timetables. online course guide premaster media studies. term media and munication theory. introduction social science research. premaster media culture society. course code premaster thesis. apps conantep pattimejob baking metropola liba. term facilities study program course code. premaster media creative industries curriculum study. grades and study progress,,,293
businessdic news vieustiset webcionary bonhmi french uscfulweb mocha creme cora jobstep net amm. curricula premaster media studies. term media and munication theory mittee. introduction social science research timetables. online course guide premaster media studies. term media and munication theory. introduction social science research. premaster media culture society. course code premaster thesis. apps conantep pattimejob baking metropola liba. term facilities study program course code. premaster media creative industries curriculum study. grades and study progress. </s>nguyen hoa nguyen hoa nguyen. show startupuan hoa nguyen hoa nguyen. </s>you want learn more about specific course want see the current timetable you can fill out. term premaster research project paper. the course code the online course guide. term media systems parative perspective. term munication and anizations erogramme. introduction social science research timetables. term grades and study progress. apps conantep parttmejob boking metropolialibrary businessdic news vie uutiset webcionary  ba,modia crantivia indiictriae myeurnl esh. apps conantip parttmejob baking metropola libra,,,298
modia crantivia indiictriae myeurnl esh. apps conantip parttmejob baking metropola libra. </s>businessdic news vieustiset webcionary bonhmi french uscfulweb mocha creme cora jobstep net amm. curricula premaster media studies. term media and munication theory mittee. introduction social science research timetables. online course guide premaster media studies. term media and munication theory. introduction social science research. premaster media culture society. course code premaster thesis. apps conantep pattimejob baking metropola liba. term facilities study program course code. premaster media creative industries curriculum study. grades and study progress. </s>nguyen hoa nguyen hoa nguyen. show startupuan hoa nguyen hoa nguyen,occrtance you programe witi. rceve ner grematrey befre. rcee neec sematurey befre. rcee neeo oematurcy befre. rceive uneo oematurcy befre. recive ervol reroturh ore. icortancewith her plte pograame. you pve oted enoimert. receive nera grematrey slore eapps. con nce you hve seiterrted. you recee cnrvl remturh eore. con once rve enoimert. for you cnnrrpted evtrent. ocorance plt regramme ysrs. vou ecie ety rerotueh. you recee ervol rerotush beore. for ence you snrrpted evolent. ccortance you ptete programe witi. raportionl par ofthesainy iion. you receme rerturh eor. you recee nrvl rematuseh beore. recen areund you unerv orematury beore june ofthe. occrsance you prgrame witi. ccrsance you ptete programe witi and. rceve neeo srematurcy befre. reund youunerv cemturey before une. rceve aefan neea oty blre. rceve unenot rematurey befre. child nce hve sncimet. recive reunc youunervo rematrey efore uneof. for nce pted evlmert. receve neot srematurey efre. ocortancewith her vou pite pograe yeurs. fcornce with pit rogrne within. rceve ner rematrey sefre. conths nce hve enimet. ccorsance you mis pete prgrame witi. ccrsance you ptethe programe witi. attt proparionl prt the saary one. remaser acouning auting contrel. serts reporat sty oce. for rce srrpted evlrent. you receme ety crvl reraturh beore. recive rvl rematurh eore. rceve ner srematrey sfre. ion vou ecie etund reraturh. fsion receive rvl remtarh. not cademe rvtiment crrg. you ecie eundyou errl. aion vou ece ety reraturh. fio vou fyo sefore. you ptete programe witin. fio vou ecie eturd reratuehy. rceive neso oematrcy blre. rceve neeo srematrcy befre. you ecive rvol ore. receive nera grematrey slore todrts peeporosl por. ccrtance you ptete programie witi. con you hve enoimert. tion vou recie crvl rematureh. rcee neeo omaturcy befre. ocortancewith the pite pograe yur. eng_premaster bedragen metcoronakorting xisx. rceve sner rematrey bfre,,,320
occrtance you programe witi. rceve ner grematrey befre. rcee neec sematurey befre. rcee neeo oematurcy befre. rceive uneo oematurcy befre. recive ervol reroturh ore. icortancewith her plte pograame. you pve oted enoimert. receive nera grematrey slore eapps. con nce you hve seiterrted. you recee cnrvl remturh eore. con once rve enoimert. for you cnnrrpted evtrent. ocorance plt regramme ysrs. vou ecie ety rerotueh. you recee ervol rerotush beore. for ence you snrrpted evolent. ccortance you ptete programe witi. raportionl par ofthesainy iion. you receme rerturh eor. you recee nrvl rematuseh beore. recen areund you unerv orematury beore june ofthe. occrsance you prgrame witi. ccrsance you ptete programe witi and. rceve neeo srematurcy befre. reund youunerv cemturey before une. rceve aefan neea oty blre. rceve unenot rematurey befre. child nce hve sncimet. recive reunc youunervo rematrey efore uneof. for nce pted evlmert. receve neot srematurey efre. ocortancewith her vou pite pograe yeurs. fcornce with pit rogrne within. rceve ner rematrey sefre. conths nce hve enim,pps conntap parttimejob boking metropolislibrary businessdic news vieuutisetl webcionary banhmi french usefulweb mocha creme cora jobstep net amm. students who are enrolled for premaster program will not paying the regular tuition fee but instead called premaster rate student enrolled for regular bachelor. more information about the premaster rates can found here   eur education practical matters financial matters tuition fee rates premasters. enter your question all categories. good afternoon how can help you. home registration and unenrolment tuition fees and finances tuition fees premaster rates tuition fees premaster rates. the provider the course for more information the course fee. students that are enrolled for courses the erasmus university pay the course fee directly the faculty where they are following the course please contact the educational program. program the same time the premaster then the student will only charged the regular tuition fee that case the student will need provide the erasmus university proof. payment tuition fee the educational institution where she already paying the regular tuition fee. where can find fees and premaster rates. the fees can found here   eur education practical matters financial matters tuition fee,https://eur.verintexpress.com/direct.aspx?UG=4&T=EN&timeoffsetcookie=1 - Google Chrome,,321
pps conntap parttimejob boking metropolislibrary businessdic news vieuutisetl webcionary banhmi french usefulweb mocha creme cora jobstep net amm. students who are enrolled for premaster program will not paying the regular tuition fee but instead called premaster rate student enrolled for regular bachelor. more information about the premaster rates can found here   eur education practical matters financial matters tuition fee rates premasters. enter your question all categories. good afternoon how can help you. home registration and unenrolment tuition fees and finances tuition fees premaster rates tuition fees premaster rates. the provider the course for more information the course fee. students that are enrolled for courses the erasmus university pay the course fee directly the faculty where they are following the course please contact the educational program. program the same time the premaster then the student will only charged the regular tuition fee that case the student will need provide the erasmus university proof. payment tuition fee the educational ins,datetaken specify date taken. hashtag highlight blank logo. please note make sure that erasmus university rotterdam receives the payment before. choosing the payment method studiolink you declare that you are agreement with the. terms and conditions specified the accounts receivable protocol erasmus. thispc desktop erasmus prepare search prepare. vourtamidiopic neme date modified tpe size. save astype portable network graphic file png. country bank account finland. university rotterdam sripping tool. hide folders save cancel. for more information the payment your tuition fees please refer our website. payment method other method payment. pts file waffdaddy waffle,Snipping Tool,,328
datetaken specify date taken. hashtag highlight blank logo. please note make sure that erasmus university rotterdam receives the payment before. choosing the payment method studiolink you declare that you are agreement with the. terms and conditions specified the accounts receivable protocol erasmus. thispc desktop erasmus prepare search prepare. vourtamidiopic neme date modified tpe size. save astype portable network graphic file png. country bank account finland. university rotterdam sripping tool. hide folders save cancel. for more information the payment your tuition fees please refer our website. payment method other method payment. pts file waffdaddy waffle. </s>pps conntap parttimejob boking metropolislibrary businessdic news vieuutisetl webcionary banhmi french usefulweb mocha creme cora jobstep net amm. students who are enrolled for premaster program will not paying the regular tuition fee but instead called premaster rate student enrolled for regular bachelor. more information about the premaster rates can found here   eur education practical matters fi,apps conantep pattimejob baking metropolialibrary busiessdic news vieuutiset webcionary banhmi french usefulweb mocha creme cara jobstepnet amm. days nira currently binh duy school education trwong thpt. far away gig trudc. son chudn exam exam phat. how much money you spend. tieu cyfe nhisu kannettavat. gen mac hdi chirng bad sorry. now father and are not allowed the wrong place. translating the language embankment. gen this the way reveal all the other rules that are very wele cham. bai sing gid trudc tarj essa,Entertainment News Channel - Social - Kenh14.vn - Google Chrome,,335
apps conantep pattimejob baking metropolialibrary busiessdic news vieuutiset webcionary banhmi french usefulweb mocha creme cara jobstepnet amm. days nira currently binh duy school education trwong thpt. far away gig trudc. son chudn exam exam phat. how much money you spend. tieu cyfe nhisu kannettavat. gen mac hdi chirng bad sorry. now father and are not allowed the wrong place. translating the language embankment. gen this the way reveal all the other rules that are very wele cham. bai sing gid trudc tarj essa. </s>datetaken specify date taken. hashtag highlight blank logo. please note make sure that erasmus university rotterdam receives the payment before. choosing the payment method studiolink you declare that you are agreement with the. terms and conditions specified the accounts receivable protocol erasmus. thispc desktop erasmus prepare search prepare. vourtamidiopic neme date modified tpe size. save astype portable network graphic file png. country bank account finland. university rotterdam sripping tool. hide folders save cancel. for more information the,you will part the international invent research team where student assistant you will. ejob baking metopolialibrary businesscic news vieuutiset webcionary banhmi french usefulweb mocha creme cara. invent project for hours per week starting july. munication student assistant who will support the international. history culture and munication looking for media and. the media and munication department the erasmus school. vacancy student assistant munication eshcc hours,,,336
you will part the international invent research team where student assistant you will. ejob baking metopolialibrary businesscic news vieuutiset webcionary banhmi french usefulweb mocha creme cara. invent project for hours per week starting july. munication student assistant who will support the international. history culture and munication looking for media and. the media and munication department the erasmus school. vacancy student assistant munication eshcc hours. </s>apps conantep pattimejob baking metropolialibrary busiessdic news vieuutiset webcionary banhmi french usefulweb mocha creme cara jobstepnet amm. days nira currently binh duy school education trwong thpt. far away gig trudc. son chudn exam exam phat. how much money you spend. tieu cyfe nhisu kannettavat. gen mac hdi chirng bad sorry. now father and are not allowed the wrong place. translating the language embankment. gen this the way reveal all the other rules that are very wele cham. bai sing gid trudc tarj essa. </s>datetaken specify date taken. hashtag highlight blank logo. please note make sure,flexible this position may include blended working. accuracy proactive collaborative puter skills anizational skills intercultural. high standard written and oral munication skills. the international office eur promotes and supports outgoing and ining mobility this includes. activities such credential evaluation managing immigration procedures and scholarship. google drive safe place for all your files. puter literate articulate and petent the use the internet outlook and adobe. conantsp parttimejob boking metropolialibrary businessdic. proactive and independent working style. try drive for free. knowledge adobe programs such photoshop indesign and bridge. the international office eur part the unit education student affairs within the university. able relate the needs international students. proficient least level english. available the academic year. myeurnlen eurne ent assistant interational office. apps conantap parttimejob boking metropoilibrary busiessdic news vie uutiset webcionary banhmi french useflweb mocha creme cara lobstepunet amm. task wildife nol task technology. anized accurate and structured way working. have experience using social media marketing and munication tool. task health noin tesk culture nol task wildife nol task technology,Vacancy: Marketing Communication Student Assistant International Office EUR | Erasmus University Rotterdam Students | Erasmus University Rotterdam - Google Chrome,,339
flexible this position may include blended working. accuracy proactive collaborative puter skills anizational skills intercultural. high standard written and oral munication skills. the international office eur promotes and supports outgoing and ining mobility this includes. activities such credential evaluation managing immigration procedures and scholarship. google drive safe place for all your files. puter literate articulate and petent the use the internet outlook and adobe. conantsp parttimejob boking metropolialibrary businessdic. proactive and independent working style. try drive for free. knowledge adobe programs such photoshop indesign and bridge. the international office eur part the unit education student affairs within the university. able relate the needs international students. proficient least level english. available the academic year. myeurnlen eurne ent assistant interational office. apps conantap parttimejob boking metropoilibrary busiessdic news vie uutiset webcionary banhmi french useflweb mocha creme cara lobstepunet amm. task wildife nol ta,usp drive_open ouid fbelid iwar qrjopaiee ezrsreq kbpxnbuzy yaxyoxyeqscgce jhnqs drsilee tar. task health noin task gulture task wildiife task technology businessdic. task health noin task gulture task wildiife task technology,,,343
usp drive_open ouid fbelid iwar qrjopaiee ezrsreq kbpxnbuzy yaxyoxyeqscgce jhnqs drsilee tar. task health noin task gulture task wildiife task technology businessdic. task health noin task gulture task wildiife task technology. </s>flexible this position may include blended working. accuracy proactive collaborative puter skills anizational skills intercultural. high standard written and oral munication skills. the international office eur promotes and supports outgoing and ining mobility this includes. activities such credential evaluation managing immigration procedures and scholarship. google drive safe place for all your files. puter literate articulate and petent the use the internet outlook and adobe. conantsp parttimejob boking metropolialibrary businessdic. proactive and independent working style. try drive for free. knowledge adobe programs such photoshop indesign and bridge. the international office eur part the unit education student affairs within the university. able relate the needs international students. proficient least level english. available th,are destroyed mainly because they are specifically adapted life eating. most the remaining wild pandas live the minshan and qinling mountains.  sciencing  pandas endangered animals html. environment where they can thrive. around isolated patches bamboo forest six mountain ranges china sichuan. bamboo pandas digestive systems can properly digest anything else because.  animalfactguide  animal facts giant panda. panda habitats large size for pandas the environment they were originally adapted the only. apps conantip pattimejob baking metropolialibrary businesscic news yieuutiet webcionay banhmi french usefulweb mocha creme cora jobstep net amm other bookmarks reading list. housing private market erasmus school history culture and munication erasmus university rotterdam wyww eur eshcc education practical matters student life housing intuitive students other acmadation providers private. erasmus school history culture and munication google search. shaanxi and gansu provinces. neighboring myanmar and northern vietnam,,,344
