source,target,title,query,index
onediive jun text document. name date modified tpe size. vouriisibo june text document. clipboard anize new open sale. items newiten hopen hlsetectan. thispc windows program files microsoft reknow activity surveillance source extras search extras. copy path easy access yedt selectnone. </s>pinto quick copy paste move copy delete rename new properties. pasteshortent foldar pgs bistoy nvert seection. new item lopen selecta. copy path easy access eat selectnone. thispc windows program files microsoft reknow activity surveillance source temp search temp. clipboard anize new open view. items new item lopen selecta. </s>tspc windows program files microsoft reknow activity surveillance. clipboara anize new open. name date modified tpe size. pictures system data sqlite dil application exten. search reknow activity surv. videos system data sql teing application ecten. pintoquick copy paste move copy delete rename new properties. this entityframework sqiserver dil application exten. windows systemnet hitp abieitc. onediive may files older. access pasteshortast folder hstoy,title program files microsoft reknow activity surveillance sour. program files microsoft reknow activity surveillance source,"1624796668,13503 - Notepad",,3
title program files microsoft reknow activity surveillance sour. program files microsoft reknow activity surveillance source. </s>onediive jun text document. name date modified tpe size. vouriisibo june text document. clipboard anize new open sale. items newiten hopen hlsetectan. thispc windows program files microsoft reknow activity surveillance source extras search extras. copy path easy access yedt selectnone. </s>pinto quick copy paste move copy delete rename new properties. pasteshortent foldar pgs bistoy nvert seection. new item lopen selecta. copy path easy access eat selectnone. thispc windows program files microsoft reknow activity surveillance source temp search temp. clipboard anize new open view. items new item lopen selecta,tispc windows program files microsoft reknow activity survellance source temp. thspc windows program files microsoft reknow actvity surveilance source temp searchtemp. clipboard anize new open select. finto quick copy parte move copy delte rename new,C:\Program Files (x86)\Microsoft\ReKnow Activity Surveillance\source\temp,,4
tispc windows program files microsoft reknow activity survellance source temp. thspc windows program files microsoft reknow actvity surveilance source temp searchtemp. clipboard anize new open select. finto quick copy parte move copy delte rename new. </s>title program files microsoft reknow activity surveillance sour. program files microsoft reknow activity surveillance source. </s>onediive jun text document. name date modified tpe size. vouriisibo june text document. clipboard anize new open sale. items newiten hopen hlsetectan. thispc windows program files microsoft reknow activity surveillance source extras search extras. copy path easy access yedt selectnone,tspc windows program files microsoft reknow activity surveillance. clipboara anize new open. name date modified tpe size. pictures system data sqlite dil application exten. search reknow activity surv new item open. search reknow activity surv. videos system data sql teing application ecten. pintoquick copy paste move copy delete rename mnew properties. this entityframework sqiserver dil application exten. windows systemnet hitp abieitc. onediive woe file folder. access pasteshortast folder hstoy. copy path asyaccess teat,C:\Program Files (x86)\Microsoft \ReKnow Activity Surveillance,,5
tspc windows program files microsoft reknow activity surveillance. clipboara anize new open. name date modified tpe size. pictures system data sqlite dil application exten. search reknow activity surv new item open. search reknow activity surv. videos system data sql teing application ecten. pintoquick copy paste move copy delete rename mnew properties. this entityframework sqiserver dil application exten. windows systemnet hitp abieitc. onediive woe file folder. access pasteshortast folder hstoy. copy path asyaccess teat. </s>tispc windows program files microsoft reknow activity survellance source temp. thspc windows program files microsoft reknow actvity surveilance source temp searchtemp. clipboard anize new open select. finto quick copy parte move copy delte rename new. </s>title program files microsoft reknow activity surveillance sour. program files microsoft reknow activity surveillance source,onedrive betemp files older. clipboara anize new open. name date modified tpe size. this chromeacl june text document. objects chromeistory text document. desktop logs june text document. tspc windows program files microsoft reknow activty surveilance source. access pasteshortast folder hstoy. pintoquick copy paste move copy delete rename properties. copy path asyaccess teat,C:\Program Files (x86) \Microsoft\ReKnow Activity Surveillance\source,,6
onedrive betemp files older. clipboara anize new open. name date modified tpe size. this chromeacl june text document. objects chromeistory text document. desktop logs june text document. tspc windows program files microsoft reknow activty surveilance source. access pasteshortast folder hstoy. pintoquick copy paste move copy delete rename properties. copy path asyaccess teat. </s>tspc windows program files microsoft reknow activity surveillance. clipboara anize new open. name date modified tpe size. pictures system data sqlite dil application exten. search reknow activity surv new item open. search reknow activity surv. videos system data sql teing application ecten. pintoquick copy paste move copy delete rename mnew properties. this entityframework sqiserver dil application exten. windows systemnet hitp abieitc. onediive woe file folder. access pasteshortast folder hstoy. copy path asyaccess teat. </s>tispc windows program files microsoft reknow activity survellance source temp. thspc windows program files microsoft reknow actvity surveilance source temp searcht,pinto quick copy paste move copy delete rename new properties. pasteshortat folger history seecton. thispc windows program files microsoft reknow activty surveillance source temp vio searchtemp. your virus protection has expired. quick access this folderis empty. mcafee protects the world. google search feeling lucky. cvjdraft thixuanhhoa berintx img_ img_. largest banks from dangerous viruses. clipboard anize new open select. about advertising business how search works. baking metropoiia libary businesscic news vie uutiset webcionary banhmi french usefulweb mocha creme cara lobstepunet arm. taiwanong bemnh feth vol. type here search pilvista. google offered vietnamese suomi svenska. let protect you too,C:\Program Files (x86)\Microsoft\ReKnow Activity Surveillance\source\temp,,7
pinto quick copy paste move copy delete rename new properties. pasteshortat folger history seecton. thispc windows program files microsoft reknow activty surveillance source temp vio searchtemp. your virus protection has expired. quick access this folderis empty. mcafee protects the world. google search feeling lucky. cvjdraft thixuanhhoa berintx img_ img_. largest banks from dangerous viruses. clipboard anize new open select. about advertising business how search works. baking metropoiia libary businesscic news vie uutiset webcionary banhmi french usefulweb mocha creme cara lobstepunet arm. taiwanong bemnh feth vol. type here search pilvista. google offered vietnamese suomi svenska. let protect you too. </s>onedrive betemp files older. clipboara anize new open. name date modified tpe size. this chromeacl june text document. objects chromeistory text document. desktop logs june text document. tspc windows program files microsoft reknow activty surveilance source. access pasteshortast folder hstoy. pintoquick copy paste move copy delete rename properties. copy pat,that doesn work try signing out and back deskiop eceectd. failed connect settings endpoint. that doesn work try signing out and back. couldn connect the internet try checking your. error code online check failed exceeded retry attempts,Microsoft Teams,,10
that doesn work try signing out and back deskiop eceectd. failed connect settings endpoint. that doesn work try signing out and back. couldn connect the internet try checking your. error code online check failed exceeded retry attempts. </s>pinto quick copy paste move copy delete rename new properties. pasteshortat folger history seecton. thispc windows program files microsoft reknow activty surveillance source temp vio searchtemp. your virus protection has expired. quick access this folderis empty. mcafee protects the world. google search feeling lucky. cvjdraft thixuanhhoa berintx img_ img_. largest banks from dangerous viruses. clipboard anize new open select. about advertising business how search works. baking metropoiia libary businesscic news vie uutiset webcionary banhmi french usefulweb mocha creme cara lobstepunet arm. taiwanong bemnh feth vol. type here search pilvista. google offered vietnamese suomi svenska. let protect you too. </s>onedrive betemp files older. clipboara anize new open. name date modified tpe size. this chromeacl june text document. o,apps conantap parttimejob boking metropoilibrary busiessdic news vie uutiset webcionary banhmi french usefulweb mocha creme cara lobstepunet amm other bookmarks reading. google  google chrome not responding. google chrome not responding. change settings such making connection metered. running windows network diagnostics. err_internet_disconnecte google  google chrome not responding. hang while windows reports the problem microsoft. checking the network cables modems and routers,www.google.com.vn - Google Chrome (Not Responding),,11
apps conantap parttimejob boking metropoilibrary busiessdic news vie uutiset webcionary banhmi french usefulweb mocha creme cara lobstepunet amm other bookmarks reading. google  google chrome not responding. google chrome not responding. change settings such making connection metered. running windows network diagnostics. err_internet_disconnecte google  google chrome not responding. hang while windows reports the problem microsoft. checking the network cables modems and routers. </s>that doesn work try signing out and back deskiop eceectd. failed connect settings endpoint. that doesn work try signing out and back. couldn connect the internet try checking your. error code online check failed exceeded retry attempts. </s>pinto quick copy paste move copy delete rename new properties. pasteshortat folger history seecton. thispc windows program files microsoft reknow activty surveillance source temp vio searchtemp. your virus protection has expired. quick access this folderis empty. mcafee protects the world. google search feeling lucky. cvjdraft thixuanhhoa berintx i,ribbonentranhonline nfo conan tap chap update html. tulossa piano ole yhteydessa instagram kavereihisi suoraan mesmessenger google chrome not responding. conantap parttimejob baking metropollibrary. messenger google chrome not responding. messengerin avulla suosikki ihmistesi hell pysyminen. conan tap full truyen conan tap full ic conan tap full. tulossa piano ole yhteydessa instagram kavereihisi suoraan mes qgf. huoneet ominaisuudet yksityisyys turvallisuus kehittsjille,Messenger - Google Chrome (Not Responding),,12
ribbonentranhonline nfo conan tap chap update html. tulossa piano ole yhteydessa instagram kavereihisi suoraan mesmessenger google chrome not responding. conantap parttimejob baking metropollibrary. messenger google chrome not responding. messengerin avulla suosikki ihmistesi hell pysyminen. conan tap full truyen conan tap full ic conan tap full. tulossa piano ole yhteydessa instagram kavereihisi suoraan mes qgf. huoneet ominaisuudet yksityisyys turvallisuus kehittsjille. </s>apps conantap parttimejob boking metropoilibrary busiessdic news vie uutiset webcionary banhmi french usefulweb mocha creme cara lobstepunet amm other bookmarks reading. google  google chrome not responding. google chrome not responding. change settings such making connection metered. running windows network diagnostics. err_internet_disconnecte google  google chrome not responding. hang while windows reports the problem microsoft. checking the network cables modems and routers. </s>that doesn work try signing out and back deskiop eceectd. failed connect settings endpoint. that doesn work tr,whatis low back pain. more than adults have low back pain some time their life while back pain usually. busnessdic news yieuutiset webcionary banhmi french uscfulweb mocha creme cara. what low back pain. find out the connections between back pain and other bone disease such. more than aduits have low back pain some time their life while back pain usually. are there differences between low back pain and other conventional back pains. acute short term back pain can often chronic for those chronic back pain they might. apps conantap parttimejob boking metropolia library. provide some methods relieve back pain. provide some methods relieve back pain ori. osteoporosis arthritis osteoarthritis etc. boking metropolialibrary businesscic news uutiset webcionary banhmi french usefulweb mocha creme cara lobstepunet amm. caused other physical problems. parttimejob baking metropolialibrary businessdic news vieuutiset webcionary banhmi french usefulweb mocha creme cara jobstep net amm otherbookmarks reading. what are symptoms and causes low back pains. tiedosto muokkaa nayta lisaa muoto tyokalut laajennukset ohje. find out the connections between back pain and health problems except bone disease,,,17
whatis low back pain. more than adults have low back pain some time their life while back pain usually. busnessdic news yieuutiset webcionary banhmi french uscfulweb mocha creme cara. what low back pain. find out the connections between back pain and other bone disease such. more than aduits have low back pain some time their life while back pain usually. are there differences between low back pain and other conventional back pains. acute short term back pain can often chronic for those chronic back pain they might. apps conantap parttimejob boking metropolia library. provide some methods relieve back pain. provide some methods relieve back pain ori. osteoporosis arthritis osteoarthritis etc. boking metropolialibrary businesscic news uutiset webcionary banhmi french usefulweb mocha creme cara lobstepunet amm. caused other physical problems. parttimejob baking metropolialibrary businessdic news vieuutiset webcionary banhmi french usefulweb mocha creme cara jobstep net amm otherbookmarks reading. what are symptoms and causes low back pains. tiedosto muokkaa nayta l,ngdi related from ngot recently uplo. views sep share save,,,23
ngdi related from ngot recently uplo. views sep share save. </s>whatis low back pain. more than adults have low back pain some time their life while back pain usually. busnessdic news yieuutiset webcionary banhmi french uscfulweb mocha creme cara. what low back pain. find out the connections between back pain and other bone disease such. more than aduits have low back pain some time their life while back pain usually. are there differences between low back pain and other conventional back pains. acute short term back pain can often chronic for those chronic back pain they might. apps conantap parttimejob boking metropolia library. provide some methods relieve back pain. provide some methods relieve back pain ori. osteoporosis arthritis osteoarthritis etc. boking metropolialibrary businesscic news uutiset webcionary banhmi french usefulweb mocha creme cara lobstepunet amm. caused other physical problems. parttimejob baking metropolialibrary businessdic news vieuutiset webcionary banhmi french usefulweb mocha creme cara jobstep net amm otherbookmarks reading. what ,might caused other physical problems. sion created from the fast. uanh dropbox ruoholahti vhteiskansio. words english united states. aabbccde asbbeene aabbc asbbccl aqd asebeer acbbcedc acbbccd acbbccd mabbccd aabbccd aabdccd aabsccdt aabbccdd. tel what you want. doctor may able help with several effective treatments. the low back also called the lumbar region the area the back. what are symptoms and causes low back pains. tnormal tnospac headingl heading title subtitie. custo office templates filefolder. documents flower info filefolder. authors hoa nguyen tags addstag. osteoporosis arthrits osteoarthriis etc. vourteambrophe neme status date modified type size. that starts below the ribcage almost everyone has low back pain. ene danske bank fiefolder. emphasize intensee stong quote lintenseq subtleref intensere. are there differences between low back pain and other conventional back pains. provide some methods relieve back pain. size thispc documents search documents. windows etca oft word. osteoporosis arthritis osteoarthritis etc. more than adults have low back pain some time their life while back pain. save thumbnail paste shortcut. whatis low back pain. aabbccde aabbccde aabbc asbbccl aqdb asbbect aabbccd aabbccd aobbccd aabbcdc aabbccd agbbccd ambeccdl arbbccdl. tnormal tnospac headingl heading title subtitle subtleem emphasis intensee stong quote intenseq subtleref intensere. find out the connections between back pain and other bone disease such. usually acute short term back pain can often chronic for those chronic back pain they. mbu office manual file folder. fortunately often gets better its own when doesn your. overed the following files. save sstype word document. downlosce iphone photos owou fiefolder. find out the connections between back pain and health problems except bone. hide folders give accessto. desktop downloads file folder. some point life one the top causes missed work the. file name more than sothy. what low back pain,Document1 - Word,,25
might caused other physical problems. sion created from the fast. uanh dropbox ruoholahti vhteiskansio. words english united states. aabbccde asbbeene aabbc asbbccl aqd asebeer acbbcedc acbbccd acbbccd mabbccd aabbccd aabdccd aabsccdt aabbccdd. tel what you want. doctor may able help with several effective treatments. the low back also called the lumbar region the area the back. what are symptoms and causes low back pains. tnormal tnospac headingl heading title subtitie. custo office templates filefolder. documents flower info filefolder. authors hoa nguyen tags addstag. osteoporosis arthrits osteoarthriis etc. vourteambrophe neme status date modified type size. that starts below the ribcage almost everyone has low back pain. ene danske bank fiefolder. emphasize intensee stong quote lintenseq subtleref intensere. are there differences between low back pain and other conventional back pains. provide some methods relieve back pain. size thispc documents search documents. windows etca oft word. osteoporosis arthritis osteoarthritis etc. more than adults have low bac,owords finnish tnomsl tnospsc heading heading subtile subtiem emphasis imensee stong quote inensequ subtieref intemseren. might caused other physical problems. bribhits symdroms back pain. some point life one the top causes missed work the back pain word hoa nguyen. doctor may able help with several effective treatments. the low back also called the lumbar region the area the back. what are symptoms and causes low back pains. mpamw axx tnormal tnospac headingl hesding title subtitle subtleem emphasis intensee strong quote intense subtleref intensere. osteoporosis arthrits osteoarthriis etc. that starts below the ribcage almost everyone has low back pain. are there differences between low back pain and other conventional back pains. provide some methods relieve back pain. tnormal tnospac headingl heading title subtitle subtleem emphasis intensee stong quote. osteoporosis arthritis osteoarthritis etc. body iaa nabbcene asebcede aabbc asbbcel aqb assbcer aosboedi acsbcepe aasbecd asbbccd aabbccd agedccd aabrccde aabaccde. more than adults have low back pain some time their life while back pain. intense subtle ref intensere select. aabbccde aabbeede aabbc asbbccl aqd msebeer acbbcep acbbccd acbbccd mabbccd aabbccd agbdccd aabsccdt aabbccdd. editingmore than adults have low back pain some time their life while back pain. whatis low back pain. design layout references mailin. pagelof words english united states more than adults have low back pain some time their life while back pain. find out the connections between back pain and other bone disease such. usually acute short term back pain can often chronic for those chronic back pain they. fortunately often gets better its own when doesn your. find out the connections between back pain and health problems except bone. font paragraph sttes edting.   webmd  back pain slideshow low back pain. some point life one the top causes missed work the. what low back pain,back pain - Word,,26
owords finnish tnomsl tnospsc heading heading subtile subtiem emphasis imensee stong quote inensequ subtieref intemseren. might caused other physical problems. bribhits symdroms back pain. some point life one the top causes missed work the back pain word hoa nguyen. doctor may able help with several effective treatments. the low back also called the lumbar region the area the back. what are symptoms and causes low back pains. mpamw axx tnormal tnospac headingl hesding title subtitle subtleem emphasis intensee strong quote intense subtleref intensere. osteoporosis arthrits osteoarthriis etc. that starts below the ribcage almost everyone has low back pain. are there differences between low back pain and other conventional back pains. provide some methods relieve back pain. tnormal tnospac headingl heading title subtitle subtleem emphasis intensee stong quote. osteoporosis arthritis osteoarthritis etc. body iaa nabbcene asebcede aabbc asbbcel aqb assbcer aosboedi acsbcepe aasbecd asbbccd aabbccd agedccd aabrccde aabaccde. more than adults have low back pain some tim,fortunately often gets better its own when doesn. tnormal tnospac heading heading title subtitle subtleem emphasis intensee stong quote intenseq subtleref intensere. symdroms back paindraw design layout references malings review. sabihitsfle home dow design layout references maiings review view help tellmewhatyouwanttodo.  wit conmn ookt eten syt. pages tables ustrations addins media links ments header footer text symbols. zoom arrange split suitch. doctor may able help with several effective treatments. ack pain pain that lasts longer than three months. the low back also called the lumbar region the area the back. transiate langusge new show track accept reject pare restrict hide. grammar count aloud accessibility ment ments changes reviewing pane author editing ink. ment ments changes reviewing pane editing.   webmd  back pain slideshow low back. that starts below the ribcage almost everyone has low back pain. provide some methods relieve back pain. the low back also called the lumbar region the area the. page words english finland. grammar count aloud accessibilty ment ments changes reviewing pane authors editing ink. language ments tracking changes pare. acute back pain can last anywhere from few days few weeks while. has been vaccinated against the virus. chronic back pain pain that lasts longer than three months. page page break models video reference number box pats cap object. widpedia online cross bookmark link ment header footer page tewt quick wordart droy equation symbol. pain can last anywhere from few days few weeks while. aabbocde aabboede aabbc asbbccl aqb asebeer acsbced acbbcedi acbbcd aabbced aabbccd agebced ambeccdt aabbccde. nabbecde asbbeene aabbc asbbcc asebcer acbbcep aabbcp acsbccd mabbcdc aabbccd agbbccd aabscdd aabbccde. fortunately often gets better its own when doesn your. some point life one the top causes missed work. webmd  back pain slideshow low back pain. for which numbered item. ments header footer text. spelling thesaurus word read check tanslate language new jous next show track pare black restrict hide. able help with several effective treatments. iroms back pain provides some methods relieve back pain.   webmd  back pain slideshow low back pain. spelling thesaurus word read check translate language new delete previous next show tracks accept reject pare block restrict hide. acute back pain can last anywhere from few days few weeks. that starts below the ribcage almost everyone has low back. some point life one the top causes missed work the. tert quick wordart drop. what low back pain. tnormal tnospac heading heading title subtitle subtleem emphasis intensee stong quote lntenseq subtleref intensere,back pain - Word,,29
