source,target,title,query,index
qtr blender jpg blendert tunnistautuminensuomifi. apps conantap parttimejob baking metropolialibrary businessdic isr vtr prer other bookmarks reading list. conantap parttimejob boking metopolialibrary businesscic news vie uutiset webcionary boohmi french usefulweb mocha creme cora jobstepnet amm. varmennekortti mobiilivarmenne osuuspankki nordea. pop pankki saastopankki oma saastopankki. qtr blender jpg blendert ertel. </s>kun teet kaupat tuotteesta sovi myyjan kanssa vastaanotatko lahetd tuotanto. tuotteen mieluiten postin pakettiautomaattiin kotiin tori paketti piste. postin toimipisteeseen lue lis. postin toimipisteeseen lue lise. tuotteen mieluiten postin pakettiautomaattiin kotiin shoulder piste. </s>voidaan kayttaa sellaisenaan luomaan retroilmetta. led lamppu pallonmuotoinen kirkas. temma lamppu ehka muistuttaa vanhaa hehkulamppua mutta oikeasti energiaa saastéava led. lamppu kirkas lamppu levittaa koristeellista valoa voidaan yhdistaa varjostimeen tai sita. tarkista muut ikea tavaratalot. lisaa tuote ostoskoriin nahdaksesi postinumerollesi. borhmi french ,svp ere jobstepnet anm. tervetuloa danske bankin tunnistautumissivulle. shared logon danskebank . apps conantap cjob boking metropoli library business dic,,,658
svp ere jobstepnet anm. tervetuloa danske bankin tunnistautumissivulle. shared logon danskebank . apps conantap cjob boking metropoli library business dic. </s>qtr blender jpg blendert tunnistautuminensuomifi. apps conantap parttimejob baking metropolialibrary businessdic isr vtr prer other bookmarks reading list. conantap parttimejob boking metopolialibrary businesscic news vie uutiset webcionary boohmi french usefulweb mocha creme cora jobstepnet amm. varmennekortti mobiilivarmenne osuuspankki nordea. pop pankki saastopankki oma saastopankki. qtr blender jpg blendert ertel. </s>kun teet kaupat tuotteesta sovi myyjan kanssa vastaanotatko lahetd tuotanto. tuotteen mieluiten postin pakettiautomaattiin kotiin tori paketti piste. postin toimipisteeseen lue lis. postin toimipisteeseen lue lise. tuotteen mieluiten postin pakettiautomaattiin kotiin shoulder piste,banhmi frengh uschilweb mochacremecara jobstepunet amm,,,671
banhmi frengh uschilweb mochacremecara jobstepunet amm. </s>svp ere jobstepnet anm. tervetuloa danske bankin tunnistautumissivulle. shared logon danskebank . apps conantap cjob boking metropoli library business dic. </s>qtr blender jpg blendert tunnistautuminensuomifi. apps conantap parttimejob baking metropolialibrary businessdic isr vtr prer other bookmarks reading list. conantap parttimejob boking metopolialibrary businesscic news vie uutiset webcionary boohmi french usefulweb mocha creme cora jobstepnet amm. varmennekortti mobiilivarmenne osuuspankki nordea. pop pankki saastopankki oma saastopankki. qtr blender jpg blendert ertel,otorifi asiaksspaively ssanns tumalisws visiyisysaseruksst mainosssecukse tori vastaa iimoitetuista worteista limianna asiaton tai sagntojen vastainen imoitus. toimitus helposti tori pakettina. torl kaikki ilmoitukset autot asunnot tori kaupat viestit qanguye. kun teet kaupat tuotteesta sovi myyjan kanssa vastaanotatko lahetd. ota yhteyttd ilmoittajaan ganguye. nosta ilmoitus karkeen iimianna asiaton ilmoitus. tulosta ilmoitus lataa kauppakirjapohja. normal price from ikea. poista tai muokkaa ilmoitusta jaailmoitus facebookissa. kunto know where start. limoitustyyppi myydéan limoitus jatetty heinakuuta heealth. ikea valaisimet brunsta ripustinsarja hemm. blender jpg blendertjpg show all brunsta kattovalaisin. tuotteen mieluiten postin pakettiautomaattiin kotiin role tori paketti. apps conantep parttimejob boking metropolialibrary businessdic news yieuutiset webcionary banhmi french uscfulweb mocha creme cara ret other bookmarks. selling price for all. oimitus helposti tori pakettina limoittajan kaikki ilmoitukset. schibsfed tori osa schibsted konsernia schibsted vastaa tietojesi hallinnasta talla sivustolla lue liséaikea valaisimet brunsta ripustinsarja hemm. limoitustyyppi myydéaan iimoitus jatetty heinakuuta. kun teet kaupat tuotteesta sovi myyjan kanssa vastaanotatko. itus helposti tori pakettina. blender jpg blendertjpg show all. limoitustyyppi myydéan limoitus jatetty. tuotteen mieluiten postin pakettiautomaattiin kotiin vai. tallennailmoitus suosikiksi vinkkeja turvalliseen kaupankayntiin. postin toimipisteeseen lue lise,,,673
otorifi asiaksspaively ssanns tumalisws visiyisysaseruksst mainosssecukse tori vastaa iimoitetuista worteista limianna asiaton tai sagntojen vastainen imoitus. toimitus helposti tori pakettina. torl kaikki ilmoitukset autot asunnot tori kaupat viestit qanguye. kun teet kaupat tuotteesta sovi myyjan kanssa vastaanotatko lahetd. ota yhteyttd ilmoittajaan ganguye. nosta ilmoitus karkeen iimianna asiaton ilmoitus. tulosta ilmoitus lataa kauppakirjapohja. normal price from ikea. poista tai muokkaa ilmoitusta jaailmoitus facebookissa. kunto know where start. limoitustyyppi myydéan limoitus jatetty heinakuuta heealth. ikea valaisimet brunsta ripustinsarja hemm. blender jpg blendertjpg show all brunsta kattovalaisin. tuotteen mieluiten postin pakettiautomaattiin kotiin role tori paketti. apps conantep parttimejob boking metropolialibrary businessdic news yieuutiset webcionary banhmi french uscfulweb mocha creme cara ret other bookmarks. selling price for all. oimitus helposti tori pakettina limoittajan kaikki ilmoitukset. schibsfed tori osa schibsted konsernia schibsted ,thanks and have nice day. all accessories are included never used.   verkkokauppa  product kstrh electrolux explore tehosekaitin gcli. color black used few times for smoothies. still have the original box for easy delivery. hit student from erasmus uni could rent least years starting from september and from finland. sewing ask the place still available,Sticky Notes,,677
thanks and have nice day. all accessories are included never used.   verkkokauppa  product kstrh electrolux explore tehosekaitin gcli. color black used few times for smoothies. still have the original box for easy delivery. hit student from erasmus uni could rent least years starting from september and from finland. sewing ask the place still available. </s>otorifi asiaksspaively ssanns tumalisws visiyisysaseruksst mainosssecukse tori vastaa iimoitetuista worteista limianna asiaton tai sagntojen vastainen imoitus. toimitus helposti tori pakettina. torl kaikki ilmoitukset autot asunnot tori kaupat viestit qanguye. kun teet kaupat tuotteesta sovi myyjan kanssa vastaanotatko lahetd. ota yhteyttd ilmoittajaan ganguye. nosta ilmoitus karkeen iimianna asiaton ilmoitus. tulosta ilmoitus lataa kauppakirjapohja. normal price from ikea. poista tai muokkaa ilmoitusta jaailmoitus facebookissa. kunto know where start. limoitustyyppi myydéan limoitus jatetty heinakuuta heealth. ikea valaisimet brunsta ripustinsarja hemm. blender jpg blendertjpg show all brunsta kattovalaisin. ,show personalized content depending your settings. also visit ytools any time. before you continue google search. and site statistics understand them. content that you currently viewing and your location serving based. archives and videos that you watch youtube personalised ude things. hang while windows reports the problem microsoft. still have the original box for easy delivery. for non personalized content and ads what you see may. google chrome isn your default browser. vices like tracking outages and protect. sewing ask the place still available. color black used few times for smoothies. htps  verkkokauppa  product kstrh electrolux explore tehosekoitin gclid ealalqobchmi_ jwwnpbbqiv bqfreaqya. apps conantip parttmejob baking metropolialibrary businessdic news vleuutiset webcionary banhmi french usefulweb mocha creme cara jobstep net amm. onlineisation and information about brow. hok accessories are included never used. tike more relevant res endings customis and ads. google chrome not responding. content and ads can based those things and your activity. nisk hil student from erasmus uni could rent least years starting from september and from finland. thanks and have nice day. you agr use cookies and data,Google - Google Chrome (Not Responding),,678
show personalized content depending your settings. also visit ytools any time. before you continue google search. and site statistics understand them. content that you currently viewing and your location serving based. archives and videos that you watch youtube personalised ude things. hang while windows reports the problem microsoft. still have the original box for easy delivery. for non personalized content and ads what you see may. google chrome isn your default browser. vices like tracking outages and protect. sewing ask the place still available. color black used few times for smoothies. htps  verkkokauppa  product kstrh electrolux explore tehosekoitin gclid ealalqobchmi_ jwwnpbbqiv bqfreaqya. apps conantip parttmejob baking metropolialibrary businessdic news vleuutiset webcionary banhmi french usefulweb mocha creme cara jobstep net amm. onlineisation and information about brow. hok accessories are included never used. tike more relevant res endings customis and ads. google chrome not responding. content and ads can based those things and your activity. nisk,chitich ubnd and check the list checkers. hit more than every time. are used the following translation understand the tmg. check list check list check list there are lines,Entertainment News Channel - Social - Kenh14.vn - Google Chrome (Not Responding),,679
chitich ubnd and check the list checkers. hit more than every time. are used the following translation understand the tmg. check list check list check list there are lines. </s>show personalized content depending your settings. also visit ytools any time. before you continue google search. and site statistics understand them. content that you currently viewing and your location serving based. archives and videos that you watch youtube personalised ude things. hang while windows reports the problem microsoft. still have the original box for easy delivery. for non personalized content and ads what you see may. google chrome isn your default browser. vices like tracking outages and protect. sewing ask the place still available. color black used few times for smoothies. htps  verkkokauppa  product kstrh electrolux explore tehosekoitin gclid ealalqobchmi_ jwwnpbbqiv bqfreaqya. apps conantip parttmejob baking metropolialibrary businessdic news vleuutiset webcionary banhmi french usefulweb mocha creme cara jobstep net amm. onlineisation and information about brow. hok a,thanks and have nice day. all accessories are included never used. wip nsrs isp student from erasmus uni could rent least years starting from september and from finland. afa nsle baath nkei. till have the original box for easy delivery. hitps  verkkokauppa  product kstrh electrolux explore tehosekoi.   verkkokauppa  product kstrh electrolux explore tehosekaitin gcli. ealalqobchmi_ jwwnpbbqiv bcqfreaqyasabeglla_d_bwehittps kenh chu tich ubnd quan vap noi doan. garment ask the place still available. all accessories are included never used adh ang. color black used few times for smoothies. still have the original box for easy delivery. hit student from erasmus uni could rent least years starting from september and from finland.   verkkokauppa  product kstrh electrolux explore tehosekoitin qclid ealalqobchmi_ jwwnpb qivigd bcqfreaqyasabeglla_d_bwe augi ris. sewing ask the place still available,Sticky Notes,,681
thanks and have nice day. all accessories are included never used. wip nsrs isp student from erasmus uni could rent least years starting from september and from finland. afa nsle baath nkei. till have the original box for easy delivery. hitps  verkkokauppa  product kstrh electrolux explore tehosekoi.   verkkokauppa  product kstrh electrolux explore tehosekaitin gcli. ealalqobchmi_ jwwnpbbqiv bcqfreaqyasabeglla_d_bwehittps kenh chu tich ubnd quan vap noi doan. garment ask the place still available. all accessories are included never used adh ang. color black used few times for smoothies. still have the original box for easy delivery. hit student from erasmus uni could rent least years starting from september and from finland.   verkkokauppa  product kstrh electrolux explore tehosekoitin qclid ealalqobchmi_ jwwnpb qivigd bcqfreaqyasabeglla_d_bwe augi ris. sewing ask the place still available. </s>chitich ubnd and check the list checkers. hit more than every time. are used the following translation understand the tmg. check list check list check list there are lines,don change this post today. usefulweb mocha creme cara jobstepnet amm other bookma. you replied loud and clear. love you where the master,Messenger - Google Chrome (Not Responding),,685
don change this post today. usefulweb mocha creme cara jobstepnet amm other bookma. you replied loud and clear. love you where the master. </s>thanks and have nice day. all accessories are included never used. wip nsrs isp student from erasmus uni could rent least years starting from september and from finland. afa nsle baath nkei. till have the original box for easy delivery. hitps  verkkokauppa  product kstrh electrolux explore tehosekoi.   verkkokauppa  product kstrh electrolux explore tehosekaitin gcli. ealalqobchmi_ jwwnpbbqiv bcqfreaqyasabeglla_d_bwehittps kenh chu tich ubnd quan vap noi doan. garment ask the place still available. all accessories are included never used adh ang. color black used few times for smoothies. still have the original box for easy delivery. hit student from erasmus uni could rent least years starting from september and from finland.   verkkokauppa  product kstrh electrolux explore tehosekoitin qclid ealalqobchmi_ jwwnpb qivigd bcqfreaqyasabeglla_d_bwe augi ris. sewing ask the place still available. </s>chitich ubnd and check the l,hoa thank you for your support hour later dim iam ciing iic tat,Messenger - Google Chrome (Not Responding),,687
hoa thank you for your support hour later dim iam ciing iic tat. </s>don change this post today. usefulweb mocha creme cara jobstepnet amm other bookma. you replied loud and clear. love you where the master. </s>thanks and have nice day. all accessories are included never used. wip nsrs isp student from erasmus uni could rent least years starting from september and from finland. afa nsle baath nkei. till have the original box for easy delivery. hitps  verkkokauppa  product kstrh electrolux explore tehosekoi.   verkkokauppa  product kstrh electrolux explore tehosekaitin gcli. ealalqobchmi_ jwwnpbbqiv bcqfreaqyasabeglla_d_bwehittps kenh chu tich ubnd quan vap noi doan. garment ask the place still available. all accessories are included never used adh ang. color black used few times for smoothies. still have the original box for easy delivery. hit student from erasmus uni could rent least years starting from september and from finland.   verkkokauppa  product kstrh electrolux explore tehosekoitin qclid ealalqobchmi_ jwwnpb qivigd bcqfreaqyasabeglla_d_bwe augi ris. s,apps conantip parttimejob boking metropolialibrary businessdic news vieuutiset placeahome webcionary bahmi french usefulweb mocha creme cara jobstepnet amm other bookmarks. headings you add the document will. how many categories are there the olympics. are the olympics still being held despite the pandemics. dtask culture index working offline. when and where are the olympics. japanese will offer during the games find for instance. how many times has japan hosted the olympics. thú you are not big fan the games but you always wanted visit japan therefore. you add the document will. places you could visit activities you could relation the japanese culture the. you want find information about the events sightseeing the city and the activities that the. games wants attend the events and asks you join this trip you find this invitation. japan hosting the olympic games friend yours who big fan the olympic. instagram story instagram story mpa instagram story mpa instagram story mpa instagram story mpa instagram story mpa showan,Task 2 - Culture (No Index) - Google Docs - Google Chrome,,688
apps conantip parttimejob boking metropolialibrary businessdic news vieuutiset placeahome webcionary bahmi french usefulweb mocha creme cara jobstepnet amm other bookmarks. headings you add the document will. how many categories are there the olympics. are the olympics still being held despite the pandemics. dtask culture index working offline. when and where are the olympics. japanese will offer during the games find for instance. how many times has japan hosted the olympics. thú you are not big fan the games but you always wanted visit japan therefore. you add the document will. places you could visit activities you could relation the japanese culture the. you want find information about the events sightseeing the city and the activities that the. games wants attend the events and asks you join this trip you find this invitation. japan hosting the olympic games friend yours who big fan the olympic. instagram story instagram story mpa instagram story mpa instagram story mpa instagram story mpa instagram story mpa showan. </s>hoa thank you for your support hour l,you are not big fan the games but you always wanted to visit japan therefore. you want to find information about the events sightseeing the city and the activities that the. you are not wanted big fan the games but you always visit japan therefore,Task 2 - Culture (No Index) - Google Docs - Google Chrome,,690
you are not big fan the games but you always wanted to visit japan therefore. you want to find information about the events sightseeing the city and the activities that the. you are not wanted big fan the games but you always visit japan therefore. </s>apps conantip parttimejob boking metropolialibrary businessdic news vieuutiset placeahome webcionary bahmi french usefulweb mocha creme cara jobstepnet amm other bookmarks. headings you add the document will. how many categories are there the olympics. are the olympics still being held despite the pandemics. dtask culture index working offline. when and where are the olympics. japanese will offer during the games find for instance. how many times has japan hosted the olympics. thú you are not big fan the games but you always wanted visit japan therefore. you add the document will. places you could visit activities you could relation the japanese culture the. you want find information about the events sightseeing the city and the activities that the. games wants attend the events and asks you join this trip you find,tokyo summer olympics wikipedia. how many different events will held the tokyo olympic games. the games will the second three consecutive olympics held east asia. how many times has japan hosted olympic games and what year. about featured snippets feedback.   bbc  news world asia. host city tokyo japan. given that the ioc has repeatedly insisted the games can ahead lokyo summer olympics wikipedia. how many times has japan hosted olympics. tokva olvmbice datee echediile and what know. the first being pyeongchang county south korea and the next beijing china.   washingtonpost  sports,,japanolympics2021,691
tokyo summer olympics wikipedia. how many different events will held the tokyo olympic games. the games will the second three consecutive olympics held east asia. how many times has japan hosted olympic games and what year. about featured snippets feedback.   bbc  news world asia. host city tokyo japan. given that the ioc has repeatedly insisted the games can ahead lokyo summer olympics wikipedia. how many times has japan hosted olympics. tokva olvmbice datee echediile and what know. the first being pyeongchang county south korea and the next beijing china.   washingtonpost  sports. </s>you are not big fan the games but you always wanted to visit japan therefore. you want to find information about the events sightseeing the city and the activities that the. you are not wanted big fan the games but you always visit japan therefore. </s>apps conantip parttimejob boking metropolialibrary businessdic news vieuutiset placeahome webcionary bahmi french usefulweb mocha creme cara jobstepnet amm other bookmarks. headings you add the document will. how many categories are,progress berlin swimmer maehata. were also suspended for the same reason. the tokyo games and beyond. japan and europe listen the athletes. bid hosting the eighteenth olympiad. japan has been enthusiastic pae. fans tuned into their radio sets late into the. corporation radio linkup and enthusiastic. germany for the fifty fifth meeting the. the games amsterdam japan. night because the time difference between. japanese delegation visited munich. athletes including women the. japan and the olympics. and winter games respectively held. the postwar military occupation. the postwar reconstruction period. fielded one the largest teams its history. rivals detroit and vienna finally march. the bid was won rome but japan was. japan had set its hopes winning. including women japanese athletes earned. bid the ioc for tokyo host the. japan has been enthusiastic pap. japan came end and japan made. olympiad october was historical. events and field hockey. the games berlin japan. track and field swimming equestrian. the right host the games and waged. landmark event that signified the end. preparations for the games literally. hoso kyokai nhk japan broadcasting. hideko became the first japanese woman. medal the meter running event and. london olympic games held. became the first woman join japanese. contingent olympic she received silver. field and swimming athlete hitomi kinue. take gold medal olympic petition. japan the games los angeles. olympic mittee designated tokyo. metropolitan legislature approved decision. aggressive campaign wrest votes from. were canceled because world war the. ransformad the face tokyo rbads print. her success encouraging more women take. total gold silver and bronze medals. and sapporo the venue for the summer. not discouraged october the tokyo. and underscored japan high economic. took its first two gold medals track and. growth during the five years leading. apps conantip parttimejob boking metropolialibrary businesscic news vieuutiet placeahome webconay banhmi french usefulweb mochacreme cara jobstepnet amm other bookmarks reading list. for japan the hosting the eighteenth. events were broadcast live via nippon. the ioc delegates put the matter. however the tokyo olympic games. winning the meter breast stroke event,18Olympics.pdf - Google Chrome,japan olympics history - google search - google chrome,692
