source,target,title,query,index
fundamental requirement applications developed for embedded systems. gem security fundamental requirement applications developed for embedded systems. these days many examples steganography involve embedding secret piece text inside. top something that not secret that something can just about anything you want. hijacking and other security threats can result irreversible damages such data loss. threats can result irreversible damages such data loss intellectual property theft and malfunction. oythe value for your embedded data field can pulled from data that you have uploaded into. building mobile device solar inverter medical equipment any other embedded system data security the. contact list information appended the respondent survey link built fields provided. security important consideration when mobile devices and other embedded systems. qualtrics values set the survey flow. embedding technique watermarking where data can effectively hidden file. steganography steganography the practice hiding secret message inside even.   qualtrics  support survey platform ,people from looking without authority july. encrypt ver encrustation noun. people from looking without authority. encrypt something putinformation into special code especially order prevent. conantap parttimejob boking metopolialibrary businessdic placeahome webcionary banhmi french usefulweb mocha cremecara jobstepnet amm. word origin from the word list. tutustu uusiin kript encrusted adjective. verb forms encryption noun. search oxford advanced learner dictionary. look anyword the dictionary offline anytime anywhere with the oxford advanced. all data encrypted before itis sent. dictionaries grammar word lists resources. encrypt something put information into special code especially order prevent,,,864
people from looking without authority july. encrypt ver encrustation noun. people from looking without authority. encrypt something putinformation into special code especially order prevent. conantap parttimejob boking metopolialibrary businessdic placeahome webcionary banhmi french usefulweb mocha cremecara jobstepnet amm. word origin from the word list. tutustu uusiin kript encrusted adjective. verb forms encryption noun. search oxford advanced learner dictionary. look anyword the dictionary offline anytime anywhere with the oxford advanced. all data encrypted before itis sent. dictionaries grammar word lists resources. encrypt something put information into special code especially order prevent. </s>fundamental requirement applications developed for embedded systems. gem security fundamental requirement applications developed for embedded systems. these days many examples steganography involve embedding secret piece text inside. top something that not secret that something can just about anything you want. hijacking and other security threats can result irreve,was minutes ago. the value for your embedded data field can pulled from data that you have uploaded into. interoperate with other systems and ponents unauthorized access eavesdropping session.   embeddedputing  technology security embedding security into data manag. security important consideration when mobile devices and other embedded systems. qualtrics values set the survey flow.   qualtrics  support survey platform survey module survey flow standard element,Task 4 - Technology (No Index) - Google Docs - Google Chrome,,865
was minutes ago. the value for your embedded data field can pulled from data that you have uploaded into. interoperate with other systems and ponents unauthorized access eavesdropping session.   embeddedputing  technology security embedding security into data manag. security important consideration when mobile devices and other embedded systems. qualtrics values set the survey flow.   qualtrics  support survey platform survey module survey flow standard element. </s>people from looking without authority july. encrypt ver encrustation noun. people from looking without authority. encrypt something putinformation into special code especially order prevent. conantap parttimejob boking metopolialibrary businessdic placeahome webcionary banhmi french usefulweb mocha cremecara jobstepnet amm. word origin from the word list. tutustu uusiin kript encrusted adjective. verb forms encryption noun. search oxford advanced learner dictionary. look anyword the dictionary offline anytime anywhere with the oxford advanced. all data encrypted before itis sent. dictionaries grammar ,but the first step really know that you are who you say you are now most people are familiar with what. and that great that works well standalone application but when you embedding you don typically. terms three good framework keep things mind authentication authorization and auditing. and when think about authentication for those who are not familiar authentication the mechanism. those are the key ponents having secure embedded platform. name olivier meyer director product management zoomdata and focus area. when you looking the security requirements for embedding scenario tend think about security. gonna allow you those things whether view dashboard view chart. use cookies enhance your user experience check out our client certificate. tologin again look the report dashboard. call forms based authentication you seen that typing your username and password the web page. user rights for authentication who are you. use cookies enhance your user experience check out our ltmocha creme cara. want your users have type that twice they already logged into your main application they don want. embedding and integration with other applications. which can verify that you are who you say you are that can trust someone else tell you that for and. once authenticated you then can let you into the application and whatever permissions you have,Embedded Application Security: Authentication | Zoomdata - Google Chrome,,876
but the first step really know that you are who you say you are now most people are familiar with what. and that great that works well standalone application but when you embedding you don typically. terms three good framework keep things mind authentication authorization and auditing. and when think about authentication for those who are not familiar authentication the mechanism. those are the key ponents having secure embedded platform. name olivier meyer director product management zoomdata and focus area. when you looking the security requirements for embedding scenario tend think about security. gonna allow you those things whether view dashboard view chart. use cookies enhance your user experience check out our client certificate. tologin again look the report dashboard. call forms based authentication you seen that typing your username and password the web page. user rights for authentication who are you. use cookies enhance your user experience check out our ltmocha creme cara. want your users have type that twice they already logged into your main applic,all data encrypted before sent. encrypt ver encrustation noun. apps conantap parttimejob baking metropoilibrary busiessdic news vieuutiset placeahome webcionary banhmi french usefulweb mochacremecora jobstepinet amm. word origin from the word list. verb forms encryption noun. chimi look any word the dictionary offline anytime anywhere with the oxford advanced. dictionaries grammar word lists resources. people from looking without authority. encrypt something putinformation into special code especially order prevent,,,877
all data encrypted before sent. encrypt ver encrustation noun. apps conantap parttimejob baking metropoilibrary busiessdic news vieuutiset placeahome webcionary banhmi french usefulweb mochacremecora jobstepinet amm. word origin from the word list. verb forms encryption noun. chimi look any word the dictionary offline anytime anywhere with the oxford advanced. dictionaries grammar word lists resources. people from looking without authority. encrypt something putinformation into special code especially order prevent. </s>but the first step really know that you are who you say you are now most people are familiar with what. and that great that works well standalone application but when you embedding you don typically. terms three good framework keep things mind authentication authorization and auditing. and when think about authentication for those who are not familiar authentication the mechanism. those are the key ponents having secure embedded platform. name olivier meyer director product management zoomdata and focus area. when you looking the security requirem,cyber analytical framework the cyber analytical framework pointed out that despite best efforts asymmetric ease. password promised user does not exercise adequate vigilance afier the iniial authentication. changing the game moving the focus during authentication from the password the person using the information. systems this shift would mean most people authenticating using biometric sensors darpa however saw some challenges. ieee websites place cookies your device give you the best user experience using our websites you agree the placement these cookies learn more read our privacy policy. previous next next the current standard method for validating user identity requires creating remembering and managing long plex. control the keyboard individuals can thus improperly obtain unauthorized access information system resources. the colloquium future directions cyber security held november arlington virginia darpa presented the. richard guidorizzi defense advanced research projects agency. share article generate citation. apps conantap parttimejob boking metropolialibrary busiessdic news vieuutiset placeahome webcionary bachmi fench usefulweb mochacremecora jobstepinet amm other bookmarks reading lit. active typical systems incorporate mechanisms verify that the person that originally authenticated the same person still get published. the way biometrics are currently used and decided try software based biometrics focused more the authenticating people. something inherently unnatural create remember and manage long plex passwords moreover long sessions femain. information technology active authentication biometrics cognitive fingerprint security. people interact with the world without the deployment additional sensors just touching something with bare hand leaves. than deploying new sensors. exploitation exists between attacking department defense dod information systems and efforts defend them significant. ponent this asymmetric advantage es from current password based constructs these constructs enable continuous. passwords moreover most systems don incorporate mechanisms verify that the originally authenticated person still the lol. behind physical fingerprint each person leaves behind unique cognitive fingerprint. the current standard method for validating user identity for authentication information systems requires humans. biometrics are defined the characteristics used recognize humans based one more intrinsic physical. past issues focus during authentication from the password the person using the information system. the active authentication program the defense advanced research projects agency darpa seeks address this problem. same person controlling the keyboard darpa active authentication program seeks address these problems moving the. behavioral traits the first phase the active authentication program focuses the behavioral traits observable through how,Security: Active Authentication - Google Chrome,active authentication - google search - google chrome,878
cyber analytical framework the cyber analytical framework pointed out that despite best efforts asymmetric ease. password promised user does not exercise adequate vigilance afier the iniial authentication. changing the game moving the focus during authentication from the password the person using the information. systems this shift would mean most people authenticating using biometric sensors darpa however saw some challenges. ieee websites place cookies your device give you the best user experience using our websites you agree the placement these cookies learn more read our privacy policy. previous next next the current standard method for validating user identity requires creating remembering and managing long plex. control the keyboard individuals can thus improperly obtain unauthorized access information system resources. the colloquium future directions cyber security held november arlington virginia darpa presented the. richard guidorizzi defense advanced research projects agency. share article generate citation. apps conantap parttimejob boking metropolial,via stylometry application usage web browsing and gps. explanation without some interaction and afraid they answer has vendor implementation specific. dlicking accept all cookies you agree stack exchange can. phishing watch demo now. user identity continuously based the sensors that are part that device more this. move your appsactive authentication mobile. which trusts the sts example passive authentication involves user signing through key. which trusts the sts example passive authentication involves user signing through. userlogs using flow example active authentication involves mobile devices verifying. store cookies your device and disclose information. does saml define how. unanswered those define the meaning these terms general they mean nothing and are often just marketing. yite the login window and requests security token from the security token service sts here the. sts after logging the sts directs the user back the url and you authenticated that site. for more active and passive authentication. refer passive authentication referred saml single sign most specifically chiranga alwis. active authentication mobile devices via apple web browsing and gps. active authentication authenticates user via the trust protocol the replying party owns lgi fif. passive authentication the has login logic the user directed the login page the. web form displayed the identity provider and the user requested log see this document. web form displayed the identity provider and the user requested log see. username and password for authenti. are you using hdore. can you narrow the scope what context this authentication what environm. clear definition and explanation single soul left this planet has ever given clear definition and,,active authentication - google search - google chrome,879
via stylometry application usage web browsing and gps. explanation without some interaction and afraid they answer has vendor implementation specific. dlicking accept all cookies you agree stack exchange can. phishing watch demo now. user identity continuously based the sensors that are part that device more this. move your appsactive authentication mobile. which trusts the sts example passive authentication involves user signing through key. which trusts the sts example passive authentication involves user signing through. userlogs using flow example active authentication involves mobile devices verifying. store cookies your device and disclose information. does saml define how. unanswered those define the meaning these terms general they mean nothing and are often just marketing. yite the login window and requests security token from the security token service sts here the. sts after logging the sts directs the user back the url and you authenticated that site. for more active and passive authentication. refer passive authentication referred saml single sign mo,copyright owner the chance promote themselves their brand beyond their existing. what watermark and how does work. how secure watermarking what you need. image security how secure watermarking what you need know about. smartframe product features industries resources contactus login. pyos lweb mocha creme cara. watermarking still sound way protect your images and what threats based. digital image watermarking one the most popular ways protect images posted online. know about watermarking digital images. watermarks are easy apply images all varieties and they give the photographer. but just how secure digital image watermarking today and how can those with assets. smartframe uses cookies give you the best browsing experience you can view our cookie policy for further details. protect safeguard their work from potential threats,,watermarking to secure - google search - google chrome,882
copyright owner the chance promote themselves their brand beyond their existing. what watermark and how does work. how secure watermarking what you need. image security how secure watermarking what you need know about. smartframe product features industries resources contactus login. pyos lweb mocha creme cara. watermarking still sound way protect your images and what threats based. digital image watermarking one the most popular ways protect images posted online. know about watermarking digital images. watermarks are easy apply images all varieties and they give the photographer. but just how secure digital image watermarking today and how can those with assets. smartframe uses cookies give you the best browsing experience you can view our cookie policy for further details. protect safeguard their work from potential threats. </s>via stylometry application usage web browsing and gps. explanation without some interaction and afraid they answer has vendor implementation specific. dlicking accept all cookies you agree stack exchange can. phishing watch demo now. us,multiple possible values field called gender might have value female male. intellectual property theft and malfunction hence data management security. other task technology index saving. embedded data any extra information you would like recorded your survey data. demographics and other information you knew about respondents beforehand and. ementthe value for your embedded data field can pulled from data that you have uploaded into. data security and authenticity important issue your work place one approach. interoperate with other systems and ponents unauthorized access eavesdropping session.   embeddedputing  technology security embedding security into data manag. the condition respondent was assigned research study. embedded data atask technology index. addition the question responses can used store information such. fundamental requirement applications developed for embedded systems. various media files like images sound files video files and monly used data. qualtrics values set the survey flow. the social media site respondent came from. hijacking and other security threats can result irreversible damages such data loss. thefield the name your variable gender state age. other vlook that still promotes your brand some would prefer more transparent modest branding. contact list information appended the respondent survey link built fields provided. look that still promotes your brand some would prefer more transparent modest branding. security important consideration when mobile devices and other embedded systems. while others might favor opaque eye catching watermark. embedding technique watermarking where data can effectively hidden file.   qualtrics  support survey platform survey module survey flow standard element,Task 4 - Technology (No Index) - Google Docs - Google Chrome,,883
multiple possible values field called gender might have value female male. intellectual property theft and malfunction hence data management security. other task technology index saving. embedded data any extra information you would like recorded your survey data. demographics and other information you knew about respondents beforehand and. ementthe value for your embedded data field can pulled from data that you have uploaded into. data security and authenticity important issue your work place one approach. interoperate with other systems and ponents unauthorized access eavesdropping session.   embeddedputing  technology security embedding security into data manag. the condition respondent was assigned research study. embedded data atask technology index. addition the question responses can used store information such. fundamental requirement applications developed for embedded systems. various media files like images sound files video files and monly used data. qualtrics values set the survey flow. the social media site respondent came from. hijacking and other,while others might favor opaque eye catching watermark. digital image watermarking one the most popular ways protect images posted online. you may want watermark that appears blend into the photograph give more natural. mishandled helping you keep your work anized you take from draft finalization. watermark identifying image pattern paper that appears various shades. you verify the authenticity file. document photo you like you may want your watermark feature copyright information. with terms like void copy sample this ensures that important documents are never. watermark could logo image text and can subtle prominent.  wikipedia  wiki wwatermarktask technology index. look that still promotes your brand some would prefer more transparent modest branding. dark background caused thickness density variations the paper. lightness darkness when viewed transmitted light when viewed reflected light atop. watermarking considered technique for data embedding that will enable.   qualtrics  support survey platform survey module survey flow standard element,Task 4 - Technology (No Index) - Google Docs - Google Chrome,,888
while others might favor opaque eye catching watermark. digital image watermarking one the most popular ways protect images posted online. you may want watermark that appears blend into the photograph give more natural. mishandled helping you keep your work anized you take from draft finalization. watermark identifying image pattern paper that appears various shades. you verify the authenticity file. document photo you like you may want your watermark feature copyright information. with terms like void copy sample this ensures that important documents are never. watermark could logo image text and can subtle prominent.  wikipedia  wiki wwatermarktask technology index. look that still promotes your brand some would prefer more transparent modest branding. dark background caused thickness density variations the paper. lightness darkness when viewed transmitted light when viewed reflected light atop. watermarking considered technique for data embedding that will enable.   qualtrics  support survey platform survey module survey flow standard element. </s>multiple pos,dark background caused thickness density variations the paper. lightness darkness when viewed transmitted light when viewed reflected light atop. himiupit pusoinic vugs uuitou dol tuays vuas visi. watermarking considered technique for data embedding that will enable.   qualtrics  support survey platform survey module survey flow standard element,Task 4 - Technology (No Index) - Google Docs - Google Chrome,watermark verification - google search - google chrome,889
