source,target,title,query,index
"vietnamese daily post. phd candidates junioq välimerenkatu search google. ten mantras. the last seven days safari has prevented trackers from profiling you. buddha days. vietnamese uncle. search all jobs linkedin. </s>are doing fine anushri. cass and the sale nov. hiring corp certified marketing agency. inbox tranthanhbao gmail  gmail. joe mallet resource linkedin . anushri hello bao hope you. linkedin offer restart your. stumbling towards the end marathon finishing line. towards the end last year felt like drunk person. </s>that we would meet face to face on the first day, i was happy about this because starting a new job remotely felt personal. how corona affected the trainee episodes kpmg. as a foreign idea, since then we held daily team meetings with him in the first weeks. i was assured of what. since then i've started doing remote days for the first time in my work history, now i feel that i'm well equipped for re",vietnamese daily post. resume create your job winning resume free resume maker. ten mantras. kpmg global mobility check. the last seven days safari has prevented trackers from profiling you. phd candidates junioresume create your job winning resume free resume maker. buddha days. vietnamese uncle. search all jobs linkedin,Start Page,,507
vietnamese daily post. resume create your job winning resume free resume maker. ten mantras. kpmg global mobility check. the last seven days safari has prevented trackers from profiling you. phd candidates junioresume create your job winning resume free resume maker. buddha days. vietnamese uncle. search all jobs linkedin. </s>vietnamese daily post. phd candidates junioq välimerenkatu search google. ten mantras. the last seven days safari has prevented trackers from profiling you. buddha days. vietnamese uncle. search all jobs linkedin. </s>are doing fine anushri. cass and the sale nov. hiring corp certified marketing agency. inbox tranthanhbao gmail  gmail. joe mallet resource linkedin . anushri hello bao hope you. linkedin offer restart your. stumbling towards the end marathon finishing line. towards the end last year felt like drunk person,tran bao parttime docx. tran bao icc internship pdf,CV,,511
tran bao parttime docx. tran bao icc internship pdf. </s>vietnamese daily post. resume create your job winning resume free resume maker. ten mantras. kpmg global mobility check. the last seven days safari has prevented trackers from profiling you. phd candidates junioresume create your job winning resume free resume maker. buddha days. vietnamese uncle. search all jobs linkedin. </s>vietnamese daily post. phd candidates junioq välimerenkatu search google. ten mantras. the last seven days safari has prevented trackers from profiling you. buddha days. vietnamese uncle. search all jobs linkedin,lam involved anising events internal sitz connectinga master students. tran bao legal intern pdf page. board member hanken master mittee helsinki. lam involved anising events internal sitz connectinga master students tran bao legal intern pdf page. reading languages music writing cooking cleaning fashion,"Tran, Bao_CV (Legal Intern).pdf (page 2 of 2)",,512
lam involved anising events internal sitz connectinga master students. tran bao legal intern pdf page. board member hanken master mittee helsinki. lam involved anising events internal sitz connectinga master students tran bao legal intern pdf page. reading languages music writing cooking cleaning fashion. </s>tran bao parttime docx. tran bao icc internship pdf. </s>vietnamese daily post. resume create your job winning resume free resume maker. ten mantras. kpmg global mobility check. the last seven days safari has prevented trackers from profiling you. phd candidates junioresume create your job winning resume free resume maker. buddha days. vietnamese uncle. search all jobs linkedin,law international trade law petition law and financial law. market europeanisation national laws decision making the and private law. mainly specialised business law contract law petition law law international. groningentran bao global mobility trainee pdf page. netherlands the session the mittee wipo standards wipo. thenordic and framework iprs. gpa tran bao global mobility trainee pdf page. could participate discussions and raise questions the whole conference was about. model and images etc. international human rights and humanitarian law international criminal law the interna. delegates joined the sessions that lasted from november observers who. research intern faculty law university. was mandated the delegate representing elsa international and elsa the. experience consulting legal services business operation customer support and market. via the project consolidated research skills learnt how deal with massive deal. graduated with upper second class honours gpa. groningena tran bao global mobility trainee pdf page. the program focuses law and aspects business with special concentration. the program focused public international law and law with various topics such. upgrading standards protection several matters copyright orphan works. assisted writing reporting analysing data research project concerning expropriation. the program focused international mercial and business law ranging from contract. tran bao global mobility trainee pdf page. international human rights and humanitarian law international criminal law the internal. data and reading confined time period improved writing and analysing skills with. tassistea writuing reporung anaiysıng aataj researcn project concerning expropriatuon. skills and customer service experience active learner and doer looking for work. wixvia the project consolidated research skills learnt how deal with massive deal. mercial transactions person who attentive details anised has strong research,"Tran, Bao_CV (Global Mobility Trainee).pdf (page 1 of 2)",,513
law international trade law petition law and financial law. market europeanisation national laws decision making the and private law. mainly specialised business law contract law petition law law international. groningentran bao global mobility trainee pdf page. netherlands the session the mittee wipo standards wipo. thenordic and framework iprs. gpa tran bao global mobility trainee pdf page. could participate discussions and raise questions the whole conference was about. model and images etc. international human rights and humanitarian law international criminal law the interna. delegates joined the sessions that lasted from november observers who. research intern faculty law university. was mandated the delegate representing elsa international and elsa the. experience consulting legal services business operation customer support and market. via the project consolidated research skills learnt how deal with massive dea,administered paper work and acted liaison behalf the anisation all times. iam involved anising events intermal sitz connecting master students. tran bao legal intern pdf page. board member hanken master mittee helsinki. representing students whole the university and other entities. logistical aspects the event serving food guiding guests helping them when needed. secretary nexus student association groningen. event volunteer eficode helsinki. reading languages music writing cooking cleaning fashion. volunteered provide information attendants the devops conference took care. administered paper work and acted liaison behalf the anisation all times tran bao legal intern pdf page,"Tran, Bao_CV (Legal Intern).pdf (page 2 of 2)",,514
administered paper work and acted liaison behalf the anisation all times. iam involved anising events intermal sitz connecting master students. tran bao legal intern pdf page. board member hanken master mittee helsinki. representing students whole the university and other entities. logistical aspects the event serving food guiding guests helping them when needed. secretary nexus student association groningen. event volunteer eficode helsinki. reading languages music writing cooking cleaning fashion. volunteered provide information attendants the devops conference took care. administered paper work and acted liaison behalf the anisation all times tran bao legal intern pdf page. </s>law international trade law petition law and financial law. market europeanisation national laws decision making the and private law. mainly specialised business law contract law petition law law international. groningentran bao global mobilit,vietnamese daily post. ten mantras. search enter website name. inbox tranthanhbao gmail . the last seven days safari has prevented trackers from profiling you. buddha days. vietnamese master. fundamentals data visu search enter website name. data privacy specialist nordcloud,Start Page,,535
vietnamese daily post. ten mantras. search enter website name. inbox tranthanhbao gmail . the last seven days safari has prevented trackers from profiling you. buddha days. vietnamese master. fundamentals data visu search enter website name. data privacy specialist nordcloud. </s>administered paper work and acted liaison behalf the anisation all times. iam involved anising events intermal sitz connecting master students. tran bao legal intern pdf page. board member hanken master mittee helsinki. representing students whole the university and other entities. logistical aspects the event serving food guiding guests helping them when needed. secretary nexus student association groningen. event volunteer eficode helsinki. reading languages music writing cooking cleaning fashion. volunteered provide information attendants the devops conference took care. administered paper work and acted liaison behalf the anisation all time,vietnamese daily post. ten mantras. search enter website name. the last seven days safari has prevented trackers from profiling you. buddha days. vietnamese master. fundamentals data visu search enter website name,Start Page,,537
vietnamese daily post. ten mantras. search enter website name. the last seven days safari has prevented trackers from profiling you. buddha days. vietnamese master. fundamentals data visu search enter website name. </s>vietnamese daily post. ten mantras. search enter website name. inbox tranthanhbao gmail . the last seven days safari has prevented trackers from profiling you. buddha days. vietnamese master. fundamentals data visu search enter website name. data privacy specialist nordcloud. </s>administered paper work and acted liaison behalf the anisation all times. iam involved anising events intermal sitz connecting master students. tran bao legal intern pdf page. board member hanken master mittee helsinki. representing students whole the university and other entities. logistical aspects the event serving food guiding guests helping them when needed. secretary nexus student association groningen. event volunteer efic,vietnamese daily post. ten mantras. search enter website name. the last seven days safari has prevented trackers from profiling you. buddha days. vietnamese master. application center brand purpose. fundamentals data visu search enter website name,Start Page,,542
vietnamese daily post. ten mantras. search enter website name. the last seven days safari has prevented trackers from profiling you. buddha days. vietnamese master. application center brand purpose. fundamentals data visu search enter website name. </s>vietnamese daily post. ten mantras. search enter website name. the last seven days safari has prevented trackers from profiling you. buddha days. vietnamese master. fundamentals data visu search enter website name. </s>vietnamese daily post. ten mantras. search enter website name. inbox tranthanhbao gmail . the last seven days safari has prevented trackers from profiling you. buddha days. vietnamese master. fundamentals data visu search enter website name. data privacy specialist nordcloud,vietnamese daily post. phd candidates junioiol iluvpinyin . iol iluvpinyin . ten mantras. the last seven days safari has prevented trackers from profiling you. buddha days. vietnamese uncle,Start Page,,544
vietnamese daily post. phd candidates junioiol iluvpinyin . iol iluvpinyin . ten mantras. the last seven days safari has prevented trackers from profiling you. buddha days. vietnamese uncle. </s>vietnamese daily post. ten mantras. search enter website name. the last seven days safari has prevented trackers from profiling you. buddha days. vietnamese master. application center brand purpose. fundamentals data visu search enter website name. </s>vietnamese daily post. ten mantras. search enter website name. the last seven days safari has prevented trackers from profiling you. buddha days. vietnamese master. fundamentals data visu search enter website name,vietnamese daily post. ten mantras. the last seven days safari has prevented trackers from profiling you. buddha days. vietnamese uncle,Start Page,,550
vietnamese daily post. ten mantras. the last seven days safari has prevented trackers from profiling you. buddha days. vietnamese uncle. </s>vietnamese daily post. phd candidates junioiol iluvpinyin . iol iluvpinyin . ten mantras. the last seven days safari has prevented trackers from profiling you. buddha days. vietnamese uncle. </s>vietnamese daily post. ten mantras. search enter website name. the last seven days safari has prevented trackers from profiling you. buddha days. vietnamese master. application center brand purpose. fundamentals data visu search enter website name,"aleksi owned jorma ihatsu until he sold it to kesko in the 1990s to the fashion group. aleksi moved from kesko in aleksi's flagship store was located in the building that was completed in sources edit edit wikitext. the new owner, fashion group, started converting aleksi stores into stores of its new chain, but a couple of years later. tornio shopping center at the border, the border is closed. edit history edit wikitext. joensuu big store closed. the kop triangle turned into an outlet. there were a total of aleksi stores in finland in the year. there were only five stores left. itis changed to the name luhta. stores edit edit wikitext. remains leoueldkoo muoldcoo wilcitolotiö. ylöjärvi shopping center closed in august. edit wikitext show history. its first store was located in helsinki at the more familiar aleksanterinkatu address. there were a total of aleksi stores in finland in the year. aleksi sells, among other things, mexx to foreign fashion chains operating in finland. leak later wikipedia. kempele shopping center zeppelin closed. aleksi is a finnish chain of clothing stores from the luhtanen family from lahti. cuorumoaja lraonot urvup aikumuuiaa nionor myymaionca uuuom noyurroa myymaroinji mutia parvuoua myonommit. esprit ril you brand clothes accessories. after, stores started to be closed or changed to luhta's stores under different names with the intention. kotka pasaati became a luhta brand store. in the so-called lundqvist business palace, designed by architect selim lindqvist. pori shopping center icco closed. the new owner fashion group started converting aleksi stores into stores of its new chain, but a couple of years later. concentrates aleksi's activities in the capital region. kuonio ouuliott wikipedia . the first aleksi store was opened in august, the name of the clothing chain comes from the fact that. lluei icteia fechion groun olkei utten alekei oamäläikäi mnmöläikie of their new oie ketiunse. the first aleksi store was opened in august, the name of the clothing chain comes from the fact that. the operating principle of aleksi, which belongs to the sportswear company, is to be the domestic equivalent. tab peltola weak service brilliance of fascination genuine skill trade means in hyper competition edita isbn wikipedia . the project was backed out, the stores were changed back to the aleksi name in the century, the chain was quickly pruned so that in the spring. together with the wardrobe chain. not logged in chat edits create a password log in",Aleksi 13 – Wikipedia,aleksi 13 - google search,551
"aleksi owned jorma ihatsu until he sold it to kesko in the 1990s to the fashion group. aleksi moved from kesko in aleksi's flagship store was located in the building that was completed in sources edit edit wikitext. the new owner, fashion group, started converting aleksi stores into stores of its new chain, but a couple of years later. tornio shopping center at the border, the border is closed. edit history edit wikitext. joensuu big store closed. the kop triangle turned into an outlet. there were a total of aleksi stores in finland in the year. there were only five stores left. itis changed to the name luhta. stores edit edit wikitext. remains leoueldkoo muoldcoo wilcitolotiö. ylöjärvi shopping center closed in august. edit wikitext show history. its first store was located in helsinki at the more familiar aleksanterinkatu address. there were a total of aleksi stores in finland in the year. aleksi sells, among other th",you want allow downloads. you can change which websites can download files,Untitled,,606
"you want allow downloads. you can change which websites can download files. </s>aleksi owned jorma ihatsu until he sold it to kesko in the 1990s to the fashion group. aleksi moved from kesko in aleksi's flagship store was located in the building that was completed in sources edit edit wikitext. the new owner, fashion group, started converting aleksi stores into stores of its new chain, but a couple of years later. tornio shopping center at the border, the border is closed. edit history edit wikitext. joensuu big store closed. the kop triangle turned into an outlet. there were a total of aleksi stores in finland in the year. there were only five stores left. itis changed to the name luhta. stores edit edit wikitext. remains leoueldkoo muoldcoo wilcitolotiö. ylöjärvi shopping center closed in august. edit wikitext show history. its first store was located in helsinki at the more familiar aleksanterinkatu address. there we",vietnamese daily post. ten mantras. search enter website name. phd candidates junioyoutube . the last seven days safari has prevented trackers from profiling you. buddha days. vietnamese uncle. phd candidates junioq search enter website name,Start Page,,625
"vietnamese daily post. ten mantras. search enter website name. phd candidates junioyoutube . the last seven days safari has prevented trackers from profiling you. buddha days. vietnamese uncle. phd candidates junioq search enter website name. </s>you want allow downloads. you can change which websites can download files. </s>aleksi owned jorma ihatsu until he sold it to kesko in the 1990s to the fashion group. aleksi moved from kesko in aleksi's flagship store was located in the building that was completed in sources edit edit wikitext. the new owner, fashion group, started converting aleksi stores into stores of its new chain, but a couple of years later. tornio shopping center at the border, the border is closed. edit history edit wikitext. joensuu big store closed. the kop triangle turned into an outlet. there were a total of aleksi stores in finland in the year. there were only five stores left. itis changed to the ",recently broadcast. dihoo village search. rural dihon for you,Music,,626
recently broadcast. dihoo village search. rural dihon for you. </s>vietnamese daily post. ten mantras. search enter website name. phd candidates junioyoutube . the last seven days safari has prevented trackers from profiling you. buddha days. vietnamese uncle. phd candidates junioq search enter website name. </s>you want allow downloads. you can change which websites can download files,updating artist artwork search. được phát gần đây. dihoo thôn niên search. the singer jump starts the year with new. mine the weeknd show archives for easter eggs,Music,,628
updating artist artwork search. được phát gần đây. dihoo thôn niên search. the singer jump starts the year with new. mine the weeknd show archives for easter eggs. </s>recently broadcast. dihoo village search. rural dihon for you. </s>vietnamese daily post. ten mantras. search enter website name. phd candidates junioyoutube . the last seven days safari has prevented trackers from profiling you. buddha days. vietnamese uncle. phd candidates junioq search enter website name,my first-class my first-class my first-class my first-class my first-class my first-class,Music,,629
my first-class my first-class my first-class my first-class my first-class my first-class. </s>updating artist artwork search. được phát gần đây. dihoo thôn niên search. the singer jump starts the year with new. mine the weeknd show archives for easter eggs. </s>recently broadcast. dihoo village search. rural dihon for you,vietnamese daily post. phd candidates junioresume create your job winning resume free resume make. ten mantras. the last seven days safari has prevented trackers from profiling you. buddha days. vietnamese uncle. resume create your job winning resume free resume make,Start Page,,637
vietnamese daily post. phd candidates junioresume create your job winning resume free resume make. ten mantras. the last seven days safari has prevented trackers from profiling you. buddha days. vietnamese uncle. resume create your job winning resume free resume make. </s>my first-class my first-class my first-class my first-class my first-class my first-class. </s>updating artist artwork search. được phát gần đây. dihoo thôn niên search. the singer jump starts the year with new. mine the weeknd show archives for easter eggs,tran bao parttime docx. tran bao icc internship pdf,CV,,646
tran bao parttime docx. tran bao icc internship pdf. </s>vietnamese daily post. phd candidates junioresume create your job winning resume free resume make. ten mantras. the last seven days safari has prevented trackers from profiling you. buddha days. vietnamese uncle. resume create your job winning resume free resume make. </s>my first-class my first-class my first-class my first-class my first-class my first-class,vietnamese daily post. ten mantras. the last seven days safari has prevented trackers from profiling you. buddha days. phd candidates junioo ladbible ladbible . vietnamese uncle. ladbible ladbible,Start Page,,647
vietnamese daily post. ten mantras. the last seven days safari has prevented trackers from profiling you. buddha days. phd candidates junioo ladbible ladbible . vietnamese uncle. ladbible ladbible. </s>tran bao parttime docx. tran bao icc internship pdf. </s>vietnamese daily post. phd candidates junioresume create your job winning resume free resume make. ten mantras. the last seven days safari has prevented trackers from profiling you. buddha days. vietnamese uncle. resume create your job winning resume free resume make,from wikipedia the free encyclopedia. timo torikka born finnish actor. finland the frequency the surname was higher than national average the following regions. elsa torikka born finnish javelin thrower. all known bearers the surname torikka were residents finland frequency sweden. not logged talk contributions create account log. print exporta wikipedia ,Torikka - Wikipedia,finnish last name starting with a t - google search,648
from wikipedia the free encyclopedia. timo torikka born finnish actor. finland the frequency the surname was higher than national average the following regions. elsa torikka born finnish javelin thrower. all known bearers the surname torikka were residents finland frequency sweden. not logged talk contributions create account log. print exporta wikipedia . </s>vietnamese daily post. ten mantras. the last seven days safari has prevented trackers from profiling you. buddha days. phd candidates junioo ladbible ladbible . vietnamese uncle. ladbible ladbible. </s>tran bao parttime docx. tran bao icc internship pdf,vietnamese daily post. ten mantras. the last seven days safari has prevented trackers from profiling you. phd candidates junioq gigantti search google. buddha days. vietnamese uncle,Start Page,,665
vietnamese daily post. ten mantras. the last seven days safari has prevented trackers from profiling you. phd candidates junioq gigantti search google. buddha days. vietnamese uncle. </s>from wikipedia the free encyclopedia. timo torikka born finnish actor. finland the frequency the surname was higher than national average the following regions. elsa torikka born finnish javelin thrower. all known bearers the surname torikka were residents finland frequency sweden. not logged talk contributions create account log. print exporta wikipedia . </s>vietnamese daily post. ten mantras. the last seven days safari has prevented trackers from profiling you. buddha days. phd candidates junioo ladbible ladbible . vietnamese uncle. ladbible ladbible,personal info and options manage you can. abouta myaccount google . make some this info like your contact details. some info may visible other people using google services find out more. your profile info google. info about you and your preferences across google services. add photo personalise your account. you can also see summary your profiles. visible others that they can reach you easily,Google Account,gigantti espoo - google search,670
