source,target,title,query,index
your connection your system clock incorrect your system clock set friday. days ago this may happen the website misconfigured attacker has promised. this connection not pri. learn more you can view the certificate you understand the risks involved you can visit. this website may impersonating reknowdesktopsurveillance hiit steal your personal. this connection not private. safari warns you when website has expired certificate this website certificate expired. financial information you should close this page. december this not right fixing the clock may address this warning. </s>vietnamese daily post. search enter website name. ten mantras. inbox tranthanhbao gmail . the last seven days safari has prevented trackers from profiling you. buddha days. screencapture zip google drive. vietnamese uncle. icc internship opportunity arbitration case. </s>drag drop vào application folder nha. cài phần mềm chưa. type message được thu,ignore warning continue open. frype message được thu. giờ double click lên phần. rùi nhếp được thu,Messenger,,7
ignore warning continue open. frype message được thu. giờ double click lên phần. rùi nhếp được thu. </s>your connection your system clock incorrect your system clock set friday. days ago this may happen the website misconfigured attacker has promised. this connection not pri. learn more you can view the certificate you understand the risks involved you can visit. this website may impersonating reknowdesktopsurveillance hiit steal your personal. this connection not private. safari warns you when website has expired certificate this website certificate expired. financial information you should close this page. december this not right fixing the clock may address this warning. </s>vietnamese daily post. search enter website name. ten mantras. inbox tranthanhbao gmail . the last seven days safari has prevented trackers from profiling you. buddha days. screencapture zip google drive. vietnamese uncle. icc internship opportun,spend least minutes each essay. data are accessible only researchers for purposeful reasons connected and patible with the. permitted access the data are directly involved the research and mit this set. study information google docsa docs google . study information google docs口. and archiving your personal data such plain texts your digital activity logs our system processes. with restricted access username and password. specific measures safeguard the fundamental rights and the interests the data subject you. find least references web pages for the content you write and copy the links urls. ensure that the number research staff with access such information restricted. there stop button that allows you stop the software from monitoring however you should. with code anonymized electronically recorded data will kept university helsinki servers. the research will conducted with implementing principles transparency data minimization. proposed research goals who have permission from the principal investigator grounds. identify the potential security risks toward data breaches during the monitoring. part meeting the researcher and task assignment. statistics about the gender academic education. answer the questions the task description when writing essay searching google. google the system will infer this need and retrieve those webpages before you have search for. legal basis for proce. inbox tranthanhbao gmail . day hours task and task based your own schedule. all the data samples used the proposed research are either legitimately available mercially. data collected stored anonymized form this means that participants have identified only. the end the experiment and return for your effort the experiment you will pensated. will deleted after the studies not keep archive the history only collect measures for. accordance with article based union member state law which shall proportionate. documents regarding ethical guidelines and data protection strategies the principal investigator will. findings reguested anonymous statistical data well data collected misht handed the. information for research subj. anonymous data will used for analysis future publications and other means disseminating the. plan for the management research material. only stop the monitoring shortly perform activities that you really don want share however. history and technology what you need. what the history your. without the need reporting your reasons and without facing any kind sanction. participation the experiment voluntary you can withdraw from the experiment any point. essay must longer than pages you are allowed copy and paste the content from the. have been obtained following appropriate ethical approval the source all data used will. with euros before tax. again this history contains logs which will encrypted and stored your puter the history. information will not kept all data collected will destroyed yyyy. internship opportunity arbitration case. software will installed and run continuously for days. declared and for each data source will explained whether ethical legal approval for usage has. while doing the task this software will collect the history your digital activity your puter,Study Information T6.3 - Google Docs,,8
spend least minutes each essay. data are accessible only researchers for purposeful reasons connected and patible with the. permitted access the data are directly involved the research and mit this set. study information google docsa docs google . study information google docs口. and archiving your personal data such plain texts your digital activity logs our system processes. with restricted access username and password. specific measures safeguard the fundamental rights and the interests the data subject you. find least references web pages for the content you write and copy the links urls. ensure that the number research staff with access such information restricted. there stop button that allows you stop the software from monitoring however you should. with code anonymized electronically recorded data will kept university helsinki servers. the research will conducted with implementing principles transparency data min,vietnamese daily post. icc internship opportunity arbitr. ten mantras. the last seven days safari has prevented trackers from profiling you. buddha days. vietnamese uncle,Start Page,,9
vietnamese daily post. icc internship opportunity arbitr. ten mantras. the last seven days safari has prevented trackers from profiling you. buddha days. vietnamese uncle. </s>spend least minutes each essay. data are accessible only researchers for purposeful reasons connected and patible with the. permitted access the data are directly involved the research and mit this set. study information google docsa docs google . study information google docs口. and archiving your personal data such plain texts your digital activity logs our system processes. with restricted access username and password. specific measures safeguard the fundamental rights and the interests the data subject you. find least references web pages for the content you write and copy the links urls. ensure that the number research staff with access such information restricted. there stop button that allows you stop the software from monitoring however you,icc internship opportunity arbitr. our most requested microspheres are now. that indicates how the. puter reviewing the data contained the log administrator. techopedia explains system log syslog. the system log syslog. enter your email here. whether the processes loaded successfully not the information can then. used diagnose the sources puter problems whereas the. applicable most versions the three mon oss windows linux and. notifying the user the log contains information about the software. startup messages system changes abnormal shutdowns etc this list. whether the system processes are loading successfully. the maintains log events that helps monitoring administering and. troubleshooting the system addition helping users get information about. join over others receiving the. dictionary software system log syslog. important processes some the events include system errors warnings. user troubleshooting the system can identify the cause problem. latest about related articles goodies. would you like receive notifications site. the events recorded are the significant occurrences the that require. reviewing the data cont. the system log syslog contains record the operating system. syslog shows informational error and warning events related the. get insights from techopedia. automated scanning and remediation security threats with vulnerability. available for purchase online. what the system log. events that indicates how the system processes and drivers were loaded the. hardware system processes and system ponents also indicates. iiicc internship opportunity arbitr. what does system log syslog mean,What is the System Log (Syslog)? - Definition from Techopedia,operating system logs - google search,10
icc internship opportunity arbitr. our most requested microspheres are now. that indicates how the. puter reviewing the data contained the log administrator. techopedia explains system log syslog. the system log syslog. enter your email here. whether the processes loaded successfully not the information can then. used diagnose the sources puter problems whereas the. applicable most versions the three mon oss windows linux and. notifying the user the log contains information about the software. startup messages system changes abnormal shutdowns etc this list. whether the system processes are loading successfully. the maintains log events that helps monitoring administering and. troubleshooting the system addition helping users get information about. join over others receiving the. dictionary software system log syslog. important processes some the events include system errors warnings. user troubleshooting the system can,similar to web browsing history boss is collected. type message is received. ie each webpages or files. are all saved on the device. frype message is collected. know operating system logs,Messenger,,11
similar to web browsing history boss is collected. type message is received. ie each webpages or files. are all saved on the device. frype message is collected. know operating system logs. </s>icc internship opportunity arbitr. our most requested microspheres are now. that indicates how the. puter reviewing the data contained the log administrator. techopedia explains system log syslog. the system log syslog. enter your email here. whether the processes loaded successfully not the information can then. used diagnose the sources puter problems whereas the. applicable most versions the three mon oss windows linux and. notifying the user the log contains information about the software. startup messages system changes abnormal shutdowns etc this list. whether the system processes are loading successfully. the maintains log events that helps monitoring administering and. troubleshooting the system addition helping users get ,spend least minutes each essay. find least references web pages for the content you write and copy the links urls. part meeting the researcher and task assignment. answer the questions the task description when writing essay searching google. google the system will infer this need and retrieve those webpages before you have search for. day hours task and task based your own schedule. will deleted after the studies not keep archive the history only collect measures for. information for research subj. history and technology what you need. what the history your. essay must longer than pages you are allowed copy and paste the content from the. again this history contains logs which will encrypted and stored your puter the history. what the system log. software will installed and run continuously for days. while doing the task this software will collect the history your digital activity your puter,Study Information T6.3 - Google Docs,,12
spend least minutes each essay. find least references web pages for the content you write and copy the links urls. part meeting the researcher and task assignment. answer the questions the task description when writing essay searching google. google the system will infer this need and retrieve those webpages before you have search for. day hours task and task based your own schedule. will deleted after the studies not keep archive the history only collect measures for. information for research subj. history and technology what you need. what the history your. essay must longer than pages you are allowed copy and paste the content from the. again this history contains logs which will encrypted and stored your puter the history. what the system log. software will installed and run continuously for days. while doing the task this software will collect the history your digital activity your puter. </s>similar to web browsin,run up the logs to find it again. webpages found before from. where to write essays now? type message received,Messenger,,13
run up the logs to find it again. webpages found before from. where to write essays now? type message received. </s>spend least minutes each essay. find least references web pages for the content you write and copy the links urls. part meeting the researcher and task assignment. answer the questions the task description when writing essay searching google. google the system will infer this need and retrieve those webpages before you have search for. day hours task and task based your own schedule. will deleted after the studies not keep archive the history only collect measures for. information for research subj. history and technology what you need. what the history your. essay must longer than pages you are allowed copy and paste the content from the. again this history contains logs which will encrypted and stored your puter the history. what the system log. software will installed and run continuously for days. whil,helsinki institute tor intormation technology hiit. includes three main parts illustrated figure. box pietari kalmin katu helsinki. each task given time. the aim this study improve our understanding what needed better support people. purpose objectives and significance the study. information for research subj. what the history your. research study proactive entity remendation based implicit signals. based only the text you read the screen the text will used construct implicit queries. what the system log. funding agency european mission horizon adapt project number. research anizations and funding agency,Study Information T6.3 - Google Docs,,14
helsinki institute tor intormation technology hiit. includes three main parts illustrated figure. box pietari kalmin katu helsinki. each task given time. the aim this study improve our understanding what needed better support people. purpose objectives and significance the study. information for research subj. what the history your. research study proactive entity remendation based implicit signals. based only the text you read the screen the text will used construct implicit queries. what the system log. funding agency european mission horizon adapt project number. research anizations and funding agency. </s>run up the logs to find it again. webpages found before from. where to write essays now? type message received. </s>spend least minutes each essay. find least references web pages for the content you write and copy the links urls. part meeting the researcher and task assignment. answer the questions the task descri,but prefer activate the one. frype message is collected. this application at the time of writing my own article,Messenger,,15
but prefer activate the one. frype message is collected. this application at the time of writing my own article. </s>helsinki institute tor intormation technology hiit. includes three main parts illustrated figure. box pietari kalmin katu helsinki. each task given time. the aim this study improve our understanding what needed better support people. purpose objectives and significance the study. information for research subj. what the history your. research study proactive entity remendation based implicit signals. based only the text you read the screen the text will used construct implicit queries. what the system log. funding agency european mission horizon adapt project number. research anizations and funding agency. </s>run up the logs to find it again. webpages found before from. where to write essays now? type message received,includes three main parts. each task given time. the aim this study improve our understanding what needed better support people. purpose objectives and significance the study. information for research subj. what the history your. research study proactive entity remendation based implicit signals. based only the text you read the screen the text will used construct implicit queries. inbox tranthanhbao gmail  gmail. what the system log. funding agency european mission horizon adapt project number. ation case management team. research anizations and funding agency,Study Information T6.3 - Google Docs,,16
includes three main parts. each task given time. the aim this study improve our understanding what needed better support people. purpose objectives and significance the study. information for research subj. what the history your. research study proactive entity remendation based implicit signals. based only the text you read the screen the text will used construct implicit queries. inbox tranthanhbao gmail  gmail. what the system log. funding agency european mission horizon adapt project number. ation case management team. research anizations and funding agency. </s>but prefer activate the one. frype message is collected. this application at the time of writing my own article. </s>helsinki institute tor intormation technology hiit. includes three main parts illustrated figure. box pietari kalmin katu helsinki. each task given time. the aim this study improve our understanding what needed better support people. purpose o,use whatsapp devices the same time. fine thanks recently been. make calls and send messages without connecting your phone. search start new chat,WhatsApp,,17
use whatsapp devices the same time. fine thanks recently been. make calls and send messages without connecting your phone. search start new chat. </s>includes three main parts. each task given time. the aim this study improve our understanding what needed better support people. purpose objectives and significance the study. information for research subj. what the history your. research study proactive entity remendation based implicit signals. based only the text you read the screen the text will used construct implicit queries. inbox tranthanhbao gmail  gmail. what the system log. funding agency european mission horizon adapt project number. ation case management team. research anizations and funding agency. </s>but prefer activate the one. frype message is collected. this application at the time of writing my own article,vdu nhắn whatsapp hay messenger cếp được thu. type message được thu. messenger hay whatsapp trên lap kouất. remender tìm cái sai cái. trype message được thu. sức khoẻ thì tắt. cái nào cũng đúng không fair. chỉ khi làm banking hay. lưu thông tin mấy cái app như. mục đích nhiều liệu. hay kiểu app việc,Messenger,,18
vdu nhắn whatsapp hay messenger cếp được thu. type message được thu. messenger hay whatsapp trên lap kouất. remender tìm cái sai cái. trype message được thu. sức khoẻ thì tắt. cái nào cũng đúng không fair. chỉ khi làm banking hay. lưu thông tin mấy cái app như. mục đích nhiều liệu. hay kiểu app việc. </s>use whatsapp devices the same time. fine thanks recently been. make calls and send messages without connecting your phone. search start new chat. </s>includes three main parts. each task given time. the aim this study improve our understanding what needed better support people. purpose objectives and significance the study. information for research subj. what the history your. research study proactive entity remendation based implicit signals. based only the text you read the screen the text will used construct implicit queries. inbox tranthanhbao gmail  gmail. what the system log. funding agency european mission horizo,health benefits and health problems that may entail from smoking ingesting cannabis. icc internship opportunity arbitration case. headings you add the document will. study information google docs. assuming you support the use cannabis for medical reasons what are the possible. task health index docx. which cannabis good bad. smoking ingesting cannabis why. task health index docx docs google . inbox tranthanhbao gmail . use cannabis for medical purposes what would your arguments. why was cannabis made illegal the. you are joining debating society and need some notes make presentation the topic. you are joining debating society and need some not. medical cannabis has bee topic hot debate assuming you are against the. recent years some countries for example austria have legalized the. why was cannabis made illegal the zor. why the use cannabis restricted,Task 1 - Health (No Index).docx - Google Docs,,19
health benefits and health problems that may entail from smoking ingesting cannabis. icc internship opportunity arbitration case. headings you add the document will. study information google docs. assuming you support the use cannabis for medical reasons what are the possible. task health index docx. which cannabis good bad. smoking ingesting cannabis why. task health index docx docs google . inbox tranthanhbao gmail . use cannabis for medical purposes what would your arguments. why was cannabis made illegal the. you are joining debating society and need some notes make presentation the topic. you are joining debating society and need some not. medical cannabis has bee topic hot debate assuming you are against the. recent years some countries for example austria have legalized the. why was cannabis made illegal the zor. why the use cannabis restricted. </s>vdu nhắn whatsapp hay messenger cếp được thu. type message được ,the assignment requires collect facts. type message is received. answer available questions,Messenger,,20
the assignment requires collect facts. type message is received. answer available questions. </s>health benefits and health problems that may entail from smoking ingesting cannabis. icc internship opportunity arbitration case. headings you add the document will. study information google docs. assuming you support the use cannabis for medical reasons what are the possible. task health index docx. which cannabis good bad. smoking ingesting cannabis why. task health index docx docs google . inbox tranthanhbao gmail . use cannabis for medical purposes what would your arguments. why was cannabis made illegal the. you are joining debating society and need some notes make presentation the topic. you are joining debating society and need some not. medical cannabis has bee topic hot debate assuming you are against the. recent years some countries for example austria have legalized the. why was cannabis made illegal the zor. why ,vietnamese daily post. icc internship opportunity arbitr. ten mantras. search enter website name. the last seven days safari has prevented trackers from profiling you. buddha days. vietnamese uncle,Start Page,,21
vietnamese daily post. icc internship opportunity arbitr. ten mantras. search enter website name. the last seven days safari has prevented trackers from profiling you. buddha days. vietnamese uncle. </s>the assignment requires collect facts. type message is received. answer available questions. </s>health benefits and health problems that may entail from smoking ingesting cannabis. icc internship opportunity arbitration case. headings you add the document will. study information google docs. assuming you support the use cannabis for medical reasons what are the possible. task health index docx. which cannabis good bad. smoking ingesting cannabis why. task health index docx docs google . inbox tranthanhbao gmail . use cannabis for medical purposes what would your arguments. why was cannabis made illegal the. you are joining debating society and need some notes make presentation the topic. you are joining debating society,task health index docx. health benefits and health problems that may entail from smoking ingesting cannabis. recent years some countries for example austria have legalized the. use cannabis for medical purposes what would your arguments. why was cannabis made illegal the. you are joining debating society and need some notes make presentation the topic. why the use cannabis restricted,Task 1 - Health (No Index).docx - Google Docs,cannabis regulation uk - google search,22
