source,target,title,query,index
coursera online courses credential. inbox tranthanhbao gmail coursera . </s>vietnamese daily post. coursera online courses credentials from top eduato. ten mantras. the last seven days safari has prevented trackers from profiling you. buddha days. vietnamese uncle. </s>vietnamese daily post. coursera online courses credentials from top eduato. coursera online courses credentials from top educators join for free. ten mantras. search enter website name. the last seven days safari has prevented trackers from profiling you. buddha days. vietnamese master. summer internship appli search enter website name. vietnamese uncle. summer internship application goodbody. fundamentals data visu search enter website name,don close this window your messages are downloading. don close this window your messages are downloading downloading messages,WhatsApp,,295
don close this window your messages are downloading. don close this window your messages are downloading downloading messages. </s>coursera online courses credential. inbox tranthanhbao gmail coursera . </s>vietnamese daily post. coursera online courses credentials from top eduato. ten mantras. the last seven days safari has prevented trackers from profiling you. buddha days. vietnamese uncle,from coursera course offered facebook. search start new chat. was applying for some jobs and the internship grant from the project. you got some christmas foods. arch start new chat. the hangover tmr morning will be bad. vên mới một nghiện. nên mới một nghìịnh. have you got some christmas foods. nhạ chị tạn mulled wine. are you going to shop again? conducted jan told you. applied for financial aid but the result will only come out jan. aww but don't be too drunk. from coursera course offerr. and the skill needed for the internship whose interview will. and now studying social media management. plan finish within next week. dnu skiii tieeueu ior the intermsnip wiose imer view wiii. like you get a certificate. enrolling the free version won't get the cert yet when,WhatsApp,,297
from coursera course offered facebook. search start new chat. was applying for some jobs and the internship grant from the project. you got some christmas foods. arch start new chat. the hangover tmr morning will be bad. vên mới một nghiện. nên mới một nghìịnh. have you got some christmas foods. nhạ chị tạn mulled wine. are you going to shop again? conducted jan told you. applied for financial aid but the result will only come out jan. aww but don't be too drunk. from coursera course offerr. and the skill needed for the internship whose interview will. and now studying social media management. plan finish within next week. dnu skiii tieeueu ior the intermsnip wiose imer view wiii. like you get a certificate. enrolling the free version won't get the cert yet when. </s>don close this window your messages are downloading. don close this window your messages are downloading downloading messages. </s>coursera online courses ,the crime having sexual intercourse with parent child sibling. việt anh anh việt english thesaurus english dutch english french english. tội loạn luân loạn luân. sexual relations between people classed being too closely related. loạn luân hôn nhân cận thân. middle english from latin incestus incestum unchastity incest,Dictionary (8 found),,310
the crime having sexual intercourse with parent child sibling. việt anh anh việt english thesaurus english dutch english french english. tội loạn luân loạn luân. sexual relations between people classed being too closely related. loạn luân hôn nhân cận thân. middle english from latin incestus incestum unchastity incest. </s>from coursera course offered facebook. search start new chat. was applying for some jobs and the internship grant from the project. you got some christmas foods. arch start new chat. the hangover tmr morning will be bad. vên mới một nghiện. nên mới một nghìịnh. have you got some christmas foods. nhạ chị tạn mulled wine. are you going to shop again? conducted jan told you. applied for financial aid but the result will only come out jan. aww but don't be too drunk. from coursera course offerr. and the skill needed for the internship whose interview will. and now studying social media management. plan fi,all việt anh anh việt english thesaurus english dutch english french english. wedding cake gingerbread antonyms plain. glowing fresh flushed blushing high coloured blowsy archaic. high sounding magniloquent grandiloquent ornate fancy. cheeked pink pinkish roseate rubicund healthy looking. elaborate over elaborate embellished curlicued extravagant. the florid plasterwork the ceilings ornate fancy very. strained overwrought elaborate over elaborate overblown. overripe overdone convoluted turgid inflated informal. highfalutin purple rare tumid pleonastic euphuistic aureate. ossianic fustian hyperventilated antonyms plain. flamboyant baroque rococo fussy busy ostentatious showy. florid plexion ruddy red red faced reddish rosy rosy. baroque orotund rhetorical oratorical bombastic laboured. sanguine rare erubescent rubescent antonyms pale. endearments florid english flowery flamboyant high flown,Dictionary,,311
all việt anh anh việt english thesaurus english dutch english french english. wedding cake gingerbread antonyms plain. glowing fresh flushed blushing high coloured blowsy archaic. high sounding magniloquent grandiloquent ornate fancy. cheeked pink pinkish roseate rubicund healthy looking. elaborate over elaborate embellished curlicued extravagant. the florid plasterwork the ceilings ornate fancy very. strained overwrought elaborate over elaborate overblown. overripe overdone convoluted turgid inflated informal. highfalutin purple rare tumid pleonastic euphuistic aureate. ossianic fustian hyperventilated antonyms plain. flamboyant baroque rococo fussy busy ostentatious showy. florid plexion ruddy red red faced reddish rosy rosy. baroque orotund rhetorical oratorical bombastic laboured. sanguine rare erubescent rubescent antonyms pale. endearments florid english flowery flamboyant high flown. </s>the crime having sexual i,the sperm ejaculated emit eject discharge release expel. việt english thesaurus english dutch english french english. excrete disge exude spout shoot out squirt out spew out. the moment sexual climax. with direct speech dated say something quickly and suddenly. việt anh anh việt english thesaurus english dutch english french english. what ejaculated exclaim cry out call out yelli sing out. emit semen climax have asm asm informal e. what ejaculated exclaim cry out call out yell sing out. utter suddenly blurt out burst out with e out with. object man male animal eject semen from the body. sinh vật học phóng tinh dịch,Dictionary (14 found),,312
the sperm ejaculated emit eject discharge release expel. việt english thesaurus english dutch english french english. excrete disge exude spout shoot out squirt out spew out. the moment sexual climax. with direct speech dated say something quickly and suddenly. việt anh anh việt english thesaurus english dutch english french english. what ejaculated exclaim cry out call out yelli sing out. emit semen climax have asm asm informal e. what ejaculated exclaim cry out call out yell sing out. utter suddenly blurt out burst out with e out with. object man male animal eject semen from the body. sinh vật học phóng tinh dịch. </s>all việt anh anh việt english thesaurus english dutch english french english. wedding cake gingerbread antonyms plain. glowing fresh flushed blushing high coloured blowsy archaic. high sounding magniloquent grandiloquent ornate fancy. cheeked pink pinkish roseate rubicund healthy looking. elaborate over ,vietnamese daily post. reminder email address and password. the last seven days safari has prevented trackers from profiling you. buddha days. vietnamese uncle. phd candidates junioq search google,Start Page,,313
vietnamese daily post. reminder email address and password. the last seven days safari has prevented trackers from profiling you. buddha days. vietnamese uncle. phd candidates junioq search google. </s>the sperm ejaculated emit eject discharge release expel. việt english thesaurus english dutch english french english. excrete disge exude spout shoot out squirt out spew out. the moment sexual climax. with direct speech dated say something quickly and suddenly. việt anh anh việt english thesaurus english dutch english french english. what ejaculated exclaim cry out call out yelli sing out. emit semen climax have asm asm informal e. what ejaculated exclaim cry out call out yell sing out. utter suddenly blurt out burst out with e out with. object man male animal eject semen from the body. sinh vật học phóng tinh dịch. </s>all việt anh anh việt english thesaurus english dutch english french english. wedding cake gingerbread ,all việt anh anh việt english thesaurus english dutch english french english. lacuna bre kju ame unə. nhiều lacunae kju lacunas. chỗ thiếu chỗ khuyết chỗ sót,Dictionary (2 found),ip law - google search,314
all việt anh anh việt english thesaurus english dutch english french english. lacuna bre kju ame unə. nhiều lacunae kju lacunas. chỗ thiếu chỗ khuyết chỗ sót. </s>vietnamese daily post. reminder email address and password. the last seven days safari has prevented trackers from profiling you. buddha days. vietnamese uncle. phd candidates junioq search google. </s>the sperm ejaculated emit eject discharge release expel. việt english thesaurus english dutch english french english. excrete disge exude spout shoot out squirt out spew out. the moment sexual climax. with direct speech dated say something quickly and suddenly. việt anh anh việt english thesaurus english dutch english french english. what ejaculated exclaim cry out call out yelli sing out. emit semen climax have asm asm informal e. what ejaculated exclaim cry out call out yell sing out. utter suddenly blurt out burst out with e out with. object man male animal e,don close this window your messages are downloading. don close this window your messages are downloading downloading messages,WhatsApp,,322
don close this window your messages are downloading. don close this window your messages are downloading downloading messages. </s>all việt anh anh việt english thesaurus english dutch english french english. lacuna bre kju ame unə. nhiều lacunae kju lacunas. chỗ thiếu chỗ khuyết chỗ sót. </s>vietnamese daily post. reminder email address and password. the last seven days safari has prevented trackers from profiling you. buddha days. vietnamese uncle. phd candidates junioq search google,but you were now stydying. search start new chat. chú mới gọi mua cho thôi. thought went home alr. hadn known you were home not. hẹn nhân bảo minh. happy new year mike. went the countdown with colleagues. wanted hear your voice for the new year,WhatsApp,,332
but you were now stydying. search start new chat. chú mới gọi mua cho thôi. thought went home alr. hadn known you were home not. hẹn nhân bảo minh. happy new year mike. went the countdown with colleagues. wanted hear your voice for the new year. </s>don close this window your messages are downloading. don close this window your messages are downloading downloading messages. </s>all việt anh anh việt english thesaurus english dutch english french english. lacuna bre kju ame unə. nhiều lacunae kju lacunas. chỗ thiếu chỗ khuyết chỗ sót,bbc   bbc . bài ngày tiếng việt. thập chú bài chú. the last seven days safari has prevented tracker from profiling you. các ngày vía phật. chú đại tiếng việt,Start Page,,339
bbc   bbc . bài ngày tiếng việt. thập chú bài chú. the last seven days safari has prevented tracker from profiling you. các ngày vía phật. chú đại tiếng việt. </s>but you were now stydying. search start new chat. chú mới gọi mua cho thôi. thought went home alr. hadn known you were home not. hẹn nhân bảo minh. happy new year mike. went the countdown with colleagues. wanted hear your voice for the new year. </s>don close this window your messages are downloading. don close this window your messages are downloading downloading messages,vietnamese daily post. ten mantras. the last seven days safari has prevented trackers from profiling you. buddha days. phd candidates junioq happy search google. vietnamese uncle,Start Page,,341
vietnamese daily post. ten mantras. the last seven days safari has prevented trackers from profiling you. buddha days. phd candidates junioq happy search google. vietnamese uncle. </s>bbc   bbc . bài ngày tiếng việt. thập chú bài chú. the last seven days safari has prevented tracker from profiling you. các ngày vía phật. chú đại tiếng việt. </s>but you were now stydying. search start new chat. chú mới gọi mua cho thôi. thought went home alr. hadn known you were home not. hẹn nhân bảo minh. happy new year mike. went the countdown with colleagues. wanted hear your voice for the new year,use logo image that helps people identify this. use image that represents what this page about. legal services and consulting. pages set your page,Facebook,happy new year 2022 - google search,342
use logo image that helps people identify this. use image that represents what this page about. legal services and consulting. pages set your page. </s>vietnamese daily post. ten mantras. the last seven days safari has prevented trackers from profiling you. buddha days. phd candidates junioq happy search google. vietnamese uncle. </s>bbc   bbc . bài ngày tiếng việt. thập chú bài chú. the last seven days safari has prevented tracker from profiling you. các ngày vía phật. chú đại tiếng việt,stop giving me the letter biang and continue to come back to take pictures for me. trust aaa. i just called to buy it. guarantee appointment. phuc biang trust how. happy new year mike. please take a picture later,WhatsApp,,359
stop giving me the letter biang and continue to come back to take pictures for me. trust aaa. i just called to buy it. guarantee appointment. phuc biang trust how. happy new year mike. please take a picture later. </s>use logo image that helps people identify this. use image that represents what this page about. legal services and consulting. pages set your page. </s>vietnamese daily post. ten mantras. the last seven days safari has prevented trackers from profiling you. buddha days. phd candidates junioq happy search google. vietnamese uncle,cho nam moi hoc hanh suon. dang ngoi hoc bai. thôi đưa con thư biang tiếp tục trở lại làm culi chụp hình cho. search start new chat. chú mới gọi mua cho thôi. hẹn nhân bảo minh. cho thu ngu mai lam kia. phúc biang mng chưa. tin tưởng bao aaaa. happy new year mike. thoi nam sau chup lai nha,WhatsApp,,361
cho nam moi hoc hanh suon. dang ngoi hoc bai. thôi đưa con thư biang tiếp tục trở lại làm culi chụp hình cho. search start new chat. chú mới gọi mua cho thôi. hẹn nhân bảo minh. cho thu ngu mai lam kia. phúc biang mng chưa. tin tưởng bao aaaa. happy new year mike. thoi nam sau chup lai nha. </s>stop giving me the letter biang and continue to come back to take pictures for me. trust aaa. i just called to buy it. guarantee appointment. phuc biang trust how. happy new year mike. please take a picture later. </s>use logo image that helps people identify this. use image that represents what this page about. legal services and consulting. pages set your page,search start new chat. but you were now stydying. chú mới gọi mua cho thôi. thought went home alr. hadn known you were home not. wanted hear your voice for the new year. hẹn nhân bảo minh. happy new year mike. went the countdown with colleagues. ngoi tau toi nha chua,WhatsApp,,363
search start new chat. but you were now stydying. chú mới gọi mua cho thôi. thought went home alr. hadn known you were home not. wanted hear your voice for the new year. hẹn nhân bảo minh. happy new year mike. went the countdown with colleagues. ngoi tau toi nha chua. </s>cho nam moi hoc hanh suon. dang ngoi hoc bai. thôi đưa con thư biang tiếp tục trở lại làm culi chụp hình cho. search start new chat. chú mới gọi mua cho thôi. hẹn nhân bảo minh. cho thu ngu mai lam kia. phúc biang mng chưa. tin tưởng bao aaaa. happy new year mike. thoi nam sau chup lai nha. </s>stop giving me the letter biang and continue to come back to take pictures for me. trust aaa. i just called to buy it. guarantee appointment. phuc biang trust how. happy new year mike. please take a picture later,"these people of europe. helsinki stop lol shop. hend how rich he is. hello everyone finally sat. hai sent sticker mon. on the side, the orchids sprouted like mushrooms. work hard play harder. like a flood in the whole continent. there are many poor continents",Messenger,,384
"these people of europe. helsinki stop lol shop. hend how rich he is. hello everyone finally sat. hai sent sticker mon. on the side, the orchids sprouted like mushrooms. work hard play harder. like a flood in the whole continent. there are many poor continents. </s>search start new chat. but you were now stydying. chú mới gọi mua cho thôi. thought went home alr. hadn known you were home not. wanted hear your voice for the new year. hẹn nhân bảo minh. happy new year mike. went the countdown with colleagues. ngoi tau toi nha chua. </s>cho nam moi hoc hanh suon. dang ngoi hoc bai. thôi đưa con thư biang tiếp tục trở lại làm culi chụp hình cho. search start new chat. chú mới gọi mua cho thôi. hẹn nhân bảo minh. cho thu ngu mai lam kia. phúc biang mng chưa. tin tưởng bao aaaa. happy new year mike. thoi nam sau chup lai nha",social media management social media content cour. learning objectivesa coursera . discuss and ask questions about this content. like this course bee expert joining the facebook social media marketing. this week you will learn the elements post and how create one for business using text and images effectively. threads last post days ago. reminder email address and password tranthanhbao. you auditing this course,Social Media Management - Social Media Content | Coursera,,385
"social media management social media content cour. learning objectivesa coursera . discuss and ask questions about this content. like this course bee expert joining the facebook social media marketing. this week you will learn the elements post and how create one for business using text and images effectively. threads last post days ago. reminder email address and password tranthanhbao. you auditing this course. </s>these people of europe. helsinki stop lol shop. hend how rich he is. hello everyone finally sat. hai sent sticker mon. on the side, the orchids sprouted like mushrooms. work hard play harder. like a flood in the whole continent. there are many poor continents. </s>search start new chat. but you were now stydying. chú mới gọi mua cho thôi. thought went home alr. hadn known you were home not. wanted hear your voice for the new year. hẹn nhân bảo minh. happy new year mike. went the countdown with colleagues. ng",vietnamese daily post. reminder email address and password. ten mantras. trackers from profiling you. social media management social med. buddha days. the last seven days safari has prevented. vietnamese uncle. phd candidates junioq search google,Start Page,,400
"vietnamese daily post. reminder email address and password. ten mantras. trackers from profiling you. social media management social med. buddha days. the last seven days safari has prevented. vietnamese uncle. phd candidates junioq search google. </s>social media management social media content cour. learning objectivesa coursera . discuss and ask questions about this content. like this course bee expert joining the facebook social media marketing. this week you will learn the elements post and how create one for business using text and images effectively. threads last post days ago. reminder email address and password tranthanhbao. you auditing this course. </s>these people of europe. helsinki stop lol shop. hend how rich he is. hello everyone finally sat. hai sent sticker mon. on the side, the orchids sprouted like mushrooms. work hard play harder. like a flood in the whole continent. there are many poor continents",reminder email address and passwor. county algoodbody tal net. correspondencem reminder email address and passwor. social media management social med. email addrocs inloaceetela suomen laani. county equai opppor tunities. please supply the following information. selecta algoodbody tal net,Personal Information - A&L Goodbody,välimerenkatu 5 - google search,401
reminder email address and passwor. county algoodbody tal net. correspondencem reminder email address and passwor. social media management social med. email addrocs inloaceetela suomen laani. county equai opppor tunities. please supply the following information. selecta algoodbody tal net. </s>vietnamese daily post. reminder email address and password. ten mantras. trackers from profiling you. social media management social med. buddha days. the last seven days safari has prevented. vietnamese uncle. phd candidates junioq search google. </s>social media management social media content cour. learning objectivesa coursera . discuss and ask questions about this content. like this course bee expert joining the facebook social media marketing. this week you will learn the elements post and how create one for business using text and images effectively. threads last post days ago. reminder email address and password tranthanhb,listen our series covid. make the right medium and long term decisions. supply chain and operations. anisations are experiencing significant operational financial and liquidity. government support and webcasts where focus your strategy over the ing. have solid understanding your cash position assessing the potential. medium and long term financial implications covid. finance and liquidity consi. challenges result covid priority for businesses managing cash. the way you respond covid will the key maintaining confidence and. engage actively and realistically with stakeholders consider the effect. determine access pools liquidity and where working capital can released,COVID-19: Responding to potential impacts on Irish business | PwC,covid impact on business in ireland - google search,405
listen our series covid. make the right medium and long term decisions. supply chain and operations. anisations are experiencing significant operational financial and liquidity. government support and webcasts where focus your strategy over the ing. have solid understanding your cash position assessing the potential. medium and long term financial implications covid. finance and liquidity consi. challenges result covid priority for businesses managing cash. the way you respond covid will the key maintaining confidence and. engage actively and realistically with stakeholders consider the effect. determine access pools liquidity and where working capital can released. </s>reminder email address and passwor. county algoodbody tal net. correspondencem reminder email address and passwor. social media management social med. email addrocs inloaceetela suomen laani. county equai opppor tunities. please supply the following info,vietnamese daily post. ten mantras. trackers from profiling you. buddha days. the last seven days safari has prevented. vietnamese uncle,Start Page,,407
vietnamese daily post. ten mantras. trackers from profiling you. buddha days. the last seven days safari has prevented. vietnamese uncle. </s>listen our series covid. make the right medium and long term decisions. supply chain and operations. anisations are experiencing significant operational financial and liquidity. government support and webcasts where focus your strategy over the ing. have solid understanding your cash position assessing the potential. medium and long term financial implications covid. finance and liquidity consi. challenges result covid priority for businesses managing cash. the way you respond covid will the key maintaining confidence and. engage actively and realistically with stakeholders consider the effect. determine access pools liquidity and where working capital can released. </s>reminder email address and passwor. county algoodbody tal net. correspondencem reminder email address and passwo,"like a pupu. i caught naht for a long time. but found a letter. nma play long to also. i grew up like this. work hard play harder. nma con lol my friend. curse a lot. every time jibbe cries. at the moment of speaking the moment. sent sticker mon. hai sent sticker mon. like a proud bubu. actively pay back. then kpe but understand differently. written a long time ago. type message nma con lol my friend. comedy sent sticker mon. nma chau likes it. i grew up like that. asian, but lazy. hello everyone finally sat. like a spoiled bubu. everyone finally sat. don't say this. saying many things right. find scratch paper and read it. then curse a lot of things that talk like. my child does not understand. call fair money",Messenger,,410
