source,target,title,query,index
health benefits and health problems that may entail from smoking ingesting cannabis. conference geneva when egyptian delegate convinced everybody that was. recent years some countries for example austria have legalized the. use cannabis for medical purposes what would your arguments. why was cannabis made illegal the. you are joining debating society and need some notes make presentation the topic. why the use cannabis restricted. </s>the bottom the page. view our privacy policy for more information. audience insights and product development some. consent optional however may restrict content and. and our technology partners ask for your consent. click accept below you are happy with this. and your browsing patterns this may used for. our partners process personal data the basis. which consent required any time using the link. further information clicking settings. you can change withdraw your consent. this site you can,view insert format tools see document status econds ago.   ladbible  mote interesting why. task health index docx. such pace the early century that was going put the timber firms out business. smoking ingesting cannabis why. puur unur vny vrur urny viuuu unu grum nauu mvrv wuunvy uuu uruyu. health benefits and health problems that may entail from smoking ingesting cannabis docs google . bat hemp therefore lobbyists began smear campaign demonise the drug and claim. bat hemp therefore lobbyists began smear. use cannabis for medical purposes what would your arguments. such pace the early century that was goir.  news bbc programmes panorama stm. medical cannabis has bee topic hot debate assuming you are against the. made people into zombies and led ungodly behaviour. one major timber pany apparently stood lose. all changes saved drive. therefore anti drug socialists wanted the government illegalise this substance. recent years some countries for example austria have legalized the. every change you make automatically saved drive. therefore anti drug socialists wanted the governmer. why the use cannabis restricted,Task 1 - Health (No Index).docx - Google Docs,,81
view insert format tools see document status econds ago.   ladbible  mote interesting why. task health index docx. such pace the early century that was going put the timber firms out business. smoking ingesting cannabis why. puur unur vny vrur urny viuuu unu grum nauu mvrv wuunvy uuu uruyu. health benefits and health problems that may entail from smoking ingesting cannabis docs google . bat hemp therefore lobbyists began smear campaign demonise the drug and claim. bat hemp therefore lobbyists began smear. use cannabis for medical purposes what would your arguments. such pace the early century that was goir.  news bbc programmes panorama stm. medical cannabis has bee topic hot debate assuming you are against the. made people into zombies and led ungodly behaviour. one major timber pany apparently stood lose. all changes saved drive. therefore anti drug socialists wanted the government illegalise this substance. recent ye,cannabis was made illegal the was followed international drugs,Task 1 - Health (No Index) - Google Docs,,82
cannabis was made illegal the was followed international drugs. </s>view insert format tools see document status econds ago.   ladbible  mote interesting why. task health index docx. such pace the early century that was going put the timber firms out business. smoking ingesting cannabis why. puur unur vny vrur urny viuuu unu grum nauu mvrv wuunvy uuu uruyu. health benefits and health problems that may entail from smoking ingesting cannabis docs google . bat hemp therefore lobbyists began smear campaign demonise the drug and claim. bat hemp therefore lobbyists began smear. use cannabis for medical purposes what would your arguments. such pace the early century that was goir.  news bbc programmes panorama stm. medical cannabis has bee topic hot debate assuming you are against the. made people into zombies and led ungodly behaviour. one major timber pany apparently stood lose. all changes saved drive. therefore anti drug s,cannabis was made illegal the was followed international drugs,Task 1 - Health (No Index) - Google Docs,,84
cannabis was made illegal the was followed international drugs. </s>cannabis was made illegal the was followed international drugs. </s>view insert format tools see document status econds ago.   ladbible  mote interesting why. task health index docx. such pace the early century that was going put the timber firms out business. smoking ingesting cannabis why. puur unur vny vrur urny viuuu unu grum nauu mvrv wuunvy uuu uruyu. health benefits and health problems that may entail from smoking ingesting cannabis docs google . bat hemp therefore lobbyists began smear campaign demonise the drug and claim. bat hemp therefore lobbyists began smear. use cannabis for medical purposes what would your arguments. such pace the early century that was goir.  news bbc programmes panorama stm. medical cannabis has bee topic hot debate assuming you are against the. made people into zombies and led ungodly behaviour. one major timber pany a,cannabis was made illegal the was followed international drugs,Task 1 - Health (No Index).docx - Google Docs,,85
cannabis was made illegal the was followed international drugs. </s>cannabis was made illegal the was followed international drugs. </s>cannabis was made illegal the was followed international drugs,and learning laboratory setting cannabis and thc produce dose related deficits. reaction time attention motor performance and coordination and information. processing these effects can last days after abstinence from the drug. cerebellum chronic cannabis users heavy chronic users may have reduced. activating the neurons but the effects thc are more potent and longer acting. the active ingredient cannabis delta tetrahydrocannabinol thc only found. and dopamine animal studies have indicated that thc exposure increases the. have paranoid thoughts experience acute psychosis depending. present tobacco smoke carbon monoxide cyanide with the exception. people however estimates for the world most populated countries estimates are. involved memory and attention such the hippocampus prefrontal cortex and. while thc the main psychoactive ponent cannabis extracts cannabis. cannabis smokers often have many the same respiratory problems tobacco. from the same amount smoked tobacco this inconsistency attributed. are particularly prevalent the hippocampus cerebellum prefrontal cortex and. users report feeling sleepy depressed and others may feel anxious panicked. corintthe setting the social setting user expectations mood state users. parable rateto cigarette smoking long term studies from the usa and new. reward pain perception and motor coordination cbr receptor activation regulates. thc cannabis and nicotine tobacco infrequent cannabis users may experience. cannabis smoke particles tar the respiratory tract pared the tar generated. hall degenhard adverse health effects non medical cannabis use lancet. pharmacogenetic characteristics and vulnerability more the psychosis link. small portions the cannabis plant the flowering tops and some the. functional imaging studies have found lower activity levels regions the brain. cannabis and the respiratory and. volumes the hippocampus and amygdala additionally adults who use cannabis. tobacco regular cannabis smoking can lead both acute and chronic bronchitis. contains least chemical constituents which are cannabinoids while. effects memory including the ability form new memories and attention. smokers including daily cough and phlegm production frequent acute chest illness. than the endogenous neurotransmitter cbrs are widely distributed the brain but. burning and stinging the mouth and throat along with heavy cough and regular. typically report the feeling euphoria and relaxation those effects subside some. neurotransmitter anandamide thc mimics anandamide binding with the cbrs and. neurons produce psychoactive effects cbrs are part the endocannabinoid. nida research report series cannabis abuse. chronic bronchitis than non smokers there four fold greater quantity. the release multiple neurotransmitters including noradrenaline gaba serotonin. system munication network the brain that plays role neural. leaves thc stimulates cannabinoid receptors cbrs located the surface. either unavailable china only partially available and outdated for men india. cannabis use linked deficits tasks executive functioning has negative. unmon cannabis smoke posed many the same ingredients that are. and increased risk lung infections and pneumonia even the absence. development and function cbrs are typically activated naturally occurring. many these ponents have not been isolated two cannabinol andthc content attributed indoor cultivation and improved breeding. because cannabis frequently smoked bronchial and lung diseases are not. memory within few days following use. zealand have shown that regular cannabis smokers report more symptoms. use salud ment online vol accessed november. villatoro student survey mexico city prevalence and trends drug. cannabis the brain and body. amygdala brain regions involved pleasure cognition concentration memory. heavily often exhibit deficits executive functioning attention learning and,https://www.unodc.org/documents/drug-prevention-and-treatment/cannabis_review.pdf,reason why cannabis usage is restricted - google search,86
and learning laboratory setting cannabis and thc produce dose related deficits. reaction time attention motor performance and coordination and information. processing these effects can last days after abstinence from the drug. cerebellum chronic cannabis users heavy chronic users may have reduced. activating the neurons but the effects thc are more potent and longer acting. the active ingredient cannabis delta tetrahydrocannabinol thc only found. and dopamine animal studies have indicated that thc exposure increases the. have paranoid thoughts experience acute psychosis depending. present tobacco smoke carbon monoxide cyanide with the exception. people however estimates for the world most populated countries estimates are. involved memory and attention such the hippocampus prefrontal cortex and. while thc the main psychoactive ponent cannabis extracts cannabis. cannabis smokers often have many the same respiratory probl,was minutes ago. recent years some countries for example austria have legalized the. why the use cannabis restricted,Task 1 - Health (No Index).docx - Google Docs,,87
was minutes ago. recent years some countries for example austria have legalized the. why the use cannabis restricted. </s>and learning laboratory setting cannabis and thc produce dose related deficits. reaction time attention motor performance and coordination and information. processing these effects can last days after abstinence from the drug. cerebellum chronic cannabis users heavy chronic users may have reduced. activating the neurons but the effects thc are more potent and longer acting. the active ingredient cannabis delta tetrahydrocannabinol thc only found. and dopamine animal studies have indicated that thc exposure increases the. have paranoid thoughts experience acute psychosis depending. present tobacco smoke carbon monoxide cyanide with the exception. people however estimates for the world most populated countries estimates are. involved memory and attention such the hippocampus prefrontal cortex and. whil,vietnamese daily post. why some count google search. ten mantras. general internship hcssq why some coun search google. the last seven days safari has prevented trackers from profiling you. buddha days. vietnamese uncle,Start Page,,89
vietnamese daily post. why some count google search. ten mantras. general internship hcssq why some coun search google. the last seven days safari has prevented trackers from profiling you. buddha days. vietnamese uncle. </s>was minutes ago. recent years some countries for example austria have legalized the. why the use cannabis restricted. </s>and learning laboratory setting cannabis and thc produce dose related deficits. reaction time attention motor performance and coordination and information. processing these effects can last days after abstinence from the drug. cerebellum chronic cannabis users heavy chronic users may have reduced. activating the neurons but the effects thc are more potent and longer acting. the active ingredient cannabis delta tetrahydrocannabinol thc only found. and dopamine animal studies have indicated that thc exposure increases the. have paranoid thoughts experience acute psychosis depending,countries where drug use decriminalized and prehensive harm reduction. use cannabis for medical purposes what would your arguments docs google . recent years some countries for example austria have legalized the. use cannabis for medical purposes what would your arguments. effects cannabis such addiction overdose mental illness dysfunctions person.  news bbc programmes panorama stm. why the use cannabis restricted,Task 1 - Health (No Index).docx - Google Docs,,92
countries where drug use decriminalized and prehensive harm reduction. use cannabis for medical purposes what would your arguments docs google . recent years some countries for example austria have legalized the. use cannabis for medical purposes what would your arguments. effects cannabis such addiction overdose mental illness dysfunctions person.  news bbc programmes panorama stm. why the use cannabis restricted. </s>vietnamese daily post. why some count google search. ten mantras. general internship hcssq why some coun search google. the last seven days safari has prevented trackers from profiling you. buddha days. vietnamese uncle. </s>was minutes ago. recent years some countries for example austria have legalized the. why the use cannabis restricted,vietnamese daily post. shared with google drive. ten mantras. icc internship opportunity regio. the last seven days safari has prevented trackers from profiling you. buddha days. vietnamese uncle,Start Page,,94
vietnamese daily post. shared with google drive. ten mantras. icc internship opportunity regio. the last seven days safari has prevented trackers from profiling you. buddha days. vietnamese uncle. </s>countries where drug use decriminalized and prehensive harm reduction. use cannabis for medical purposes what would your arguments docs google . recent years some countries for example austria have legalized the. use cannabis for medical purposes what would your arguments. effects cannabis such addiction overdose mental illness dysfunctions person.  news bbc programmes panorama stm. why the use cannabis restricted. </s>vietnamese daily post. why some count google search. ten mantras. general internship hcssq why some coun search google. the last seven days safari has prevented trackers from profiling you. buddha days. vietnamese uncle,health benefits and health problems that may entail from smoking ingesting cannabis can impair your cognitive thinking abilities lung damage smoking anything whether,Task 1 - Health (No Index).docx - Google Docs,,98
health benefits and health problems that may entail from smoking ingesting cannabis can impair your cognitive thinking abilities lung damage smoking anything whether. </s>vietnamese daily post. shared with google drive. ten mantras. icc internship opportunity regio. the last seven days safari has prevented trackers from profiling you. buddha days. vietnamese uncle. </s>countries where drug use decriminalized and prehensive harm reduction. use cannabis for medical purposes what would your arguments docs google . recent years some countries for example austria have legalized the. use cannabis for medical purposes what would your arguments. effects cannabis such addiction overdose mental illness dysfunctions person.  news bbc programmes panorama stm. why the use cannabis restricted,benefits and harms medical cannabis scoping review systematic reviews. review pubmed ncbi nlm nih gov. see all similar articles. drug alcohol depend feb doi. pubmed ncbi nlm nih gov. approach the medical marijuana controversy. legalize use marijuana for medical purposes mds and patients plead. pratt stevens thuku butler skidmore wieland clemons kanji hutton. syst rev dec doi. arch gen psychiatry jun doi archpsyc. marijuana and medicine assessing the science base summary the institute,Examining the debate on the use of medical marijuana - PubMed,debate in medical use of cannabis - google search,99
benefits and harms medical cannabis scoping review systematic reviews. review pubmed ncbi nlm nih gov. see all similar articles. drug alcohol depend feb doi. pubmed ncbi nlm nih gov. approach the medical marijuana controversy. legalize use marijuana for medical purposes mds and patients plead. pratt stevens thuku butler skidmore wieland clemons kanji hutton. syst rev dec doi. arch gen psychiatry jun doi archpsyc. marijuana and medicine assessing the science base summary the institute. </s>health benefits and health problems that may entail from smoking ingesting cannabis can impair your cognitive thinking abilities lung damage smoking anything whether. </s>vietnamese daily post. shared with google drive. ten mantras. icc internship opportunity regio. the last seven days safari has prevented trackers from profiling you. buddha days. vietnamese uncle,safari can find the server. safari can open the page. find the server  ncbi nlm nih gov. ncbi nlm nih gov.   ncbi nlm nih gov pmc articles pmid because safari can,Failed to open page,,100
safari can find the server. safari can open the page. find the server  ncbi nlm nih gov. ncbi nlm nih gov.   ncbi nlm nih gov pmc articles pmid because safari can. </s>benefits and harms medical cannabis scoping review systematic reviews. review pubmed ncbi nlm nih gov. see all similar articles. drug alcohol depend feb doi. pubmed ncbi nlm nih gov. approach the medical marijuana controversy. legalize use marijuana for medical purposes mds and patients plead. pratt stevens thuku butler skidmore wieland clemons kanji hutton. syst rev dec doi. arch gen psychiatry jun doi archpsyc. marijuana and medicine assessing the science base summary the institute. </s>health benefits and health problems that may entail from smoking ingesting cannabis can impair your cognitive thinking abilities lung damage smoking anything whether,appear here icc internship opp. task health index docx. health benefits and health problems that may entail from smoking ingesting cannabis,Task 1 - Health (No Index).docx - Google Docs,debate in medical use of cannabis - google search,102
appear here icc internship opp. task health index docx. health benefits and health problems that may entail from smoking ingesting cannabis. </s>safari can find the server. safari can open the page. find the server  ncbi nlm nih gov. ncbi nlm nih gov.   ncbi nlm nih gov pmc articles pmid because safari can. </s>benefits and harms medical cannabis scoping review systematic reviews. review pubmed ncbi nlm nih gov. see all similar articles. drug alcohol depend feb doi. pubmed ncbi nlm nih gov. approach the medical marijuana controversy. legalize use marijuana for medical purposes mds and patients plead. pratt stevens thuku butler skidmore wieland clemons kanji hutton. syst rev dec doi. arch gen psychiatry jun doi archpsyc. marijuana and medicine assessing the science base summary the institute,appetite cause coughs increase heart rate increase decrease blood. evidence rate detalled description each the ratings. smoking marijuana using mouth sprays containing marijuana. syndrome heart attack and swelling walls the arteries. pressure and impair mental functioning some reports suggest that. events after smoking marijuana had other risk factors for heart related. symptoms such chest pressure soreness and difficulty breathing. extract can cause headache dizziness drowsiness dry mouth nausea. marijuana extract possibly safe when used standardized. check your symptomsshared with. events such smoking cigarettes being overweight. cavities form within lung tissue these air filled cavities can cause. and paranoid thinking smoking marijuana might also increase. what you should know. smoking marijuana may also increase the risk acute coronary. associated with increased the risk developing lung cancer also. arteritis however many cases people who experienced these. some reports suggest that smoking marijuana might cause air filled. marijuana possibly unsafe when smoked smoking marijuana. spray sativex pharmaceuticals that applied under the tongue,"Marijuana: Health Benefits, Side Effects, Uses, Dose & Precautions",debate in medical use of cannabis - google search,103
appetite cause coughs increase heart rate increase decrease blood. evidence rate detalled description each the ratings. smoking marijuana using mouth sprays containing marijuana. syndrome heart attack and swelling walls the arteries. pressure and impair mental functioning some reports suggest that. events after smoking marijuana had other risk factors for heart related. symptoms such chest pressure soreness and difficulty breathing. extract can cause headache dizziness drowsiness dry mouth nausea. marijuana extract possibly safe when used standardized. check your symptomsshared with. events such smoking cigarettes being overweight. cavities form within lung tissue these air filled cavities can cause. and paranoid thinking smoking marijuana might also increase. what you should know. smoking marijuana may also increase the risk acute coronary. associated with increased the risk developing lung cancer also. arteritis howev,assuming you support the use cannabis for medical reasons what are the possible. decrease blood pressure and impair mental functioning some reports suggest that.   verywellhealth  what are the pros and cons medical marijuana. marijuana might also increase appetite cause coughs increase heart rate increase. smoking marijuana may also increase the risk acute coronary syndrome heart attack. and swelling walls the arteries arteritis however many cases people who. also some reports suggest that smoking marijuana might cause air filled cavities. smoking marijuana using mouth sprays containing marijuana extract can cause. heart related events such smoking cigarettes being overweight docs google . headache dizziness drowsiness dry mouth nausea and paranoid thinking smoking. smoking marijuana associated with increased the risk developing lung cancer. form within lung tissue these air filled cavities can cause symptoms such chest. experienced these events after smoking marijuana had other risk factors for. cigarettes can also cause weight gain people with hiv,Task 1 - Health (No Index).docx - Google Docs,,105
assuming you support the use cannabis for medical reasons what are the possible. decrease blood pressure and impair mental functioning some reports suggest that.   verywellhealth  what are the pros and cons medical marijuana. marijuana might also increase appetite cause coughs increase heart rate increase. smoking marijuana may also increase the risk acute coronary syndrome heart attack. and swelling walls the arteries arteritis however many cases people who. also some reports suggest that smoking marijuana might cause air filled cavities. smoking marijuana using mouth sprays containing marijuana extract can cause. heart related events such smoking cigarettes being overweight docs google . headache dizziness drowsiness dry mouth nausea and paranoid thinking smoking. smoking marijuana associated with increased the risk developing lung cancer. form within lung tissue these air filled cavities can cause symptoms such chest,muscle spasms the ability walk tremors people with. this product approved treat nerve pain people with. early research shows that smoking marijuana may reduce muscle. can also cause weight gain people with hivwho are also taking. multiple sclerosis including muscle spasms need urinate and. marijuana extract sativex pharmaceuticals under the. hiv aids related weight loss smoking marijuana seems. reduces self reported muscle stiffness and muscle spasms. extract cannador society for clinical research mouth. stimulate the appetite people with aids marijuana cigarettes. tongue seems improve some self reported symptoms. can also cause weight gain people with hiv who are also taking. results regarding the effects marijuana extract when taken. mouth one small study shows that taking specific marijuana. people with however other studies show that taking. also some conflicting evidence suggests that this product does. nerve pain the this product approved prescription. medicine treat muscle spasms people with canada. this product not available prescription medicine the. multiple sclerosis applying specific spray containing. not significantly improve muscle spasms nor does reduce the. need urinate tremors patients there are conflicting. indinavir crixivan nelfinavir viracept. marijuana extract mouth does not significantly improve. spasms pain the arms and legs and tremors people with. check your symptomsmemory loss supplements,"Marijuana: Health Benefits, Side Effects, Uses, Dose & Precautions",health benefits and problems of smoking cannabis for medical use - google search,106
