source,target,index,title,query
thisislandingpage__her husband blows into garden used throughout the poetic book imply. 国单昆海 the sulamite invites the husband use his mouth stimulate his wife douglas rosenau expert. english sex therapy theology protestant christianity over years. sulamite invites her husband use his mouth stimulate his wife. sulamite invites her husband use his mouth stimulate his wife douglas rosenau. female genital cannot conclude with certainty but possible think that she. douglas rosenau christian sex specialist therapist theologian. english sex therapy theology. english female genitalia cannot conclude with certainty but possible think that she. sulamite uses very sexy words extremely intimate contexts she wants. protestant for more than years,will ding tiag the miek. will ding tiag body like. will love you wife and ngl. office theme click add text. strong useful multi exam. say goodbye now love each other. very knowledgeable about the exam. will have sex and agri lhen. husband and wife wife and eghi,1214,Đời Sống Tình Yêu của couples 3 - Microsoft PowerPoint (Product Activation Failed),who is dr. dougla rosenau? - google search - google chrome
google  search who dougla rosenau sxsrf aoaemvirk ytaieeba cbkmwyig source inms tbm isch ved. please review consider others hou nunnk. douglas rosenau dts voice. will enjoy sex and pliments. nothing for selfish ambition glory but. doug rosenau cmhc summit. the needs the husband wife rather than the. for yourself please focus your interests. vin brothers and sisters let together together. for you but please pray for igi temple,love lives couples microsoft powerpoint product activation.  couples love life microsoft powerpoint product activation. office theme love life couples microsoft powerpoint product activation dialing toos. office theme love life couples microsoft powerpoint product activation,1228,Đời Sống Tình Yêu của couples 3 - Microsoft PowerPoint (Product Activation Failed),who is dr. dougla rosenau? - google search - google chrome
sexlitéu i want seven. sexla de tel wants seven. it makes me so happy. princess's llit text direction. resolution use current resolution. i love you so much i want to. silly kids. gdto settings activate widows. sex thing i have to do. sexli den i do scrub bio. dumped bin hen. yès evening for dhung re. shame to the extent that i don't. sex to the right lane. i love you i really want to align text. i'm so ashamed that i don't. yès dark for vocchi. sexla des i rule the storm. crng is very tired. still love you do. ana when chle luo. study program. still love you lim. yès exam for re vodhong. his shoulder ahe right seven. sex dies i have to do. aah yes i really want to. love me for my husband. sexlités i want seven th. sexla dies i have to do,love lives couples microsoft powerpoint product activation. still animal love describe holding. yes for vordhong reborn. what the number and. omem chut will you have sex e work participant. worry about the little ones sleeping minh. what attitude you have. couples love life microsoft powerpoint product activation. sexliéu want reveal sah. love you and really want. ahh bad that don't. ana when that person sad. sexla want seven nests. yès exam for vochéng download. love you love you and miss you a lot. yes yes and really want. ana when you sleepy. you why are you bugged. shoulder back and right now. yes exam for vochéng download. still angry love him indescribably. have you tried saying this. yes dark for vocchio. love you love you and really want. sexli ies e work for her father office. omem chut let you stop. the shoulder back and you were right away. shoulder and sas right seven. sexlidéu want show nest. worried about the small machine sorry. chicken dsa qui vila three patch machine. past number how much. kki chle that person. there still enough love to describe. sexladéu tei want seven births. worried that the puter too small print. sexliäéa ing work for divisional insurance. shoulder back and you sas right now. sex dies have lim,1232,Đời Sống Tình Yêu của couples 3 - Microsoft PowerPoint (Product Activation Failed),god loves couples - google search - google chrome
thisislandingpage__love lives couples microsoft powerpoint product activation. still animal love describe holding. yes for vordhong reborn. what the number and. omem chut will you have sex e work participant. worry about the little ones sleeping minh. what attitude you have. couples love life microsoft powerpoint product activation. sexliéu want reveal sah. love you and really want. ahh bad that don't. ana when that person sad. sexla want seven nests. yès exam for vochéng download. love you love you and miss you a lot. yes yes and really want. ana when you sleepy. you why are you bugged. shoulder back and right now. yes exam for vochéng download. still angry love him indescribably. have you tried saying this. yes dark for vocchio. love you love you and really want. sexli ies e work for her father office. omem chut let you stop. the shoulder back and you were right away. shoulder and sas right seven. sexlidéu want show nest. worried about the small machine sorry. chicken dsa qui vila three patch machine. past number how much. kki chle that person. there still enough love to describe. sexladéu tei want seven births. worried that the puter too small print. sexliäéa ing work for divisional insurance. shoulder back and you sas right now. sex dies have lim,sex diés tối phải lin. danh cho vachống tái. yès thi dành cho vordhống tái. sexlitéu toi msốn bảy tnh,1233,Đời Sống Tình Yêu của couples 3 - Microsoft PowerPoint (Product Activation Failed),your body is mine and mine is yours - google search - google chrome
what attitude you have. serve the other bed. sex ies have lin. sexla want seven nests. yès exam for vochéng download. ana when that person sad. sexla its viz storm,and the back couch are usually used. google  search making love other place tbm isch ved ahukewil lxa phzahvmz sbhzzjdqmq ccegqiabaa making love other place. most beautiful women your. images may subject copyright learn more. make love beyond the bedroom can really spice marriage long term relationship. damajority  top ten places make love around the house besides the bedroom. best potential husband material. this website uses cookies improve your experience assume you with this but you can opt out you wish accept read more activate wink. making love the dream what does mean. dangerous tools out the way about pleasure not pain. these are just few examples ways you can spice your sex life important. making love the rain the song download. top ten places make love around the house besides. this website uses cookies improve your experience assume you with this but you can opt out you wish. don have worry about squeaky mattresses bed frames and there usually. the bedroom may the primary place that people share their love but doesn have the only place exploring interesting spots. top ten places make love around the house besides the. fortable bed the couch can also add the excitement various. blanket the floor can offset that problem and the benefits outweigh the little. more space the downside having sore knees because the hard floor usually. top caribbean islands with the. making love the afternoon lyrics. making love the rain quotes. making love the morning quotes. pleq making love the bath. relationship with your partner mutual understanding and munication about your. top ten places make love aro. waiting  damajority  this articie lifestyie top tenz. related imagesq making love the. island the list top tenz. super nintenoo enteryrinment svstem. making love the rain the song. top ten places make love. making love the twelfth century. love other place god. garage love session the hood the car work table can exciting. around the house besides the. accept read morengs activate winfacebook. positions and activities just little hint those who want creative the arms. you may also like. stay away from making love the kitchen. waiting  damajority . making meaning making love. super nintendo entertrinment system. the garage carport there are many possibilities for excitement the. the caribbean islands with the. making love the rain the song sample. classic edition with games. photograph people making love. making love the rain poems. note however that the most important part good love life great. sex life goes long way have fun. making love the rain the song wiki. the place typically known the man cave just note caution move all. the couch you are tired sore knees try the living room couch. google making love other place. this article lifestyle top tenz,1237,Top Ten Places to Make Love around the House (Besides the Bedroom) - DaMajority - Google Chrome,making love in other place - google search - google chrome
thisislandingpage__and the back couch are usually used. google  search making love other place tbm isch ved ahukewil lxa phzahvmz sbhzzjdqmq ccegqiabaa making love other place. most beautiful women your. images may subject copyright learn more. make love beyond the bedroom can really spice marriage long term relationship. damajority  top ten places make love around the house besides the bedroom. best potential husband material. this website uses cookies improve your experience assume you with this but you can opt out you wish accept read more activate wink. making love the dream what does mean. dangerous tools out the way about pleasure not pain. these are just few examples ways you can spice your sex life important. making love the rain the song download. top ten places make love around the house besides. this website uses cookies improve your experience assume you with this but you can opt out you wish. don have worry about squeaky mattresses bed frames and there usually. the bedroom may the primary place that people share their love but doesn have the only place exploring interesting spots. top ten places make love around the house besides the. fortable bed the couch can also add the excitement various. blanket the floor can offset that problem and the benefits outweigh the little. more space the downside having sore knees because the hard floor usually. top caribbean islands with the. making love the afternoon lyrics. making love the rain quotes. making love the morning quotes. pleq making love the bath. relationship with your partner mutual understanding and munication about your. top ten places make love aro. waiting  damajority  this articie lifestyie top tenz. related imagesq making love the. island the list top tenz. super nintenoo enteryrinment svstem. making love the rain the song. top ten places make love. making love the twelfth century. love other place god. garage love session the hood the car work table can exciting. around the house besides the. accept read morengs activate winfacebook. positions and activities just little hint those who want creative the arms. you may also like. stay away from making love the kitchen. waiting  damajority . making meaning making love. super nintendo entertrinment system. the garage carport there are many possibilities for excitement the. the caribbean islands with the. making love the rain the song sample. classic edition with games. photograph people making love. making love the rain poems. note however that the most important part good love life great. sex life goes long way have fun. making love the rain the song wiki. the place typically known the man cave just note caution move all. the couch you are tired sore knees try the living room couch. google making love other place. this article lifestyle top tenz,nguyen thi diamond picture. congratulations the anniversary the calculation. freevoyeurxxx net making love bathroo. this the love the heavenly temple. couple making love the floor bath. kiss bath making love gif wifflegif.   oneway radio. spiritual post prayer broken item. belong the oil lover. google  search making love the bathroom tbm isch ved ahukewie cne fhzahwpjaykhsfcb ccegqiabaa making love the bathroom. yurizan beltran and johny sins making lov. mom couple making love the bath. thia vldar uploadad wwvvideos . enter message the coated bar reliance. period the love life each couple. read cgkh hat bhkh. finds making love inside bathro. pray the beginning the hour. mrs qpms not msqp. couple making love stock footage. period the love life each fire door. period the love life each fire. hdct sister hoang ngoc dung. bathroom love making ended with huge facial. mom couple making love the bathr. dana making love with her muscular boy. couple has unfettable lovemaking. making love the bathroom. read cgkh sing bhkh. period love life each age. mom couple making love the bathroom floor. three hong binh congrats. phoenix not allowed inject. all you can send your sheet tonight,1238,Zalo,making love in the bathroom - google search - google chrome
thisislandingpage__nguyen thi diamond picture. congratulations the anniversary the calculation. freevoyeurxxx net making love bathroo. this the love the heavenly temple. couple making love the floor bath. kiss bath making love gif wifflegif.   oneway radio. spiritual post prayer broken item. belong the oil lover. google  search making love the bathroom tbm isch ved ahukewie cne fhzahwpjaykhsfcb ccegqiabaa making love the bathroom. yurizan beltran and johny sins making lov. mom couple making love the bath. thia vldar uploadad wwvvideos . enter message the coated bar reliance. period the love life each couple. read cgkh hat bhkh. finds making love inside bathro. pray the beginning the hour. mrs qpms not msqp. couple making love stock footage. period the love life each fire door. period the love life each fire. hdct sister hoang ngoc dung. bathroom love making ended with huge facial. mom couple making love the bathr. dana making love with her muscular boy. couple has unfettable lovemaking. making love the bathroom. read cgkh sing bhkh. period love life each age. mom couple making love the bathroom floor. three hong binh congrats. phoenix not allowed inject. all you can send your sheet tonight,"never denied but right. you are so gentle. your brother's brother. ana when lazy. sexla dies i have to shut up. this wonderful love each other. subdue the other person or moan in bed. sexli ies come to do cha bao. to the needs of the anti-over of. god gave me the way. sexliäes i am a journalist. with his wife still warm. sexli des to do cha bao. contacting the server for information press esc cancel couples love life microsoft powerpoint product activation. small day to zero. i'm too weak now. let the little ones sleep. yes exam for vocheng download. omem dit brother sub. play bing hen. your brother's property. still love you. his shoulder is now present. when he returned to his strength, he went to the work station. i offer my body as. each of you carries fim benefits. and the strength to love him to the docks. now it's pink, darling. when fever should love not. vin brothers and sisters, let's get together. now it's so pink i love it. i'm so tired dear. sexliéu i want to show sah. never denied him. i have to have sex. desire sch kode kur vink nhrng. i support my husband's thinking. ноп от от decide. sexliteu i want seven years. have you tried saying this yet? another person's ich. it's very enjoyable to slide. to her husband's needs than his. yes, you are very welcome. please check others out. please join us together. for yourself, but focus on your own interests. i enjoy sex praise. have fun with you later now. marriage a decision. have you tried saying this? for some mornings. i'm glad to do it all the way. i love love i really want. humbly consider others better than yourself. yès concatenation for vochang re. i'll do it for you, but please pray for the igi temple. i don't ich while. serve the other person or in bed. sexla dies i must lane. sex what i want to confess. you hun him like that. sexliäes i'm shady. sexlideu did want seven. be happy all the way around doing things. it makes me so happy. please be careful with each other. each of you spends in return. your brother's one. yes dark for vocchi. unanimity love. with her husband is still hot. sex thing stuff to do. ambition ich or honor but. someone else's sck nita. what's your brother's one? i'm so tired all the time. your brother's brother's brood. sexla if i want seven inches. stir jubilantly. sex dies to do. or cut elsewhere. when fever if love no. love me for my husband. a lover of fellow human beings. little if you husband. sex thing i do godabão",1239,Đời Sống Tình Yêu của couples 3 - Microsoft PowerPoint (Product Activation Failed),making love in the nature - google search - google chrome
everyone has times when are tired have times when want alone. nam thinks that man bravery encapsulated his strength. hurt when es sex often think that women are very sensitive. want sleep together but when get married. want sleep together but when got married made vow respect. when es sex but men are more sensitive. everyone has times when are tired have times when want stay. have never rejected you and never will but. but you should careful how you say because men are easy survive. his favoritism therefore women need understand the pain their husbands when. want sleep together but when got married promised stay true windows. honey tired let hug you hun. there question that helps adjust our attitude. glorify god and the ultimate lover anti roi. have never rejected you and never will. lover role your husband will feel emotionally rejected when you say. think about and then yourself have never refused you and will never refuse but. expressed his desire close his wife. does that mean not allowed say tonight. that determination makes have the right attitude when don. glorify god and make her husband ultimate lover the decision itself. that decision makes have the right attitude when don want anyone touch. right now pink darling. god for humiliating marriage. honor the lord and make lime. honey tired let hug you hug you that enough,love lives couples microsoft powerpoint product activation. love life couples microsoft powerpoint product activation. never refused but now. manh will take care wife and. couples love life microsoft powerpoint product activation. ding thta thta curtain ahu. will notify you while threatening. will love you soon wife and suspect. will have sex and agri lhea. very knowledgeable the exam. will enjoy body like. you hun you nimble. raye with this that ytu loves nkanem hug him hun him lightly. minh darling wife and eghi. man will dig into the body fragile. will practice stubborn sex and sgri lhen. the needs fast wife cts never refused the. hug you hug you gently. the needs fast wife butter cts. now let try connect with him dear. will not miss the sex tag and sgri lhea. that enough make happy. won school the exam. vti vel quickly and ndng heat. will eat body like. will love you quickly wife and sghl. abau have never rejected you and will. manh will dig his body like. with his wife quickly and with hot children. please share with this that yts love. fight with this love each other. will practice stubborn sex and aggi lhen. hate sex and agri pliments. the needs fast wife bra fish. say goodbye now love each other. chta give the way. don know how stay life. going hate sex and aggi pliments. have never rejected you and will. never refuse but right. ray with this love aban. chta give miah the way. chta can you tell how. the property the center the city. with wife quick minh ins sdng shiet,1241,Đời Sống Tình Yêu của couples 3 - Microsoft PowerPoint (Product Activation Failed),let god work - google search - google chrome
have never rejected you and will. will encourage her husband. never refuse but right. chta has shown the way. please share with this love akania text direction. wife and let god,love life couples microsoft powerpoint product activation. aun you are light. never refused but now. with barbarian anti mnh con adag shie. now reject him and will. will have sex and agri lhea. will focus sex and sgri lhea. you hun you nimble. now please connect with dear. hug you hug you gently. manh will give ttag thia manh shu. the needs fast wife butter cts. hug him hun him gently. will love quickly wife and suspect. man will ding into the body strong. with his wife quickly and with hot children. break with today love each other. man pet quickly wife and suspect. say goodbye now love each other. orphan will love you. chta give the way. won able see you during the holidays. man will ding with his body hugging him hunching him lightly. have never rejected you and will. going schlep while doing. the needs fast wife cts,1244,Đời Sống Tình Yêu của couples 3 - Microsoft PowerPoint (Product Activation Failed),god blesses us to be a blessing to others - google search - google chrome
god gave the body. to the needs of the quick butter cts. i love anti-eghi. butng sex sgri lhen. lie the lord. action kit business. lae agari sia there. dni private kink split. aggi lhen sex aggi lhen. tdng role owner. merciless people. i practice sex sgri lhee. godly act. ray and now yes love each other. body for friend cut. the heat drops quickly. to the needs of the cts. with val quickly proved to be adag ah. yourself for friend. butug sex agri lben. illustrated sex step sgri lhen. as fragile as a body. lol,love life couples microsoft powerpoint product activation. will ding tiag thin body curtain. will have sex and sgri lben. let say goodbye each other that can love each other. haah dynamic dose tis. man will take care wife and. the need his wife wife cts. options animation animation painter. god means having attitude. lam sguti tia lah. chta has given the way. office theme love life couples microsoft powerpoint product activation. vti val quickly proved ndng heat. cada the body thsi,1249,Đời Sống Tình Yêu của couples 3 - Microsoft PowerPoint (Product Activation Failed),panda love gif - google search - google chrome
means that you have thsi. manh lhng sch lhi. will have sex and aggi hen. aah will practice sex and aggi pliments. chta has given the way. chts please give the way. chta gave the way. tag tag tht body ahu. minh pet quickly wife and take break. good with today love each other. manh will the gym shu. quickly wife and suspect. the needs fast wife baa. budag sex and sggi pliment. things are not allowed. with his wife quickly became hot child. man will fragile possible. lam agugutri tia lah. break with this love each other. can help but feel sorry for myself. haah dynamic dose ray. the gym and have sex. having low birth weight baby. man thong sch while. wife quickly mend children ndng heat. will love you your wife and suspect. will practice stubborn sex and aggi lhen. able dine thsa soon possible. say goodbye now love each other. sorry thda can niah. chta give the way. chen will lsuh move. naughty and irritable wife cts. what are you doing. liég rin luh chan. cds against bra ces. dea nhu irritated the bra wife. the needs quick bala wife. love you quickly wicked wife. baug thda can nah,will use thsa can strong. will have sex and aggi hen. chta gave the way. chts please give the way. good with today love each other. lam agugutri tia lah. fast darling wife and break. the needs fast wife cta. cada has lot money. dea needs chdng bra wife. will practice stubborn sex and aggi lhen. say goodbye now love each other. lbtng sch back multi. with his wife quickly ias children sdng heat. fragile will ding tiag thin body shu. vti wife against manh children sdng shie. office theme love life couples microsoft powerpoint product activation,1258,Đời Sống Tình Yêu của couples 3 - Microsoft PowerPoint (Product Activation Failed),nopermission - google search - google chrome
click add text image archive microsoft powe. office theme love life couples microsoft powerpoint product activation drawing tools,possible have delivery address. troag eph cheà wordà ziora. revelation these are not defiled with. what the ambition the university. mig aahem lai dili lridhdiria. what does the bible. have problem with skin,1271,Đời Sống Tình Yêu của couples 3 - Microsoft PowerPoint (Product Activation Failed),is it ok with oral sex? - google search - google chrome
thisislandingpage__possible have delivery address. troag eph cheà wordà ziora. revelation these are not defiled with. what the ambition the university. mig aahem lai dili lridhdiria. what does the bible. have problem with skin,sulamite invites her husband use his mouth stimulate his wife. this model does not allow changing the bow the wrong one the main point dissolution freedom. this kite does not change full wrong the main point dissolution freedom. female genitalia cannot conclude with certainty but possible think that she. her husband rotten into garden used throughout the poetic book imply. whoever succeeds unclean then unclean that person this also includes variety. protestants for more than years say that the bible silent the matter oral munication. douglas rosenau christian sex specialist therapist theologian. this doesn show right wrong the main point the new testament freedom. and mrs wheat say that verbal munication problem between husband and wife you have settings activate indows. and mrs wheat say that verbal munication problem between husband and wife all. whoever considers unclean unclean the millet this also includes variety. confident jesus that nothing unclean itself unless there. christianity float says nothing unclean itself romans know and. sulamite uses very sexy words extremely intimate contexts she wants,1272,Document2 - Microsoft Word (Product Activation Failed),dr douglas rosenau - google search - google chrome
