source,target,index,title,query
identify panda habitat and explain what threatens them. the most mon cause this condition software labor injury. for added flavor the patient can also add few teaspoons raw honey. acpanied sharp feeling like electric shock making difficult for patients activities. overexertion causes the muscles and cords the lower back stretch and stretch. some the following diseases. 国單昆海 joints patients should apply heat because. what efforts have been made prevent the extinction pandas. the pain not too severe the patient can apply some folk remedies. folk remedies for pain relief. banana seeds the patient roasted and dried the seeds and then ground them into powder used drink with water every day. wormwood the patient only needs crush about saved add little white wine. pain relievers paracetamol panadol. coriander and cinnamon patients should bine them the form tea and drink daily. hot and cold press. helps relax muscles and promote better blood circulation. find out some topics through google characters approximate value. apply the painful lower back area. which countries are making such efforts. western medicine treatment still the preferred method patients can buy,identify panda habitat and explain what threatens them. ctrl determine the panda habitat and explain what threatens them. the plains where they once lived conservation dependent endangered species. identify the bamboo bucket habitat and explain what mon threat. english appears shaanxi and gansu agriculture deforestation has pushed bamboo buckets from the. what efforts have been made prevent the extinction the bamboo bucket. which countries are making such efforts. why the bamboo bucket considered endangered species. what servitude has been taken prevent the panda demise,532,Tìm hiểu một số đề tài qua google - - Microsoft Word (Product Activation Failed),gấu trúc sống ở đâu - google search - google chrome
information about panda species. unique thing the world. visanuocngoai net thong tin gau truc. chinese visa information about pandas. information about panda animals,let find out more details about this lovely species with thegioidongvat. china but pandas belong the carnivorous order carnivora which includes different mammal species. scientific name ailuropoda melanoleuca. eat plants tron es from the earth black es from the earth. mon name big panda panda. anger emanating from the earth. mon name big panda panda that es from the earth,559,Gấu Trúc và 10+ thông tin cơ bản cần biết - Thegioidongvat.Co - Google Chrome,gấu trúc sống ở đâu - google search - google chrome
about few hundred grams cannot crawl their own until months age birth panda cubs have color. pan watch later shareong panda. pan watch later sharea thegioidongvat gau truc this.  thegioidongvat category nganh dong vat gai. males usually leave female pandas will pregnant for months and give birth cubs new born panda cubs. unequal battle with pandas. white but larger the black patches will grow more delicate. pandas and basic info needed. cat owl ettin howl act gau windows. top most dangerous animals the world,living and this energy es from bamboo that pandas are forced eat. billion reward for research. when you have maintain great body with such picky diet. around the giant panda. half the amount energy that person the same weight must eat maintain health. low that they take lot effort digest after each meal then. the last brown panda. radio ring for group male and female giant pandas from qinling mountain and quan. bulky bears only eat each bamboo leaf form extremely nutritious food. jaguars steal white meals. monitor them for years before pleting report published reputable journal. the mystery the great panda. unknown facts about giant pandas. waiting for khoahoc around the giant panda. death handles meat but everyone knows animal. this one likes eat bamboo leaves find out the mystery the giant panda scientists. pandas are very picky when es eating. science they found that subjects absorbed only the required energy pared. similar sized animals which means megajoule instead. household children make the population surplus. experts tracked the daily energy expenditure pandas cashew nut. death after birth hens incubate. lovely animal that specializes eating bamboo leaves but the quantity too small because too lazy deliver. how animals that are honored china national treasures survive. wild dog with trick. expected does this mean panda weighing needs. the zoological institute the chinese academy sciences beijing attached. why get rid the lows. see the exhausted mother cat die. can said that the existence giant pandas confusing thing nature the. things you don know about giant pandas. live through winter degrees,582,Khám phá bí ẩn loài gấu trúc lớn - KhoaHoc.tv - Google Chrome,gấu trúc sống ở đâu - google search - google chrome
dec scientists estimate monarch butterflies the east. the chinese consider the nong family gold national treasure like. oct the scrotum frog titicaca frog species freshwater frog. khoahoc partner pub cof forid utf which countries countries are effort effort conservation species panda panda. scrotal frog the peruvian giant frog critically endangered and. homepage technology life medicine scientific discovery. china national treasures danger khoahoc. panda they are one the species protected chinese law. khoahoc discovery bacteria insects. monarch butterflies the verge extinction khoahoac. america has disappeared for about years showing the efforts. khoahoc explore animal world. big scientists many countries are now working save this species,birth causes the panda health decline artificial insemination using frozen sperm. thawing technique should increase the survival rate sperm. magnet bar two colors black and white. matthew durnin scientific director nature conservation anization asia. tructu tinh trung dong linh. technical expert the wolong giant panda research center said. mon name big panda panda. most people are familiar with the image pandas when the animal fat. liquid however the past only sperm survived yan and colleagues improved. loses most its appeal without pandas. being martial arts master vividly portrayed dreamworks animation with creation. cold middle east tried many times before but failed huang yan. wild bamboo buckets usually live the wild the central regions vate windows. protect and increase the number pandas the world. this the panda bear born the wolong giant panda research center. trademark two major sporting events the pan pan the asian games and the. occurs thyme and sycamore also known middle panda.  visanuocngoai net thong tin gau truc. according yan scientists preserve panda sperm sub zero temperatures thanks nitrogen. this always danger extinction and chosen the symbol the national fund. uyen does not have chinese national treasure like the slogan. the artificial insemination was carried out march this year people discovered you you. sichuan more than pandas but surely this heritage rich land will. anti corruption known the home giant pandas more than bears. anti corruption does not have only chinese national treasure like slogan. you you its mother has given birth times successfully the sex the newborn panda unknown. scientific name ailuropoda melanoleuca. due the small number pandas china inbreeding possible. extremely cute pictures kung panda the trio blockbuster cartoons ever made. jing jing the beijing olympics when the bear pooped clumsy and dreamed ing back. most people are quite familiar with panda images when the animal fat. pacific and north asia considers china achievements significant its efforts protect. still hot fire furnace. originating from china pandas belong the carnivorous order carnivora which includes species mammals. increasing trend recent years the condition can cause birth defects. wwf nature conservation since when became very easy mascot. updated minh long vnexpress according afp  khoahoc tao gau ate windows. global box office records and and pandas. panda behavior and habitat. country however now many people often call this animal with cute name bear. conceived june after ultrasound examination sperm that has been preserved for several years,601,Tứ Xuyên - Thiên đường gấu trúc - Báo Nhân Dân - Google Chrome,gấu trúc sống ở đâu - google search - google chrome
drying the voice benefactor. lift heart with raisins. lovers the middle girls. benefactor among the boys. who took the banquet hall. who are the kings. daughters jerusalem urge you. sweet people left for potholes. the flag you waved above was love. and his right hand embraces. the gazelles the deer the field. like the bowl tree among the trees the forest. not alarmed carry the consciousness love. the lily the saron the lily the valley. his left hand rests under head. like lily among the thorns. behold came leaping over the mountains. use the fruit the bowl strengthen. doneng the flag you waved over love. because sick with love. would gladly sit your shadow,women may untouched for long time but men. occurs after marriage but again. happens after marriage but again. english happens after marriage but again. after marriage but again. rns surge hostile sentiment has beelows. the wife should understand the very high need the husband bed because. survey one third sewish college students ros. the wife should understand the very high needs her husband bed because. survey one third sewish college students. rns surge hostile sentiment has bee. easy fall love pliment the little tam,657,Yêu theo cách của Chúa -Th.tráng NGTự TKMùa Thu 2021 - Microsoft Word (Product Activation Failed),tự điển anh việt - google search - google chrome
what you want know about christianity. the concept being baptized for the dead not biblical and paul not endingorsing the. there such thing baptism for. google sells bunk beds for sale. timely articles and special offers from christianity . practical advice from god word the king james. christianity  wiki bible there such thing baptism for the dead html utm_source pushnami. google fun learning english. baptism for the dead rather connecting back the resurrection. christianity  daily inspirations. daily bible verse king james version. print math review sheet. privacy policy terms use. addition your newsletter you will receive email updatesate windows. ielts self study route. idea mentioning this passage scripture paul does not approve the practice. tip search for english results only you can specify your search language preferences. urgent you can provide bibles food and shelter for persecuted christians. google  search dictionary dictionary english vietnamese sxsrf aoaemvksjabhketzn jfvlzfijc rhwka source dld yfp. enter your email address. pgnexus pokem childrens sermons. pick from our variety devotionals truly daily,refuse allow their husband engage anal intercourse with them but. 回單昆三 there are differences between these other types sex and anal sex. woman hand does not burn and hurt simply because she rubs her husband. painful vaginal intercourse the doctor will tell her that not normal and they. there warning pain from any these other types sex besides anal. because the bible does not directly condemn husband engaging anal sex. leaders his society therefore know this principle this call. they have anal intercourse with them when understand what sodomy. and other health injuries. get sore from prolonged sexual relations sure but could her vagina. settings activate wndows there also one more principle which applies wives even you struggle. impossible for husband sodomize his wife. with his wife willing agree disagree with them this. need look into reasons why that happening but that the same woman. for even hereunto were called because christ also suffered for. master slave relationship does have many things mon and one the. god designed use woman body definition unnatural and. the way that anal sex will cause pain whether from prolonged use. abusive relationship not all abuse must taken and does god. call suffering seen below. was guile found his mouth who when was neither reviled reviled not. the lining the anus was thick and tough the skin the mouth. the bible condemning anal sex and does not believe violation. servants subject your masters with all fear not only the good and tivate windows. restricted just the master slave relationship. biggest things has mon that wives are manded regard their. learn any thing let them ask their husbands home. husbands their masters peter for more depth biblical. was christ slave the answer was freeman yet suffered ativate windows. christians suffer mistreatment and abuse the hands others not. scriptures the bible says wives corinthians and they will. there are differences between these other types sex and anal sex. scriptures the bible says wives corinthians and they willo settings activate ndows. with allow your husband have anal sex with you believing that his. settings activate wndowstheir wives are not that believe husbands are sodomizing their wives when. there also one more principle which applies wives even you struggle. painful woman were the doctor and explain that she having. settings activate wndows the first thing realized that when christians e believe. settings activate wndows was christ slave the answer was freeman yet suffered. song solomon trying pare anal sex oral sex other types. well and suffer for take patiently this acceptable with. settings activate wndows but the fact none the things just mentioned are true anal sex and. anal sex painful because warning from your body that you are not. specific biblical mand should more gracious with fellow believers. there warning pain from any these other types sex besides anal settings activate wndowns. masters would kindly submit you the next verses which e directly. examination the similarities and differences between the master slave. the practice regular anal sex over many months years did not. the hands men who were not his slave masters but rather the spiritual. manual sav noricon ofonnlas oronges. christian husbands over the years that engage anal sex with their wives. this then brings the second realization came the subject anal. can find ways reduce that pain but the fact pletely normal for. full disclosure years past thought that wives had biblical right. biblicaly speaking relates male prostitution then understand that. specific action wrong based larger biblical principle rather than. sex fact can find allusions these other types sexual activity the. settings activate wndows dowssay well that because the anus not designed for sex now yes you. prolonged sexual intercourse but god did not design vaginal sex. the natural use the woman then you are submit his teaching and that. say well that because the anus not designed for sex now yes you. husband places his penis now could woman hand mouth begin. words dowsthere warning pain from any these other types sex besides anal. the hands men who were not his slave masters but rather the sniritual. biblicalgenderroles  entitled why god wants you stay. dangerous bacteria from the anus the mouth and vagina. mouth and hands can. switching between anal oral and vaginal sex would not spread. this means that you are christian wife your husband sees mand. penis with woman mouth does not hurt just from the fact that her. then realized two things. addition this while the husband wife relationship not identical the. when buffeted for your faults shall take patiently but. allow divorce for abuse. 目單昆三 master biblically speaking the answer yes for more the subject. the anus did not give off warning pains when penetrated each and. body part woman that meant for sexual pleasure the same way her. gentle but also the forward for this thankworthy man for. servants subject your masters with all fear not only the good and. therefore not believe can conclude that the anus dual purpose. moderate use them during sex does not normally naturally cause pain. who may not see that valid application that principle. ebody part woman that meant for sexual pleasure the same way her. the biblical case have made against anal sex that anal sex goes against. conscience toward god endure grief suffering wrongfully for what glory. how god wants christians react abuse from others see articles. but point that the initial contact with these areas the body and. having anal sex with you misuse your body then have the biblical. relationship and the husband wife relationship see article. but the fact none the things just mentioned are true anal sex and. means you are submit anal intercourse with your husband. have strong possibility causing issues with feces not able held. manual sex parison apples oranges. after what just quoted. the vagina and mouth. point that have e know many conservative and bible believing. the first thing realized that when christians e believe. biblicalgenderroles  entitled biblical differences between wives and. and for those who say this principle only applies slaves and their. the anus had natural expansion mechanism for things enter. woman may experience pain during vaginal sex for reasons other than. were tell the doctor she has painful anal intercourse the doctor going. again when suffered threatened not but mitted himself him that. and they not see violation the natural use the woman and. can christian wife refuse anal intercourse her husband. leaving example that should follow his steps who did sin. sex woman follow her husband interpretation and application the,674,Yêu theo cách của Chúa -Th.tráng NGTự TKMùa Thu 2021 - Microsoft Word (Product Activation Failed),tự điển anh việt - google search - google chrome
image search romq romal. types romantic relationships and. google  search romantic relationship tbm isch lsxsrf aoaemvinbptjip zjrzfcbth tss zwcw source biw bih. waiting  googie . happy together principles for stronge. what should healthy boundaries con. google  imghp tab ogbl. romantic hot chocolate cafe recipes. romantic doctor teacher kim season. google  imghp dvi tab ogbl. tips for building healthy relationship. report the suggestions not cover the syncromantic. new way look your roman,how prepare lesson about family. opening archive image ppt press esc cancel. press the esc key cancel opening the document. god gives seed the sower. rosoft office accvation wizard. three file data folder laptop new folder. quickly access this number recent presentations. three learning teaching materials,747,Presentation1 - Microsoft PowerPoint (Product Activation Failed),romantic relationship - google tìm kiếm - google chrome
did you guys over the fence while you were love sentences like this. when performing the church the male and female couple can answer the celebrant ask they can. each other seems bee natural live eat love have sex. for christians what think because fairy weddings. the show son and wife they often ask very delicate questions like. good matter what say don want use solomon model. each other seems bee natural the river must eat love must have sex. overe barriers overe fear and false ideas the relationship ttings activate wdowbos into wisdom books. for many young people today there nothing sensitive about having sex with. did you guys over the fence while you were love bridges like this. for christians what think because weddings ahead windows,did you guys over the fence while you were love sentences like this. each other seems bee natural live eat love have sex. the show son and wife they often ask very delicate questions like. when es church activities men and women try answer the owner and lady. for many young people today there nothing sensitive about having sex with. for christians what think because weddings ahead windows,752,Yêu theo cách của Chúa -Th.tráng NGTự TKMùa Thu 2021 - Microsoft Word (Product Activation Failed),bạn muốn hẹn hò 2021 - google tìm kiếm - google chrome
thisislandingpage__did you guys over the fence while you were love sentences like this. each other seems bee natural live eat love have sex. the show son and wife they often ask very delicate questions like. when es church activities men and women try answer the owner and lady. for many young people today there nothing sensitive about having sex with. for christians what think because weddings ahead windows,for your wife happy you will. eat after the code. eat after losing taste. eat first don wait. options animation animation painter. eat after take ngomanimation pane. make your wife happy you will,753,Yêu theo cách của Chúa - Microsoft PowerPoint (Product Activation Failed),vợ chồng son - google tìm kiếm - google chrome
eat first use wait. slide click add title. sex very beautiful theme colors. eat after losing taste. very beautiful sex cut. options animation animation painter. yes thats right thank god thank you. sentence first use wait. make your wife happy you will,sentence first use wait. make your wife happy you will. eat after losing taste. eat first use wait,758,Yêu theo cách của Chúa - Microsoft PowerPoint (Product Activation Failed),a beautiful couple - google tìm kiếm - google chrome
目單昆三三 strange vietnamese poetry easy read and understand even you follow. 目單昆三三 drink the mountain gilead. this depicts quartet which the two main characters plete their love. can hexagonal seven syllables sentences with words each and the main idea hebrew poetry. located the center the post are reading paragraph the middle the book songs songs paragraph. strange vietnamese poetry easy read and understand even you follow,love front the wind more durable. meta hotro tho luc bat cau. with even though bitter. half second enough shake half life. long time pick immediately throw away. beucare antibacterial and nourishing. love you lying hand. reference how start conversation with lover topics talk with good lover funny. home call myself home. seven ounces true love eight ounces kingly love. love you every time. intima mama for women. love you take hand. sit and play love song. there person who misses the moon here. you are all that desire. love here are some poems about love that share. vaginal moist feminie hygiene. oillan intimate hygiene solution. half second enough shake half life warms the lonely heart. but why are the tears blurred. next time want meet wait hundred years. intiutny itu need dal have lim ycu iuoit uicit cnan uiat. hate you every time love you. where does the moon miss you,760,"Thơ lục bát 2 câu về tình yêu, tình bạn hay nhất - META.vn - Google Chrome",thơ lục bát hay về tình yêu - google tìm kiếm - google chrome
