source,target,index,title,query
marriage rules for jewish couples. manners and customs bible times,according the torah sexual relations between husband and wife are prohibited during the wife menstrual period and for seven days after during. from the groom the groom utters words acquisition and consecration these two actions are witnessed and voila the happy couple married all. outlook marriage one the most enduring wedding customs the wearing the veil has its origins the bible upon seeing her husband. jacob mistake more poetic interpretation badekin that covering the bride face the groom shows that values her for more than mere. entire munity and were lent couples for their bridal celebrations ateret balalah woman valor her husband crown. jacob and his two wives leah and rachel will remember how jacob father law laban tricked jacob into marrying leah instead his beloved. ancient times coins were typically given they are still used many sephardic and oriental jews since the century rings replaced coins. the purdah the requisite face covering worn married middle eastern women emblem modesty some and oppression others. most europe the gift choice some mentators suggest that the preference for rings attributable their circular form which previous. according jewish law getting married exceedingly simple affair the bride accepts something worth more than dime today currency. these days more usual inscribe the gender neutral ani dodi dodi belong beloved and beloved belongs. the white bridal dress intrinsic modern weddings including jewish weddings that mon assume this attire universal which. many jewish brides moroccan and yemenite descent still marry this type garb especially israel ancient greece both bride and groom wore. know that the mikvah very ancient institution because vestiges one were found the remains the destroyed jewish fortress masada print. ring must belong the groom solid metal and free gems the inclusion precious stones produces significant variations ring values. today fact some the most ancient practices are currently being rediscovered and renovated couples seeking blend tradition with modern. white garments adorned with gardens the classic bridal costume for iraqi jewish brides included silver bells and golden nose rings. large ornate objets art decorated either with representations the jerusalem temple local synagogue such rings were objects pride the dows. not fact oriental and sephardic brides have worn brightly colored dresses set off with veils made streaming gold coins fact. fact the christian ritual baptism based mikvah immersion jewish tradition the institution the mikvah not custom but law. the rest the white gown the veil the portable chuppah wedding canopy etc are but customs which have grown around jewish weddings. symbol the purity conferred upon her the wedding. follow your heart and eyes thus for married man the tallit now functions reminder keep his mind off forbidden sexual situations. wedding customs old new. the white bridal gown became customary amongst ashkenazic jews who followed the example their christian neighbors although white was not. rachel veiling leah heavily before the wedding placing the veil over the bride face himself jewish groom makes sure doesn trepeat windows. but despite its fascinating history and continued popularity the veil not requirement some modern women reject because its similarity. many orthodox munities bride gives tallit the groom which wears only from the day married despite being bar mitzvah for. isaac for the first time rebecca took her veil and covered herself gen. resume the wife must the mikvah although most women visit indoor mikvah any body natural water lake river ocean can beet. jfedgmw  wedding customs old new reinvented text daccording jewish law getting the happy couple married. another veiling custom badekin the veiling the bride the groom just before the wedding also has biblical roots those familiar with the story. lawful jewish marriage requires act kinyan that the bride given and that she accept something nominal value from the groom print. that time the woman called tamay impure this means she forbidden take part certain religious practices before sexual relations can. endless love between husband and wife others see the circle representing link the past and mitment the future. jfedgmw  wedding customs old new reinvented. years according some jewish mystics the tallit associated with sexual temptation which for man more issue after marriage than the. color mourning ironically while the white gown has e symbolize bridal virginity christian culture the jewish tradition the gown denotes. through the ages this not diminish their importance for customs add measureless beauty and meaning life cycle milestones. but for whatever reason north america today almost universally the custom give ring the object exchange according jewish law the. the preferred color among all christians france the middle ages and beyond brides rarely wore white electing blue rose because white was the. something quite different that matter how sexually active bride may have been before marriage the wedding purifies her white worn. traditional age being bar mitzvah the biblical mand wear the fringes the tallit states you shall look them and not tempted. which presumed the rabbis could cause bride reconsider interesting custom post renaissance europe was the use munal rings. rachel veiling leah heavily before the wedding placing the veil over the bride face himself jewish groom makes sure doesn repeat,12,"Wedding Customs: Old, New, Reinvented - Jewish Federation of Greater Metrowest NJ - Google Chrome",marriage rules for jewish couples - google search - google chrome
"i know god but why don't you tell people. move him to live quietly by his side until. the case, isaac lives. when he obeyed his father, he was born on mount moriah. simply please love. isaac's spirit or not he becomes quite affluent. after the lawsuit, isaac lived quietly with his father. be able to overcome her husband's plot with her children to compete. when i experienced it, i found that rebeca was very kind and gentle. difficult to understand but once you understand it is very simple. quietly with my father. cto settings activate wind. when she was sixty years old when she was pregnant with twins, sac became the father of two. don't learn the extra side of these. experienced the provision of the morning god the lord promised. details in testing. ask the housekeeper to find it for you. noon according to the love of the day, where the heavenly father creates the experience of providing for the morning god promised. until he died to the age he was newly established. attentive responsibility. then must understand a lot of love also.回單昆 g according to the circumstances. delicious according to his liking again the god-created father. know that his sea almost died photo. it's really possible to resist a sub's command. real alternative anti-network command of a sub. a teenager who obeyed his father was born on mount moriah. be happy with a sub then. check out the details in the test. people are so simple that. want to be happy with a man. when he obeyed his father, he was born on mount moriah. light a lamp to celebrate the sabbath. he became rather passive he lived quietly by his side. isaac lived quietly with his father, not knowing if he was right. after the lawsuit, isaac lived quietly with his father. in terms of business, he is rich in wealth. i am a flock of many sheep. his near-death turn had too much of an impact. but in the role of anti-he who like. law relating to intimacy in kissing. light candles to celebrate the sabbath. abraham, isaac is a bit pale. too heavy on the spirit of isaac or not. his brother's blessing. an ordinary everyday act. when he died, he was married to rebecca. after getting married, it's not been a year yet. what isaac brought into his tent shows. aabbccdc aabbccdc aabbc aabbcc aae. but in the role of husband he who like. the bible says isaac prayed for him. they might be surprised to see the butler. must love so much don't learn. family with rebecca thanks to a housekeeper from her hometown. too heavy on the spirit of isaac or not. a single lump of dough called challah. the pregnant lord answered his prayers so he. deceitful child genius. true superseded command of a sub. he became quite passive, he lived quietly by his side. how a person is content with living a normal life. rebeca person of two children. with him bless him he built an altar to. with abraham, isaac was a bit pale after the lawsuit. with rebeca thanks to the housekeeper in her hometown. with abraham, isaac was a bit pale. i won't be until he's old enough to be established. do not know to turn his near death photo. a child in the spiritual life of a man. how can one respect god like rebecca. the fact that isaac put in his papers shows",priests who served the holy temple was challah today modern world the popular usage the word. shabbat into the jewish home for thousands.   chabad  women special mitzvot. search instead for mitzvot wife the family shabbath. throughout history have whispered prayers for health and happiness and for children who will illuminate the. international and mikvah  resource. goodness heart you wish your family embrace the giving yourselves others jewish women. prayers and convey them high. reprinted from the child never. woman the potential giver life you hold the power elevate your home and family from the physically. chabad  chaya klein editor. which permeates our existence. her role the mainstay the home who does the actual lighting there woman the house she. the three mitzvot the woman. you visited this page times last visit. mikvah  article the_three_mitzvot_of_the_woman. serve remind the spiritual dimensions shabbat just physical candle reveals the otherwise unseen. the practice the laws mikvah. menstrual flow time when the depth the husband wife relationship expressed without physical intimacy. rainwater even melted snow the water kept under strict hygienic control cleaned daily and chlorinated this. simcha breaks theworld with good. rabbi mikvah mikvah . mundane the spiritually sublime the adherence the laws family sanctity and mikvah give you the. but sanctifies your entire family and your entire home immersion the mikvah biblical mandment the. years ever since matriarch sarah. times intimate separation and reunion part cycle married life separation begins with the onset the. mikvah natural body water gathering water that has designated connection natural water the. sanctified and manded separate the challah every time bake bread also represents the. ebildinstead eating its holiness prohibits. candles lighting challah and taharat hamishpacha family. water the primary source all living things has the power purify restore and replenish life mikvah. mikvah pool designed specifically for immersion according the plex rules and customs jewish law. tthe three mitzvot ndows. remembrance this gift and anticipation the redemption and the rebuilding the holy temple still. you may find plete worldwide. illuminated her tent with her friday night. women special mitzvot acts transformation chabad o. please contact your local orthodox. pabbi mikvah mikheh . information from mikvah  and. mitzvot wife the family shabbath. practical use any way. when our ancestors settled the land israel one the many gifts they were manded give the kohanim. the practice the laws dews. and administrator mikvah  she. invite into the most intimate area your life bringing dliness every aspect your lives and impacting. must filled with living waters from flowing source that has never been dormant such fresh spring water. contents room too spiritual sense the shabbat candles reveal the unseen and intangible dly energy.   chabad  mitzvot and customs. taharat hamishpacha family sanctity. observe the mitzvah separating the challah remove the piece dough and make the blessing burning. material for this article includes. the primary function the shabbat candles. sacred the jewish woman. the mitzvah lighting shabbat candles rests upon all members the household but the woman the house. listing mikvaot mikvah  you. there are three mitzvaot that are especially sacred the jewish woman these are shabbat. unable light the obligation falls upon the man.   mikvah  article the_three_mitzvot_. showing results for mitzvot wife the family shabbat. lighting two candles honor the shabbat and jewish. instead eating its holiness prohibits. these are shabbat candles lighting challah. period anticipation and preparation for mikvah immersion the reunion which follows holds the highest. take few moments whisper your own prayers allowing the unique holiness the time permeate your. the jewish marriage sanctifies husband and wife taharat hamishpacha family sanctity observance introduces. the three mitzvot the woman mikvah . learn about the jewish responsibilities the married individual after marriage women begin. the soul any child conceived your observance brings holiness and blessing not only your most physical self. mitzvot and customs marriage chabad . throughout the world have practiced this beautiful lifeaffirming mitzvah for hundreds generations. and taharat hamishpacha family sanctity. the shabbat candles are lit friday evening eighteen minutes before sunset. however refers the piece dough that separated and consecrated with the blessing who has. shabbat into the lewish bome forthousands. lighting shabbat candles rests upon all members the household. there are three mitzvaot that are especially. the first woman light shabbat candles was our matriarch sarah while the mitzvah. the time candle lighting especially auspicious time for private prayer from behind covered eyes women. today the destruction the holy temple does not permit actually give the challah the kohanim however. are interested learning more about. bring peace and tranquility into the home and enhance our enjoyment the shabbat meal the candles also. challah refers the two braided loaves bread served the traditional shabbat meal its basic biblical meaning. resides brooklyn with her. the shabbat candles have ushered the holiness,36,The Three Mitzvot of the Woman - Mikvah.org - Mivtza Taharas Hamishpacha - Google Chrome,mitzvot meaning - google search - google chrome
google sells bunk beds for sale. google offered vietnamese francais,rules and customs jewish law water the primary source. water that fills the actual immersion pool. record speedi chargeboostja tad windows. holds the highest potentialfor sanctity marriage. but why the blood jesus powerful safe. click read christianity tuics aiiu cusiois jewisii law vaici piiai sourit. religionnews  now and. each the above mentioned three mitzvot are singularom minute. separation begins with the onset the menstrual flow time. designated connection natural water the mikvah pool. new invention charges your phone. water stored separate holding tank that has opening. mikvah natural body water gathering water that has. why the blood jesus powerful. reasons why halloween not satan.  biblestudytools  minutes and. eedi ichargeboostja tadj windows. not only your most physical self but sanctifies your entire. strict hygiene control cleaned daily and chlorinated this natural. replenish life mikvah must filled with living waters from. record speedtchargeboostja tadj windows.  biblestudytools  now and. google  search dictionary dictionary english vietnamese sxsrf aoaemvlnjmjn fevunnjr khdw source ptvy. water rainwater even melted snow the water kept under. ian mom had friend. how god met hagar her deepest need. when the depth the husband wife relationship expressed. what should christians know about ouija. family and your entire home immersion the mikvah. rthday never heard that one. young christian mom had friends. ntión charges your phone. before young christian mom had friends. intimate separation and reunion part cycle married life. kiss and mingle with the city. them call satan birthday print. flowing source that has never been dormant such fresh spring.  christianity  now and. record speedichargeboostja tad windowssubtitle. click read christianity . hamishpacha family sanctity observance introduces times.  biblestudytools  minutes. designed specifically for immersion according the plex. all living things has the power purify restore and. christianity  minutes and. celebrate halloween but never. america moves towards restructuring prepares. which allows the natural water.  christianity  now. marriage the post the reformed church. satan birthday never heard that one. child conceived your observance brings holiness and blessing. the jewish marriage sanctifies husband and wife taharat. new inventión charges your phone. rns the decisions follow decades. who didn celebrate halloween but never. met hagar her deepest need. open google translate feedback. eediqchargegodsijaqadte windows piblestudytools  minutes. new inventióri charges vour phone. without physical intimacy period anticipation and. google selling bunk beds. the reformed church america moves towards ros. heard one them call satan birthday print. record speedfchargeboostja tadjte windows. the reformed church america moves towards rdo. each the above mentioned three mitzvot are singular. print math review sheet. wait expectation anticipation expectation expectation.  biblestudytools  now. why halloween not satan.  christianity  minutes. debate over lgbtq ordination and same sex. dliness every aspect your lives and impacting the soul any.  christianity  minutes and. biblical mandment the highest ordinance. pgnexus pokem childrens sermons. new invention charges round phone. preparation for mikvah immersion the reunion which follows,41,Rêbeca từ hạnh phúc thành bất hạnh (Last saved by user) - Microsoft Word (Product Activation Failed),tự điển anh việt - google search - google chrome
must filled with living waters from flowing source that has never been dormant such fresh spring water. menstrual flow time when the depth the husband wife relationship expressed without physical intimacy. foundation the home the times these mitzvot are performed are filled with unique sanctity and opportunity. the content this page produced mikvah  and copyrighted the author publisher mikvah  you may distribute provided you ply with our copyright policy. the blessing the head family. ewishfamily googleish family bible heart. contact logging the blessings the head family. the blessings the head family google search. mikvah natural body water gathering water that has designated connection natural water the. whereupon the very gates heaven are open wide for your personal prayers and requests. water the primary source all living things has the power purify restore and replenish life mikvah. mikvah pool designed specifically for immersion according the plex rules and customs jewish law. foundation the home the times these mitzyot are performed are filled with aunigue sanctity and opportunityngceremony the head family. ngceremony the head family search googleng ceremony the head jewfamily. mingle with the city water that fills the actual immersion pool. rainwater even melted snow the water kept under strict hygiene control cleaned daily and chlorinated this. the blessing the head family google search. menstrual flow time when the deep the husband wife relationship expressed without physical intimacy. ish family bible heart google search. each the above mentioned three mitzvot are singular importance the jewish woman the akeret habayit. natural water stored separate holding tank that has opening which allows the natural water kiss and. ceremony the head jewfamily search googleewishfamily. ntent this page produced mikvah  and copyrighted the author publisher mikvah  you may distribute provided you ply with our copyright policy. period anticipation and preparation for mikvah immersion the reunion which follows holds the highest. mikvah  article the_three_mitzvot_of_the_woman,principally the story his twin sons esau and jacob the account begins with. the history the heavens and the earth genesis. you behold have blessed him and will make him fruitful and will multiply him. various ways the life isaac parallels that his father abraham after. waiting years for child with his wife rebekah god answered isaac prayer. and blessing ishmael was isaac who would inherit the promises given. happened him terms his descendants follows the death abraham. family that god had chosen work through was the provider and sustainer. the genealogy shem genesis. part four concluded with the death abraham and his burial. iiin part four concluded with the death abraham and his burial. the genealogy noah genesis. northern arabia and jordan based archaeological understanding the. the gonoaloay torah gonosic the structure genesis. the tumultuous story isaac and his family demonstrates their utter failure forlengthy account filled with intrigue treachery and moral failure but also with. the genealogy terah genesis. tribes would adjacent but also opposition the children israel his. the toledoth sections genesis are follows. many years realize that this plan was god not man time after time they. anized around the children israel and their interaction with. effect bringing close any possibility ishmael being counted the line. god unrelenting faithfulness yet the amount space accorded the story. the genealogy isaac genesis. children would bee two verv different peoples not unlike ishmgel andpatterns from the past. isaac the least original the three patriarchs his life. several the sons named are recognizable the names locations. descendants lived hostility towards all their brothers new. isaac himself after his father death small what happened him. lengthy account filled with intrigue treachery and moral failure but also with. rabbi sir jonathan sacks genesis the book beginnings. vision  law prophets and writings part isaac jacob esau birthright blessings. the genealogy noah genesis meditation what chosen and what not. the genealogy esau father the edomites genesis. tribes god had promised this abraham earlier for ishmael have heard. the tumultuous story isaac and his family demonstrates their utter failure for. and told her her ing son ishmael yet despite god passion. meditation what chosen and what not. with the sons jacob israel ishmael had sons who became arab. ost the old testament those books known the early new. isaac and rebekah isaac father abraham the one through whom. though chronologically out sequence ishmael death mentioned. the genealogy ishmael genesis. today jews trace their origins course neither abraham nor isaac was. place where angel had appeared the despairing egyptian servant hagar. from the euphrates river the red sea and from northern sinai western. through whom god had chosen work interesting however that parallel. place names given the genesis account the territory ishmael stretched. this point emphasizing again that his line has part the inheritance the. hopes bringing about the blessings god had promised. tanne the lonatoricinalof the threo notrinroho hie lifoin various ways the life isaac parallels that his father abraham after. the toledoth isaac taken the next section this. isaac the least original the three patriarchs ihis life. and the couple became the parents twins this signals again that the. isaac the least original the three patriarchs ilis life. she asked god for help understanding the reason his reply was that the. the genealogy esau edom genesis. other peoples israel was the name given god jacob one the twin sons. the genealogy the sons noah shem ham and japheth genesis. though chronologically out sequence ishmael death mentioned atbabylonia what know the arabian peninsula this region ishmael. isaac himself after his father death smnall what happened him. testament church the law the prophets and the writings. exceedingly shall beget twelve princes and will make him great nation. babylonia what know the arabian peninsula this region ishmaeľ. lacks the drama abraham the struggles jacob. the book the genealogy adam genesis. patterns from the past. israelite jew each also gives rise many the arab peoples. translated the well the living one who sees the negev desert the. two his sons isaac and ishmael that point isaac through whom the. took matters into their own hands just abraham had sometimes done. the book genesis among other things profound. biblical line promise would traced resided beer lahai roi possibly. during rebekah pregnancy the children quarreled much inside her that. anization the toledoth ishmael genesis detailing what. the genealogy jacob genesis,44,"The Law, the Prophets and the Writings, Part 5: Isaac and Sons: Birthright and Blessings - Google Chrome",the blessing ceremony of isaac in his family in bible times - google search - google chrome
