source,target,index,title,query
thisislandingpage__men and women are real. male skeleton female skeletohat. male skeleton female skeldtohat. male skeleton female skeletoh. male skeleton female skeletohaat. male skeleton female skeletohaatnom. male skeleton female skeletohaat love life couples,men and women are real. male skeleton female skeletohatmajor skeleton gender differences. male skeleton female skeletohnat. major skeleton gender differences. ole skeleton female skeletoheat. ale skeleton female skeletohat. ole skeleton female skedetobeat. male skeleton female skeletohaat. mole skeleton female skeletoheat. omajor skeleton gender differences. ajor skeleton gender differences. canstockphoto  csp shape. male skeleton female skeletoheat. ale skeleton female skeletoheat. microsoft powerpoint product activation. canstockphoto  csp couples love life. male and female are available,981,Đời Sống Tình yêu của couples - Microsoft PowerPoint (Product Activation Failed),differences between male and female skeletons - google search - google chrome
microsoft powerpoint product activation. anti tai stars can only focus,female menstrual cycle the first part the cycle desire for love has. also makes him look good males have sex declarations settings activate vindows. can sweep woman like hurricane few days after her period the wife will. drink like the tide depending. don want have anything with love. touched below the navel gonads are concentrated. man may have sex his brain but the part wants. ווח drink like the tide depending. perineal there are many sensitive spots that just touch,989,Yêu theo cách của Chúa -Th.tráng NGTự TKMùa Thu 2021 - Microsoft Word (Product Activation Failed),man can do only one thing at a time - google search - google chrome
why can husband just pull over. don devalue hurt anyone. why men cant more. google  search man can only one thing time tbm isch ved ahukewjryejt zahvhapqkhfl ateq ccegqiabaa man can only. man can only one thing time. river with the two animals and the cabbage there. why can husband only practice. are left alone the wolf will eat the goat the goat and. small rowing boat which can take only one thing. the life sir harry par. doing one thing time star. man has wolf goat and cabbage must cross. but time more powerful. why does seem like only. when the bird has died ants eat. get this image dreamstime  license details. only sex the brain. with him time however the wolf and the goat. want know where this information es from learn more. and finally our time. beard the one thing. circumstances can change any time. copyright sangoiri dreamstime . why husband can only exercise. she can her success. doing one thing time star mysore. the cabbage left alone the goat will eat the cabbage. you may powerful today. focus lips once thing. focus one thing time. man can only one thing time google search. how can the man get across the river with the two animals,only sex the brain. focus lips once thing. why husband can only exercise,991,Đời Sống Tình yêu của couples - Microsoft PowerPoint (Product Activation Failed),man has sex on the ebrain - google search - google chrome
thisislandingpage__only sex the brain. focus lips once thing. why husband can only exercise,toilette humor pinterest discover. looking inside man brain. this idea with talent. are you business let start here discover. graph man brain cartoon. looking for way cook. see more ideas about education. privacy acknowledges that you have read yourself. click make the most. explore education subjects science. see more from marcin. granh man brain cartoon. from toilette humor . man humor satirical strange brain story. the best ideas the world. are you already member log. looking for cooking tips fashion tips etc,992,"Looking inside a man's brain | Brain gif, Best funny pictures, Brain - Google Chrome",man has sex on the ebrain - google search - google chrome
thisislandingpage__toilette humor pinterest discover. looking inside man brain. this idea with talent. are you business let start here discover. graph man brain cartoon. looking for way cook. see more ideas about education. privacy acknowledges that you have read yourself. click make the most. explore education subjects science. see more from marcin. granh man brain cartoon. from toilette humor . man humor satirical strange brain story. the best ideas the world. are you already member log. looking for cooking tips fashion tips etc,why husband can only exercise. menchi has sex which. men love life couples. only sex the brain. focus lips once thing. menpih couples love life. microsoft powerpoint product activation.  couples love life. pih couples love life,993,Đời Sống Tình yêu của couples - Microsoft PowerPoint (Product Activation Failed),man has sex on the ebrain - google search - google chrome
his back putting his hand his thigh holding his arm guide him away enough make shake. why easy for him get the top. why does just growl instead saying out loud. why does turn his head look beautiful women. why can just cuddle. the toes not mention sensitive points,said that what most men need woman who pliments her ability. those who have need also dare say but she also dares say that part belongs the expertise. they only talk about the time when boys receive hormones explain why men don much. women are more talkative than men people study and discover. the song songs the words the sulamith are twice many those solomon that the reason. and the husband just grumbled. why easy for him get the top.   oneway radio. why does just growl instead saying out loud. there much literature increase testosterone for men naturally don know the document you mean how. hello are you crooked can ask you something. thought there was theme for men naturally increasing testosterone hihi. you just made friends with nguyen ton. work the same time. that female fetuses slurp more than male fetuses. during sex the wife utters the full expression her pleasure. men who have need also dare say part. why does turn his head look beautiful women. hong binh call nhazalo visit phuong lan. tran thi thanh ngoc pictures. the men who have need also dare mention but she also dares bald that part belongs the expertise say where what kind part that. coated bar self strong hours. phoenix pai chi from the beginning. you guys who have need. thought there was topic for. are you fine what. zalo visit the direction spread. why can just cuddle,995,Zalo,yêu theo cách của chúa -th.tráng ngtự tkmùa thu 2021 - microsoft word (product activation failed)
why easy get the top. why easy for him get the top. english good money diplomatic ability management ability but there one. english after being praised publicly his wife you are great lover. why does turn his head look beautiful women. interrogated what did you that she praised. why can just cuddle. why does turn his head. why isn like that. english man ability husband there are men who like plimented their wives. manly capacity her husband there are men who like praised their wives. english man ability husband. english share the secret,hoc dac aak mit. sao anh dường như. khi sốt nều yêu không. việc một người chồng tuyết với,997,Đời Sống Tình yêu của couples - Microsoft PowerPoint (Product Activation Failed),good comment on husband's terrific lover - google search - google chrome
evit vei love you. why out his head. you say yes when you have fever cut,home news sport showbiz australia fmail health science money video travel best buys discounts. published bst may updated bst may. mail news article rubber man turn head degrees like owl html. deliberately dislocates his joints part his eye watering act. dailymail news article rubber man turn head degrees like owl htmlo surat rubber man can turn his. yash shah from surat india flexible can rotate his head degrees. latest headlines supply chain crisis afghanistan covid piers man prince harry meghan markle world news most read. rachael burford for mailonline. can turn his head degrees just like. was shah grandfather who pushed him bee contortionist. freaky rubber man flexible. the year old now vowing for the title most flexible man the world. surat rubber man can turn his,1000,Không tên - Google Chrome,man turns his head on shapely woman? - google search - google chrome
establish secure connection can also bend his limbs has bones his body leading locals nickname him rubber man. published bst may updated bst may. she leads stars dkms. home news sport showbiz australia femail health science money videos travel best buys discounts. can also bend his bones has his body leading locals nickname him rubber man tivate windows. deliberately dislocates his joints part his eye watering act. poetry award over zoom. mirror selfie and then. latest headlines supply chain crisis afghanistan covid piers man prince harry meghan markle world news most read. osite oweb enter your search. the year old now vowing for the title most flexible man the world. also admitted that has taken inspiration from the famous american. back japanese royal targeting and groping. she tells herself hot. dailymail news article rubber man turn head degrees like owl html. her love for beau brett. was shah grandfather who pushed him bee contortionist. with the help television and internet. nspiration from the famous americanfollowing word mom. borschool board president caught mic saying. eyes water and turning his head degrees just like owl instagram insta. with her husband josh. also admitted that has taken inspiration from the famous americanfollowing word mom. why don you nick. can also bend his limbs has bones his body leading locals nickname him rubber man tivate windows. contortionist daniel browning smith and began training his own his mid. contortionism can dangerous form entertainment deliberately. can also bend his limbs has bones his body leading locals nickname him. freaky footage shows teenager bending his body into shapes that will make your. skirt and bralet she. dislocate their joints part their act. case with angelina jolie. shah said attempt pull these crazy moves began training myself. his name left hand. over death his friends. yash shah from surat india flexible can rotate his head degrees. ring horafter recently insisting. gave smacker onashley graham bares. dailymail news rubber man turn head degrees like owl html. and cried the phone. rachael burford for mailonline. reading liste reading list. can turn his head degrees just like. freaky rubber man flexible,dailymail news coronavirus index html.   google  url url  f dailymail fnews farticle frubber man turn head degrees like owl html psig aovvaw dnhzryubc gcpunyk ust. published bst may updated bst may. images may subject copyright learn more. surat rubber man can turn his head. deliberately dislocates his joints part his eye watering act. latest headlines supply chain crisis afghanistan covid piers man prince harry meghan markle world news most read. the year old now vowing for the title most flexible man the world. dailymail news article rubber man turn head degrees like owl html. man turns his head shapely woman. absolutely crazy for plus size women. woman turning away photos. cto settings tivate win. was shah grandfather who pushed him bee contortionist. surat rubber man can turn his. home news sport showbiz australia femail health science money video travel best buys discounts. home news sport showbiz australia fmail health science money videos travel best buys discounts. human owl can turn his head. degrees daily mail online. google  search man turns his head shapely woman tbm isch ved ahukewjx_lah_ zahw kusfhaheco ccegqiabaa man turns his. yash shah from surat india flexible can rotate his head degrees. rachael burford for mailonline. can turn his head degrees just like. freaky rubber man flexible.   google  url url  f dailymail,1002,Không tên - Google Chrome,man turns his head on shapely woman? - google search - google chrome
thisislandingpage__dailymail news coronavirus index html.   google  url url  f dailymail fnews farticle frubber man turn head degrees like owl html psig aovvaw dnhzryubc gcpunyk ust. published bst may updated bst may. images may subject copyright learn more. surat rubber man can turn his head. deliberately dislocates his joints part his eye watering act. latest headlines supply chain crisis afghanistan covid piers man prince harry meghan markle world news most read. the year old now vowing for the title most flexible man the world. dailymail news article rubber man turn head degrees like owl html. man turns his head shapely woman. absolutely crazy for plus size women. woman turning away photos. cto settings tivate win. was shah grandfather who pushed him bee contortionist. surat rubber man can turn his. home news sport showbiz australia femail health science money video travel best buys discounts. home news sport showbiz australia fmail health science money videos travel best buys discounts. human owl can turn his head. degrees daily mail online. google  search man turns his head shapely woman tbm isch ved ahukewjx_lah_ zahw kusfhaheco ccegqiabaa man turns his. yash shah from surat india flexible can rotate his head degrees. rachael burford for mailonline. can turn his head degrees just like. freaky rubber man flexible.   google  url url  f dailymail,what are you going. why does look back. rerit vei love you. only sex the brain. why are you ngodi ddи see,1003,Đời Sống Tình yêu của couples - Microsoft PowerPoint (Product Activation Failed),man turns his head on beautiful woman? - google search - google chrome
why does look back. why easy get the top cut. man turns his head beautiful. why easy nail iia text direction. couple love life microsoft powerpoint product activation drawing tools,michlo hoshino minden pletures corbis. why does look back. michio hoshino minden pictures corbis,1010,Đời Sống Tình yêu của couples - Microsoft PowerPoint (Product Activation Failed),orgasm of a bear image - google search - google chrome
thisislandingpage__michlo hoshino minden pletures corbis. why does look back. michio hoshino minden pictures corbis,had many wondering about their sexual habits. have not been known rape. latest headlines supply chain crisis afghanistan covid piers man prince harry meghan markle world news most read. mail news article the sexual habits bears mammals promiscuous deliberate seeking mate murder sex not known rape sexually assault humans html. dailymail news article the sexual habits bears mammals promiscuous deliberate seeking mate murder sex not known rape sexualy assault humans html. reports that leonardo dicaprio raped bear his new film the revenant. some brown bears will kill female cubs order get them mate. would bear fancy leo they are. home news sport showbiz australia femail health science money video travel best buys discounts. bears are promiscuous when see. the men have asms but not clear the females. bears have never raped sexually assaulted human being modern recorded. mate and will murder for sex but. chris spargo for dailymail . promiscuous deliberate when seeking. two male bears captivity did engage oral sex with one another almost. male bears spend days courting mate the wild and then after they are done. mate and will murder for sex. published bst december updated bst december,1011,Bears are promiscuous when seeking a mate and will murder for sex | Daily Mail Online - Google Chrome,orgasm of a bear image - google search - google chrome
thisislandingpage__had many wondering about their sexual habits. have not been known rape. latest headlines supply chain crisis afghanistan covid piers man prince harry meghan markle world news most read. mail news article the sexual habits bears mammals promiscuous deliberate seeking mate murder sex not known rape sexually assault humans html. dailymail news article the sexual habits bears mammals promiscuous deliberate seeking mate murder sex not known rape sexualy assault humans html. reports that leonardo dicaprio raped bear his new film the revenant. some brown bears will kill female cubs order get them mate. would bear fancy leo they are. home news sport showbiz australia femail health science money video travel best buys discounts. bears are promiscuous when see. the men have asms but not clear the females. bears have never raped sexually assaulted human being modern recorded. mate and will murder for sex but. chris spargo for dailymail . promiscuous deliberate when seeking. two male bears captivity did engage oral sex with one another almost. male bears spend days courting mate the wild and then after they are done. mate and will murder for sex. published bst december updated bst december,michlo hoshino minden pictures corbis. why are you easy. why does look back. epih couples love life. options animation animation painter. microsoft powerpoint product activation. pih couples love life,1012,Đời Sống Tình yêu của couples - Microsoft PowerPoint (Product Activation Failed),orgasm of a bear image - google search - google chrome
fortable should like caressed cuddled confided afterwards. english let talk each other what makes you like. english let talk each other what you like what your favorite place. during sex the male body releases oxytocin hormone that causes. husbands sexual needs full. husbands sexual needs fulfill his visual need for sexual stimulation but big. drowsy after the game was over went back sleep while the girls saw. husband visual creature yours too naked one their favorite. men usually reach their peak years old women between years old. continued right behind the pond. men usually reach the peak when years old women years old. tell each other what makes you like what the most like make clear. not really sexual being rather not display don want full. shapes smartart chart screenshot hyperlink bookmark cross reference. which place the best make clear. not really sexual being rather not display don want fulfill hiso settings activate inc. words needs see naked the only one who can fulfill. let talk each other. not really sexual being rather not display don want fulfill his. needs many times the difference between men and women sexually alive settings activate vindows. english knows the right place. why can just cuddle. husbands sexual needs fulfill his visual need for sexual stimulation but,born california riley begins. biggest customer the year from venesto. woman hit ceiling fan. terrible gift offer gratitude. dress for the van haus. who knows shows crush. moments when animals are innocent fairies. buy but tne bos. waiting for the vaccine two people help reduce sweating lot. always ensure prestige hours ago. giant crocodile years old. waiting for surfcountor  information you need know. released from prison the man insisted. just bunch fat bears playing with balloons. brush the right that right now the left. interesting but little historical facts. journey top atni initiatives. dress well for van hau. don need open eyes know that dear friend approaching. kenh chi mot dan gau beo choi voi bong bay thoi. believe the same category. ask the police keep you jail. thanks the buddha door like eat rice. athlete the gymnastics phone. don want live with wife after. information you need know. baby love b give back. effective thighs and legs. sometimes really don understand they being brushed scratched. horror hollywood all time. buy sut tno bo ino. head injury hours ago. the creepy truth the exorcism. riley loos years old. beautiful dress van hau group. you won able distinguish between animals and objects this series pictures. riley petes national petitions. buy but tno bo orimo. triley loosiem america todc team perform. the infamous roland doe okay. white with vegetarian food even. beautiful dress van hau team. buy but bo ima. kenh cool khoanh khac phe pha cua cac dong vat khi duoc gai dung cho ngua chn,1022,20 khoảnh khắc phê pha của đội quân khi được gãi đúng chỗ ngứa - Google Chrome,gãi đúng chỗ ngứa. - google search - google chrome
cool chi mot dan gau beo choi elephant bong bay thoi chn. beekse bergen netherlands england. now time feel like playing with the balloons the bears the national park. live healthy you want. under the circumstances the other two crept crept forward. matter how excited you are about new piece technology you will probably never,makeagif  gif dog hugs. check out these animal gifs. source watch the full video. dog hugs make gif. like show you notifications for the latest. added year ago anonymc. check out these animals gifsmakeagit  cat.  makeagif  tag catmakeagit dog.  makeagif  gif catgifcentral kitten meets with mom your back iwqn. source watch the full video create gif from this. check out these animal gifse makeagif. added year ago anonymously animal gifs,1024,Dog Hugs on Make a GIF - Google Chrome,cute animal hug gif - google search - google chrome
catgifcentral kitten meets with mom your back iwqn. gifs gif gifs . hugging animals gifs tenor. funny animals hug gif funnyanim. cute animal hug gif. images may subject copyright learn more. reasons dogs are amazing. makeagif  gif catgifcentral kitten meets with mom your. cute animal hug gifs. added hours ago anonymously animal gifs. catgifcentral kitten meets with mom your bar. raccoon hug gifs get the best gif. rorder collie hug gie rorder. create gif ate windows. animal hug gifs tenor. catgifcentral kitten meets with mom. makeagif  gif catgifcentral kitten meets with mom your back iwqn. google  search cute animal hug gif tbm isch ved ahukewj vsiu_zahu sfhdxid ccegqiabaa animal cute gif gs_icp cgnpbwcqar. dog hugs make gif. border collie hug gif bor,generate code for this image. office them ino title. source  litteanimalgifs tumblr  post panda wrestling. goto settin couple love life. giphy  giphy  gifs hug panda auh zcqsviv. michlo hoshino minden pictures corbis. office theme animation pane. source  littleanimaigifs tumblr  post panda wrestling. why does look back. source  litteanimalgifs tumblr . open image new tab. options animation animation painter. giphy  giphy  gifs hug panda regrirue. monophy  gifs hug panda auh zcqsviv. source  littleanimalgifs tumblr  post panda wrestling,1026,Panda Hug GIF - Google Chrome,cute panda hug gif - google search - google chrome
