source,target,index,title,query
wiporsbiebiusiooints three port line spl itter. hitps  wish  feed tabbed_feed latest product led. itps  wish  feed tabbed feed latest product source tabbed_feed latestbiposition isha. itps ish  feed abbed feed ltest product sdb cct tsource tabbed feed. thaleht swom youtube facebook google elekironikks koko verkkokauppa kotonttori powe giganttiverkkokau googlesheets googlekeep muutkijanmerkt. prepare three batteries usb charger and voltage should less than. gpackage only has led light blocks model. vsfacccbaadd source tabbed feed latest position ishare web. saat jopa alennusta koodilla good. please install your led light carefully hard pulling and need bend shake. bebbale source tabbed feed latestbposition share wel. source tabbed feed latestbtposition share web. ghgg mini usb recorder pendant. the light made use original material purely handmade. hitps  wish  feed tabbed_feed latest product. itps wish  feed tabbed feed latest product seedcicaab cabicsource tabbed feed latestbiposition tshare web. uusi listaus pex series. sebdceebs dsource tabbed feed latest position ishare web. uusi listaus peuusi listaus pelimainen. ostoskoriin heti niin sast. itps  wish  feed tabbed_feed latest product source tabbed feed latest position ishare web. modes solar lightd rajoitettu madra. itps wwnw wish  feed tabbed_feed latest product suosituimmat. the light set installation done your preference. googlesheets googlekeep muutkijanmerkit lukulsta. self locking wifi switch. tuotteet myy toimittaa blue intel. tabbed feed ltestitp trrajoitettu maara. tahtien sota taide tahtien sota juliste. only has led light blocks model. contains box light kit instruction the card enter the link search jand battery. lgn maksa vain toimituskulut. building block lampled light. source tabbed feed latestbiposition share web. ecoceb source tabbed feed latestbposition share web. products and quality services. tietoa toimituspéivistd yta lisadl. nemelkein loppu melkein loppu. pikatoimitus star trek meta. cfd source tabbed feed latestbposition share web. uusi listaus pemaksa vain toimituskulut. eaff afa dedaccebdsource tabbed feed latest positi. magnifying led melkein loppu. mattain trret wss maticin inrrit mabrez vain triminrebnhlusb hub. kyglaring led valosarja lego. the light set used light technic bugatti chiron not include the legoyieistietoja samankaltaiset. specialized custom designed lighting kit toys aim supply customer with good. uusi listaus peuusi listaus. google eletroniiks koko verkkokauppa kotikonttori giganttves googlesheets googlekeep muutkijanmerkit lukulista. latestbiposition share web collection wish. smart rotary touch dimmer. faecaffb tsource tabbedfeed latest position ishare web. dfc source tabbed feed latest position share web. instruction manual the card enter the link search send message. ile vain led valosarja lohkomallia. ostoskorin heti niin sast. plug power and light your building blocks with our amazing design. source tabbed feed latestbposition share webey. hitps wonwwish yfeecl tabbed feed latest product sbc source tabbed feed latestbiposition hare web. color key color key. bricks and bring them new vitalit. lle vain led val. sovellicet tintic sukignthé lta sanomat lkalehti suom youtube facebook google eekirnikks koko verkkokauppa kotonttori powe giganttiverkkokau googlesheets googlekeep muutkijanmerkt lukuista. make your creations unique with your rich imagination and creativity let light your. osta caseme osta caseme. for lago grostusers eco. looks like great bit kit nicely made and packaged clear. rajoitettu mara melkein lopp. package only has led light blocks model normaali toimitus. tha sanomat alehi suor voutube facebook google elekirniikka koko verkkokauppa kotkontiori powe. tps  wish  feed tabbeddmakeup mirror ligt. will reply within hours. instruction video thank you very much advanced version led. wish feed tabbed feed_latest produc d_latest position. itpsi wnwwish yfeed tabbed feed late. itpsy wish  feed iabbe feed jtestproduct saccbeb locedbsource tabbed feed atesibpostion sharc led lighting kitl. kuvaus vabiemman lisaa toivelistalle. cbbcb cale source tabbed feed latestitposition share web. adantis space shude sts. srrthe mosster book moasters. tin sukién thé ilta sanomat. tps wish  feed tabbed_feed latest product bcacd source tabbed feed latest positi. source tabbed feed latestbposition share web. less car wele light. sanomat lalehi suom youtube facebook. sovelliset tin tic sukin the. cfctb tetha source tabbed feed latest iposition share web. source tabbed_feed latestiiposition ishare web. magley moon color ight. uusi listaus pestorm storm. wish  feed tabbed feed latest product source tabbed feed latest position share web. basic version led light. needa lamp led light. sovellvkset tinti sykiénthé lfa sanomat malehti suom youtube facebook google eekironikka koko verkkokauppa kofikonttori powe giganttiverkkokau googlesheets googlekeep. ebc source tabbed_feed latestiiposition share web. advanced version led likyglaring led valosarja lego. ihasanomat lfalehti suom youtube facebook google eektronikks koko verkeokauppa cotkontiori powe giganttiverkkokau googlesheets googlekeep mustkijanmerkt lukuiista. seedb source tabbed feed latest position shar. cab source tabbed feed latestbiposition share web. min usb recorder pendant. instruction video thank you very much. melkein loppu melkein loppu. the light set used light technic bugatti chiron not include the lego. package only has led light blocks model. bricks and bring them new vitality advanced version led kyglaring led. uusi listaus pev dsfeb. source tabbed feed latestbiposition chare web. toskreal twe recordnga pater. limainen led light kit,hitsps  aboutyou champion aateet. urban classics superdry adidas originals urban classics. hitps  aboutyou champion erl. applications tintitc sykién thé lta sanomat talehti suom youtube facebook google electronics size verkkokauppa kotkonttori powe googlesheets googlekeep other bookmarks reading list. dat cardigans boma matthias geerts bugatti keylargo. iatteetmatthias geerts bugatti keylargo,23,Shoppaile ALE Alessa miehille verkosta | ABOUT YOU - Google Chrome,about you - google-haku - google chrome
youtube facebook google electronics koko verkkokauppa home office powe. baomol youtubew youtube facebook google electronics koko verkkokauppa home office powe,reading and writing about what liva tudi. sruat and fight matter what because can child dir sleep well. ths nguyen thi kim len qui covers activities. around knows name and wants talk. thudng nguyen nhan has bee star. dudi duge split bar murc due. rdy when she told she was sorry. thug work and start lelber. many different mircs the division divided into mircs due the exact time difference. content responsibility info mediatec . changed mind been living the school been love with you. how many people like the mirc model the grader suffering from pain. euat show and liva tudi the first child the world stupid. cam thdy meters has good body every student the school has been born the middle the night because has bad hand. thanh cap right april. srruat and fight matter what because can child dir stupid. year thdy meter the number the body every student the cdc sick happy fall the palm your hand. sorry when tell you that sorry. viing plays the role guan the movie she can stupid person has major role more than couple. the owner this page less than years old and has been living and mirc has been state from years old she has moved new location. changed mind happy been living the school tired. medical examination good sirc,50,,dau that lung duoi la benh gi - google-haku - google chrome
suom google search try luck. information advertisements panies women search functions privacy terms use settings ees. applications tintlc sykiénthe lfa sanomat mtalehti suom youtube facebook google elekironiicks koko verkkokauppa kotkonttori powe gigantitverkkokau google sheets googlekeep other age marks from the book. information advertisements panies women search data protection terms use settings. daughter the pirate king,higu cda what medlatec. where are you going. what kind education and training are you looking for study dir stupid. save the search engine. always find full urls. gigantt verdkokau google sheets. p medlatecyn tin tuc hien tuong dau lung duoi dau hieu cua benh. fall the palm your hand. not and well done. pau lung dudi dangerous. lits hsku nhing ngusihay dsu phis cusi pressed. dudi when you press. the ban quan tam. cam thdy meters has good body every student the school has been born the middle the night because has bad hand. tintic sukignthé lta sanomat ltaleht suom youtube facebook google elekioniiks koko verkkokauppa . the location hodc dir doi stupid. what kind education and training you want see and what will you study dir stupid. what the point understanding. let shout out everyone from,51,,dau that lung duoi la benh gi - google-haku - google chrome
the style the room. how style ngira tong khop. method value gidm value,roueeec lsrr task index. non essential  regione toscana web tamminhduong home blogs dau lung duoi benh cach dieu tri moi. applications tintlc sykiénthe lha sanomat lhalehti suom youtube facebook google verkkokauppa kotlkonttori powe giganttiverkkau google sheets googlekeep other books from the chapter. frontal  regione toscana web home,54,What is lower back pain and 8 new treatments 2021 - Tam Minh Duong - Liferay - Google Chrome,dau that lung duoi la benh gi - google-haku - google chrome
thisislandingpage__roueeec lsrr task index. non essential  regione toscana web tamminhduong home blogs dau lung duoi benh cach dieu tri moi. applications tintlc sykiénthe lha sanomat lhalehti suom youtube facebook google verkkokauppa kotlkonttori powe giganttiverkkau google sheets googlekeep other books from the chapter. frontal  regione toscana web home,exit from dfa dfa dfa dfa dfa sdng beauty page. there lot pain tuberculosis disease ulcer. uong not happy sur flowers and health care nct truee. windscribe free proxy and blocker. sucjattu haku haku termils beautify and nct phd bight thosi hia. cried out because had school don agree join the second shift. everyday life due work sports accidents good health and well being. unfortunately sur flowers and health care nct truee,56,Back pain cause - Google Chrome,dau that lung duoi la benh gi - google-haku - google chrome
you are fast and understand the question. closed turned inward closed over dudi. how you know gout and thosi. what wrong geek gidm. high tudi cao huyat. what the start the bot when. the dress and shoes are good shape. days high and high support. when will the nurde bot start hour. improve easy use collagen and. vain and gidi have good reputation. you are quick and understanding. the content specialized the field science. tall tusi cao huyat. higu cisa has bag always nice have dudi. the contents the list are from the top the field. the djs who are currently playing and playing because the need out. rongbay muargvn enbacuong deu. the title the subject the subject major specialty,the style the room. what the list goals and ways calculate every three. hope that everyone will have good time soon you have child you know that. haanh vieovna nice much. ngre related sedation and other stich issues. method value gidm value. hitp iww regione toscana web fetch that page. the information related the editions the documents mentioned above,74,,relationship between lower back pain and other health problems (apart from osteoarthritis). - google-haku - google chrome
the style the room. select all text matches. method value gidm value. must age marks lukulstatong khop. paste the normal text match. paste without formatting ctrl shiftsv. dibu tri gidm address,other than that there sharp pain the head dusi has quick look and picture that can desired. vitri clia the center the center for different delicacies due the knife sharp. another sharp pain painful one. please call van dong thsdng right away due pared with many other students possible pete with ndy. the cup not only cup tea but also cup tea. all need scream out loud everyone right away. need get out hurry and scream for help right away because this pared many other places can different because this. find out more about this the following content. check your name and signature. find out more details about this the following content. the building and construction the building are designed used building block that can easily replaced the meter will quick and easy. rust thira you young you not good enough and you good health. the outside the house more than just cup tea. this property centerpiece for variety beautiful properties due the pain sharp. what the name the dvd. wailing people with hudng crammed money the air that the coal filter can. let higu pass case there gap hope. iung the name the place and the center the middle the house. first aid and treatment. how beautiful are you. ching soon resound samnganh male. many idn bits nudc duc hodc fast the country this due the illness and the coal worth noting. going have try understand there gap good cing. the risk falling from pared the average. reveal the design right away due. uong not able use the language the country but still active. gate valve syt nvd. e out quickly nuge. valve can used immediately due the student may not able take the exam today. what wrong with this guy according pgs nguyen nghia nguyen giang vien graduate student hcmc enter. will able dif the data. ehity hig hbu froug aeat. gdp the normal munication between the teacher and the student more convenient european munity. officials issued medical equipment. long dusi ving cot. first aid and service. have sharp heart tet. male give higu past ching may must good cing. other than that where the pain the head. apply tintic sukignthé lta sanomat halehti suom facebook google elekironiikks koko verkkoksuppa kotkonttori powe gigantitverkkokau google sheets googlekeep muatkijanmerkt you count. baultng dudi fade away. people talking about hudung crammed money the room where the doctor can. bee hooves and screams right away due pared may different from this point. dwei dwei very well and the most important results the first meeting. gdp the normal cups the normal cups caused the phone. state the end check. anyone who wants see this page should able use the website. the design and construction the website are different from each other due. apply tintic sukignthé lta sanomat halehti suom facebook google elekironiikks koko verkkoksuppa kotkonttori powe gigantitverkkokau google sheets googlekeep muatkijanmerkt from numbers. please let know there gap good cing. let people learn follow. uncover right away due people may different from the petition. what wrong with you. tpning curvy valve syt nvd. tells how put money the cda stream. cling like luc came out. make sure that you are male. used have good time with husband and put the tir the office. very happy with life. what are you sick and tired according pgs nguyen nghia nguyen giang vien medical student hcmc pinch. guitar lung tinh viing tht lung fade mdt will beautiful and beautiful. your name and cycle. who more less famous due the fact that the phone gay. sick dudi baby swallow gidng. male let know there gap ching. anyone who wants see this page should able see what going. let higu pass ching may gap fade good cing. the world around makes the first one two different people hello. years old ddn con syt. fat scale collection hdi thudc violation. going scream people going have put money office. good health duc male. viiig hau cdc van dongithirtmgnigay voiihirhg ving the rhachi vir. nursc duc model nudc title day can due error. ding kenthucyduoc right now,75,What is lower back pain and its common locations most encountered - Google Chrome,Relationrelationbetweenpainwaistbacklowerandproblemshealthhealthother
dting transfer however the does not press that the users cannot convert. the way dbu dan follow the instructions the cadre leader. the style the room. how dbu dan follow the instructions stdisu. skin disease inflammation ulcer tumor the reason due thodi song. two quan more than.  benhvien nguyen nhan dau that jung htm. according the government expenditure the stkham healthy for hang. let know how show you how use graphics pull drag drop. snooze ung turn around when. exited the page nhdy dfa beauty page. according the government expenditure the stkham healthy for hang now you can have little bit.  benhvien nguyen nhan dau that lung htm. thodi flower sings long sick and day coal liver mat happy chira trf. transfer mon however the dgi not pressed people can convert. thudng the cup pressed into the sgng the apart from that. can you teach how show pull press damage. thodi flower song screams lung sick day coal liver.  benhvien nguyen nhan dau that lung htm benhvien nguyen nhan dau that lung htm uong khdp boi. sports tal nan study abroad and learn about nigu lao tha,find out more about this the following content. state check the property value not too bad the meter will quick and easy. how beautiful are you. dudi day was fast year. still alive and well. months ago and year ago did not know how use the php file change the content the php file. you must kijanmerkit lukulstad let know there gap good cing. male let higu pass ching may gap fade good cing. termils lung ving sdng tht fung. tai lieu tap huan phan. sucjsttu haku hsku termils lung duri ving thit chi. ahead and get out the middle shout out right away due still different from the petition. please let know there gap good cing. center for different finesse due the knife sharp. what are you doing. you can stretch your shoulders right away the shoulder tudn for has many different cdp let know what hot the first place. make sure that you are male. congratulations and best wishes. sorry can wait give good cing. arod shubai ans tordar thaudng ving scream lung where your daughter. must kijanmarkets from the book ear lieu met tong. good health duc male. for those who need learn. bine the other chin hodc the mon cup made thodi flower gdy out,85,What is lower back pain and its common locations most encountered - Google Chrome,bị đau dưới thắt lưng là bệnh gì - google-haku - google chrome
sgng the middle the day half sdng showing lost. student school due work playing games etc. sports tal nan nct and grade level tuberculosis. want school learn how sing and scream. lost way through beauty queens. skin disease inflammation ulcer tumor the reason due thodi song. screaming school due thodt location. thuong the cup pressed into the song the thin glass the song apart from that. exit dfa lost dfa dfa dfa beauty page. sports disasters studying and studying young age tuberculosis. thudng the cup pressed against the sgng the apart from that. thodt because dfa fell created cda gng song shout out loud. exited the page nhdy dfa beauty page. skin disease inflammation ulcer tumor nguyen nhan thodi hda song. thuong bringing cup pressed into songs thin songs apart from that. thodt because dta have lost created cda gng song shout out the middle class people. hodic thodi hda has bad place. sports disasters health problems and health problems tuberculosis. sports disaster help you with your health and fitness needs tuberculosis. sorry sorry sorry don think sorry. skin disease inflammation ulcer tumor nguyen due thodi hda cot song. because the distance less than when dong school unplug the baby and put the wrong direction tue namuong khdp bdi sun fri,the name the owner very good days before the end. expansion other areas can according the exact direction the business happy. vinmec service press lich. good luck although the pain very low there problem due. meters away from the most beautiful women the city the most famous women the world have pay attention work the field. born dyc and lung duroi. out when each other throats. expansion other areas can done according the main reason happy. and get out the way. nguyen nhan and cup. many cases related the telephone line this method calling the cost uong ready the next day. change the format due the error the body during the capsule and the capsule. financials sing sorry hear that you are going have school. many cases related the telephone line this method calling the cost wong. hai chire capsule department general surgery department international dermatology vinmec nang. dwrorc switch medical school medical doctor nguyen thi thanh binh bac phuc. service for vinmecdy out when the places are lost,88,"Lower back pain: Causes, treatment | Vinmec - Google Chrome",bị đau dưới thắt lưng là bệnh gì - google-haku - google chrome
the specifications are suitable for use and how use them your charts type long term nutrition like hop ticket will use dura the network. dfa lost beauty queen dfa beauty queen. how start follow the instructions the user find the right food and how use the trigu. how dbu dan follow the instructions bac stdieu. skin diseases inflammation ulcers tumors the reason due thodi song. the sound music the cup pressed into the song and the sound the song thin apart from that. thodt because dta can created sorry hear that you right the middle the night. ubc gay sex like codeine. pages information how like and how use them millions dollars. mookkausung turn around when hits. sorry because bad mood. two quan more than. sports disasters education and health problems tuberculosis. the report can used support people who have access information including udng return source when their skin sharp. edits not having enough time flowers. your chat types receivers can ordered long term preferences and ways use the library over the million. tudi nct nct have normal day due work play. share your business type receiver can used prescription. steroids keep you prison. thodi hda has song that long sick and tired coal liver mat good luck chifa tri. thube gay sex like codein save money. skin disease inflammation ulcer tumor nguyen nhan thodi hda cdt song. sports accidents studying and studying for years and years tuberculosis. according the stkham family fine for hang now you can have little bit. more expensive than male gidi bit still pregnant born. tusi very high and the risk this page not enough year old woman. sports accidents studying abroad and studying young age sdi laborers. wbc non steroidal anti inflammatory drug nsaid. the will able pay the bills for the poor including. editing uong hodc thodi flower song scream lung. thodi flowers are very beautiful sick and tired coal liver mat. according the government expenditure the stkham healthy for hang now you can have little bit. chiing ctia you type can prescribed. sports disasters studying and studying high school level sdi tuberculosis. not press with the vaccine and unpack the baby the latest iam wrong nct does not press. skin diseases inflammation ulcers tumors nguyen due thodi hda cot. two more important than. non steroidal infection nsaid. must age marks from the chapter. ban type bac can prescribed. skin disease inflammation ulcer tumor nguyen due thodi hda cot song. tips how like and use your skin your friezes one type. euong mdt the prime minister office,there are many reasons why there are many problems the end the year there are many factors that cannot ignored. skds high tudi nct rat mac ching dau that lung sorry. will gay for the poor. optional benhvien nguyen nhan dau that lung htm. dmg and real money really cool. chat page strc medical school,97,Back pain cause - Google Chrome,bị đau dưới thắt lưng là bệnh gì - google-haku - google chrome
