source,target,index,title,query
free back the office. cat personalize your desk you. sense feeling that you own this place just like your bedroom but have you. more enthusiasm and passion you might have noticed that. movement essentials desk setup for. good ergonomic chair designed. effective tips green and. nothing increases your focusing power. ing beside you will throw positive vibes and reduce the stress work you mig. most like personalize the desk with cool goodies like photos favorite. consider the greatest necessity. feeling chatty great ergonomic chair. personalize the desk like dog. you disturb you from working. who don take breaks the. can help developers multitasking and. top photo challenges for those. make side side parison with. can really help work with. effective desk setup tips for. will feel more motivated and. and therefore help double your productivity. ith cool goodies like photos favorite superhe. ersonglize the desk like dog cat any other living animal because can really nice work with. other hand the guys. have sit for long hours solve the technicalities the code which takes hours and their mind focused just the. stuck working from home. make your office eco friendly. the code remove bugs and make. away from distraction and focusing. the ultimate guide help you prepare. essentials desk setup for. error free can good sound. personalize for the best. feeling that you own this place just like your bedroom but have you ever thought bringing real. tips for the best minimalist home. applications tinti sykiénthé lfta sanomat ltalehti suom youtube facebook google eekironikks koko verkkoksuppa kotkontiori powe. his place just like your bedroom but have. lize for the best programmer desk setuppersonalize the. free back the office you from working. when you are working alongside friend you feel more. kind joke but believe not this actually works not only for developer desk setup but also other cases. fis tool when the noise around. life panion personalize the desk like dog cat any other living animal beca. the office lize for the best programmer desk setup. free back the office productivity. standing desk ergonomic chair smartoffice. more than putting the headphones. again and again greet the customers but entirely different the case the developer. for long hours sitting developers. having good ergonomic office chair essential element the desk setup. personalize for the best programmer desk setup. for seamless back the office good ergonomic chair designed. bring real life panion. nalize the desk with cool goodies like photos favorite superhero poster and. works therefore this the reason why they require good chair for programming because they don take short breaks. feeling chatty building out your office talk about bulk order rates. personalize the desk like lize for the best programmer desk setup. upperhero poster and lot other stuff and. autonomous office hybrid fordad. for seamless back the office. other punctuation marks from the chapter. canceling tool when the noise around. the duration their work,home and lighting wiz floor lamp rgbw all vrit and. philips sceneswitch led sub lamp. uri alykas battery verkkokauppai todennsko. samsung galaxy black capsule maker silver capsule maker black chrome android phone cover. awalaismet lamps white light shades wifi. products the products you last viewed. black marks from the chapter. cable package two lamps. with built dimming function approx. procurement system within kade reach. ton and luxurious design. sewing machines otterbox symmetry protective case nespresso vertuo plus deluxe nespresso vertuo next deluxe samsung galaxy samsung galaxy. applications tin sykiénthé lfa messages ltalehti youtube facebook google eekirniika koko verkkokauppa kotkontiori powe ganttiverkeokau google sheets googlekeep. lamps and bulbs airam pack halogen lamp for base. grilling and kitchen table lamps other lamp base. impact resistant double structure different sizes coffee six coffee cup sizes very sharp camera soft mic hole. cameras wiz lylampu globe amber shade. lighting studio control tubes and lamps glass tunable white shades white light. the user you wish. cameras lamps and decor. iavideo perfect finish every time make even pot coffee zoom pleasant material,405,Verkkokauppa.com - todennäköisesti aina halvempi - Google Chrome,working table design for developer – google-haku - google chrome
thisislandingpage__home and lighting wiz floor lamp rgbw all vrit and. philips sceneswitch led sub lamp. uri alykas battery verkkokauppai todennsko. samsung galaxy black capsule maker silver capsule maker black chrome android phone cover. awalaismet lamps white light shades wifi. products the products you last viewed. black marks from the chapter. cable package two lamps. with built dimming function approx. procurement system within kade reach. ton and luxurious design. sewing machines otterbox symmetry protective case nespresso vertuo plus deluxe nespresso vertuo next deluxe samsung galaxy samsung galaxy. applications tin sykiénthé lfa messages ltalehti youtube facebook google eekirniika koko verkkokauppa kotkontiori powe ganttiverkeokau google sheets googlekeep. lamps and bulbs airam pack halogen lamp for base. grilling and kitchen table lamps other lamp base. impact resistant double structure different sizes coffee six coffee cup sizes very sharp camera soft mic hole. cameras wiz lylampu globe amber shade. lighting studio control tubes and lamps glass tunable white shades white light. the user you wish. cameras lamps and decor. iavideo perfect finish every time make even pot coffee zoom pleasant material,reduced molding articulated stem. xiaomi yeelight portable led. xiaomi smart led desk lamp. flicker free flickering crowing. reduced design four lights. delivery postal code light current. flicker free vilku crowise. delivery postal code clctt ioia search word. reduced design four light modes. four ready light modes reading puter relaxation and concentration. available for dispatch immediately pcs. min from the helsinki market. home app hub support. creates atmosphere lights candle. arrive approximately wednesday thursday. see delivery costs from. xiaomi led desk lamp desk lamp light current. bluetooth controls several lights. you could pitdd myds ndisté products. home and lighting lighting floor lamps table lamps product,407,,working lamp - google-haku - google chrome
with usb charging port. snnin home app hub home app hub support. and video iaomi bedside lamp. stapled delivery not confirmed see delivery costs decorative oath. innolux tokio table lamp. delivery not confirmed see delivery costs decorative oath. was disappointed about the unsold hetsing and. available order from our warehouse pcs. unconfirmed hetsing unsold and. dimmable built mah battery wifi and bluetooth. phone meter available order wholesaler stock col. iaomi yeelight candela philips signe. voiimet available order from the wholesaler stock col. floor lamp dly lamp with usb charging port decorative lamp aly floor lamp alu. the ceiling luminous flux luminous intensity luminous intensity. hila reduced design nefa valotiaa flicker free viku vérise touch buttons. those who bought this product also bought myss naits. via video iaomi yeel. push system table lamp lamp table lamp dly lamp,hitps  verkkokauppa  catalog lowlights. min from the helsinki store. flicker free flickering crowing. via video xiaomi led desk lamp pdyté lamp. anosteln ask the first question home vmovilias erib. iaomi led desk lamp. the shelf stock kel music. applications tintlc sykiénthe lita sanomat lkalehti youtube facebook google eelectronics size verkkokauppa home office powe googlesheets googlekeep other marks from the chapter. reduced design four light modes. other items see delivery costs from. grilling and kitchen light current. verkkokauppa  pro yuy cjwkcajwtpggbhbjeiway. pet supplies delivery postal code. peril arv wednesday thursday. via video iaomi led desk lamp. available for dispatch immediately pcs. min from the helsinki market. avostels ask the first question. home app hub support. perisieil thuotohl nithd valotildd. see delivery costs from. heir approx wednesday thursday. the shelf stock kel psrr. cameras reduced design four light modes. cables arvostenu ask the first ask,410,,working lamp - google-haku - google chrome
xiaomi yeelight portable led. xiaomi bedside lamp nnolux joy. hey curvy suoskit shopping cart. home application hub tuk height. xiaomi led desk lamp. downlighter with usb charging port. flicker free flicker crow. those who bought this product also bought myss naits. wil and bluetooth usb port vibrateo. light current supplied variampo. you might like myds néists products. fixed lighting system with table lamps,finland largest watch shop. pay month for months. ask for offer this watch. wristwatches jewelry sports watches rings gifts other outlet. delivery time business days. watch search ylf among products. you will receive answer during our opening hours. tintic sukignthé ltasanomat ltaleht suom youtube facebook google elekionikks koko verkkokauppa kotkonttori powe gigantt verkkoka. seiko presage studio ghibli porco rosso snr limited edition. slimy tofmitus qtr slimy engraving,456,,"elektroniikka, koko suomi, tori.fi - google chrome"
speechless were very worried even though the situation looked very slu q_a flipping became fashionable. among the first from the bays. united the surface the court copenhagen the end the first half. moment tragic end danish technical player christian eriksen danish super tight download boring. the stands finnish fans. bad helsinki based alex palmunoksa tells llta sanom apparently. joel from the bottom fire levi. after years marriage one. which you just throw. home album antti hamalainen christian eriksen. the mystical one that appeared mexico. separately the shortening pulled and other finns close just couple years. reported fihaku zquery pets. instant into the tragic néytelmé danish technical player christian eriksen danish super pace download tylya. which was not choice. speechless were very worried because otherwise the situation looked good. told the new ones. the finnish and danish national football match changed saturday night. shortening brought the audience standstill and was pletely silent vaki cried the elf says. the elf tells how touch paper. chairman ari lahti said. the finnish football association. the atmosphere the match changed moment when the danish player stepped onto the field image. home album antti hamalainen. joel from the bottom fire spread. the jatti crater grows the swallow joined the surface kent copenhagen the end the first half. photo the finnish national team. the jatt crater grows engulfed. shout encouragement wrong originated. maarit and llkka have made money together. the finnish fans stopped for few moments the lakeside park. chairman the finnish football association. momentarily into tragic play danish technical player christian eriksen. the mysterious appeared mexico. picture the finnish goalpost. the elf tells how poignant. for the anizers the tragic match choice. speechless were very worried the situation between sill erisen looked very euro flipping became fashionable. shortened the surface the field kédpenhamina the end the first half text the tragic match. petri turunen from anyway. your husband skiing holiday and for week. joel from the bottom fire spreading. danish super pace download tylya. about christian erisen health. after all was already married. christian swashbuckler fan joni. the world nice gesture. the most read sports. from the archive bydit. danish super speed downloads tyla text. petri turunen god even from. shortened the surface the field kédpenhamina the end the first half tekstid the tragic match. hoped that the danes would answer the call and they did. ari lahti chairman the finnish football association. bad alex palmunoksa from helsinki tells ilta sanom. joni haltia says that didn e with the idea start shouting christian. applied tintdc sukiénthé lta sanomat ikalehti suom youtube facebook google elekroniicks koko verkkokauppa kotikonttori powe giganttiverkkau googlesheets googlekeep blueberry brand chapters. choice that does not. the atmosphere the match changed moment when the danish player stepped onto the field picture. haltia tells how poignant. especially the shortening really attracted and other finns. the atmosphere the match changed instant when the danish player stepped onto the field picture. tell about the victory momentarily denmark. huh something didn notice. danish super pace download tylyd. told yule new information christian erisenini. elf tells how poignant. ari lahti told yule new information. text the tragic match. are you bitch already. bad helsinki based alex palmunoksa tells ilta sanom. text after tragic match then later turn better direction palm branch says the offer price. the anizers choice that does not. finnish supporters naked pausing moments lshelts parken was the choice. danish super speed download tylya. maarit and llkka have made money. the finnish supporters were nagging and stopping for few moments. finns tell about the shocking moments the denmark finland match. finnish supporters stood still for few moments lhelts parken was the choice. joel from the bottom fire. euro flipping became fashion. christian whiner fan joni. started shouting separate joni haltia tells ilta sanom. holiday and for week. hain says that when the resuscitation started the situation looked really bad. fan joni haltia says. the freshest the section danish super tahtilata tylya. thl corona infections were reported the. picture the finnish goalscorer. the heart patient was saved good. heart was saved good. published magazines picture the finnish goal scorer,product preferably the post office parcel machine home tori package. all announcements the sticker. applications tintlc sykiénthe lita sanomat ikalehti suon verkkokauppa home office powe gigantiverkkau google sheets googlekkeep other age marks from the chapter. thursday premises cars apartments tori shops. gtx nested and hype. when you shop for the product agree with the seller whether you will receive the letter. craving type myydadn limoitomat jatedte temaén,466,,"elektroniikka, koko suomi, tori.fi - google chrome"
atte thé tho ctia hai adi. omiyage via lru niém aam. state the art ear. trann chi clia flower yota. glue ball that tir nhat you. acacia ball that tir you. non tir nuc mat trdi moc. bungu cafe cafe kiem van. video pop cookie play. fade the nurérc mat trdi moc. you want eat sushi. ueq bueg cia sushi knong. the best the light. gido virgin irodori english. how long have you been and how long have you been. you can banbo loy. bst listen thust cia ntk. kenzo duroc costs million. via trann chi ciia flower yota. atte tho cda two adi. applications tintdc sykiénthe lfa sanomat mhalehti suom youtube facebook google eekironiicks koko verkkokauppa kotkontiori powe gigantitverkkokau googlesheets googlekeep muutkijanmarkt lukulsta kilalavn thuc. applications tintdc sykiénthe lfa sanomat mhalehti suom youtube facebook google eekironiicks koko verkkokauppa kotkontiori powe gigantitverkkokau googlesheets googlekeep,diengiadung maylocnuoc thietbinhabep dogiadung shavings. insert your mat into the cutting edge the world but you won have spend money press. trangchii tintdc japanese old. mugi who ming around and mudi plays the role ladder sneaking behind the scenes later. let have quick chat with the hotline tuvnmuahang tintec tuydndung. mugi who ing around and mudi the role followed chi and munity outside later. harvest what gip gip for you. delicious thom and and the name the owner the address for the mdi andn speak delicious friend. the best sushi the world. you are the sushi chef you are called mon. applications tintc sukién the lta sanomat maleht suom youtube facebook google hektroiiks koko verkkokauppa mustkijanmerkt from chapters. applications tintdc sykiénthe lfta sanomat mtalehti suom youtube facebook google eekironiicks koko verkkokauppa kotkontiori powe giganttiverkkokau googlesheets googlekeep. applications tintlc sykiénthe lfta sanomat mtalehti suom youtube facebook google eekironiicks koko verkkokauppa kotkonttori powe gigantitverkkokau googlesheets google keep mout kijanmerit from the book. according the official website the cdu and the sushi barista bit middle aged man where did you sushi con duge called. not place eat and drink sushi restaurant that loved customers you bigt sushi cing billiards. what does the for you. why sushi young thanh men quoc dan the most famous person related articles. the most famous person the world the man who didn want play music didn want have sex. according the official website the city there clia mon sushi chinese teacher. did you clean cita stupid good understand why this delicious andn qudc. how can help you hom. iehg tourists when they the beach nude and naked and they really like. diengiadung maylocnugc thietbinhabep dogiadung baohanh. the most beautiful woman the world the most famous person the world the woman who doesn have the music the woman who doesn have the music the woman who the middle the night. kotionttori powe giant web site googlesheets googlekeep,486,,vì sao sushi được xem như culture in japan - google-haku - google chrome
tags how make sushi cdch iam sushingon how make sushi tainha sushi. how make your father song you can right your ear. hey let try this sushi now let your family chic you bar shang. time right your family ears,why people often give wasabi sushi sashimi gitra and . why does gari receive different sushi cuds from each other.   monngon nhung nguyen lieu lam sushi nhat khong the thieu. danger for sirc khde hours. matdinh dudng how sushi,518,Task 2 - Van Hoa (No Index) - Google Docs - Google Chrome ,"về mặt dinh dưỡng, sushi nào tốt? - google-haku - google chrome"
paste iima formatting trlshiftsv. clear formatting ctrin google. just add text ctrl shift. vématdinh dudng sus copy ctrlsc. select all text matches. cover the normal text accordingly. médritele mat dinh dudng ctrl shift.   monngon nhung nguyen lieu lam sushi nhat khong the thieu. applications tintdc sykiénthe lfa sanomat mtalehti suom youtube facebook google eekironiicks koko verkkokauppa kotkontiori powe gigantitverkkokau googlesheets googlekeep. explore meit dinh duting ctrl alts shiftl. star gari thisdng add keep.   monngon nhung nguyen lieu. information advertisements panies women search activities moderation neutral since privacy terms use settings. matdinh dudng what sushi. redo cttshiftsz okilene onneant. turn the page horizontally,don fet install the heater the back the refrigerator and freezer and heat for days bankalzheimar. sashimi all inclusive package that includes many dishes ngir kiem luon and bach tudc all about children. sashimi all about the total amount money single high low lvon and bach tudc all. vegetarian sushi better than vegetables but delicious ingredient make sushi though. the sales sushi are just good for coal heart and business you can get. and ting iat vira the two severances are paid then called sashimi. the sushi mons don have packed gbm bag happy say that loves the two schools school vegetarian. please however this material always the list contests such sushi restaurants besides girng ngam. why does gari receive different sushi cuds from each other. get omega the morning. sashimi all about the amount money every meal single high low lvon and bach tudc all. meter cooking time and sushi ice cream you can clean the area while you are safe. sushi divided into many different types because when  and other resources are forced. hwong charge singing sushi and sashimi are widely known japan and the world. dong state ciing gitip directly because the development area but not kill the general population. years old the two them are sent each other will able call sashimi. dong bang clings gilips because the development but doesn like die general personally know that the food delicious and safe for sushi way. taller but baby sushi includes many different bars. sorry for the strc. risk life threatening plications cost rare another danger eliminated due. sushi contest hop hop gitta dwra chut dwra chut ndm ndm hand hand and head lwa chon tet for strc. because the raw material for the sushi not cooked the chef charge the sushi and sushi balls are not available. the sushi test all good. thrc can kill bacteria and sterilizing bacteria however few people like and. ciing gitp gidm mirc ctia one including gdm pcb pbdes and. sushi divided into many different types for example when piling and other materials are forced hand. sashimi chi includes many dishes ngtr hdi kiem luon and bach tude all over the place. ongoing addition the fact that sushi team has been tested for strc use the gilp personal protective equipment maintain the safety sushi how ttong npnngie jam. taller but baby sushi includes many other ingredients. the sushi mons don have packed gbm bag happy enjoy the new school year. the page translation the standard for the pression art and music particular sushi general addition nau chin. sushi contest hop hop gitta dwra chute dwra ndm hand hand and wife that what iwra chooses for strc. called nigiri sushi when cut cut times maki sushi and. sushi tet for strc khde catrs flea dinh dusng. the two singers are happy then they will able call sashimi. danger for sirc khde hours. the way the main menu sushi and ooze for the heart well other dietary supplements. more than that the structure omega fatty acids long lasting general will talk about nutrition with nutritional content that can reduce the science fatty acids. the ban quan tam. the future you don want chat you can chat with students and give you lot nutrition different types language. the ban quan tama. however the few men the list fda remending children young and pregnant and women who are pregnant pregnant. why people often give wasabi sushi sashimi gitra and . call the locator thw. love parents give bii ham irong thien high. gyor taller but sushi includes other ingredients feet. sushi sales are just good for coal heart and business better design. cing member the staff ice cream sushi can used clean the area while you are safe. don waste the biogas the next shift and the temperature for days. showing off this talent has always been found petitions such sushi restaurants besides girng ngam. tuong nhu kiem map cling ham lrong thily ngan high don know what with sushi. was born and declared full swing vira the two hotels are the main agents they will called sashimi. send the cancer department. many thanks but general children and young people press this picture. drink omega the morning. nipivien vtv tat uat wewwiyiett. detained when was finished change the diet and use the fat cholesterol and calories omega. test for the heart just like knife for other nutrition. but you want restaurant eat sashimi called sushi. since the raw material for the sushi pression not available many people are worried that the sushi will not sanctioned.   monngon nhun sushi nhat khon. love for the heart just like knife for other purposes. when you are the middle the night call nigiri sushi,519,,"về mặt dinh dưỡng, sushi nào tốt? - google-haku - google chrome"
