source,target,index,title,query
thisislandingpage__while the federal munications mission regulates only radio frequency. gps signal not harmful. mode pared mobile phone call which transmits voice data continuously you. english built mobile phone. fields for humans the tractive gps tracker plies with the same electromagnetic. general but that not the case gps has several dozen satellites owned they. similar other words exposure limited just like with any product. others generate electromagnetic fields such your cell phone,relevant data transmissions occur average every minutes default tracking. người thường đồn đại rằng những tín hiệu của gps nguy hiễm cho sức khỏe nói. when you talking your cell phone that could watts transmitting few. can expect even less exposure electromagnetic fields and signals. với các trường điện tín hiệu hơn. dựng trong điện thoại. the tractive gps plies with all guidelines and does not exceed european and. produces electromagnetic field such your mobile phone. regulations other words exposure limited just with any other product that. quay quanh quỹ đao trái đất mỗi tinh gởi những tín hiệu đến mỗi một dung. hiệu nghĩa không hại cho thể trên thực điện thoại thông minh wifi. nếu gps theo dõi được chế tạo cho thú cưng còn toàn như vây thì gps dụng. thoại khoảng watts được truyền rất gần đầu bạn vây gps chỉ nhận tín. tuyến cho con người thiết theo dõi gps tractive tuân thủ các quy định. tin hiệu gps không hại. tương nói cách khác phơi nhiễm hạn chế giống như với bất sản phẩm nào. vietnameseisúc với các trường điện tín hiệu hơn. tractive gps tuân thủ tất các hướng dẫn không vượt quá các quy định sar của. takes zero radio power the issues with and the body are all related transmission. english với các trường điện tín hiệu hơn. thoại khoảng watts được truyền rất gần đầu bạn vậy gps chỉ nhận tín. firstly the phone gps receive only does not transmit only receives receiving. electromagnetic fields for humans the tractive gps tracker plies with the same.   quora  are gps signals bad for health will the signals affect. nói tóm lại chúng chẳng cần phải lắng sức khỏe khino you have nothing.   healthtechzone  topics healthcare articles gps our. you have nothing worry about. động của bạn trong khi ban truyền thông liên bang chỉ quy định trường điện tần. truyền hay phát tín hiệu tín hiệu gps nhận được không năng lượng tuyến. while the federal munications mission regulates only radio frequency. điện chỉ hại cho thể con người khi truyền khi bạn gọi một cuộc điện. còn hại nhiều hơn kiểu mẫu gps nào bạn thể tìm được. mode pared mobile phone call which transmits voice data continuously you. centimeters from your head nêu gps theo dõi được chế tạo cho thú cưng còn toàn như vậy thì gps dụng. secondly gps itself super super weak signal es from very far away. dụng cho con người còn toàn hơn rất nhiều. tín hiệu gps không hại. gps điều quan trọng cần phải biết dụng gps chỉ nhận những tín hiệu chứ không. quay quanh quỹ đạo trái đất mỗi tinh gởi những tín hiệu đến mỗi một dụng. khác tạo trường điện chẳng hạn như điện thoại động của bạn. tín hiệu gps không hai. centimeters from your head. nếu gps theo dõi được chế tạo cho thú cưng còn toàn như vậy thì gps dụng. chung nhưng thật thì không phải vậy gps vài chục tinh hữu chúng. health leave the gps switched even when not required. người thường đồn đại rằng những tín hiệu của gps nguy hiểm cho sức khỏe nói,1272,Task 4 - Technology (No Index) - Microsoft Word (Product Activation Failed),google translate - google search - google chrome
thisislandingpage__relevant data transmissions occur average every minutes default tracking. người thường đồn đại rằng những tín hiệu của gps nguy hiễm cho sức khỏe nói. when you talking your cell phone that could watts transmitting few. can expect even less exposure electromagnetic fields and signals. với các trường điện tín hiệu hơn. dựng trong điện thoại. the tractive gps plies with all guidelines and does not exceed european and. produces electromagnetic field such your mobile phone. regulations other words exposure limited just with any other product that. quay quanh quỹ đao trái đất mỗi tinh gởi những tín hiệu đến mỗi một dung. hiệu nghĩa không hại cho thể trên thực điện thoại thông minh wifi. nếu gps theo dõi được chế tạo cho thú cưng còn toàn như vây thì gps dụng. thoại khoảng watts được truyền rất gần đầu bạn vây gps chỉ nhận tín. tuyến cho con người thiết theo dõi gps tractive tuân thủ các quy định. tin hiệu gps không hại. tương nói cách khác phơi nhiễm hạn chế giống như với bất sản phẩm nào. vietnameseisúc với các trường điện tín hiệu hơn. tractive gps tuân thủ tất các hướng dẫn không vượt quá các quy định sar của. takes zero radio power the issues with and the body are all related transmission. english với các trường điện tín hiệu hơn. thoại khoảng watts được truyền rất gần đầu bạn vậy gps chỉ nhận tín. firstly the phone gps receive only does not transmit only receives receiving. electromagnetic fields for humans the tractive gps tracker plies with the same.   quora  are gps signals bad for health will the signals affect. nói tóm lại chúng chẳng cần phải lắng sức khỏe khino you have nothing.   healthtechzone  topics healthcare articles gps our. you have nothing worry about. động của bạn trong khi ban truyền thông liên bang chỉ quy định trường điện tần. truyền hay phát tín hiệu tín hiệu gps nhận được không năng lượng tuyến. while the federal munications mission regulates only radio frequency. điện chỉ hại cho thể con người khi truyền khi bạn gọi một cuộc điện. còn hại nhiều hơn kiểu mẫu gps nào bạn thể tìm được. mode pared mobile phone call which transmits voice data continuously you. centimeters from your head nêu gps theo dõi được chế tạo cho thú cưng còn toàn như vậy thì gps dụng. secondly gps itself super super weak signal es from very far away. dụng cho con người còn toàn hơn rất nhiều. tín hiệu gps không hại. gps điều quan trọng cần phải biết dụng gps chỉ nhận những tín hiệu chứ không. quay quanh quỹ đạo trái đất mỗi tinh gởi những tín hiệu đến mỗi một dụng. khác tạo trường điện chẳng hạn như điện thoại động của bạn. tín hiệu gps không hai. centimeters from your head. nếu gps theo dõi được chế tạo cho thú cưng còn toàn như vậy thì gps dụng. chung nhưng thật thì không phải vậy gps vài chục tinh hữu chúng. health leave the gps switched even when not required. người thường đồn đại rằng những tín hiệu của gps nguy hiểm cho sức khỏe nói,secondly gps itself super super. health leave the gps switched. how use mobile phone with correct gps. page words vietnamesehups  quora  are gps signai. first the phone gps only. and sent from not partic. typical reception mobile phone. radio power loss problems. for example when you are talking the phone. short don have worry,1273,Task 4 - Technology (No Index) - Microsoft Word (Product Activation Failed),google translate - google search - google chrome
search google for firstly the phone gps receive only. typical reception mobile phone about dbm that secondly gps itself super super weak signal es from very far away. and sent from not particularly powerful satellites that emit all directions. you and the body. oxford dictionary firstly the phone gps receive only. secondly gps itself super super weak signal es from very far away. typical reception mobile phone about dbm that. receiving taken read selection. google  search google translate sxsrf aoaemvj lhsruupegnqjvppkwuzkrmb snktyy fao epwd,couch staring the word acceptance written her. inpatible with our culture but also because seems like. disdain surrender weakness defeat and vulnerability. anger though rare certainly reared its head moments. fight the bloodiest battle ever endure rarely. surrender meant admitting that ben was really gone. but the wake any kind loss must eventually. accept what can change control this. seemed final permanent like giving will. concede and hate the idea throwing the towel. survive live white knuckle world with white flag. feels unnatural not only because grossly. whiteboard and thinking impossible. personal affront strength and fortitude and ability. but remember sitting counselor deep cushioned. consciously putting our pain the hands the savior,1275,"give Him the hurt, the questions, the fear - ghidanhwtc@gmail.com - Gmail - Google Chrome",google translate - google search - google chrome
how use cellphone with gps safe. how use cellphone with gps safe search google,vibration free sim data speed. with the above harmful effects necessary limit the use phones children from early age understand that baby locator watch. locator watch for kids. green free sim data hair. high speed dataa color. green free sim data speed. with the above harmful effects necessary limit the use phones children from early age understand that baby kida locator watch with keyboard. taste for children years old grade ihan. models locator watch for. purchase leave phone number. support vietnamese increase sim. suitable and best color. the best the three. gps wifi locator watch. grade school age parents should buy. years old grade should buy. taste for children years old grade. back smart watch account,1278,Những tác hại của điện thoại đối với sức khỏe của trẻ em mà các chuyên gia không muốn ba mẹ biết - Google Chrome,sử dụng điện thoại có gps sao cho an toàn sức khỏe - google search - google chrome
thisislandingpage__vibration free sim data speed. with the above harmful effects necessary limit the use phones children from early age understand that baby locator watch. locator watch for kids. green free sim data hair. high speed dataa color. green free sim data speed. with the above harmful effects necessary limit the use phones children from early age understand that baby kida locator watch with keyboard. taste for children years old grade ihan. models locator watch for. purchase leave phone number. support vietnamese increase sim. suitable and best color. the best the three. gps wifi locator watch. grade school age parents should buy. years old grade should buy. taste for children years old grade. back smart watch account,google will review all android apps that request location permission. ogle  his latitude and longitude are still tracked heart hortons. track user location tom tom turn confess. for the women prize begins savagely witty deep dive into the black hole. quickly the thieves knew when the owner left the house when etc. google location data accidentally turns innocent people into theft suspects. how locate people phone. turn off location tracking windows. what gps the pharmaceutical industry. conspiracies leaks users can suffer enormous damage both terms physical health. waiting for  google  reach this man latitude and longitude still being tracked heart hortons. one talking about this. detailed progress table decoding feeling truths about how download play. location and travel schedule the victim what easier for criminals know the object. instructions prevent google from tracking your location. how find where save minecraft windows edition. use the smartphone location tracking feature safely you can apply some. how change the taskbar position windows. more dangerous all this happens without the user even knowing next. carefully and responsibly always make sure that the smartphone only tracked and. share the data that has the least impact your life. google still tracks your location even when location history turned off. district chi minh city from your address update location. check and remove apps that collect untrusted location data. google there are also lot panies that provide location tracking services and course they sell the data. waiting for  google  blame leak the user can suffer tremendous damage both terms physical health. vdo has had countless cases being tracked attacked kidnapped stolen because criminals can track your location. century both terms physical health and personal wealth calculate. how locate someone else phone global positioning system. like any other technology you should use location tracking your smartphone. turn off location when not use. how share location zalo send location others super easy. leaks users security and safety both personal health and personal property are affected. how know phone tracked. data collected from users for many applications without the user permission. vdo breach leak the user may suffer extreme damage. that aiming for moving deserted place house can emptied. prevent uber from tracking your iphone location when you not using the app. great period both terms physical health and personal wealth calculate. not give your smartphone stranger untrustworthy person avoid installing tracking software. how use location tracking safely. social media then confronts real life tragedy and transcendence. the distance his latitude and longitude still being tracked the heart hortons.  quantrimang  tim tri luu minecraft windows edition. turn off your network connection when you don need. next breach leak users may suffer extreme damage. termspeople also search for. people also search for. the american ic memoirist first novel shortlisted. how you know your phone being tracked,1279,Theo dõi vị trí trên smartphone: 1 lợi 10 hại - QuanTriMang.com - Google Chrome,sử dụng điện thoại có gps sao cho an toàn sức khỏe - google search - google chrome
thisislandingpage__google will review all android apps that request location permission. ogle  his latitude and longitude are still tracked heart hortons. track user location tom tom turn confess. for the women prize begins savagely witty deep dive into the black hole. quickly the thieves knew when the owner left the house when etc. google location data accidentally turns innocent people into theft suspects. how locate people phone. turn off location tracking windows. what gps the pharmaceutical industry. conspiracies leaks users can suffer enormous damage both terms physical health. waiting for  google  reach this man latitude and longitude still being tracked heart hortons. one talking about this. detailed progress table decoding feeling truths about how download play. location and travel schedule the victim what easier for criminals know the object. instructions prevent google from tracking your location. how find where save minecraft windows edition. use the smartphone location tracking feature safely you can apply some. how change the taskbar position windows. more dangerous all this happens without the user even knowing next. carefully and responsibly always make sure that the smartphone only tracked and. share the data that has the least impact your life. google still tracks your location even when location history turned off. district chi minh city from your address update location. check and remove apps that collect untrusted location data. google there are also lot panies that provide location tracking services and course they sell the data. waiting for  google  blame leak the user can suffer tremendous damage both terms physical health. vdo has had countless cases being tracked attacked kidnapped stolen because criminals can track your location. century both terms physical health and personal wealth calculate. how locate someone else phone global positioning system. like any other technology you should use location tracking your smartphone. turn off location when not use. how share location zalo send location others super easy. leaks users security and safety both personal health and personal property are affected. how know phone tracked. data collected from users for many applications without the user permission. vdo breach leak the user may suffer extreme damage. that aiming for moving deserted place house can emptied. prevent uber from tracking your iphone location when you not using the app. great period both terms physical health and personal wealth calculate. not give your smartphone stranger untrustworthy person avoid installing tracking software. how use location tracking safely. social media then confronts real life tragedy and transcendence. the distance his latitude and longitude still being tracked the heart hortons.  quantrimang  tim tri luu minecraft windows edition. turn off your network connection when you don need. next breach leak users may suffer extreme damage. termspeople also search for. people also search for. the american ic memoirist first novel shortlisted. how you know your phone being tracked,what pop the type. what the application gps your bad the gps system takes long that also why sometimes. the intersection the three circles your position. black shampoo gray hair. what jade locust logout log. your movement when receiving the signal least four satellites the machine will output the position three. afternoon once your location has been calculated then smartphone devices android windows phone ios can. what off sign out. what the application gps. calculate other information such travel speed direction motion tracking travel distance. what are parental controls way. what iridium edge solar power logout log. destination distance and more. you have lost gps signal your mobile device may connected satellites but satellites are still. smartphone devices must receive the signal least three satellites give two way position and track. your bad the gps system takes long that also why sometimes,1280,GPS là gì? GPS hoạt động như thế nào? Ứng dụng của GPS - Wiki Máy Tính - Google Chrome,sử dụng điện thoại có gps sao cho an toàn sức khỏe - google search - google chrome
thisislandingpage__what pop the type. what the application gps your bad the gps system takes long that also why sometimes. the intersection the three circles your position. black shampoo gray hair. what jade locust logout log. your movement when receiving the signal least four satellites the machine will output the position three. afternoon once your location has been calculated then smartphone devices android windows phone ios can. what off sign out. what the application gps. calculate other information such travel speed direction motion tracking travel distance. what are parental controls way. what iridium edge solar power logout log. destination distance and more. you have lost gps signal your mobile device may connected satellites but satellites are still. smartphone devices must receive the signal least three satellites give two way position and track. your bad the gps system takes long that also why sometimes,track save battery android phone. have you been lied. check the health iphone android with phone doctor plus. top applications monitor internet connection smartphones and perform the test and the following will article how. top apps monitor internet connection portable smartphone. nail your petitor analysis. how check the phone again and perform the test and the following will article how. easy steps with semrush. check network capacity phone. instructions check internet speed phone. how check your phone being tracked. check check the phone tracked not,1281,"Cách kiểm tra điện thoại bị theo dõi, check Android, iPhone có bị theo - Google Chrome",sử dụng điện thoại có gps sao cho an toàn sức khỏe - google search - google chrome
thisislandingpage__track save battery android phone. have you been lied. check the health iphone android with phone doctor plus. top applications monitor internet connection smartphones and perform the test and the following will article how. top apps monitor internet connection portable smartphone. nail your petitor analysis. how check the phone again and perform the test and the following will article how. easy steps with semrush. check network capacity phone. instructions check internet speed phone. how check your phone being tracked. check check the phone tracked not,dementia however this very slim chance scientists have confirmed. just remember always keep the brain sharp and active and there. lesser chance developing memory disorders some research before ensure that you have enough. that using the navigation devices can slow down the full potential the. overall health but that. simply not true gps has few dozen satellites its possession which. receive signals which means they aren bad for you matter fact. effects the human body only harmful when about transmission. navigation does make somewhat lazy therefore bee slightly. why not experiment daily weekly with new routes such your travel. this does not mean that have stop using gps technology especially. agnetism and the negative. suggest that keep your hippocampus healthy and prevent illness you. use other gadgets that causes more harm our body and makes our. hinnocampis hich part our brain that vital for formina nowdefending inerrancy. breaking the myth gps signals are dangerous. the gps device only receives. brain feel unchallenge and lazy phones and routers. device are just too powerful. hippocampus which part our brain that vital for forming new. should and exercise your brain regular basis for using the gps. the gps receive takes. tip being lazy makes you unhealthy. signals doesn transmit them the signals that the gps receive takes. previously established the signals that gps device receive aren. however using gps has bee helpful tool with everyday life. these devices are both affordable and reliable but still people have. for the human body. there rumor that gps signals are bad for your overall health but that. happen orbit around the earth and every one them broadcasts signals. every gps device the important fact that the gps device only receives. about this technology and how affects our well being for instance there. non radio power when you talk about electromagnetism and the negative. lesser chance developing memory disorders healthtechzone  topics healthcare articles gps our health htm. work your nearest supermarket when you running errands. being for instance there. smartphones and routers make much more damage you than any. memories also associated with learning and emotions gps car. the moment you make phone call there about four watts which are. you the great thing that. but still people have. you prone developing memory affected diseases such alzheimer and. prone developing memory disorder. your game starts here. being transmitted very close from your head clear gps only. gps model you could find. information possibly buy the best car gps for you the great thing that. dangerous our bodies but the usage navigation technology can make. healthtechzone  topics healthcare articles gps our health htm. mon notion that the signals the gps device are just too powerful,1282,GPS and Our Health - Google Chrome,healthtechzone gps - google search - google chrome
  healthtechzone  topics healthcare articles gps our,although gps not harmful the brain you depend too much.   healthtechzone  topics healthcare articles gps our,1286,Task 4 - Technology (No Index) - Microsoft Word (Product Activation Failed),healthtechzone gps - google search - google chrome
