source,target,index,title,query
the time its annexation the roman empire. the lord his god was with him the basis for solomon. davidic solomonic rule israel the theological notions divine. and many the cappadocians. spelling research thesaurus word. wisdom see ments divine presence directly connected. the remark that solomon established himself firmly over his. schools gymnasiums and temples. similar statements divine favor made regarding david. katha crole ande zaua analla and. located plateau the north. argaeus caesarea developed into. govemments place the procurators did little alter the existing. reign archelaus archelaus renamed the city caesarea. monarchy from until cappadocia with only two significant. served the capital city for the. side the thirteen thousand foot. the roman governors the cavalry class replaced the monarchy cappadocia from. roman rule provided catalyst. books google  books esd aaqbaj printsec frontcover onepage false. roman procurators equestrian rank replaced the cappadocian. for more urban development but. honor emperor caesar augustus. several royal succession contexts including rehoboam. kingdom succinct way summarizing the details solomon. get this book print form. cable badoc has only two important cities tyana and mazaca. asa jehoshaphat and amaziah uzziah and may. however did boast several. strength and success also see reflection below with solomon. the leading roman city the. region not until the fourth century. volcanic snow capped mount. the growth cities was slow. connects solomon with the divine favor the davidic dynasty via. cities tyana and mazaca the. roman empire posed unique situation for rome without municipal. election presence and enablement are all succinctly noted within this. imply implicit challenges any regular changeover god presence. rome came from the large slave. the chronicler begins his account solomon reign. transition power note the similar summary statement kings. beginning his reign the chronicler uses similar phraseology. cappadocian kings through the. opening statement chronicles addition this opening remark. the lower classes lived feudal villages. following two chapters summarizing solomon actions the. emphasizing god favor solomon during the transition from. the building the temple. time its incorporation into the,and chronicles frederick mabie. thedtl worldcat a thedtl worldcat  search querystring and chronicles frederick mabie clusterresults true groupvariantrecords false. grand rapids mich zondervan. expand search with related terms. content tvnea thedtl worldcat  search querystring and chronicles frederick mabie clusterresults true groupvariantrecords false. libguides thedtl  dtl idm odc  php. print print book rev. search digital theological library. edwin yamauchi elaine phillips elmer smick elmer bernard. thedtl worldcat a libguides thedtl  dtl idm odc  php. authors tremper longman david garland frederick mabie frederick james. zondervan illustrated bible backgrounds mentary,907,Home - CDL Expositor's Bible Commentary (1st & Rev. ed.) - LibGuides at Digital Theological Library - Google Chrome,1 and 2 chronicles frederick mabie | search | digital theological library - google chrome
books google  vn出 app. and chronicles frederick mabie. libguides thedtl  dtl idm ocdc  php. books google  vna libguides thedtl  dtl idm ocdc  php,and many the cappadocians. spelling research thesaurus word. schools gymnasiums and temples. katha crole ande zaua analla and. located plateau the north. argaeus caesarea developed into. govemments place the procurators did little alter the existing. reign archelaus archelaus renamed the city caesarea. monarchy from until cappadocia with only two significant. served the capital city for the. side the thirteen thousand foot. roman rule provided catalyst. roman procurators equestrian rank replaced the cappadocian. for more urban development but. honor emperor caesar augustus. năm đến tận năm scn cáp đốc chỉ hai thành phố quan trọng tyana mazaca. however did boast several. the leading roman city the. region not until the fourth century. volcanic snow capped mount. the growth cities was slow. những tổng đốc thuộc tầng lớp thay thế cho nền quân chủ của cáp đốc. cities tyana and mazaca the. roman empire posed unique situation for rome without municipal. hăm đến tận năm scn cáp đốc chỉ hai thành phố quan trọng tyana mazaca. rome came from the large slave. cappadocian kings through the. the lower classes lived feudal villages. vào lúc sáp nhập vào quốc tạo một tình huống đặc biệt. vào lúc sáp nhập vào quốc tạo một tình huống đặc biệt cho. time its incorporation into the,910,1803 1 Peter E DỊCH - Microsoft Word (Product Activation Failed),dđặt ra một tình huống đặc biệt - google search - google chrome
waiting for  google  anh shady trees bamboo grown for food. was established with only six bamboo buckets rescued from the wild now after. non profit panda breeding and research facility chengdu was established. abo bear and oung dissolve the lips closest nhien givn well. she the national treasure china the most flexible when being fed from about. for more than years this place now nurtures about pandas from large small. hours minutes hours after that time they have the habit enjoying sleep. overseas experts join hands overe the pandemic. belonging the species giant panda red panda the base also the mon roof for,june env launched online campaign mobilize the participation famous artists. are the end life. the bear keeper will soon end the bear captive operation and transfer the remaining bears. the success the petition has once again shown young people. the context that captive bear farming longer economically profitable and most bears are present. online campaign support take action together for the bears vietnam. bears propagate the legal regulations not extracting bear bile not and keeping bears captivity. put end bear farming. but the future ruler the country paying more attention and has better awareness. june env launched online campaign mobilize the participation the best artists and contests. the future people the country are paying more attention and have better awareness. from more than letters received high school and high school students from all over the country. since the beginning env will send mailing packages letters bear owners across the country this. the school broadcasts radio telling people not use bear bile and informing the. addition env also sends letters postcards and some cases face face meetings with farmers. not registered the same time persuade the bear owner transfer the remaining individuals the rescue center,915,Chiến dịch bảo vệ gấu - Google Chrome,bảo vệ gấu trúc khỏi tuyệt chủng - google search - google chrome
thisislandingpage__june env launched online campaign mobilize the participation famous artists. are the end life. the bear keeper will soon end the bear captive operation and transfer the remaining bears. the success the petition has once again shown young people. the context that captive bear farming longer economically profitable and most bears are present. online campaign support take action together for the bears vietnam. bears propagate the legal regulations not extracting bear bile not and keeping bears captivity. put end bear farming. but the future ruler the country paying more attention and has better awareness. june env launched online campaign mobilize the participation the best artists and contests. the future people the country are paying more attention and have better awareness. from more than letters received high school and high school students from all over the country. since the beginning env will send mailing packages letters bear owners across the country this. the school broadcasts radio telling people not use bear bile and informing the. addition env also sends letters postcards and some cases face face meetings with farmers. not registered the same time persuade the bear owner transfer the remaining individuals the rescue center,australian animals standing. this food is not an ineffective medicine to replace medicine. entertainment culture. business card sports world legal education. protect elephants from danger. connecting the machine. the animals are preserved in time in advance. connecting a lot. science and technology. science and technology sunday. humanity was almost perfect. google uses artificial intelligence. panda conservation. sign vtc with google. artificial intelligence. biologists recommend a species to be conserved in time. breathe the wave. injury after an increase in the amount of pre-critical habitat protection. video tens of thousands of koalas die in fire and are in danger of extinction. wonderful creatures. strains after the fire disaster,916,Những động vật được bảo tồn kịp thời trước nguy cơ tuyệt chủng - Google Chrome,bảo vệ gấu trúc khỏi tuyệt chủng - google search - google chrome
super deals buy fun tickets. how damaged your skin. lazy walk vietnamese puppeteers. play free hotel room. ways find enough excuses evade. when exfoliating too much. storms when telling customers tip. the guy who works the bar causes. thousands dong just want get. tips cure bad breath god,isnguyen but also neighboring mountainous provinces. china giant panda species escape the danger extinction. this number old enough describe the genetic diversity this species the equinox. deputy general director techbank. america first lady interested chinese pandas. that total pandas lived captivity. the pressure only the province but also the neighboring mountainous provinces. nepal the last two jumping bears were successfully rescued. according data from the national forestry and grassland administration the number giant pandas living. the wild now increase individuals from the decade. deputy general director techbank but also neighboring mountainous provinces. aika naynay trung quoc loai gau truc khong thoat khoi nguy tuyet chung post html. vietnam located which province. what the wonder vietnam. this number old enough annoh the genetic diversity this species the year naynay trung quoc loai gau truc khong thoat khoi nguy tuyet chung post html. this square kilometer national park for pandas yang chao. longformay square kilometer national park for pandas yang chao. close shaanxi and gansu,918,Trung Quốc: Loài gấu trúc khổng lồ thoát khỏi nguy cơ tuyệt chủng - Google Chrome,bảo vệ gấu trúc khỏi tuyệt chủng - google search - google chrome
national park wide for the bamboo bucket yang chao quan. national forestry and grassland said news conference thursday. nguyen developed the genetic capital system.  ngaynay trung quoc loai gau truc khong thoat khoi nguy tuyet chung. industry and national park said news conference thursday. creating pandas mon procedure because female pandas can only bee pregnant for three days. which countries are making such efforts. the national forestry and grassland administration said press conference thursday. square kilometer national park for the bamboo bucket yang chao official the bureau. giant panda creating advanced sperm and stem cell help fertilize the nucleus. wide national park for pandas. the ovulatory cycle reported sky news. wide national park for the bamboo bucket yang chao official the forest bureau,injured while the red wolf listed endangered china yuan shaanxi and gansu. this conservation group also lists leopards and snow leopards vulnerable. injured while the red wolf listed endangered. yuan shaanxi and gansu china,924,Nhiều động vật ăn thịt lớn đang biến mất trong khu bảo tồn gấu trúc - ThienNhien.Net | Con người và Thiên nhiên - Google Chrome,mỹ bảo vệ gấu trúc khỏi tuyệt chủng - google search - google chrome
thisislandingpage__injured while the red wolf listed endangered china yuan shaanxi and gansu. this conservation group also lists leopards and snow leopards vulnerable. injured while the red wolf listed endangered. yuan shaanxi and gansu china,"marine principle school. the fourth survey of pandas by the forestry administration of vietnam. i am a member of the vietnamese community. i will build more. according to the website of china environmental ecology today. the removal of the giant panda from the endangered list shows zones. day of may. cdn old screen shot png. completely meditative. chinese national made panda live show show. pho morning love. solution to live with covid vice president visit vietnam. save chinese panda. saw their habitat improve as well as the forces of the medium. raccoon burrowing thailand. borrowing bamboo from thailand must pay china. public cinema. removed from the list of endangered species after clearance. waiting for play google . donated to the hospital. china announced the good news that the panda is no longer there. million for china. my home contest is happy. highly virulent poultry. the world's oldest giant panda has died in china. desired message. blood cholesterol to prevent stroke. putin smiled at the gift of a panda from china. cdn tuoitre screen shot png build more. tvyen shaanxi camsu. viet nam htme calendar, young life rhythm, culture, entertainment, sports, education, science, health, fake news, readers. i am a chinese student who is different from htmin covid. general phan van giang. panda at a zoo reuters photo. i am planning to pay the panda to pay millions to china. refreshing cool. diana consecrated connection. boundary principle field. highest bitcoin price ever. the years china conducts quantitative surveys. nature conservation is doing a good job of preserving biodiversity. with nattoenym red rice help reduce. singapore warns of the risk of building more. pandas at a zoo light reuters. asean needs to be steadfast. animals you plan to pay pandas for rent. tto eco-environment china said what kind of name panda. girl who won the nobel prize. flu outbreak detected. pandas these surveys are conducted once a year in focus. schedule young life rhythm culture entertainment sports education science health fake real readers. cooperate before meeting face-to-face. new nuclear reaction. potential electricity bill when. peace wedding ceremony. panda borrowed from thailand. sea ​​level rise. comment world. endangered species in nature. yan shaanxi gansu. japanese raw material coagulation. sales on youth classifieds. save the chinese panda other species. flu was detected. the amount of panda body in the wild increased to about the donor. countries in helping them integrate into the ecological environment. wide access to customers. canadian zoo returns bamboo chinese pandas. nature of pandas increased. however, year to year increases with child year. have to pay china. central leadership. waiting to play google calendar young life rhythm culture entertainment sports education science health fake real readers. taliban controls afghanistan. merciless with lice. submerge the east. i may interest you. singapore branch of bad luck",925,"Trung Quốc báo tin vui, gấu trúc không còn là loài nguy cấp trong tự nhiên - Tuổi Trẻ Online - Google Chrome",mỹ bảo vệ gấu trúc khỏi tuyệt chủng - google search - google chrome
where the lockdown over. award for vietnamese female storyteller. why does the want punish. challenge china epidemic outbreak. the ministry health conditionally approves the vaccine. vietnamese people from murder. translator saves group people. tto the health ministry has conditionally approved for the need. connect resources support youth start ups. received special award for innovation. urgent need epidemic prevention for. the country you stand front,  googleadservices  pagead aclk cjbmgjjqlyacyd_hutoupyno iajzx mnzfenplzwdokk pshfxabiirxnspgwbx daabyiti qhiaqkoawhia keqgtvak_qabn jnoq efj. weather forecast today sea area. establish secure connection inner. water may increase dong liter this afternoon. the ecuadorian history urges the not let the backyard. accumulez vous des ampoules. recycflu has mutation the sars cov gene sequence. help the mother relieve the problem pregnant woman eating samosa. what will happen china when canceled countries. south china mornig assy. covid news recorded more. sars cov gene sequence. hcmc recorded additional cases. study after pleting the injection. can pregnant women eat vegetables reasons for mother. digital conversion for business. voh  south china momiing post battery language website. recyclez les gratuitement mutation occurred. new regulations fire and explosion insurance premiums. regional world cup qualifying schedule. america opened its border after nearly years tourists from all over the world poured. recyclez les gratuitementam encroaching human land encroaching panda habitat very. cambodia heavy fines for people who post pictures police sleeping meeting. weather forecast chi minh city today and today. covid epidemic still affects many countries. from thua thien hue mau there are showers and rain. tomorrow thunderstorms the evening. should know clarify questions,935,Gấu trúc Panda ra khỏi danh sách động vật nguy cơ tuyệt chủng - Google Chrome,mỹ bảo vệ gấu trúc khỏi tuyệt chủng - google search - google chrome
thisislandingpage__  googleadservices  pagead aclk cjbmgjjqlyacyd_hutoupyno iajzx mnzfenplzwdokk pshfxabiirxnspgwbx daabyiti qhiaqkoawhia keqgtvak_qabn jnoq efj. weather forecast today sea area. establish secure connection inner. water may increase dong liter this afternoon. the ecuadorian history urges the not let the backyard. accumulez vous des ampoules. recycflu has mutation the sars cov gene sequence. help the mother relieve the problem pregnant woman eating samosa. what will happen china when canceled countries. south china mornig assy. covid news recorded more. sars cov gene sequence. hcmc recorded additional cases. study after pleting the injection. can pregnant women eat vegetables reasons for mother. digital conversion for business. voh  south china momiing post battery language website. recyclez les gratuitement mutation occurred. new regulations fire and explosion insurance premiums. regional world cup qualifying schedule. america opened its border after nearly years tourists from all over the world poured. recyclez les gratuitementam encroaching human land encroaching panda habitat very. cambodia heavy fines for people who post pictures police sleeping meeting. weather forecast chi minh city today and today. covid epidemic still affects many countries. from thua thien hue mau there are showers and rain. tomorrow thunderstorms the evening. should know clarify questions,that case the government has role guide them gentle way careful about how live together. extremely strict since the wildlife conservation law was introduced. the wild letting people live animal sanctuaries when the. china the panda has long been considered national treasure and protected.  media cldnry nbcnews  image upload t_fit f_auto g_auto best newscms pandas jpg build close relationship stick. build close close relationships. extremely strict since the wildlife conservation law was introduced the year build close close relationship. and the same time protect this precious animal,936,Gấu trúc chính thức không còn là động vật có nguy cơ tuyệt chủng ở mức “nguy cấp” | VTV.VN - Google Chrome,nước nào bảo vệ gấu trúc khỏi tuyệt chủng - google search - google chrome
growing importance due the negative impacts human activities wildlife. support the implementation policies designed protect wildlife many independent nonprofit anizations well. the purpose this ensure that the natural world will protected protect future generations and. further the conservation these animals they also have symbolic meanings creating motivation for the conservation all species. vietnam facing many challenges and still has certain limitations improving capacity and perfecting institutions investigating and prosecuting crimes the field. remember stay healthy take good preventive measures for the health yourself your family and the munity. policies legal regulations are not synchronized biodiversity conservation general and species conservation particular have not been paid due attention species conservation problem. and other wildlife species contributing the prevention natural disasters maintaining biological services. contribute the promotion wildlife conservation today wildlife conservation has bee reality. serve agriculture unbiased objective and unbiased. wildlife conservation the practice protecting wild animals and their habitats. many countries have government agencies and anizations and institutions dedicated wildlife conservation. serving agriculture and punishing this kind offender not enough deterrent. this change consumption habits animal products one the reasons behind the decline endangered species our country recent years due. different species this planet. evil objective and unbiased. help humanity realize the importance wildlife and the wild environment humans and. efforts strengthen the protection important species such rhinoceros elephants tigers and pangolins addition directly contributing. important attitude the life and socio economic development the local national and local munities. remove old style accents,waiting for their invasive  google  all which have been banned from entering the country. black market net buyers paying high prices for illegal animal products. for those who want exotic pets medical research topics and animal skins and. elephants the century are example wasn until some species whale was about. poachers and local conservation groups. native species have not yet developed natural protection for alien species and vice versa. avoid authorities and they operate. furthermore poachers have developed sophisticated techniques for smuggling animals baby bear. some these include relief from legal fraud pollution prevention and environmental loss. leopards and monkeys were placid and stuffed into suitcases for transport live animals have been sold. food for turtles causing rapid decline turtle populations because turtles can defend themselves. prevent goat population explosion the island they were forced abandon their native suckling base. other body parts are also secretly smuggled across borders and sold online. known poaching the adpushup family reduces the population the point where the species bees endangered. recover from this ban but others are still risk. human encroachment their environment. fortunately conservation efforts around the world are bent helping these animals. extinction for which countries have agreed abide international ban some whale species have. threatened have human advocates. ngo whose sole purpose prevent illegal poaching especially animals. strains unfortunately thieves are often difficult catch because they are intentionally dodging. number species are danger extinction lack restrictions the fishing industry. known poaching they can reduce the population the point where the species bees endangered. when hunters ignore the rule governing the number animals hunted fact. illegal hunting can endanger the species. avoid authorities and they operate where enforcement weak. even legal hunting fishing and wildlife gathering can lead population decline. threatened new vitality its dwindling people through series efforts. introduced the galapagos islands the century the goats feed the supply. waiting for  google  around they can. like elephants and rhinos thanks nhcushupc the international foundation anti hunting groups. inability deal with species that pete closely with them for food about muscle. waiting for  google  human encroachment their habitat. example threats posed both petition and predation the galapagos tortoise goat has origin already. international law prohibits the activity and there are number governments and non governmental anizations,941,Lý do động vật trở thành nguy cơ tuyệt chủng - Google Chrome,nước nào bảo vệ gấu trúc khỏi tuyệt chủng - google search - google chrome
