source,target,index,title,query
author hundred dresses class. author pliant like bamboo. author kobayashi dragon maid. authormapper authormapper  search aspx migraine val name athe new england center for headache val publication. search google enter url,clement alexandria suggests that paul wrote the book originally hebrew and that luke. for this book even though they didn know the author name. parallels between hebrews and paul writings. second botn clement alexandria and origen claim. the enormously influential king james bible took its cue from this tradition fact the kjv. the king james version assumes par. who wrote the book hebrews. pauline association for the book but recognized that paul himself probably did not put pen paper. author zondervanacademic  blog who wrote the book hebrews. there are handful contenders let take look the reasons each them might the. zondervanacademic  blog who wrote the book hebrews. certainly reasonable conclusion paul wrote the book hebrews many the thoughts. church tradition that mistook pauline association for pauline authorship. etc iio vtole ulc dook hedi ews. the nuanced position the authorship question the alexandrian fathers was obscured later. when you consider the wide agreement among biblical scholars about who wrote every other book. the new testament little mysterious that don know who wrote hebrews. the hebrews the tradition pauline authorship continued. translated into greek though the greek hebrews bears resemble translation greek. hebrews are similar those found paul writings. search title author and topic. you find the title translated was found some manuscripts the epistle paul the apostle,472,Who Wrote the Book of Hebrews? | Zondervan Academic - Google Chrome,author of hebrews - google search - google chrome
items reknow activity surveillance source extras. med gtét google search google chrome. gtt google search google. reknow activity surveillance source extras,items reknow activity surveillance source extras. reknow activity surveillance source extras,488,C:Program Files (x86)MicrosoftReKnow Activity Surveillancesourceextras,gtét - google search - google chrome
thisislandingpage__items reknow activity surveillance source extras. reknow activity surveillance source extras,thank you for playing fair. teamviewer sessions are free charge for personal use. this was free session sponsored  teamviewer ,489,TeamViewer,gtét - google search - google chrome
the first christian century. often the poor were tenant. poor however existed with meager. masters provided their household. gary smith poor orphan widow. the first century christianity one three people was italy and one five. the same has been wrongly oppressed. drink frugally and often. roman master gave the slaves his house food clothing and shelter there are people. lose everything their meager. farmers indebted absentee rich. person elsewhere was slave but not all slaves were poor the. and give them education however most the free but poor people eat and drink. and one out five elsewhere was. find even the barest essentials. social economic the court system often defrauds the poor being poor means being poor. slave yet not all slaves fit the. shelter some even provided the. sustenance and often quarreled. one out three persons italy. the first century one three people lived italy and one five. same category the poor roman. person elsewhere slave but not all slaves were poor. and gave them education however most the free but poor people eat. landowners crop failure meant. with education most the free. homes food and clothing indicated. slaves with food clothing and,free pigeon bag set. examples found consider adding one please. pigeon brand japanese rockstar. pigeon brand top japan charger for. got glosbe  meager sustenance. the most popular queries list. glosbe  meager sustenance. meager sustenance vietnamese english vietnamese dictionary. glosbe uses cookies ensure you get the best experience. you can try more lenient search get some results,491,meager sustenance in Vietnamese - English-Vietnamese Dictionary | Glosbe - Google Chrome,gtét - google search - google chrome
 bloomsburycollections  dtl idm oclc  book critical and exegetical mentary the books chronicles mentary,japanese officials have estimated the cost hosting the olympics. wikipedia  wiki japan the_olympic. olympic games host city summer olympics tokyo. this not surprising however because since the average. japan the olympics english wikipedia. medals subject olympic games. waiting for  google  start from survival show. short distance speed skating. may continue host the olympics the near future. japan ready apply host the winter olympics. the olympics japan has hosted japan has been the host country the olympics times. japan peted the olympics for the first time and has participated most the games since that time. remove old style accents. hosting the olympic the midst the storm covid japan suffered damage. the japan olympic mittee was founded and recognized. summer olympics which the majority gold medals are judo japan has medals the world. medals the summer olympics,515,Nhật Bản tại Thế vận hội – Wikipedia tiếng Việt - Google Chrome,nhật bản đã đăng cai olympic - google search - google chrome
thisislandingpage__japanese officials have estimated the cost hosting the olympics. wikipedia  wiki japan the_olympic. olympic games host city summer olympics tokyo. this not surprising however because since the average. japan the olympics english wikipedia. medals subject olympic games. waiting for  google  start from survival show. short distance speed skating. may continue host the olympics the near future. japan ready apply host the winter olympics. the olympics japan has hosted japan has been the host country the olympics times. japan peted the olympics for the first time and has participated most the games since that time. remove old style accents. hosting the olympic the midst the storm covid japan suffered damage. the japan olympic mittee was founded and recognized. summer olympics which the majority gold medals are judo japan has medals the world. medals the summer olympics,nagano the capital and largest city the nagano prefecture japan hosted the winter. stream your service jesus gospel minist. olympics respectively they became the first non western cities that were selected host. how many times has japan. japan got its chance host the games again this time this was the first time japan. sale ends soon limited offer. japan got its chance. however before the plan could e fruition war broke out between japan and china. japanese capital sportsstar looks the times when japan has hosted the. which led the japane. kohei jinno left who was forced leave his house two times ahead the and olympics. outside the japan olyn. read lighting ceremony starts tokyo leg torch relaykohei jinno left who was forced leave his house two times ahead the and olympics. read lighting ceremony starts tokyo leg torch relay. nagano the capital and largest city the nagano prefecture japan hosted the. olympics which took place from february sportstar thehindu  olympics tokyo olympics faq tokyo summer olympics games when has japan hosted olympics winter. which led the japanese government forfeiting its right host the games. outside the japan olympic museum near the national stadium reuters. sportstar thehindu  olympics tokyo olympics faq tokyo summer olympics games when has japan hosted olympics winter games. tokyo ahead the edition the postpone summer games the. athletics motorsport more sports podcasts. games make way for construction the main stadium walks next the olympic rings monument. how many times has japan hosted the. tokyo ahead the edition the postponed summer games the japanese. videos basketball athletics motorsport more sports. sportstar diwali sale all plans are for year. capital sportsstar looks the times when japan has hosted the olympics both summer and. hen tokyo and sapporo were chosen the host cities for the summer and winter. successfully hosted edition the olympics games which was held from october. the winter olympics was hosted sapporo city hokkaido prefecture japan after the. sapporo got its turn host the edition which took place from february. sportsstar digital the hindu digital. plans host the winter olympics were canceled due the outbreak the second world war. olympics which took place from february kohei jinno left who was forced leave his house two times ahead the and olympics. sportstar plus all the other hindu digital products. motorsport more sports podcasts. olympics both summer and winter. sapporo got its turn,516,How many times has Japan hosted the Olympics? - Sportstar - Google Chrome,nhật bản đã đăng cai olympic - google search - google chrome
thisislandingpage__nagano the capital and largest city the nagano prefecture japan hosted the winter. stream your service jesus gospel minist. olympics respectively they became the first non western cities that were selected host. how many times has japan. japan got its chance host the games again this time this was the first time japan. sale ends soon limited offer. japan got its chance. however before the plan could e fruition war broke out between japan and china. japanese capital sportsstar looks the times when japan has hosted the. which led the japane. kohei jinno left who was forced leave his house two times ahead the and olympics. outside the japan olyn. read lighting ceremony starts tokyo leg torch relaykohei jinno left who was forced leave his house two times ahead the and olympics. read lighting ceremony starts tokyo leg torch relay. nagano the capital and largest city the nagano prefecture japan hosted the. olympics which took place from february sportstar thehindu  olympics tokyo olympics faq tokyo summer olympics games when has japan hosted olympics winter. which led the japanese government forfeiting its right host the games. outside the japan olympic museum near the national stadium reuters. sportstar thehindu  olympics tokyo olympics faq tokyo summer olympics games when has japan hosted olympics winter games. tokyo ahead the edition the postpone summer games the. athletics motorsport more sports podcasts. games make way for construction the main stadium walks next the olympic rings monument. how many times has japan hosted the. tokyo ahead the edition the postponed summer games the japanese. videos basketball athletics motorsport more sports. sportstar diwali sale all plans are for year. capital sportsstar looks the times when japan has hosted the olympics both summer and. hen tokyo and sapporo were chosen the host cities for the summer and winter. successfully hosted edition the olympics games which was held from october. the winter olympics was hosted sapporo city hokkaido prefecture japan after the. sapporo got its turn host the edition which took place from february. sportsstar digital the hindu digital. plans host the winter olympics were canceled due the outbreak the second world war. olympics which took place from february kohei jinno left who was forced leave his house two times ahead the and olympics. sportstar plus all the other hindu digital products. motorsport more sports podcasts. olympics both summer and winter. sapporo got its turn,the japan olympic museum tokyo the best place learn more about the olympics. question how many times has japan hosted the olympics. mitee the western end meiji jingu gaien park across from the national stadium the. total number olympic medals gold silver bronze. verse how many times has japan hosted the olympics. stockholm the following olympic games were held japan the past. japan first participation olympic games was july the olympic games. located the lower two floors the building that also houses the japanese olympic. japan exhibits the history the olympics general and past olympic games held japan. and offers hands area where visitors can experience various olympic sports the museum. closest station gaienmae along the ginza subway line sapporo. tokyo summer games held. how many gold medals olympics. olympic rings tokyo bay. japan guide  html. places you can visit activities you can related,517,Olympic Games in Japan - Google Chrome,how many times japan hosted the olympic games - google search - google chrome
japan the olympics english wikipedia wikipedia  wiki japan the olympics. japanese encephalitis jevax vabiotechcare  vaccine viem nao nhat ban jevax. search google enter url,العربيةa wikipedia  wiki nhật bản tại_thế vận hộivi wikipedia  wiki nhật bản tại thế vận hội. bảng huy chương sửa sửa nguồn. bảng huy chương sửa sửa nguồ. các vđv cầm cho đoàn tại các olympic.   japan guide  html. quốc gia này không được mời tới thế vận hội sau nhị thế chiến từng tham gia tẩy chay thế vận. các thế vận hội mùa trong huy chương vàng thuộc môn judo nhật bản huy chương tại thế. liên kết ngoàibạc đồng tông. wikipedia  wiki nhật bản tại_thế vận hội. huy chương tại các thế vận hội mùa sửa sửa nguồn. ban olympic nhật bản. thay đổi gần đây. vận hội mùa đông. hội mùa tại moskva. thế vận hội mùa đông nagano tỉnh nagano. huy chương tại các thế vận hội mùa đông,520,Nhật Bản tại Thế vận hội – Wikipedia tiếng Việt - Google Chrome,nhật bản đã đăng cai olympic - google search - google chrome
places you can visit activities you can related. how many times has japan hosted the olympics. big tomb games but you always wanted visit japan you want. places you can visit activities you can. sapporo winter olympics hokkaid. how many gold medals olympics.  wikipedia  wiki adt. the olympics japan has held. olympic still held despite the pandemic not why. nagano winter olympics nagano prefecture. english places you can visit activities you can related.   japan guide  html. question how many times has japan hosted the olympics. how many categories are there the olympics. total number olympic medals gold silver bronze. when and where does the olympics take place. join this trip you find this invitation interesting you are not fan. the japanese will deliver the game find example. sapporo winter olympics hokkaidō.  wikipedia  wiki adt n_t,you weren created settle connecting the dots daily devotional for october connecting the dots devotio. research thank you you got tue oct vuong vuong helsinki wrote con. fwd thelab fyi wed oct thelab noreply feedproxy google  wrote thelab academic. ending soon get exalting jesus john free last chance get recovery the unity the bible free free. the face unanswered prayers father possible may this cup taken from yet not will but. quickly own your favorite products aeoneshop favorite and most suitable products. invites jade close month end offer off health care products from vinmart online. spiritual growth campaigns are small group factory proven strategy for strengthening your small group ministry. press know the lord connecting the dots daily devotional for october connecting the dots devotional,522,"Inbox (10,814) - ghidanhwtc@gmail.com - Gmail - Google Chrome",hạng mục tiếng anh - google search - google chrome
thisislandingpage__you weren created settle connecting the dots daily devotional for october connecting the dots devotio. research thank you you got tue oct vuong vuong helsinki wrote con. fwd thelab fyi wed oct thelab noreply feedproxy google  wrote thelab academic. ending soon get exalting jesus john free last chance get recovery the unity the bible free free. the face unanswered prayers father possible may this cup taken from yet not will but. quickly own your favorite products aeoneshop favorite and most suitable products. invites jade close month end offer off health care products from vinmart online. spiritual growth campaigns are small group factory proven strategy for strengthening your small group ministry. press know the lord connecting the dots daily devotional for october connecting the dots devotional,literature every days honor the rio olympics hcv hcb. literature every days cand. honor rio olympics hcv hcb,523,Thể thao Việt Nam ở Olympics: Thiếu cả lượng và chất - Báo Công an Nhân dân điện tử - Google Chrome,có bao nhiêu hạng mục trong olympic? - google search - google chrome
thisislandingpage__literature every days honor the rio olympics hcv hcb. literature every days cand. honor rio olympics hcv hcb,dental implant care treatment. this page does not exist. summer olympics included sports increase two pared the previous see that the number. law institute hanoi espace. this clearly seen when there were only sports. olympic sports are those that are contested the summer and winter olympics. dong kinh ancient music new hanoi. this clearly seen when there were only first exams.  fans  internetve mon the sport chu. regulations how the sport anized. the number subjects and content peted each olympics different. fluent english korean dentist. the event has ended. waiting for  google  appear,524,Danh sách các môn thể thao Olympic phổ biến nhất - Google Chrome,có bao nhiêu môn thể thao trong olympic - google search - google chrome
verse olympic still held despite the pandemic not why.   japan guide  html. question how many times has japan hosted the olympics. winter olympics sapporo hokkaido. olympic still held despite the pandemic not why.  wikipedia  wiki adt_b. nagano winter olympics nagano prefecture. total number olympic medals gold silver bronze. when and where does the olympics take place. verse the olympics are held despite the pandemic not and why. sapporo winter olympics hokkaidō. how many categories the olympics. japan has been the host country the olympics times. how many gold medals olympics.  wikipedia  wiki adt. the olympics japan has held.  wikipedia  wiki adt n_t. places you can visit activities you can related,how many categories are there the olympics. japan will host the olympics friend yours. olympic still held despite the pandemic not why. how many times has japan hosted the olympics. total number olympic medals gold silver bronze. when and where does the olympics take place. join this trip you find this invitation interesting you are not fan. who big fan the olympic games wants attend the events and remend you. find information about events attractions the city and activities that. the japanese will deliver the game find example. big tomb games but you always wanted visit japan you want. how many gold medals olympics,528,task 2 [Compatibility Mode] - Microsoft Word (Product Activation Failed),"olympic vẫn được tổ chức bất chấp đại dịch hay không, - google search - google chrome"
thisislandingpage__how many categories are there the olympics. japan will host the olympics friend yours. olympic still held despite the pandemic not why. how many times has japan hosted the olympics. total number olympic medals gold silver bronze. when and where does the olympics take place. join this trip you find this invitation interesting you are not fan. who big fan the olympic games wants attend the events and remend you. find information about events attractions the city and activities that. the japanese will deliver the game find example. big tomb games but you always wanted visit japan you want. how many gold medals olympics,fix the electricity here. quite lot people don know that not all gymnastics are among the. five the olympic sports what are the sports the olympics. well the new medley content some. the olympic games the number major sporting event the planet attracting many. will learn about this through the following article. zalo ant will introduced tokyo new petitions sports. different gymnastics even total disciplines besides new gymnastics. what are the olympic games. what are the olympic gymnastics. existing events will also planned including basketball freestyle bmx and return. network construction price list. fix virus infected puter. home appliance repair tphcm. added who the father the ultimate olympics modern olympiad ahead. home air conditioner repair. more urban and increase the number women teams participating. cheap laptop keyboard replacement. tokyo olympic games will have content. attention well the participation gymnasts from many countries and regions. cheap laptop battery replacement. the official program for the summer olympics has been approved the executive mittee. the price data recovery service. existing soccer will also planned including basketball freestyle bmx and return. repair electric light bulb hcm. what year was held. price code for puter repair district receive service. price code for puter repair district bike madison well the new mixed content some. what are olympic gymnastics. oiympic zuzt where nig tiicu person who not love with people. that the purpose the tokyo summer olympics make them young and. air conditioner cleaning home. fix the puter with sound. tokyo olympic games will have events peting disciplines. the price puter upgrade. puter installation price list. calling fee vnd minute for madison bike same the content. calling fee vnd minute. ant will introduced tokyo new petitions various sports. sell cheap laptop charger. new mixed assets number. fix the water here. cleaning washing machine home. price code for puter repair district. reference wele olympic games tokyo what special about google doodle. puter repair price code district added who the father the latest olympic games modern olympiad ahead. printer ink refill price list. truongthinh info cac mon the thao olympic cac mon the thao olympic. olympic sport what are the petitions the olympics they. ioc censored june ioc president thomas bach stated. fix puter that won turn. repair electric fan home. pride every athlete every sport. territories the world winning medal the olympics always. fixed washing machine home,529,【1️⃣】 Các môn thể thao Olympic là gì? Các môn thể thao Olympic 2020/2021 là gì? - Trường Thịnh ™ - Google Chrome,có bao nhiêu môn thể thao trong olympic 2020 - google search - google chrome
winter olympics nagano love nagano. question how many categories are there the olympics. japan has been the host country the olympics times. places you can visit activities you can related. verse olympic still held despite the pandemic not why. japan will host the olympics one your friends. how many times has japan hosted the olympics. big tomb games but you always wanted visit japan you want. how many gold medals olympics. sapporo winter olympics hokkaid. the olympics japan has held. different gymnastics even total disciplines. olympic still held despite the pandemic not why. nagano winter olympics nagano prefecture. tokyo olympic games will have events peting disciplines.  wikipedia  wiki adt_b.   japan guide  html. question how many times has japan hosted the olympics. how many categories are there the olympics. total number olympic medals gold silver bronze. when and where does the olympics take place. join this trip you find this invitation interesting you are not fan. who big fan the olympic games wants attend the events and remend you. find information about events attractions the city and activities that. the japanese will deliver the game find example. sapporo winter olympics hokkaidō.  truongthinh info cac mon the thao olympic cac mon the thao olympic.  wikipedia  wiki adt n_t,different gymnastics even total disciplines. verse olympic still held despite the pandemic not why. winter olympics sapporo hokkaido.  wikipedia  wiki adt_b. nagano winter olympics nagano prefecture. question how many categories are there the olympics.  wikipedia  wiki adt. tokyo olympic games will have events peting disciplines.  baodantoc dieu thu can biet the van hoi olympic tokyo. sapporo winter olympics hokkaidō. japan has been the host country the olympics times.  truongthinh info cac mon the thao olympic cac mon the thao olympic. the olympics japan has held,535,task 2 [Compatibility Mode] - Microsoft Word (Product Activation Failed),có bao nhiêu môn thể thao trong olympic 2020 - google search - google chrome
