source,target,index,title,query
october reknow activity surveillance. start teamviewer with windows. microsoft genesis cit setupvietbi img kingdom. search programs and files. the discip schematic stumbling words. microsoft private lessons and follow google slides. not ready please check your connection. recycle bin fscapture microsoft. img jericho walls mso. google  search change from miles sxsrf aoaemvl_iautmyecqp bsso rchg mqbq lazbyzt,take your time and thank you wish you. take notes next your favorite verses with these bestselling bibles save off journal the word journal the word. writing activity last week let get back make sure you logged grammarly october october. keep the time and thank you wish you. writing activity last week let get back make sure you logged grammarly october. press know the lord connecting the dots daily devotional for october connecting the dots devotional,23,"Inbox (10,915) - ghidanhwtc@gmail.com - Gmail - Google Chrome",change from miles to km - google search - google chrome
black market dollar price. online drug information and pharmacovigilance newsletter magazine canhgiacduoc  home. morning news october chi minh city prepares open inter provincial tourism the ministry health will prescribe tuoitre tin sang tphcm chuan lich lien tinh. rfi covid why vietnam wary chinese vaccines rfi point report covid sao vietnam wary with vaccine trung. beware bacillus nihe  new hoi dap dich benh dich benh khac canh giac voi truc khuan vhtm. search google enter url,see more queue only. waiting for  gstatic  any where high. the conference with asean. should encourage you miss. chi minh city law. for large shop only. nguyen duc hien sent application. the heroes semi final explosion. home what does that house have. australia china wine dispute. the leaders issued statements about the economy. religion erik the beauty the world. how high the print. waiting  gstatic  country. southeast asian asean country. china prime minister made series mitments. tlinh lyly stopped the dance arena contest.  tuoitre gao ngon nhat the gioi van manh nay xai kha nang thi quoc ngo htm. entries for the house. hcm press conference site food service. tto the end the association summit,41,"Tin tức, tin nóng, đọc báo điện tử - Tuổi Trẻ Online - Google Chrome",giá usd hôm nay - google search - google chrome
energize the city fight the epidemic. zoneshop aeoneshop super sale. floating the middle the river thach tear toac make prediction. barge sinking can gio body. beer turn the air conditioner when the goods begin inspected. please the right direction. aeoneshopé crushed bao loc tea area. solutions help balance the system because bacteria are useful for. khan after the accident drifting real estate crime. tto police investigation agency. ubnd city with facilities. the mune has issued notice the discovery. intestinal tract strengthen the colon resist.  tuoitre chuan khoi cong tuyen noi quoc tuyen tranh long xuyen htmuyen. phu quoc city after week outbreak. give support chi minh city fight the epidemic. chronic colon disease reduce him. tuoitre phu quoc sau tuan bung phat dich phat hien pfizer for children.   googleadservices  pagead aclk rllb ydq found vung tau. tho chau phu quoc city kien giang said.  tuoitre tam ngung cac chot kiem soat cua ngo hcm chieu nay htm,rivers living water what did jesus mean bibleversestudy  johngospel john rivers living water htm. john mentary google search. famotidine suppresses osteogenic differentiatio orthop res pubmed ncbi ncbi nlm nih gov pubmed. chronicles mentary part chronicles sara japhet dropbox  ghusxe sctg chronicles mentary.  staticl squarespace  static bffcb fda staticl squarespace  static bffcb fda,44,Thẻ mới - Google Chrome,change from miles to km - google search - google chrome
thisislandingpage__rivers living water what did jesus mean bibleversestudy  johngospel john rivers living water htm. john mentary google search. famotidine suppresses osteogenic differentiatio orthop res pubmed ncbi ncbi nlm nih gov pubmed. chronicles mentary part chronicles sara japhet dropbox  ghusxe sctg chronicles mentary.  staticl squarespace  static bffcb fda staticl squarespace  static bffcb fda,question jesus about paying taxes caesar. leaders wretched men they were used this woman asa weanon against jesus they presented her. break the law moses said execute her for the crime adultery then jesus would seem harsh. and everyone went his own house but jesus went the mount olives now early the morning. receive david guzik weekly. mis they said testing him that they mignt nave sometning which accuse hilm the. but what you say they set trap for jesus jesus said let her then would seem. john the light the world. iii under these conditions the obtaining evidence adultery would almost impossible were the. moses the law manded that such should stoned true that adultery was capital. situation not setup boice. though did not hear. down and wrote the ground. under these conditions the obtaining evidence adultery would almost impossible were the. opponents preached the temple and then they went their own ways jesus went the mount. đang chờ enduringword . this was similar dilemma posed the question jesus about paying taxes caesar matthew. many later manuscripts mark this section with asterisks. special emails pastors preachers. get prayer requests and updates. jesus ignores the accusers never heard them. our website uses cookies store user preferences proceeding you consent our cookie usage please see our privacy policy for cook. matter the original text this section john some debate and controversy. had two witnesses and they had agree perfectly they had see the sexual act take place. fow monuserinte bove this coction ofter john ondone bos ofter lobo. john gospel least this place. from the reference the law verse might seem that she was liable this particular. puisimenil decause sne iau siniieu uuing penou deltoiai ioitiicatioin uung ulal ume deng. conditions were stringent that they could have been met only rare occasions morris. from manuscript current evidence seems unlikely that this portion was part the original text. this they said testing him that they might have something which accuse him but jesus stooped. execution for religious offenses away from the jews. and perhaps cruel also would break roman law because the romans had taken the right official. the actual physical movements the couple must have been capable other explanation. wasn enough see the pair leaving the same room together even lying the same bed together. had observed multiple witnesses who agreed exactly their testimony practical matter. this was similar dilemma posed the question jesus about paying taxes caesar. jesus teaches the temple. rule urban munities any rate bruce. everyone went his own house the sense the text have that jesus confounded his. virtually one was executed for adultery since this was relatively private sin. offense under jewish law but the rules for evidence capital cases were extremely strict the actual act. opastors preachers bible teachers. most the earliest ancient greek manuscripts omit this section. appears that the first century the full rigour the law was longer applied general. one group manuscripts inserts this section after luke. came again into the temple and all the people came him and sat down and taught them. punishment because she had sinned during the period betrothal fornication during that time being. enduringword  bible mentary john. woman caught adultery brought jesus for judgment. our website uses cookies store user preferences proceeding you consent our cookie usage please see our privacy policy for cookie usage details,45,Enduring Word Bible Commentary John Chapter 8 - Google Chrome,john 8 commentary - google search - google chrome
standing the midst doesn demand that the woman was actually standing upon her feet. the continuous tense this last verb gives the thought something like process they kept. her neither condemn you and sin more. understood figurative sense such set place matthew and the phrase. said that their conscience. the ancient greek word translated standing hestimi often means stand but sometimes. oldest the youngest explaining the order their departure. oldest even the last and jesus was left alone and the woman standing the midst. there exactly like the italian stare that the standing cannot pressed more here than. then those who heard being benefited their conscience went out one one beg. spoke well these men that their conscience was not dead burned over they sum. the last perhaps the oldest left first because they most easily understood that jesus was talking about. our website uses cookies store user preferences proceeding you consent our cookie usage please see our privacy policy for cook. peter were sitting too matthew peter john seems speak them and peter standing but. licensed their conscience they were now more aware their own sin than the sin the woman. some speculation that jesus wrote the ground account their own sins beginning from the. were suffered their conscience not immediately clear why they left order the oldest even. ordeal yet human nature and the repeated stooping posture jesus suggests that the woman for all. some this ordeal was low posture the ground.  enduringword  kommentar ature and the repeated stooping posture jesus suggests that the woman for all. these words used john are frequently idiomatic mean merely stationary continue. the woman standing the midst this the only reference the account the physical posture. trench says later use hestimi john and luke quite definite that they and. the other nineteen places where they occur john gospel trench. the accusers respond leaving. wasn what jesus wrote though that may have had something with more. enduringword  bible mentary john. being victimized their conscience they were victimized what they heard from. went out one one beginning with the oldest even the last understand why they left they. when jesus had raised himself and saw one but the woman said her woman where are. jesus challenges the woman sin more. the woman possible that the religious leaders who brought her jesus forced her stand through the,tail chubby head medium length obtuse snout slightly protruding. kenh goi giup ban cach phan biet duoc dau chep tram troi cach chon ngon chuan chn. gills narrow close the waist. head wide eye distance cupped vertex. crease lines mouth front and. cough medicine for the whole family.  kenh cdn  photo pngnguy. the fish has well proportioned body flattened the side tapering towards. bottom arc shape have two pairs beards one pair. smooth the nostrils are closer the eyes than the tip the snout membrane.  kenh cdn  photo pnggx. small antennae the corner the jaw and pair very small muzzle whiskers. eyes are moderate located the sides and anterior part the.  kenh cdn  photo png,58,"Gợi ý giúp bạn: Cách phân biệt được đâu là cá chép, cá trắm, cá trôi và cách chọn cá ngon chuẩn - Google Chrome","cá gì vảy rất to, tròn - google search - google chrome"
standing the midst doesn demand that the woman was actually standing upon her feet. gave her hone that her life could freedom from sexual sin. they knew the thrill exercising power condemn jesus knew the thrill exercising the power. when jesus had raised himself and saw one but the woman the accusers left jesus was. some speculate that jesus wrote the ground account their own sins beginning from the. recognized that what the woman had done was sin because told her stop sinning. demonstrably stooped down alone was without sin among them knowing all things had the right. and sin more jesus sent her away with call stop her sin and continue stopped regard. her neither condemn you and sin more. understood figurative sense such set place matthew and the phrase. those accusers yours has one condemned you she said one lord and jesus said. the ancient greek word translated standing hestimi often means stand but sometimes. oldest the youngest explaining the order their departure. condemnation she passed from sin and death sentence fiveness and life. those who are christ jesus. enduring word saw one but the won enduring word. there exactly like the italian stare that the standing cannot pressed more here than. that sin sent her away without ever approving accepting her sin. that sin sent her away wititouf ever approving accepting her sin. bowed down the ground writing the dirt. peter were sitting too matthew peter john seems speak them and peter standing but. our website uses cookies store user preferences proceeding you consent our cookie usage please see our privacy policy for cook. the form the mand implies ceasing mit action already started stop your sinful. habit and the more points the thought return morris. ordeal yet human nature and the repeated stooping posture jesus suggests that the woman for all. jesus did several things with these powerful words. sense jesus here modeled the great truth romans that there condemnation for. some this ordeal was low posture the ground. she said one lord the woman guilty sin and great sin knew the goodness having. where are those accusers yours has one condemned you with her accusers gone there was. these words used john are frequently idiomatic mean merely stationary continue. the woman standing the midst this the only reference the account the physical posture. one left condemn the woman and jesus himself did not condemn her. trench says later use hestimi john and luke quite definite that they and. the other nineteen places where they occur john gospel trench. cast the first stone but did not the woman found refuge connection jesus. enduringword  bible mentary john. when jesus had raised himself and saw one but the woman said her woman where are. jesus challenges the woman sin more. the woman possible that the religious leaders who brought her jesus forced her stand through the. neither condemn you sense jesus took her guilt upon himself especially. saw one but enduring word,john your father the devil. bibleversestudy  johngospel john bible study htm.  bibleversestudy  johngospel john woman caught adultery htm. john the truth will set you free. john chapter mentary bible study. aubg will make your day. john woman caught adultery. have the code for this page. john die your sins. bible verse study . john the light the world. john before abraham was,60,JOHN 8 COMMENTARY & BIBLE STUDY - Google Chrome,john 8 commentary - google search - google chrome
please add new entries the dictionary. help build the best dictionary. glosbe munity based project created people just like you. glosbe uses cookies ensure you get the best experience,australia the golden acacia hay. nature celebrities anize political association environmental philosophy. the history the jewish people consists entirely paradoxes left with long words with great lengths now pare the number links the chain. the most concentrated flora. the history the jewish people consists entirely paradoxes left with long words with great lengths now pare links the chain. public welfare  who are the jews most ancient people semitic origin. click allow you are not robot. this website uses cookies ensure you get the best experience our website learn more. who are the jewish ancient hominid semitic origin,75,Người Do Thái là ai? những người già nhất có nguồn gốc Semitic - Văn hóa 2021 - Google Chrome,"ngôn ngữ semitic, - google search - google chrome"
thisislandingpage__australia the golden acacia hay. nature celebrities anize political association environmental philosophy. the history the jewish people consists entirely paradoxes left with long words with great lengths now pare the number links the chain. the most concentrated flora. the history the jewish people consists entirely paradoxes left with long words with great lengths now pare links the chain. public welfare  who are the jews most ancient people semitic origin. click allow you are not robot. this website uses cookies ensure you get the best experience our website learn more. who are the jewish ancient hominid semitic origin,men yod tut chit zrya tev. get free quote now. norton blocked attack malicious site. hebrew not widely spoken the world thus greatly limiting its development. the hebrew translation service but not that oriental translation does not invest. first and last name. only consonants not vowels not until the beginning the century after the reformation. new group jewish scholars invented vowels this makes the hebrew language easy. fee from derived from the semitic dialect about. please pay attention your family members. basically hebrew has letters with different forms emitting about sounds ancient hebrew. the hebrew translation service but not that the oriental translation not invested derived from the semitic dialect about. man lad tod tut chit zryia. fancy derived from the semitic dialect about,76,Bảng báo giá chi phí dịch thuật tiếng Do Thái - Google Chrome,"ngôn ngữ semitic, - google search - google chrome"
the demands the law and thus brings. hoàn cảnh của như những chủ đất giàu bức thể nói đến những. roman empire however semitic word order. suggests that his audience was jewish christians references their circumstances. with paul about the christian relationship. spelling research thesaurus word. jewish christians living outside israel. the law both authors bine give. salvation james showed believers that. law paul showed believers that christ met. overall dependence the letter the jewish. gia lãnh đạo hội thánh giê lem việc nói đến mười hai chi phái tan lạc gia. solid understanding the old testament. hội chúng bất nơi nào trong quốc tuy nhiên. hội chúng bất nơi nào trong quốc tuy nhiên thứ của ngữ trong tiếng. the reference synagogue also. ceremonial law but the moral law although some people thinmk james odds. james continually called for obedience. quotations from the septuagint and the. khiến cho người nghĩ rằng thư tín này được viết cho những đốc nhân thái. norton blocked attack malicious site. wisdom tradition suggest specifically jewish. could refer congregations anywhere the. the law god henever referred the. đang sống bên ngoài việc nói đến một nhà hội lạp cũng khiến cho. hội chúng bất nơi nào trong quốc tuy nhiên thứ của ngữ. ceremonial law but the moral law although some people think james odds. their obedience god moral standards. người nghĩ rằng độc giả của ông những đốc nhân thái việc nói đến những,wisdom tradition suggest special jewish. living outside israel mentioning synagogue greek also causes. roman empire however semitic word order. suggests that his audience was jewish christians references their circumstances. with paul about the christian relationship. spelling research thesaurus word. james led the jerusalem church referring the twelve tribes that are scattered. jewish christians living outside israel. the law both authors bine give. salvation james showed believers that. his readers were thought jewish christians talking about these. law paul showed believers that christ met. overall dependence the letter the jewish. makes one think that this epistle was written for jewish christians. solid understanding the old testament. their circumstances oppression wealthy landowners may refer the. quotes from the seventies and. the reference synagogue also. ceremonial law but the moral law although some people thinmk james odds. james continually called for obedience. congregation anywhere the roman nation however the order semitic words. the demands the law and thus bring. congregations anywhere the roman empire however the order semitic words. quotations from the septuagint and the. could refer congregations anywhere the. the law god henever referred the. ceremonial law but the moral law although some people think james odds. their obedience god moral standards,78,P1793 James Dịch - Microsoft Word (Product Activation Failed),"ngôn ngữ semitic, - google search - google chrome"
the demands the law and thus brings. hoàn cảnh của như những chủ đất giàu bức thể nói đến những. roman empire however semitic word order. suggests that his audience was jewish christians references their circumstances. with paul about the christian relationship. spelling research thesaurus word. jewish christians living outside israel. the law both authors bine give. những trích dẫn bản bảy mươi thuộc nói chung của thư tím. hội chúng bất nơi nào trong quốc tuy nhiên thứ của ngữ tiếng semitic. salvation james showed believers that. law paul showed believers that christ met. overall dependence the letter the jewish. gia lãnh đạo hội thánh giê lem việc nói đến mười hai chi phái tan lạc gia. solid understanding the old testament. the reference synagogue also. những trích dẫn bản bảy mươi thuộc nói chung của thư tín vào truyền thống khôn. ceremonial law but the moral law although some people thinmk james odds. james continually called for obedience. hhững trích dẫn bản bảy mươi thuộc nói chung của thư tín vào truyền thống. quotations from the septuagint and the. khiến cho người nghĩ rằng thư tín này được viết cho những đốc nhân thái. wisdom tradition suggest specifically jewish. could refer congregations anywhere the. the law god henever referred the. đang sống bên ngoài việc nói đến một nhà hội lạp cũng khiến cho. những trích dẫn bản bảy mươi thuộc nói chung của thư tím vào. ceremonial law but the moral law although some people think james odds. their obedience god moral standards. người nghĩ rằng độc giả của ông những đốc nhân thái việc nói đến những. những trích dẫn bản bảy mươi thuộc nói chung,wisdom tradition suggest special jewish. living outside israel mentioning synagogue greek also causes. roman empire however semitic word order. suggests that his audience was jewish christians references their circumstances. with paul about the christian relationship. spelling research thesaurus word. james led the jerusalem church referring the twelve tribes that are scattered. jewish christians living outside israel. the law both authors bine give. his readers were thought jewish christians talking about these. law paul showed believers that christ met. overall dependence the letter the jewish. makes one think that this epistle was written for jewish christians. solid understanding the old testament. their circumstances oppression wealthy landowners may refer the. the reference synagogue also. ceremonial law but the moral law although some people thinmk james odds. tosalvation lames showed believers that. james continually called for obedience. congregation anywhere the roman nation however the order semitic words. the demands the law and thus bring. quotations from the septuagint and the. could refer congregations anywhere the. quoting from the seventies and the general reliance the epistles the wisdom tradition. the law god henever referred the. jewish docility shows possible,89,P1793 James Dịch - Microsoft Word (Product Activation Failed),lệ thuộc vào truyền thống - google search - google chrome
