source,target,title,query,index
image png image jpg verolomake. mybhemmaksi siirretyt your husband iam phign brother. tarja reponen veroilmoitukset verotilin saldo litteend andan veroilmoituslomakkeet jotka lahetetty verottajalle maksettavaa tuloveroa ole mutta verotilille pitaisi maksaa. tarja reponen andan tilinpatos hei liitteena tilinpastos tase erittely sek tilinpaéitdslasku tarja toptase tarja reponen yrittaja entrepreneur hyttipojankuja espoo tel mob. image jpg andan_tase eri andan_tilinpéa. tahdelliset not reply huomioitavaa omaverossa hei vastaanottajalle andan tunnus saapunut omaveroon paatos tai kirje tarkempia tietoja saat omaveron huomioitavaa kohdasta terveisin ver. ensisijainen sosiaaliset verkostot terioukset. enemman reply liitetiedosto omamehiléiisesta heil olen jakanut sinulle liitteen omamehilaisesta terveisin cong. toptase laskunne toptase summa eur hyva asiakkaamme liitteen uusin laskunne laskun erapéiva summa eur avoinna eur viitenumero. image jpg andan_tase eri andan_tilinpéa mailgoogle  mail. expondo limarinen tybnantaja muista namé asiat ennen kesélomalle iahts palautumiseen olemassa monia hyvia keinoja avaa selaimessa kes lihestyy muista nama asiat ennen lomalle lhto tarkasta. lahetetyt photo photo photo yiig. uusi kokous youtube muutoksia youtuben kayttoehtoihin sait taman sahkspostin koska youtuben kéyttdehtoja ehdot paivitetty selkemmiksi lapinakyvammiksi ehdot paivitettiin vastaavalla tavalla yhdysv. tuntemistiedot epas muistutus vastatkaa epassin tuntemistietokyselyyn tama viesti lahetetty yritykselle andan hei epassin palveluntarjoaja haluamme muistuttaa etta teidan tulee vastata epassin asiakka. sovellukset tintlc sykiénthe lita sanomat verkkokauppa kotikonttori powe giganttiverkkokau google sheets googlekkeep muut ijanmerkit lukulsta. hangouts tarja reponen huhtikuun alv myynnit hei huhtikuun alv palautusta eur voitko ilmoittaa mitka summat maalis huhtikuussa uuden yrittajan myyntis koska korttimyynnit tulee pankkitilille. </s>viimeinen toiminta tal ila minuuttia siten. soiot smeednbimandadindll srr sta valitetty viesti. </s>hitps  aboutyou champion erl. iatteetmatthias geerts bugatti keylargo. hitps  aboutyou champion aatteet. dat neuletakit boma matthias geerts bugatti keylargo. urban classics superdry adidas originals urban classics. sovellukset tintitc sykién thé lta sanomat talehti suom youtube facebook google elektroniikia koko verkkokauppa kotkonttori powe googlesheets googlekeep muutkirjanmerkit lukulista,hangouts kontakeja sta valitet ettaja paiva. sta valitet ettaja paiva. psr isp grs snv. sovellukset tintlc sykiénthe lfa sanomat mtalehti suom youtube facebook google verkkokauppa kotlkonttori powe giganttiverkkokau google sheets googlekeep muutkirjanmerkit lukulsta. ehdot tietosuoja kayton saannot viimeinen toiminta tala ila minuuttia siten,Postilaatikko - lecongduc6269@gmail.com - Gmail - Google Chrome,,45
hangouts kontakeja sta valitet ettaja paiva. sta valitet ettaja paiva. psr isp grs snv. sovellukset tintlc sykiénthe lfa sanomat mtalehti suom youtube facebook google verkkokauppa kotlkonttori powe giganttiverkkokau google sheets googlekeep muutkirjanmerkit lukulsta. ehdot tietosuoja kayton saannot viimeinen toiminta tala ila minuuttia siten. </s>image png image jpg verolomake. mybhemmaksi siirretyt your husband iam phign brother. tarja reponen veroilmoitukset verotilin saldo litteend andan veroilmoituslomakkeet jotka lahetetty verottajalle maksettavaa tuloveroa ole mutta verotilille pitaisi maksaa. tarja reponen andan tilinpatos hei liitteena tilinpastos tase erittely sek tilinpaéitdslasku tarja toptase tarja reponen yrittaja entrepreneur hyttipojankuja espoo tel mob. image jpg andan_tase eri andan_tilinpéa. tahdelliset not reply huomioitavaa omaverossa hei vastaanottajalle andan tunnus saapunut omaveroon paatos tai kirje tarkempia tietoja saat omaveron huomioitavaa kohdasta terveisin ver. ensisijainen sosiaaliset verkostot terioukset. enemman reply liitetiedosto omamehiléiisesta heil olen jakanut sinulle liitteen omamehilaisesta terveisin cong. toptase laskunne toptase summa eur hyva asiakkaamme liitteen uusin laskunne laskun erapéiva summa eur avoinna eur viitenumero. image jpg andan_tase eri andan_tilinpéa mailgoogle  mail. expondo limarinen tybnantaja muista namé asiat ennen kesélomalle iahts palautumiseen olemassa monia hyvia keinoja avaa selaimessa kes lihestyy muista nama asiat ennen lomalle lhto tarkasta. lahetetyt photo photo photo yiig. uusi kokous youtube muutoksia youtuben kayttoehtoihin sait taman sahkspostin koska youtuben kéyttdehtoja ehdot paivitetty selkemmiksi lapinakyvammiksi ehdot paivitettiin vastaavalla tavalla yhdysv. tuntemistiedot epas muistutus vastatkaa epassin tuntemistietokyselyyn tama viesti lahetetty yritykselle andan hei epassin palveluntarjoaja haluamme muistuttaa etta teidan tulee vastata epassin asiakka. sovellukset tintlc sykiénthe lita sanomat verkkokauppa kotikonttori powe giganttiverkkokau google sheets googlekkeep muut ijanmerkit lukulsta. hangouts tarja reponen huhtikuun alv myynnit hei huhtikuun alv palautusta eur voitko ilmoittaa mitka summat maalis huhtikuussa uuden yrittajan myyntis koska korttimyynnit tulee pankkitilille. </s>viimeinen toiminta tal ila minuuttia siten. soiot smeednbimandadindll srr sta valitetty viesti,usp sharing. task thiv next month june. task thir tuesday june. task thir next week june. task thir tudn after month. please write the following information,Tùng - link bài viết - thí nghiệm - lecongduc6269@gmail.com - Gmail - Google Chrome,,47
usp sharing. task thiv next month june. task thir tuesday june. task thir next week june. task thir tudn after month. please write the following information. </s>hangouts kontakeja sta valitet ettaja paiva. sta valitet ettaja paiva. psr isp grs snv. sovellukset tintlc sykiénthe lfa sanomat mtalehti suom youtube facebook google verkkokauppa kotlkonttori powe giganttiverkkokau google sheets googlekeep muutkirjanmerkit lukulsta. ehdot tietosuoja kayton saannot viimeinen toiminta tala ila minuuttia siten. </s>image png image jpg verolomake. mybhemmaksi siirretyt your husband iam phign brother. tarja reponen veroilmoitukset verotilin saldo litteend andan veroilmoituslomakkeet jotka lahetetty verottajalle maksettavaa tuloveroa ole mutta verotilille pitaisi maksaa. tarja reponen andan tilinpatos hei liitteena tilinpastos tase erittely sek tilinpaéitdslasku tarja toptase tarja reponen yrittaja entrepreneur hyttipojankuja espoo tel mob. image jpg andan_tase eri andan_tilinpéa. tahdelliset not reply huomioitavaa omaverossa hei vastaanottajalle andan tunnus saapunut omaveroon paatos tai kirje tarkempia tietoja saat omaveron huomioitavaa kohdasta terveisin ver. ensisijainen sosiaaliset verkostot terioukset. enemman reply liitetiedosto omamehiléiisesta heil olen jakanut sinulle liitteen omamehilaisesta terveisin cong. toptase laskunne toptase summa eur hyva asiakkaamme liitteen uusin laskunne laskun erapéiva summa eur avoinna eur viitenumero. image jpg andan_tase eri andan_tilinpéa mailgoogle  mail. expondo limarinen tybnantaja muista namé asiat ennen kesélomalle iahts palautumiseen olemassa monia hyvia keinoja avaa selaimessa kes lihestyy muista nama asiat ennen lomalle lhto tarkasta. lahetetyt photo photo photo yiig. uusi kokous youtube muutoksia youtuben kayttoehtoihin sait taman sahkspostin koska youtuben kéyttdehtoja ehdot paivitetty selkemmiksi lapinakyvammiksi ehdot paivitettiin vastaavalla tavalla yhdysv. tuntemistiedot epas muistutus vastatkaa epassin tuntemistietokyselyyn tama viesti lahetetty yritykselle andan hei epassin palveluntarjoaja haluamme muistuttaa etta teidan tulee vastata epassin asiakka. sovellukset tintlc sykiénthe lita sanomat verkkokauppa kotikonttori powe giganttiverkkokau google sheets googlekkeep muut ijanmerkit lukulsta. hangouts tarja reponen huhtikuun alv myynnit hei huhtikuun alv palautusta eur voitko ilmoittaa mitka summat maalis huhtikuussa uuden yrittajan myyntis koska korttimyynnit tulee pan,viing plays the role guan the movie she can stupid person has major role more than couple. dudi duge split bar murc due. thanh cap right april. euat show and liva tudi the first child the world stupid. ths nguyen thi kim len qui covers activities. thudng nguyen nhan has bee star. many different mircs the division divided into mircs due the exact time difference. the owner this page less than years old and has been living and mirc has been state from years old she has moved new location. how many people like the mirc model the grader suffering from pain. eedy when tell you that sorry. medical examination good sirc,Hiện tượng đau lưng dưới là dấu hiệu của bệnh gì? | Medlatec - Google Chrome,dau that lung duoi la benh gi - google-haku - google chrome,50
viing plays the role guan the movie she can stupid person has major role more than couple. dudi duge split bar murc due. thanh cap right april. euat show and liva tudi the first child the world stupid. ths nguyen thi kim len qui covers activities. thudng nguyen nhan has bee star. many different mircs the division divided into mircs due the exact time difference. the owner this page less than years old and has been living and mirc has been state from years old she has moved new location. how many people like the mirc model the grader suffering from pain. eedy when tell you that sorry. medical examination good sirc. </s>usp sharing. task thiv next month june. task thir tuesday june. task thir next week june. task thir tudn after month. please write the following information. </s>hangouts kontakeja sta valitet ettaja paiva. sta valitet ettaja paiva. psr isp grs snv. sovellukset tintlc sykiénthe lfa sanomat mtalehti suom youtube facebook google verkkokauppa kotlkonttori powe giganttiverkkokau google sheets googlekeep muutkirjanmerkit lukulsta. ehdot tietosuoja kayton saannot viimeinen toiminta tala ila minuuttia siten,not and well done. dudi when you press. fall the palm your hand. nayta aina taydet url osoitteet. tintic sukignthé lta sanomat ltaleht suom youtube facebook google elekioniiks koko verkkokauppa . lits hsku squishy dsu phis cusi pressed. let shout out everyone from. gigantt verdkokau google sheets. pau lung dudi dangerous. what kind education and training are you going see and where are you going study dir déi stupid. the location hodc dir doi stupid. what kind teaching and learning are you going have show off study dir déi stupid. the ban quan tam. higu cda what medlatec. where are you going. what the point understanding. p medlatecyn tin tuc hien tuong dau lung duoi dau hieu cua benh. cam thdy meters has good body every student the school has been born the middle the night because has bad hand,Hiện tượng đau lưng dưới là dấu hiệu của bệnh gì? | Medlatec - Google Chrome,dau that lung duoi la benh gi - google-haku - google chrome,51
not and well done. dudi when you press. fall the palm your hand. nayta aina taydet url osoitteet. tintic sukignthé lta sanomat ltaleht suom youtube facebook google elekioniiks koko verkkokauppa . lits hsku squishy dsu phis cusi pressed. let shout out everyone from. gigantt verdkokau google sheets. pau lung dudi dangerous. what kind education and training are you going see and where are you going study dir déi stupid. the location hodc dir doi stupid. what kind teaching and learning are you going have show off study dir déi stupid. the ban quan tam. higu cda what medlatec. where are you going. what the point understanding. p medlatecyn tin tuc hien tuong dau lung duoi dau hieu cua benh. cam thdy meters has good body every student the school has been born the middle the night because has bad hand. </s>viing plays the role guan the movie she can stupid person has major role more than couple. dudi duge split bar murc due. thanh cap right april. euat show and liva tudi the first child the world stupid. ths nguyen thi kim len qui covers activities. thudng nguyen nhan has bee star. many different mircs the division divided into mircs due the exact time difference. the owner this page less than years old and has been living and mirc has been state from years old she has moved new location. how many people like the mirc model the grader suffering from pain. eedy when tell you that sorry. medical examination good sirc. </s>usp sharing. task thiv next month june. task thir tuesday june. task thir next week june. task thir tudn after month. please write the following information,roueeec lsrr task index. eiturvaliinen  regione toscana web tamminhduong home blogs dau lung duoi benh cach dieu tri moi. sovellukset tintlc sykiénthe lha sanomat lhalehti suom youtube facebook google verkkokauppa kotlkonttori powe giganttiverkkokau google sheets googlekeep muutkirjanmerit lukulsta. eitunalinen  regione toscana web home,Dau lưng dưới là bệnh gì và 8 cách diều trị mới 2021 - Tâm Minh Đường - Liferay - Google Chrome,dau that lung duoi la benh gi - google-haku - google chrome,54
roueeec lsrr task index. eiturvaliinen  regione toscana web tamminhduong home blogs dau lung duoi benh cach dieu tri moi. sovellukset tintlc sykiénthe lha sanomat lhalehti suom youtube facebook google verkkokauppa kotlkonttori powe giganttiverkkokau google sheets googlekeep muutkirjanmerit lukulsta. eitunalinen  regione toscana web home. </s>not and well done. dudi when you press. fall the palm your hand. nayta aina taydet url osoitteet. tintic sukignthé lta sanomat ltaleht suom youtube facebook google elekioniiks koko verkkokauppa . lits hsku squishy dsu phis cusi pressed. let shout out everyone from. gigantt verdkokau google sheets. pau lung dudi dangerous. what kind education and training are you going see and where are you going study dir déi stupid. the location hodc dir doi stupid. what kind teaching and learning are you going have show off study dir déi stupid. the ban quan tam. higu cda what medlatec. where are you going. what the point understanding. p medlatecyn tin tuc hien tuong dau lung duoi dau hieu cua benh. cam thdy meters has good body every student the school has been born the middle the night because has bad hand. </s>viing plays the role guan the movie she can stupid person has major role more than couple. dudi duge split bar murc due. thanh cap right april. euat show and liva tudi the first child the world stupid. ths nguyen thi kim len qui covers activities. thudng nguyen nhan has bee star. many different mircs the division divided into mircs due the exact time difference. the owner this page less than years old and has been living and mirc has been state from years old she has moved new location. how many people like the mirc model the grader suffering from pain. eedy when tell you that sorry. medical examination good sirc,there lot pain tuberculosis disease ulcer. cried out because had school don agree join the second shift. windscribe free proxy and blocker. everyday life due work sports accidents good health and well being. exit from dfa dfa dfa dfa dfa sdng beauty page. unfortunately sur flowers and health care nct truee. sucjattu haku haku termils beautify and nct phd bight thosi hia. uong not happy sur flowers and health care nct truee,Nguyên nhân đau thắt lưng - Google Chrome,dau that lung duoi la benh gi - google-haku - google chrome,56
there lot pain tuberculosis disease ulcer. cried out because had school don agree join the second shift. windscribe free proxy and blocker. everyday life due work sports accidents good health and well being. exit from dfa dfa dfa dfa dfa sdng beauty page. unfortunately sur flowers and health care nct truee. sucjattu haku haku termils beautify and nct phd bight thosi hia. uong not happy sur flowers and health care nct truee. </s>roueeec lsrr task index. eiturvaliinen  regione toscana web tamminhduong home blogs dau lung duoi benh cach dieu tri moi. sovellukset tintlc sykiénthe lha sanomat lhalehti suom youtube facebook google verkkokauppa kotlkonttori powe giganttiverkkokau google sheets googlekeep muutkirjanmerit lukulsta. eitunalinen  regione toscana web home. </s>not and well done. dudi when you press. fall the palm your hand. nayta aina taydet url osoitteet. tintic sukignthé lta sanomat ltaleht suom youtube facebook google elekioniiks koko verkkokauppa . lits hsku squishy dsu phis cusi pressed. let shout out everyone from. gigantt verdkokau google sheets. pau lung dudi dangerous. what kind education and training are you going see and where are you going study dir déi stupid. the location hodc dir doi stupid. what kind teaching and learning are you going have show off study dir déi stupid. the ban quan tam. higu cda what medlatec. where are you going. what the point understanding. p medlatecyn tin tuc hien tuong dau lung duoi dau hieu cua benh. cam thdy meters has good body every student the school has been born the middle the night because has bad hand,haanh vieovna nice much. hope that everyone will have good time soon you have child you know that. the style the room. the information related the editions the above mentioned documents. ngre related sedation and other stich issues. hitp iww regione toscana web kaanna tama sivu. what the list goals and ways calculate every three. method value gidm value,Task 1 - Suc Khoe (No Index) - Google Docs - Google Chrome,mối liên quan giữa đau thắt lưng dưới và các vấn đề sức khoẻ khác (ngoài các bệnh xương khớp). - google-haku - google chrome,74
haanh vieovna nice much. hope that everyone will have good time soon you have child you know that. the style the room. the information related the editions the above mentioned documents. ngre related sedation and other stich issues. hitp iww regione toscana web kaanna tama sivu. what the list goals and ways calculate every three. method value gidm value. </s>there lot pain tuberculosis disease ulcer. cried out because had school don agree join the second shift. windscribe free proxy and blocker. everyday life due work sports accidents good health and well being. exit from dfa dfa dfa dfa dfa sdng beauty page. unfortunately sur flowers and health care nct truee. sucjattu haku haku termils beautify and nct phd bight thosi hia. uong not happy sur flowers and health care nct truee. </s>roueeec lsrr task index. eiturvaliinen  regione toscana web tamminhduong home blogs dau lung duoi benh cach dieu tri moi. sovellukset tintlc sykiénthe lha sanomat lhalehti suom youtube facebook google verkkokauppa kotlkonttori powe giganttiverkkokau google sheets googlekeep muutkirjanmerit lukulsta. eitunalinen  regione toscana web home,state the end check. gdp the normal cups the normal cups caused the phone. baultng dudi fade away. male let know there gap hiy cing. people talking about hudung crammed money the room where the doctor can. long dusi ving cot. e out quickly nuge. anyone who wants see this page should able see what going. make sure that you are male. rust thira you young you not good enough and you good health. used have good time with husband and put the tir the office. first aid and service. ding kenthucyduoc right now. the outside the house more than just cup tea. what are you sick and tired according pgs nguyen nghia nguyen giang vien medical student hcmc pinch. years old ddn con syt. uong not able use the language the country but still active. need get out hurry and scream for help right away because this pared many other places can different because this. what the name the dwdi. sovellset tintic sukignthé lta sanomat halehti suom facebook google elekironiikks koko verkkoksuppa kotkonttori powe giganttiverkkokau google sheets googlekeep muutkijanmerkt lukuistaet. your name and cycle. sovellset tintic sukignthé lta sanomat halehti suom facebook google elekironiikks koko verkkoksuppa kotkonttori powe giganttiverkkokau google sheets googlekeep muutkijanmerkt lukuista. many idn bits nudc duc hodc fast the country this due the illness and the coal worth noting. male give higu past ching may must good cing. who more less famous due the fact that his phone gay. the world around makes the first one two different people hello. tpning curvy valve syt nvd. this property centerpiece for variety beautiful properties due the pain sharp. check your name and signature. wailing people with hudng crammed money the air that the coal filter can. valve can used immediately due the vilng may not able take the exam today. good health duc male. gate valve syt nvd. will able dif the data. gitra lung tinh viing tht lung fade mdt will beautiful and beautiful. iung the name the place and the center the middle the house. ching soon resound samnganh male. let higu pass ching may gap fade good cing. what wrong with this guy according pgs nguyen nghia nguyen giang vien graduate student hcmc enter. find out more about this the following content. the risk falling from pared the average. please let know there gap good cing. reveal the design right away due. tells how put money the cda stream. nursc duc model nudc title day can due error. going have trdid understand there gap good cing. dwei dwei very well and the most important results the first meeting. let higu pass case there gap hope. anyone who wants see this page should able use the website. all need scream out loud everyone right away. sick dudi baby swallow gidng. the cup not only cup tea but also cup tea. let people learn follow. vitri clia the center the center for different delicatessens due the knife sharp. uncover right away due people may different from the petition. please call van dong thsdng right away due pared with many other students possible pete with ndy. cling like luc came out. first aid and treatment. ehity hig hbu froug aeat. the design and construction the website are different from each other due. have sharp heart tet. bee hooves and screams right away due pared may different from this point. how beautiful are you. the building and construction the building are designed used building block that can easily replaced the meter will quick and easy. gdp the normal munication between the teacher and the student more convenient. very happy with life. officials issued medical equipment. fat scale collection hdi thudc violation. find out more details about this the following content. another sharp pain painful one. other than that where the pain the head. viiig hau cdc van dongithirtmgnigay voiihirhg ving the rhachi vir. what wrong with you. other than that there sharp pain the head dusi has quick look and picture that can desired. who more less famous due the fact that the phone gay. going scream people going have put money office,Đau lưng dưới là bệnh gì và các vị trí đau thường gặp nhất - Google Chrome,mối liên quan giữa đau thắt lưng dưới và các vấn đề sức khoẻ khác - google-haku - google chrome,75
