source,target,title,query,index
jotts han voi lsstis astrologisen tahtikartan seurss. lappeenranta kaupunki joka kéy. tintic syliénthe lha sanomat italehti suom youtube facebook google hlekironiikka koko verkkokauppa kotikontiori powe lukulsta. matkailijoita vain kourallinen vanhankaupungin kadut ovat lumenvalkoiset. saariston rengastie parhaat vinkit matkalle. taalla rauli virtanen hamina. minne nyt voi matkustaa katso paivitetty lista. suomen parhaat perhekohteetsuomi maat maailman parhaat aktiivimatkailu matkavinkit paratiisireportteri blogi tekijat. suomi kotimaan parhaat matkakohteet. porvoo suomen kuuluisin hienoin puutalokaupunki rauman ohella erityisen ihanaksi pohjois norjan parhaat matkakohteet nama suomen kiehtovimmat kartanot. risteily kauniiden saaristomaisemien halki kestda tuntia matkalla nahdaan myos. porveo taika kaunsimmillaan pienills keskiaikaisills kujil kuva julia kivelé visit finland. toinen aitoissa toimiva ravintola ranta aitta johon sisaankaynti jokikadun puolelta. merilts saapuneet purjelaivat purkivat aikoinaan lastinsa ranta aitat maalattiin. porvoo taiks kauneimmillaan pienills keskiaikaisills kujilla kuva julis kivels visit finland kannattaa kokea ahvenanmaalla. nepalilsinen ennustajs katsoo kartslts miss suomi. jos pidit tasts artikkelista arvostamme kovin jos jaat sen vaikkapa facebookissa. molemmat kadut ovat kapeita natteja kavelijoille pyhitettyja. tunnelmallisin tapa matkustaa helsingista porvooseen risteily runebergilla. suomi maat maailman parhaat aktiivimatkailu matkavinkit paratiisireportteri blogi teki. porvoo suomen kuuluisin hienoin puutalokaupunki rauman ohella erityisen ihanaksi pohjois norjan parhaat matkakohteet nama. suomi maat maailman parhaat aktiivimatkailu matkavinkit paratiisireportteri blogi tekijat. tarkes osa vanhan porvoon nakymia ovat joenrannan punaiset ranta aitat niihin maailman. yilaer verame iemel suomen parhaat hiihtokeskukset. talvella porvoo voi tuntua jopa kesaistakin porvoota tunnelmallisemmalta kun muita. vilkas valikatu hieman rauhallisempi. edelfeltin ateljeemuseo sijaitsee haikon kartanon yhteydessa porvoon edustalla. kerro omia porvoon vinkkejési auta muita matkailijoita kokemaan taydellinen porvoon. porvoo anihanan tunmelmslinen tavlle kuvas vit porvoo taso. abvenanmaan parhast nahtao suomen kiehtovimmat kartanot. suomesta saamme pienen provision mutta sind maksa penniakaén ylimaaraists. kuvanmittaisiakirkon kulmalla pieni ville vallgrenin tekema albert edelfeltin rintakuva,kasitoita ravintoloiden lukumaara taso uskomaton suklaapuodit mutkittelevat mukul. lapset rakastavat vanhaa porvoota jonka nakymat. sivusto kayttaa evasteita kayttajakokemuksen parantamiseksi lue lisaa evasteista taaltaikuistetaan tunnelmallisia hetkia joita muistellaan pitkaan vaikka alueella eletaan vahvasti nykypaivaa. vanhassa porvoossa katseltavaa ympari vuoden vanhassa porvoossa kannattaa kayda pelkastain lapset rakastavat vanhaa porvoota jonka nakymat. suomalaista designia porvoolaisia kasitoita antiikkia. kasitoita ravintoloiden lukumaara taso uskomaton suklaapuodit mutkittelevat mukulakivikujat salaset. pienet leikkipuistot vanha porvo. matkailijoiden kestosuosikki matkailijat tulevat ihastelemaan varikkaita puutaloja kavelemaan. vanhassa porvoossa katseltavaa ympari vuoden vanhassa porvoossa kannattaa kayda pelkastaan lapset rakastavat vanhaa porvool first. vanha porvoo ranta aittoineen yksi suomen valokuvatuimmista kansallismaisemista. vanhaa maisemaa arkkitehtuuria taidetta antiikkia ravintoloiden vuoksi ollakseen pieni kaupunki ovat kuin suoraan satukiriasta. sivusto kayttaa evasteita kayttajakokemuksen parantamiseksi lue lisaa evasteista taaltar. ravintoloiden lukumaara taso uskomaton. kaikenikaisille lapsille ikimuistosen elamyksen. ikuistetaan tunnelmallisia hetkia joita muistellaan pitkéaan vaikka alueella eletaan vahvasti nykypaivaa. vanhaa porvoota tullaan katsomaan eri puolilta maailmaa eika ihme ainutlaatuinen porvoossa. suklaapuodit mutkittelevat mukulakivikujat salaiset. moni asia sopivasti ennallaan kaikkein eniten tunnelma. thaleht swom youtube facebook google elekironiiks koko verkkoksuppa kotonttori powe giganttiverkkokau googlesheets googlekeep muutkijanmerkit lukuista. heil olen kunta kati. vanhassa porvoossa kannattaa kayda pelkastaan. kaikenikeisille lapsille ikimuistoise kaupunkia. majoituspalveluista nautil idyllisesta menneen ajan. ravintoloiden vuoksi ollakseen pieni kaupuniki. pienet leikkipuistot vanha porvo vataon. tama sivusto kayttaa evasteita kayttajakokemuksen parantamiseksi lue. vanhaa maisemaa arkkitehtuuria taidetta antiikkia. tama sivusto kavitaa evasteita kavttaiakokemuksen parantamiseksi lue lis nahtavyydet. nahtavyydet ravintolat kahvilat lasten porvoo. vanhassa porvoossa katseltavaa ympari vuoden. kasintehtya paikallista suklaata matkamuistoja. vuodenajan mukaan huomaa etta lista ole kaiken. vanhaa maisemaa arkkitehtuuria taidetta antiikkia ravintoloiden vuoksi ollakseen pieni kaupunki ovat kuin suoraan satukirjasta. kahviloiden putiikkien aukioloajat paivan. kapeita mukulakivikatuja pitkin nauttimaan kahviloiden ravintoloiden tarjonnasta ostoksille. pienet leikkipuistot vanha porvoo tarjoaa. vieta yosi yhdessa vanhan porvoon lukuisista pienista. vanhassa porvoossa katseltavaa ympari vuoden vanhassa porvoossa kannattaa kayda pelkastain lapset rakastavat vanhaa porvool. ovat kuin suoraan satukirjasta. vanhan porvoon suloisista pikkuputiikeista. taalta naet nahtavyyskohteiden ravintoloiden. sisustustavaroita vaatteita kaikkia naita loydat. suklaakauppoihin pikkuputiikkeihin moni rauhoittuu koko jokilaakson kattavassa kansallissessa,Vanha Porvoo - Porvoo - Google Chrome,porvoon vanha kaupunki - google-haku - google chrome,822
kasitoita ravintoloiden lukumaara taso uskomaton suklaapuodit mutkittelevat mukul. lapset rakastavat vanhaa porvoota jonka nakymat. sivusto kayttaa evasteita kayttajakokemuksen parantamiseksi lue lisaa evasteista taaltaikuistetaan tunnelmallisia hetkia joita muistellaan pitkaan vaikka alueella eletaan vahvasti nykypaivaa. vanhassa porvoossa katseltavaa ympari vuoden vanhassa porvoossa kannattaa kayda pelkastain lapset rakastavat vanhaa porvoota jonka nakymat. suomalaista designia porvoolaisia kasitoita antiikkia. kasitoita ravintoloiden lukumaara taso uskomaton suklaapuodit mutkittelevat mukulakivikujat salaset. pienet leikkipuistot vanha porvo. matkailijoiden kestosuosikki matkailijat tulevat ihastelemaan varikkaita puutaloja kavelemaan. vanhassa porvoossa katseltavaa ympari vuoden vanhassa porvoossa kannattaa kayda pelkastaan lapset rakastavat vanhaa porvool first. vanha porvoo ranta aittoineen yksi suomen valokuvatuimmista kansallismaisemista. vanhaa maisemaa arkkitehtuuria taidetta antiikkia ravintoloiden vuoksi ollakseen pieni kaupunki ovat kuin suoraan satukiriasta. sivusto kayttaa evasteita kayttajakokemuksen parantamiseksi lue lisaa evasteista taaltar. ravintoloiden lukumaara taso uskomaton. kaikenikaisille lapsille ikimuistosen elamyksen. ikuistetaan tunnelmallisia hetkia joita muistellaan pitkéaan vaikka alueella eletaan vahvasti nykypaivaa. vanhaa porvoota tullaan katsomaan eri puolilta maailmaa eika ihme ainutlaatuinen porvoossa. suklaapuodit mutkittelevat mukulakivikujat salaiset. moni asia sopivasti ennallaan kaikkein eniten tunnelma. thaleht swom youtube facebook google elekironiiks koko verkkoksuppa kotonttori powe giganttiverkkokau googlesheets googlekeep muutkijanmerkit lukuista. heil olen kunta kati. vanhassa porvoossa kannattaa kayda pelkastaan. kaikenikeisille lapsille ikimuistoise kaupunkia. majoituspalveluista nautil idyllisesta menneen ajan. ravintoloiden vuoksi ollakseen pieni kaupuniki. pienet leikkipuistot vanha porvo vataon. tama sivusto kayttaa evasteita kayttajakokemuksen parantamiseksi lue. vanhaa maisemaa arkkitehtuuria taidetta antiikkia. tama sivusto kavitaa evasteita kavttaiakokemuksen parantamiseksi lue lis nahtavyydet. nahtavyydet ravintolat kahvilat lasten porvoo. vanhassa porvoossa katseltavaa ympari vuoden. kasintehtya paikallista suklaata matkamuistoja. vuodenajan mukaan huomaa etta lista ole kaiken. vanhaa maisemaa arkkitehtuuria taidetta antiikkia ravintoloiden vuoksi ollak,elektronilkka koko verkkokauppa . brunssista ravintola samalla kunnianosoitus porvoolaisen. tunneimallinen uvun hirsirakennus ssa toimil uusi ravintol. ohella kunkin paivan tuoreista raaka aineista loindittuja bistroklassikoita. terms use reportamap eror. sicapelle wining dining tarjoaa vilkoittain vaihtuvien yilatysmenujen. sittemmin parisilaistuneen kuvanveistaja ville vallgrenin sikapelle. sunnuntaisin sicapellessa nautitaan mutkattoman viintyisasta. saltin menu koostuu satokauden tuotteista annokset suunniteltu. vanhan porvoon keskella keskiaikaisen tuomiokirkon kupeessa sijatsee. terms use report amap eror,Palvelut Vanhassa Porvoossa - Porvoo - Google Chrome,porvoo kauppatori - google-haku - google chrome,853
elektronilkka koko verkkokauppa . brunssista ravintola samalla kunnianosoitus porvoolaisen. tunneimallinen uvun hirsirakennus ssa toimil uusi ravintol. ohella kunkin paivan tuoreista raaka aineista loindittuja bistroklassikoita. terms use reportamap eror. sicapelle wining dining tarjoaa vilkoittain vaihtuvien yilatysmenujen. sittemmin parisilaistuneen kuvanveistaja ville vallgrenin sikapelle. sunnuntaisin sicapellessa nautitaan mutkattoman viintyisasta. saltin menu koostuu satokauden tuotteista annokset suunniteltu. vanhan porvoon keskella keskiaikaisen tuomiokirkon kupeessa sijatsee. terms use report amap eror. </s>kasitoita ravintoloiden lukumaara taso uskomaton suklaapuodit mutkittelevat mukul. lapset rakastavat vanhaa porvoota jonka nakymat. sivusto kayttaa evasteita kayttajakokemuksen parantamiseksi lue lisaa evasteista taaltaikuistetaan tunnelmallisia hetkia joita muistellaan pitkaan vaikka alueella eletaan vahvasti nykypaivaa. vanhassa porvoossa katseltavaa ympari vuoden vanhassa porvoossa kannattaa kayda pelkastain lapset rakastavat vanhaa porvoota jonka nakymat. suomalaista designia porvoolaisia kasitoita antiikkia. kasitoita ravintoloiden lukumaara taso uskomaton suklaapuodit mutkittelevat mukulakivikujat salaset. pienet leikkipuistot vanha porvo. matkailijoiden kestosuosikki matkailijat tulevat ihastelemaan varikkaita puutaloja kavelemaan. vanhassa porvoossa katseltavaa ympari vuoden vanhassa porvoossa kannattaa kayda pelkastaan lapset rakastavat vanhaa porvool first. vanha porvoo ranta aittoineen yksi suomen valokuvatuimmista kansallismaisemista. vanhaa maisemaa arkkitehtuuria taidetta antiikkia ravintoloiden vuoksi ollakseen pieni kaupunki ovat kuin suoraan satukiriasta. sivusto kayttaa evasteita kayttajakokemuksen parantamiseksi lue lisaa evasteista taaltar. ravintoloiden lukumaara taso uskomaton. kaikenikaisille lapsille ikimuistosen elamyksen. ikuistetaan tunnelmallisia hetkia joita muistellaan pitkéaan vaikka alueella eletaan vahvasti nykypaivaa. vanhaa porvoota tullaan katsomaan eri puolilta maailmaa eika ihme ainutlaatuinen porvoossa. suklaapuodit mutkittelevat mukulakivikujat salaiset. moni asia sopivasti ennallaan kaikkein eniten tunnelma. thaleht swom youtube facebook google elekironiiks koko verkkoksuppa kotonttori powe giganttiverkkokau googlesheets googlekeep muutkijanmerkit lukuista. heil olen kunta kati. vanhassa porvoossa kannattaa kayda pelkastaan. kaikenikeisille lapsille ikimuistoise k,amanf august eki fin puisto. sstee terms privacy send fesdback. kahvila cafe jokiranta jokikatu. porvoon beds and books,Jokikatu 23 - Google Maps - Google Chrome,porvoo kauppatori - google-haku - google chrome,854
amanf august eki fin puisto. sstee terms privacy send fesdback. kahvila cafe jokiranta jokikatu. porvoon beds and books. </s>elektronilkka koko verkkokauppa . brunssista ravintola samalla kunnianosoitus porvoolaisen. tunneimallinen uvun hirsirakennus ssa toimil uusi ravintol. ohella kunkin paivan tuoreista raaka aineista loindittuja bistroklassikoita. terms use reportamap eror. sicapelle wining dining tarjoaa vilkoittain vaihtuvien yilatysmenujen. sittemmin parisilaistuneen kuvanveistaja ville vallgrenin sikapelle. sunnuntaisin sicapellessa nautitaan mutkattoman viintyisasta. saltin menu koostuu satokauden tuotteista annokset suunniteltu. vanhan porvoon keskella keskiaikaisen tuomiokirkon kupeessa sijatsee. terms use report amap eror. </s>kasitoita ravintoloiden lukumaara taso uskomaton suklaapuodit mutkittelevat mukul. lapset rakastavat vanhaa porvoota jonka nakymat. sivusto kayttaa evasteita kayttajakokemuksen parantamiseksi lue lisaa evasteista taaltaikuistetaan tunnelmallisia hetkia joita muistellaan pitkaan vaikka alueella eletaan vahvasti nykypaivaa. vanhassa porvoossa katseltavaa ympari vuoden vanhassa porvoossa kannattaa kayda pelkastain lapset rakastavat vanhaa porvoota jonka nakymat. suomalaista designia porvoolaisia kasitoita antiikkia. kasitoita ravintoloiden lukumaara taso uskomaton suklaapuodit mutkittelevat mukulakivikujat salaset. pienet leikkipuistot vanha porvo. matkailijoiden kestosuosikki matkailijat tulevat ihastelemaan varikkaita puutaloja kavelemaan. vanhassa porvoossa katseltavaa ympari vuoden vanhassa porvoossa kannattaa kayda pelkastaan lapset rakastavat vanhaa porvool first. vanha porvoo ranta aittoineen yksi suomen valokuvatuimmista kansallismaisemista. vanhaa maisemaa arkkitehtuuria taidetta antiikkia ravintoloiden vuoksi ollakseen pieni kaupunki ovat kuin suoraan satukiriasta. sivusto kayttaa evasteita kayttajakokemuksen parantamiseksi lue lisaa evasteista taaltar. ravintoloiden lukumaara taso uskomaton. kaikenikaisille lapsille ikimuistosen elamyksen. ikuistetaan tunnelmallisia hetkia joita muistellaan pitkéaan vaikka alueella eletaan vahvasti nykypaivaa. vanhaa porvoota tullaan katsomaan eri puolilta maailmaa eika ihme ainutlaatuinen porvoossa. suklaapuodit mutkittelevat mukulakivikujat salaiset. moni asia sopivasti ennallaan kaikkein eniten tunnelma. thaleht swom youtube facebook google elekironiiks koko verkkoksuppa kotonttori powe giganttiverkkokau googlesheets googlekeep muutkijan,empirekaupungin rakentaminen purku uhka muokkaa muokkaa wikitskstia. deemsunnen keskiajalta suureen paloon. tulosta taivie pohjoisessa rajana joentormalla siaitseva entinen porvoon maalaiskunnan kaupungin raja raja nakyy selvasti rakennetun alueen paattymisena ienvieressa olevasta tuliportin pylvaasta pohjoisessa maen paalia. tanne vittaavat sivut tagantinran koordinaatit. kasvoi viipurin jaatya venajalle uudenkaupungin raunassa keskiaikaisista rakennuksista ovat silyneet porvoon tuomiokirkko kellotapulija joitakin kellareital. vanha porvoo paikallisesti ruotsiksi usein gamia stan porvoon kaupungin vanhin kaupunginosa kaupungin historiallinen keskusta kaupunginosa tunnettu turistikohde keskiaikaisen asemakaavansa hyvin vanha poriee. vuoden suurpalo jélleenrakennus muokkas muskkaa wikitskstia. sivun tiedot pinta ala. varsinainen noin hehtaarin laajuinen vanhakaupunki sijaitsee porvoon keskustan kupeessa porvoonjoen rantatormalla aluetia rajaavat lannessa joki etelassa mannerheiminkatu seka rinkamakatu idassa kaivokatu postinumerot. purkaa keskialkaiseen kaavaan rakennetut kortelit niiden tilalle olisi tulut empirekaupungin ruutuasemakaavaa purku uhka vaislyi vuonna alue sai asemakaavan vuonna vanhan porvoon sallyttamiseen vaikutti. korkeuserot joenrannasta korkeimpaan kohtaan vanhan porvoon pohjoisosassa maasto viettaa joelle empirekaupunkia. rakennukset tentiin vanhojen kivijalkojen kellarien paallel vanhan porvoon nykyinen rakennuskanta pagosin rakennettu vuosina rakentamista pyrittiin paloturvallisuuden nimissa ohjaamaan kivirakennusten tekoon puutalojen sijaan. sovellukset tintdc sykiénthe lfa sanomat mtalehti suom youtube facebook google eekironiicks koko verkkokauppa kotkontiori powe giganttiverkkokau googlesheets googlekeep muutkijanmerkit lukulsta. pohjoisessa rajana joentermalla siaitseva entinen porvoon maalaiskunnan kaupungin raja raja nakyy selvasti rakennetun alueen paattymisena tienvieressa olevasta tuliportin pylvaasta pohjoisessa maen paalia. onie vuoden suurpalo jalleenrakennus. tomnsv aiheesta muualla kaupunginosa. vanhan kaupungin etelapuolelie rakennettiin luvulla empirekaupunki jonka vuoksi noin kolmannes vanhan porvoon eteldosan rakennuskannasta purettin jaljelle jaanyt vanha porvoo alkoi ransisty suunnitelmissa off. viitetiedot sijainti muokkaa muokkaa wikitekstia ivakiluku. rakennukset tentiin vanhojen kivijalkojen kellarien paallel vanhan porvoon nykyinen rakennuskanta pagosin rakennettu vuosina rakentamista pyrittiin paloturvalisuuden nimissa ohjaamaan kivirakennusten tekoon puutalojen sijaan. vuoden kartan mukaan viela virallisesti kaupunkiin kuuluneet lukiokuja linnakatu mutta vanhaa rakennuskantaa naiden pohjoispuoleliain silia vahavaraista vakea asui kaupungin tullirajan pohjoispuolelial alueelle luonteenomaista ovat suuret. lisza linkkela porvoo suomen vanhimpia kaupunkeja ensimmaiset merkinnat kaupungista ovat luvulta kaupunginoikeudet porvoon arvioidaan saaneen noin vuonna keskiaikainen porvoo oli porvoon iaanin paakaupunki asemakaavaa keskiajalla juurikaan. tulostettava versio korkeuserot joenrannasta korkeimpaan kohtaan vanhan porvoon pohjoisosassa maasto viettaa joelle empirekaupunkia. historia muckkaa muokkaa wikiteksta. atikkeli keskustelu lue muokkaa muokkaa wikitekstia nayta historia haha wikipedia. vanha porvoo paikallisesti ruotsiksi usein gamia stan porvoon kaupungin vanhin kaupunginosa kaupungin historiallinen keskusta kaupunginosa tunnettu turistikohde keskiaikaisen asemakaavansa hyvin. keskiajalta suureen paloon muokkea muokkaa wikitekstia. isonvinan alkainen kaupungin tuno kaupunki oli luvulia lakkautettu kahteenkin kertaan jotta asukkaat saataisiin muuttamaan uuteen helsingin kaupunkiin vuonna kaupunginolkeudet palasivat ovat jatkuneet siita asti keskeytykselta kaupungin merkitys. viuoden kes oli eritain kuiva tuli pazsi rouva holmin keittiosta kaupungista paloi noin kaupungin talosta vain sasty liekeilta kaupunki oli talven tulon takia jalleenrakennettava nopeasti siksi asemakaavaa juurikaan muutettu uudet. porvoo suomen vanhimpia kaupunkeja ensimmaiset merkinnat kaupungista ovat luvulta kaupunginoikeudet porvoon arvioidaan saaneen noin vuonna keskiaikainen porvoo ofi porvoon iaanin paakaupunki asemakaavaa keskiajalla juurikaan. sallyneiden luvun rakennusten vuoksi vanha porvoo kuuluu niin kansallismaisemien kuin valtakunnalisesti merkittaviin rakennettuihin kulttuuriymparistojen luetteloon. sijainti muokkaa muokkaa wikitekstia vakiluku noin. vanha poruoo wamermeiminkadn siata. viuoden kes oli eritain kuiva tulf pazsi rouva holmin kelttiosta kaupungista paloi noin kaupungin talosta vain sasty liekeilta kaupunki olitalven tulon takia jalleenrakennettava nopeasti siksi asemakaavaa juurikaan muutettu uudet. sallyneiden luvun rakennusten vuoksi vanha porvoo kuuluu niin kansallismaisemien kuin valtakunnalisesti merkittaviin rakennetuinin kulttuuriymparistjen luetteloon. suunniteltu vaan tontite olivat epasaanndllisen muotoisia pieniall kaupunki tunoutui useaan kertaan tulipaloissa vanhan ajan paloista merkittavimmat olivat tanskalaisten sytytiama palo luvun alussa kaksi luvun paloa venajan kanssa kaydyissa sodissa. kasvol viipurin jaatya and. vuoden suurpalo jalleenrakennus muokka muokkaa vikitekstia. isonvihan aikainen kaupungin tuno kaupunki oli uvulia lakkautettu kahteenkin kertaan jotta asukkaat saataisiin muuttamaan uuteen helsingin kaupunkiin vuonna kaupunginoikeudet palasivat ovat jatkuneet siita asti keskeytyksetta kaupungin merkitys. rakennukset tentiin vanhojen kivijalkojen kellarien paallel vanhan porvoon nykyinen rakennuskanta pagosin rakennettu vuosina rakentamista pyrittiin paloturvallisuuden nimissa ohjaamaan kivirakennusten tekoon puutalojen sijaan wiikipedia vanha porvoo koordinaatit. lataa pdf fiedostona vuoden kartan mukaan vieia virallisesti kaupunkiin kuuluneet lukiokuja linnakatu mutta vanhaa rakennuskantaa naiden pohjoispuoleliakin silia vahavaraista vakea asui kauphjois tullira kauphjois alueelle luonteenomaista ovat suuret. etole kijautunut keskustelu muokkaukset luo tunnus kirjaudu sisaan. historia muokkaa muokkaa wikitekstia. empirekaupungin rakentaminen purku uhka. muilla kiila keskiajalta suureen paloon muokkas muokkaa vikickstia. kasvoi viipurin jaatya venajalle uudenkaupungin raunassa keskiaikaisista rakennuksista ovat sailyneet porvoon tuomiokirkko kellotapulija joitakin keflareital. suunniteltu vaan tontite olivat epasaanndllisen muotoisia pienialzl kaupunki tunoutui useaan kertaan tulipaloissa vanhan ajan paloista merkittavimmat olivat tanskalaisten sytytiama palo luvun alussa kaksi luvun paloa venajan kanssa kaydyissa sodissa,Vanha Porvoo – Wikipedia - Google Chrome,vanha porvoo - google-haku - google chrome,860
empirekaupungin rakentaminen purku uhka muokkaa muokkaa wikitskstia. deemsunnen keskiajalta suureen paloon. tulosta taivie pohjoisessa rajana joentormalla siaitseva entinen porvoon maalaiskunnan kaupungin raja raja nakyy selvasti rakennetun alueen paattymisena ienvieressa olevasta tuliportin pylvaasta pohjoisessa maen paalia. tanne vittaavat sivut tagantinran koordinaatit. kasvoi viipurin jaatya venajalle uudenkaupungin raunassa keskiaikaisista rakennuksista ovat silyneet porvoon tuomiokirkko kellotapulija joitakin kellareital. vanha porvoo paikallisesti ruotsiksi usein gamia stan porvoon kaupungin vanhin kaupunginosa kaupungin historiallinen keskusta kaupunginosa tunnettu turistikohde keskiaikaisen asemakaavansa hyvin vanha poriee. vuoden suurpalo jélleenrakennus muokkas muskkaa wikitskstia. sivun tiedot pinta ala. varsinainen noin hehtaarin laajuinen vanhakaupunki sijaitsee porvoon keskustan kupeessa porvoonjoen rantatormalla aluetia rajaavat lannessa joki etelassa mannerheiminkatu seka rinkamakatu idassa kaivokatu postinumerot. purkaa keskialkaiseen kaavaan rakennetut kortelit niiden tilalle olisi tulut empirekaupungin ruutuasemakaavaa purku uhka vaislyi vuonna alue sai asemakaavan vuonna vanhan porvoon sallyttamiseen vaikutti. korkeuserot joenrannasta korkeimpaan kohtaan vanhan porvoon pohjoisosassa maasto viettaa joelle empirekaupunkia. rakennukset tentiin vanhojen kivijalkojen kellarien paallel vanhan porvoon nykyinen rakennuskanta pagosin rakennettu vuosina rakentamista pyrittiin paloturvallisuuden nimissa ohjaamaan kivirakennusten tekoon puutalojen sijaan. sovellukset tintdc sykiénthe lfa sanomat mtalehti suom youtube facebook google eekironiicks koko verkkokauppa kotkontiori powe giganttiverkkokau googlesheets googlekeep muutkijanmerkit lukulsta. pohjoisessa rajana joentermalla siaitseva entinen porvoon maalaiskunnan kaupungin raja raja nakyy selvasti rakennetun alueen paattymisena tienvieressa olevasta tuliportin pylvaasta pohjoisessa maen paalia. onie vuoden suurpalo jalleenrakennus. tomnsv aiheesta muualla kaupunginosa. vanhan kaupungin etelapuolelie rakennettiin luvulla empirekaupunki jonka vuoksi noin kolmannes vanhan porvoon eteldosan rakennuskannasta purettin jaljelle jaanyt vanha porvoo alkoi ransisty suunnitelmissa off. viitetiedot sijainti muokkaa muokkaa wikitekstia ivakiluku. rakennukset tentiin vanhojen kivijalkojen kellarien paallel vanhan porvoon nykyinen rakennuskanta pagosin rakennettu vuos,googlefi maps place vanha porvoo porvoo data saf qipm_dm alnfwakw sxw x_n_xf user faf qipm. odotetaan palvelita osoitteessa google. iii sovellukset tintiic sukiénthe ifta sanomat italehti suom youtube facebook google hektronikka koko verkkokauppa kotkonttori powe giganttiverkkokau googlesheets google keep,Vanha Porvoo – Google Maps - Google Chrome,vanha porvoo – google-haku - google chrome,865
