source,target,title,query,index
nannies and panies sse baihoc hongik. jksct tint kien the. student science and technology. eektronikka koko verkkokauppa kofikonttori powe gig. knang vid mén sushi velvet nhidu. good news study abroad spain. contact nnidu you can visit vietnam study abroad. high school student girizubi. are you charge your office. vrrttt cauhoithuong gap bangkytuvan dangky. duhoc nhat ban nzptir knoa. more important than the cic oaisushi ticket let meet each other. chil page nhat ban news nhat ban van hod nhat ban school sushi cover timiatm. wear when taking soup. cugc test you and baby. smart soton for evouton. honc student han lam. japanese information ticket sushitizo ching cing each other when. mbi labor dong thidu dah anga. tintuc viet nhat amthuc you. vietnamese study abroad vietnam. chin mangcénch dut hge bin. thibai school the best. tha sanomat lhalehti suom youtube facebook google eekirnikks koko verkkoksuppa kotkontiori powe. you sushico how many types. what kind sushieebeg you understand. hot conquering the world. sovellukset tintlc sykién the youtube facebook google elekironiicks koko verkkokauppa kotikonttori powe ossr lukulsta. the list online matches. airclira school your own country. national high school exam. viet sse hoc sangji. you should study abroad you will need borrow money and want the middle the city study abroad japan. what kind sushichbao hidu are you. urvallinen duhocyiet ssewn sushi bao many types. time eat and drink sushi but you love much and mudn. ing vibrating cla bin loan today ching bring aen cic ban cil nht study abroad pany. how much sushi how many types. </s>did you clean cita stupid good understand why this delicious andn qudc. sovellukset tintlc sykiénthe lfta sanomat mtalehti suom youtube facebook google eekironiicks koko verkkokauppa kotkonttori powe giganttiverkkokau googlesheets google keep mout kijanmerit lukulsta. sovellukset tintdc sykiénthe lfta sanomat mtalehti suom youtube facebook google eekironiicks koko verkkokauppa kotkontiori powe giganttiverkkokau googlesheets googlekeep muutkijanmerkit lukulsta. what does the for you. diengiadung maylocnuoc thietbinhabep dogiadung shavings. kotionttori powe giganttiverkkokau googlesheets googlekeep. you are the sushi chef you are called mon. mugi who ming around and mudi the role followed chi and  munity outside later. according the official website the city there clia mon sushi chinese teacher. delicious thom and and the name the owner the ad,sovellukset tin sykién thé lta sanomat. year old book cta nif thu trudng. qua tang cude séng. qgg how many kinds sushi sus nayta lisad. verkkokauppa kofikonttori powe giganttiverkkokau googe sheets googl. facebook google elekironiika koko verkkokauppa kotkontiori powe muut kijanmerkit. qua tang cude song. qgg how many kinds sushi ggg sus niytd,(20+) Watch | Facebook - Google Chrome,có bao nhiêu loại sushi - google-haku - google chrome,471
sovellukset tin sykién thé lta sanomat. year old book cta nif thu trudng. qua tang cude séng. qgg how many kinds sushi sus nayta lisad. verkkokauppa kofikonttori powe giganttiverkkokau googe sheets googl. facebook google elekironiika koko verkkokauppa kotkontiori powe muut kijanmerkit. qua tang cude song. qgg how many kinds sushi ggg sus niytd. </s>nannies and panies sse baihoc hongik. jksct tint kien the. student science and technology. eektronikka koko verkkokauppa kofikonttori powe gig. knang vid mén sushi velvet nhidu. good news study abroad spain. contact nnidu you can visit vietnam study abroad. high school student girizubi. are you charge your office. vrrttt cauhoithuong gap bangkytuvan dangky. duhoc nhat ban nzptir knoa. more important than the cic oaisushi ticket let meet each other. chil page nhat ban news nhat ban van hod nhat ban school sushi cover timiatm. wear when taking soup. cugc test you and baby. smart soton for evouton. honc student han lam. japanese information ticket sushitizo ching cing each other when. mbi labor dong thidu dah anga. tintuc viet nhat amthuc you. vietnamese study abroad vietnam. chin mangcénch dut hge bin. thibai school the best. tha sanomat lhalehti suom youtube facebook google eekirnikks koko verkkoksuppa kotkontiori powe. you sushico how many types. what kind sushieebeg you understand. hot conquering the world. sovellukset tintlc sykién the youtube facebook google elekironiicks koko verkkokauppa kotikonttori powe ossr lukulsta. the list online matches. airclira school your own country. national high school exam. viet sse hoc sangji. you should study abroad you will need borrow money and want the middle the city study abroad japan. what kind sushichbao hidu are you. urvallinen duhocyiet ssewn sushi bao many types. time eat and drink sushi but you love much and mudn. ing vibrating cla bin loan today ching bring aen cic ban cil nht study abroad pany. how much sushi how many types. </s>did you clean cita stupid good understand why this delicious andn qudc. sovellukset tintlc sykiénthe lfta sanomat mtalehti suom youtube facebook google eekironiicks koko verkkokauppa kotkonttori powe giganttiverkkokau googlesheets google keep mout kijanmerit lukulsta. sovellukset tintdc sykiénthe lfta sanomat mtalehti suom youtube facebook google eekironiicks koko verkkokauppa kotkontiori powe giganttiverkkokau googlesheets googlekeep muutkijanmerkit lukulsta. what does the for you. diengiadung ma,other than tsunamayomaki nhan sings hop mayonaise. sovellukset tintlc sykiénthe lfta sanomat mtalehti suom youtube facebook google eekironiicks koko verkkokauppa kotkontiori powe giganttiverkkokau googlesheets googlekeep muutkijanmerkit lukulsta japanduhoc sush. sovellukset tintlc sykiénthe lfta sanomat mtalehti suom youtube facebook google eekironiicks koko verkkokauppa kotkontiori powe giganttiverkkokau googlesheets googlekeep. inarizushi mon sushi diing aburaage sharp chira  sushi tron virng. inarizushi busy vegetarian restaurants outside the restaurant  sushi and virng can take the exam. tekkamaki type hosomaki chira ddy when the living room kind hosomaki,20 loại Sushi ngon nhất Nhật Bản - JAPANDUHOC - Google Chrome,có bao nhiêu loại sushi - google-haku - google chrome,472
other than tsunamayomaki nhan sings hop mayonaise. sovellukset tintlc sykiénthe lfta sanomat mtalehti suom youtube facebook google eekironiicks koko verkkokauppa kotkontiori powe giganttiverkkokau googlesheets googlekeep muutkijanmerkit lukulsta japanduhoc sush. sovellukset tintlc sykiénthe lfta sanomat mtalehti suom youtube facebook google eekironiicks koko verkkokauppa kotkontiori powe giganttiverkkokau googlesheets googlekeep. inarizushi mon sushi diing aburaage sharp chira  sushi tron virng. inarizushi busy vegetarian restaurants outside the restaurant  sushi and virng can take the exam. tekkamaki type hosomaki chira ddy when the living room kind hosomaki. </s>sovellukset tin sykién thé lta sanomat. year old book cta nif thu trudng. qua tang cude séng. qgg how many kinds sushi sus nayta lisad. verkkokauppa kofikonttori powe giganttiverkkokau googe sheets googl. facebook google elekironiika koko verkkokauppa kotkontiori powe muut kijanmerkit. qua tang cude song. qgg how many kinds sushi ggg sus niytd. </s>nannies and panies sse baihoc hongik. jksct tint kien the. student science and technology. eektronikka koko verkkokauppa kofikonttori powe gig. knang vid mén sushi velvet nhidu. good news study abroad spain. contact nnidu you can visit vietnam study abroad. high school student girizubi. are you charge your office. vrrttt cauhoithuong gap bangkytuvan dangky. duhoc nhat ban nzptir knoa. more important than the cic oaisushi ticket let meet each other. chil page nhat ban news nhat ban van hod nhat ban school sushi cover timiatm. wear when taking soup. cugc test you and baby. smart soton for evouton. honc student han lam. japanese information ticket sushitizo ching cing each other when. mbi labor dong thidu dah anga. tintuc viet nhat amthuc you. vietnamese study abroad vietnam. chin mangcénch dut hge bin. thibai school the best. tha sanomat lhalehti suom youtube facebook google eekirnikks koko verkkoksuppa kotkontiori powe. you sushico how many types. what kind sushieebeg you understand. hot conquering the world. sovellukset tintlc sykién the youtube facebook google elekironiicks koko verkkokauppa kotikonttori powe ossr lukulsta. the list online matches. airclira school your own country. national high school exam. viet sse hoc sangji. you should study abroad you will need borrow money and want the middle the city study abroad japan. what kind sushichbao hidu are you. urvallinen duhocyiet ssewn sushi bao many types. t,the end edo the most famous person invented type sushi with hotbed hayazushi different from the traditional way mon sushi. now not allowed give cup yeast the table make sour. this picture for because invisible can. transmit update and for shuttle heian and you can use make safe install narezushi reveal like. now not allowed let the men because they have. what kind sushi you know. the most famous sushi chef for beer vietnamese man  gidi favorite sashimi home. you can call and your bigt mon sushi cda your best friend. mon but out there and thre home. pression not enough muromachi trd after ding fat baby going ciing vgi. not enough know about mem mon but there only one mon and few pages thre you home. but sushi brought the star. bringing sushi the table beautiful display for everyone because not safe eat. the end edo the first person invented type sushi because hayazushi different from the traditional way mon sushi you. narezushi tea unveiling favorite country typically rej. praise tang famous that expensive but. email sashiminomevn gmeil in chaol sashimi home the gidp dugc for. giganttiverkkokau google sheets googlekeep muut ijanmerkit. ing famous the world but not many people know this language. there are members sushi that are tough very thin and have cup wasabi rdi for meal lot food and duroc how deal with this issue. you have you can call and how you know how make sushi,Sushi Là Gì? Điểm Tên Các Loại Sushi Cơ Bản - Sashimi Home - Google Chrome,có bao nhiêu loại sushi - google-haku - google chrome,473
the end edo the most famous person invented type sushi with hotbed hayazushi different from the traditional way mon sushi. now not allowed give cup yeast the table make sour. this picture for because invisible can. transmit update and for shuttle heian and you can use make safe install narezushi reveal like. now not allowed let the men because they have. what kind sushi you know. the most famous sushi chef for beer vietnamese man  gidi favorite sashimi home. you can call and your bigt mon sushi cda your best friend. mon but out there and thre home. pression not enough muromachi trd after ding fat baby going ciing vgi. not enough know about mem mon but there only one mon and few pages thre you home. but sushi brought the star. bringing sushi the table beautiful display for everyone because not safe eat. the end edo the first person invented type sushi because hayazushi different from the traditional way mon sushi you. narezushi tea unveiling favorite country typically rej. praise tang famous that expensive but. email sashiminomevn gmeil in chaol sashimi home the gidp dugc for. giganttiverkkokau google sheets googlekeep muut ijanmerkit. ing famous the world but not many people know this language. there are members sushi that are tough very thin and have cup wasabi rdi for meal lot food and duroc how deal with this issue. you have you can call and how you know how make sushi. </s>other than tsunamayomaki nhan sings hop mayonaise. sovellukset tintlc sykiénthe lfta sanomat mtalehti suom youtube facebook google eekironiicks koko verkkokauppa kotkontiori powe giganttiverkkokau googlesheets googlekeep muutkijanmerkit lukulsta japanduhoc sush. sovellukset tintlc sykiénthe lfta sanomat mtalehti suom youtube facebook google eekironiicks koko verkkokauppa kotkontiori powe giganttiverkkokau googlesheets googlekeep. inarizushi mon sushi diing aburaage sharp chira  sushi tron virng. inarizushi busy vegetarian restaurants outside the restaurant  sushi and virng can take the exam. tekkamaki type hosomaki chira ddy when the living room kind hosomaki. </s>sovellukset tin sykién thé lta sanomat. year old book cta nif thu trudng. qua tang cude séng. qgg how many kinds sushi sus nayta lisad. verkkokauppa kofikonttori powe giganttiverkkokau googe sheets googl. facebook google elekironiika koko verkkokauppa kotkontiori powe muut kijanmerkit. qua tang cude song. qgg how many kinds sushi ggg sus niytd,know more than different types sushi call gimbap with the main menu for showing sushi and. rich content addition plants can converted into many different types crops and matrices for the country dac. delicious food and using sorry. time say goodbye thank you. you can buy and sell products. mirt siu don gidn velvet circ delicious. trangchu onlineshop monviet mona monau thucduongpho doanvat uong. cream bdt fat ice cream tai delicious. and delicious right your ears. meter liza chon hido for mon sushi today. the source money not low months now cold and has been recognized many vietnamese people. sushi iai mon dwroc loves this current class. are confident our family and can make sushi. addition the first time you have child and child you will able use for the first time because beautiful thom. room muditinh and ddm nhat. ddu mutat lightning mayonaise,Những nguyên liệu làm sushi Nhật không thế thiếu - Món Ngon - Google Chrome,nguyên liệu cơ bản để làm sushi - google-haku - google chrome,479
know more than different types sushi call gimbap with the main menu for showing sushi and. rich content addition plants can converted into many different types crops and matrices for the country dac. delicious food and using sorry. time say goodbye thank you. you can buy and sell products. mirt siu don gidn velvet circ delicious. trangchu onlineshop monviet mona monau thucduongpho doanvat uong. cream bdt fat ice cream tai delicious. and delicious right your ears. meter liza chon hido for mon sushi today. the source money not low months now cold and has been recognized many vietnamese people. sushi iai mon dwroc loves this current class. are confident our family and can make sushi. addition the first time you have child and child you will able use for the first time because beautiful thom. room muditinh and ddm nhat. ddu mutat lightning mayonaise. </s>the end edo the most famous person invented type sushi with hotbed hayazushi different from the traditional way mon sushi. now not allowed give cup yeast the table make sour. this picture for because invisible can. transmit update and for shuttle heian and you can use make safe install narezushi reveal like. now not allowed let the men because they have. what kind sushi you know. the most famous sushi chef for beer vietnamese man  gidi favorite sashimi home. you can call and your bigt mon sushi cda your best friend. mon but out there and thre home. pression not enough muromachi trd after ding fat baby going ciing vgi. not enough know about mem mon but there only one mon and few pages thre you home. but sushi brought the star. bringing sushi the table beautiful display for everyone because not safe eat. the end edo the first person invented type sushi because hayazushi different from the traditional way mon sushi you. narezushi tea unveiling favorite country typically rej. praise tang famous that expensive but. email sashiminomevn gmeil in chaol sashimi home the gidp dugc for. giganttiverkkokau google sheets googlekeep muut ijanmerkit. ing famous the world but not many people know this language. there are members sushi that are tough very thin and have cup wasabi rdi for meal lot food and duroc how deal with this issue. you have you can call and how you know how make sushi. </s>other than tsunamayomaki nhan sings hop mayonaise. sovellukset tintlc sykiénthe lfta sanomat mtalehti suom youtube facebook google eekironiicks koko verkkokauppa kotkontiori powe giganttiverkkokau,danger for sirc khde hours. why does gari receive different sushi cuds from each other. matdinh dudng how sushi. why people often give wasabi sushi sashimi gitra and .   monngon nhung nguyen lieu lam sushi nhat khong the thieu,Task 2 - Van Hoa (No Index) - Google Docs - Google Chrome,"về mặt dinh dưỡng, sushi nào tốt? - google-haku - google chrome",491
danger for sirc khde hours. why does gari receive different sushi cuds from each other. matdinh dudng how sushi. why people often give wasabi sushi sashimi gitra and .   monngon nhung nguyen lieu lam sushi nhat khong the thieu. </s>know more than different types sushi call gimbap with the main menu for showing sushi and. rich content addition plants can converted into many different types crops and matrices for the country dac. delicious food and using sorry. time say goodbye thank you. you can buy and sell products. mirt siu don gidn velvet circ delicious. trangchu onlineshop monviet mona monau thucduongpho doanvat uong. cream bdt fat ice cream tai delicious. and delicious right your ears. meter liza chon hido for mon sushi today. the source money not low months now cold and has been recognized many vietnamese people. sushi iai mon dwroc loves this current class. are confident our family and can make sushi. addition the first time you have child and child you will able use for the first time because beautiful thom. room muditinh and ddm nhat. ddu mutat lightning mayonaise. </s>the end edo the most famous person invented type sushi with hotbed hayazushi different from the traditional way mon sushi. now not allowed give cup yeast the table make sour. this picture for because invisible can. transmit update and for shuttle heian and you can use make safe install narezushi reveal like. now not allowed let the men because they have. what kind sushi you know. the most famous sushi chef for beer vietnamese man  gidi favorite sashimi home. you can call and your bigt mon sushi cda your best friend. mon but out there and thre home. pression not enough muromachi trd after ding fat baby going ciing vgi. not enough know about mem mon but there only one mon and few pages thre you home. but sushi brought the star. bringing sushi the table beautiful display for everyone because not safe eat. the end edo the first person invented type sushi because hayazushi different from the traditional way mon sushi you. narezushi tea unveiling favorite country typically rej. praise tang famous that expensive but. email sashiminomevn gmeil in chaol sashimi home the gidp dugc for. giganttiverkkokau google sheets googlekeep muut ijanmerkit. ing famous the world but not many people know this language. there are members sushi that are tough very thin and have cup wasabi rdi for meal lot food and duroc how deal with this issue. you have you can call a,danger for sirc khde hours. love parents give bii ham irong thien high. khde however this material always the list contests such sushi restaurants besides girng ngam. why does gari receive different sushi cuds from each other. sashimi chi includes many dishes ngtr hdi kiem luon and bach tude all over the place. don waste the biogas the next shift and the temperature for days. the page translation the standard for the pression art and music particular sushi general addition nau chin. test for the heart just like knife for other nutrition. why people often give wasabi sushi sashimi gitra and . however the few men the list fda remending children young and pregnant and women who are pregnant pregnant. gyor taller but sushi includes many other ingredients feet. showing off these talents are always present the contests such sushi restaurants besides girng ngam. thrc can kill bacteria and sterilizing bacteria however few people like and. the sales sushi are just good for coal heart and business you can get. risk life threatening plications cost rare another danger eliminated due. the ban quan tam. sashimi all inclusive package that includes many dishes ngir kiem luon and bach tudc all about children. the two singers are happy then they will able call sashimi. nipivien vtv tat uat wewwiyiett. was born and declared full swing vira the two hotels are the main agents they will called sashimi. vegetarian sushi better than vegetables but delicious ingredient make sushi although. call the locator thw. the sushi test all good. meter cooking time and sushi ice cream you can clean the area while you are safe. get omega the morning. but you want gidm eat sashimi called sushi. the sushi mons don have packed gbm bag happy enjoy the new school year. the sushi mons don have packed gbm bag happy say that loves the two schools school vegetarian. dong state ciing gitip directly because the development area but not kill the general population. more than that the structure omega fatty acids persistent general will talk about nutrition with nutritional content that can reduce the science fatty acids.   monngon nhun sushi nhat khon. sushi contest hop hop gitta dwra chut dwra chut ndm ndm hand hand and head lwa chon tet for strc. since the raw material for the sushi pression not available many people are worried that the sushi will not sanctioned. and ing ing iat vira the two seps are paid then the diroc called sashimi. hwong charge singing sushi and sashimi are widely known japan and the world. don fet install the heater the back the refrigerator and freezer and heat for days bankalzheimar. cing member the staff ice cream sushi can used clean the area while you are safe. because the raw material for the sushi not cooked the chef charge the sushi and sushi balls are not available. years old the two them are sent each other will able call sashimi. the ban quan tama. sushi tet for strc khde catrs flea dinh dusng. taller but baby sushi includes many other ingredients. sushi divided into many different types because when  and other resources are forced. tuong nhu kiem map cling ham lrong thily ngan high don know what with sushi. sushi sales are just good for coal heart and business better design. send the cancer department. ciing gitp gidm mirc ctia one including gdm pcb pbdes and. drink omega the morning. taller but baby sushi includes many different bars. the future you don want chat you can chat with students and give you lot nutrition different types language. when you are the middle the night call nigiri sushi. detained when was finished change the diet and use the fat cholesterol and calories omega. called nigiri sushi when cudn cudn times maki sushi and. love for the heart just like knife for other purposes. many thanks but general children and young people press this picture. dong bang clings gilips because the development but doesn like die general personally know that the food delicious and safe for mon sushi way. sushi contest hop hop gitta dwra chute dwra ndm hand hand and wife that what iwra chooses for strc. ongoing addition the fact that sushi team has been tested for strc use the gilp personal protective equipment maintain the safety sushi how ttong npnngie jam. sorry for the strc. sushi divided into many different types for example when piling and other materials are forced hand. sashimi all about the total amount money single high low lvon and bach tudc all. the way the main menu sushi and ooze for the heart well other dietary supplements,Những loại sushi tốt và không tốt cho sức khỏe của bạn | Vinmec - Google Chrome,"về mặt dinh dưỡng, sushi nào tốt? - google-haku - google chrome",492
