source,target,title,query,index
bdng kook youtubeem new video. the border between singapore and death. giganttiverkkou google sheets google keep. one the most famous children the world among the most famous palestine groups this time months ago. cude covered vietnamese food drink. take care the throne cla ngudi dan israel the government israel join with and the alliance see the action good dai gaza jerusalem nguoitinan nanung phirc tap nha dal gaza jerusalem ngoditinan nan. the need for translation not top the list. one thing good enough avoid ciia kndi arab. amaaandbung dot gist palestine national security law and itong air ticket israel lasting. arab syria jordan and cap the next war soon safe cudc israel. tinh trang tat jerus. international boundar luroc israel thir hai wants translate tickets israel has just one cup translation into the nudc. for cough however since played very small role hussein and turned bee hybrid the industry. qitr and two are members israel the men olympic. one the most famous baby boy acts among the palestine groups this time months ago. lebanon say dwoc plo sir can you ctr  municate with your children israel. loss and damage two usd. fatah and hamas came out canton gitra israel. soon called the first step the end the year this because the main focus the jordanian phase. today vietnam but difficult believe that the wedding and the plan are not acceptable but the behavior not fair and being celebrated with the greatest popularity palestine. now vietnam there still doubt that the apartment correct plains and the plan not valid ust. ling quy leprosy vaccine. fly sabena and visit san bay lod. and hamas escalated until the end when israel launched the lead cast service gaza leading. cubc fighting gitka two sharp van tit din right now cia dai hoa deng lien hop. arab syria jordan and whoever cap bing clia cudc the next war safe cudc israel. fly sabena and get greedy and fly lod. conquer hand including gdm jerusalem dai gaza golan highland and singapore famous. february new member was registered and signed join the international munity the national government. now jerusalem plays important role. gido jerusalem holy grail with pregnant woman. the mountain and clinging thd clad vwong israel dai the kitd hitu jerusalem say tig ching. sovellukset tintdc sykiénthe lfa sanomat mhalehti suom youtube facebook google eekironiicks koko verkkokauppa kotkontiori powe giganttiverkkokau googlesheets googlekeep muutkijanmerkit lukulsta tinh t,the goal meet the needs the family. the dong the news the war has been put into the army israel and the world. ngos and volunteers participated hamas cling. ngos and volunteers participated hamas ciing branch nuc. information about the information the information inserted into the army israel and the city.  ivic luc luong hamas dong dai gaza html. what the need used school education and other problems two jobs. the goal say that the government israel very famous. tinhtrang jerusalem hamas and exchange. clia clia ludi palestine staff member. group micro pages group thousands soldiers call. quintet bit swallows jerusalem. this very good practice. dong quan this page recruiting thousands soldiers calling. palestine being attacked israel. hamas very famous this group always the. due pregnancy and curricula the eign palestine staff members. due pregnancy nutrition cur the eign palestine staff members. quan this page recruiting thousands soldiers calling.  ivic luc luong hamas dong tro lai gaza htmi. used education training and other activities two jobs. what the need what the need use education training and other problems two jobs. bat bat swallow jerusalem,Task 3 - Lich Su (No Index) - Google Docs - Google Chrome,hamas và phong trào hồi giáo jihad - google-haku - google chrome,938
the goal meet the needs the family. the dong the news the war has been put into the army israel and the world. ngos and volunteers participated hamas cling. ngos and volunteers participated hamas ciing branch nuc. information about the information the information inserted into the army israel and the city.  ivic luc luong hamas dong dai gaza html. what the need used school education and other problems two jobs. the goal say that the government israel very famous. tinhtrang jerusalem hamas and exchange. clia clia ludi palestine staff member. group micro pages group thousands soldiers call. quintet bit swallows jerusalem. this very good practice. dong quan this page recruiting thousands soldiers calling. palestine being attacked israel. hamas very famous this group always the. due pregnancy and curricula the eign palestine staff members. due pregnancy nutrition cur the eign palestine staff members. quan this page recruiting thousands soldiers calling.  ivic luc luong hamas dong tro lai gaza htmi. used education training and other activities two jobs. what the need what the need use education training and other problems two jobs. bat bat swallow jerusalem. </s>bdng kook youtubeem new video. the border between singapore and death. giganttiverkkou google sheets google keep. one the most famous children the world among the most famous palestine groups this time months ago. cude covered vietnamese food drink. take care the throne cla ngudi dan israel the government israel join with and the alliance see the action good dai gaza jerusalem nguoitinan nanung phirc tap nha dal gaza jerusalem ngoditinan nan. the need for translation not top the list. one thing good enough avoid ciia kndi arab. amaaandbung dot gist palestine national security law and itong air ticket israel lasting. arab syria jordan and cap the next war soon safe cudc israel. tinh trang tat jerus. international boundar luroc israel thir hai wants translate tickets israel has just one cup translation into the nudc. for cough however since played very small role hussein and turned bee hybrid the industry. qitr and two are members israel the men olympic. one the most famous baby boy acts among the palestine groups this time months ago. lebanon say dwoc plo sir can you ctr  municate with your children israel. loss and damage two usd. fatah and hamas came out canton gitra israel. soon called the first step the end the year this because the main focus the jordanian ph,the dong the news the war has been put into the army israel and the world. ngos and volunteers participated hamas cling. trirdc day tho tho tho. the cubc gitka israel and palestine not wele member the related admin ton gio. jerusalem the holy city thailand dia. hamas chizc two year old warriors and masters the art and hands and feet. jerusalem van and knows lot about oranges when maca two are not strong enough. this page recruiting thousands soldiers please call. jesus good hands just place call the bar because. the goal the first one that just country israel. this book requires book with this phd jerusalem role trd important déi. trd cda luc lwong hamas cude cup. cuba gitka israel and palestine are not happy married gidouat tif there are problems related gido although. every country can have their own private clia. has three ton gido gido abraham the most due thai gido dbc gido and hbi gido. clia clia ludi palestine staff member. gaza day chirc hdi gido insert clia palestine male laptop. the adt related ton gio. israel dai because the kitd hitu jerusalem the center the economy. when the palest people the world came back israel and. the data tough the cost clear and the ticket policy very petitive. hamas very famous this group always the. heat thyc not fade picture chapter israel and palestine ticket. palestine being attacked israel. the century more than were called the superintendent. theodore herz you know that the father and mother the country are the only ones who mean. gido jerusalem the right place the mohammad love the virginity. jerusalem last night hamas and bat. the area for hands and feet used education training and other educational institutions these two are the tools used the study the puter and the problems two jobs,Task 3 - Lich Su (No Index) - Google Docs - Google Chrome,hamas và phong trào hồi giáo jihad - google-haku - google chrome,943
the dong the news the war has been put into the army israel and the world. ngos and volunteers participated hamas cling. trirdc day tho tho tho. the cubc gitka israel and palestine not wele member the related admin ton gio. jerusalem the holy city thailand dia. hamas chizc two year old warriors and masters the art and hands and feet. jerusalem van and knows lot about oranges when maca two are not strong enough. this page recruiting thousands soldiers please call. jesus good hands just place call the bar because. the goal the first one that just country israel. this book requires book with this phd jerusalem role trd important déi. trd cda luc lwong hamas cude cup. cuba gitka israel and palestine are not happy married gidouat tif there are problems related gido although. every country can have their own private clia. has three ton gido gido abraham the most due thai gido dbc gido and hbi gido. clia clia ludi palestine staff member. gaza day chirc hdi gido insert clia palestine male laptop. the adt related ton gio. israel dai because the kitd hitu jerusalem the center the economy. when the palest people the world came back israel and. the data tough the cost clear and the ticket policy very petitive. hamas very famous this group always the. heat thyc not fade picture chapter israel and palestine ticket. palestine being attacked israel. the century more than were called the superintendent. theodore herz you know that the father and mother the country are the only ones who mean. gido jerusalem the right place the mohammad love the virginity. jerusalem last night hamas and bat. the area for hands and feet used education training and other educational institutions these two are the tools used the study the puter and the problems two jobs. </s>the goal meet the needs the family. the dong the news the war has been put into the army israel and the world. ngos and volunteers participated hamas cling. ngos and volunteers participated hamas ciing branch nuc. information about the information the information inserted into the army israel and the city.  ivic luc luong hamas dong dai gaza html. what the need used school education and other problems two jobs. the goal say that the government israel very famous. tinhtrang jerusalem hamas and exchange. clia clia ludi palestine staff member. group micro pages group thousands soldiers call. quintet bit swallows jerusalem. this very good practice. dong quan this page recruiting thousand,luxury villaung dét dai gaza men and with more than people. war and face face. flower crabs are tall. and men and women puters and services with more than people covering the entire population. the six year old international union now open the public,Lực lượng Hamas đóng vai trò gì ở dải Gaza? - Google Chrome,căng thẳng israel-palestine - google-haku - google chrome,944
luxury villaung dét dai gaza men and with more than people. war and face face. flower crabs are tall. and men and women puters and services with more than people covering the entire population. the six year old international union now open the public. </s>the dong the news the war has been put into the army israel and the world. ngos and volunteers participated hamas cling. trirdc day tho tho tho. the cubc gitka israel and palestine not wele member the related admin ton gio. jerusalem the holy city thailand dia. hamas chizc two year old warriors and masters the art and hands and feet. jerusalem van and knows lot about oranges when maca two are not strong enough. this page recruiting thousands soldiers please call. jesus good hands just place call the bar because. the goal the first one that just country israel. this book requires book with this phd jerusalem role trd important déi. trd cda luc lwong hamas cude cup. cuba gitka israel and palestine are not happy married gidouat tif there are problems related gido although. every country can have their own private clia. has three ton gido gido abraham the most due thai gido dbc gido and hbi gido. clia clia ludi palestine staff member. gaza day chirc hdi gido insert clia palestine male laptop. the adt related ton gio. israel dai because the kitd hitu jerusalem the center the economy. when the palest people the world came back israel and. the data tough the cost clear and the ticket policy very petitive. hamas very famous this group always the. heat thyc not fade picture chapter israel and palestine ticket. palestine being attacked israel. the century more than were called the superintendent. theodore herz you know that the father and mother the country are the only ones who mean. gido jerusalem the right place the mohammad love the virginity. jerusalem last night hamas and bat. the area for hands and feet used education training and other educational institutions these two are the tools used the study the puter and the problems two jobs. </s>the goal meet the needs the family. the dong the news the war has been put into the army israel and the world. ngos and volunteers participated hamas cling. ngos and volunteers participated hamas ciing branch nuc. information about the information the information inserted into the army israel and the city.  ivic luc luong hamas dong dai gaza html. what the need used school education and other problems two jobs. the goal say that the,the high speed office the department gave new report the risk danger. copy gaza thiic ddy. who should called take the role years old and convince israel make sense. cap gaza thiic day. related news escalate israel does not show you will notified immediately. cap gaza thiic ddy. you are danger being danger all the time however the israel tir chdi dinh khang dinh foschipemats. phong giving hamas ismail haniyeh bigt right now cudc awarded bau. phong handing over hamas bee ismail haniyeh let know right away bee cudc give ddi unell. the government the people republic china will not able accept the escalation israel does not respond the request that you will notified immediately. giita israel hamas are struggling gaza. how long are you danger however the israel side not living the palace. when you are you can use the screen regularly because fine. israel has installed security image the central region which has been pressed for while now. gaza and israel have met two officials discuss the implementation the project israel and hamas. nickolay miadenov official ticket the world question. qub gilra israel and hamas are struggling find their way gaza. phong giving hamas bee ismail haniyeh let know right away bee cudc give away ddi. gaza and israel have met two officials who are responsible for the implementation the agreement between gitra israel and hamas. nick nickolay mladenov central ticket question. you can use when you. jihad giving away jihad danger escalating dai gaza. viet thang ttxvn vietnam gmt. image gaza tang israel sneaks into gets out gaza. gitra lsrael and hamas cudc have ticket. vigt thang ttxvn vietnam. contact information israel does not show you will notified immediately. gazavalsracldatthéa two officials cdc. gaza luan the palestine factions due the exchange money the hamas page. the government the people republic china will not able see the escalation israel does not understand the situation and you will notified immediately. people who have long history beauty. nick nickolay mladenov center question. leh ngimg bein high wind cross hbi gido jihad kheded batsh can wait e back. may high ranking official gave brief jinad the danger. high pitched contest gido jihad kheded batsh. cdc very friendly with you. israel installs security image the central region. éydungdang translation and use covid pandemic world cup transfer ddiss the country. thank you for your support and qatar phdi mladenov acted leader the world. the government officials israel and the hamas department are struggling cope with gaza. israel installs security image central region. february the world cup will transferred the national daihoi iss. you still the middle the period but you can use beautiful. image the gaza when time gaza transfer ddiss the country. may high ranking officer gave high resolution photo the jihadist government. who should called take the role and claim that israel has done. ding the first day the year israel. you are danger being danger all the time however the israel side has tir chdi dinh khang dinh foschipemats. buy bombs rockets trudc right high quality high quality official mission. who misses this day. thi linh phong gives jihad danger escalating dai gaza. palestine takes care the throne israel ctia minh. picture the gaza when time gaza. the one show off the beauty,Thủ lĩnh phong trào Jihad: Nguy cơ bạo lực leo thang ở Dải Gaza | Trung Đông | Vietnam+ (VietnamPlus) - Google Chrome,hamas và phong trào hồi giáo jihad - google-haku - google chrome,945
the high speed office the department gave new report the risk danger. copy gaza thiic ddy. who should called take the role years old and convince israel make sense. cap gaza thiic day. related news escalate israel does not show you will notified immediately. cap gaza thiic ddy. you are danger being danger all the time however the israel tir chdi dinh khang dinh foschipemats. phong giving hamas ismail haniyeh bigt right now cudc awarded bau. phong handing over hamas bee ismail haniyeh let know right away bee cudc give ddi unell. the government the people republic china will not able accept the escalation israel does not respond the request that you will notified immediately. giita israel hamas are struggling gaza. how long are you danger however the israel side not living the palace. when you are you can use the screen regularly because fine. israel has installed security image the central region which has been pressed for while now. gaza and israel have met two officials discuss the implementation the project israel and hamas. nickolay miadenov official ticket the world question. qub gilra israel and hamas are struggling find their way gaza. phong giving hamas bee ismail haniyeh let know right away bee cudc give away ddi. gaza and israel have met two officials who are responsible for the implementation the agreement between gitra israel and hamas. nick nickolay mladenov central ticket question. you can use when you. jihad giving away jihad danger escalating dai gaza. viet thang ttxvn vietnam gmt. image gaza tang israel sneaks into gets out gaza. gitra lsrael and hamas cudc have ticket. vigt thang ttxvn vietnam. contact information israel does not show you will notified immediately. gazavalsracldatthéa two officials cdc. gaza luan the palestine factions due the exchange money the hamas page. the government the people republic china will not able see the escalation israel does not understand the situation and you will notified immediately. people who have long history beauty. nick nickolay mladenov center question. leh ngimg bein high wind cross hbi gido jihad kheded batsh can wait e back. may high ranking official gave brief jinad the danger. high pitched contest gido jihad kheded batsh. cdc very friendly with you. israel installs security image the central region. éydungdang translation and use covid pandemic world cup transfer ddiss the country. thank you for your support and qatar phdi mladenov acted leader the wo,chu dirt man can kick and you can use rocket. leather business shoes shopnow. china hit the bomb. durludn worried about the current state the art know after dot. feng shui life dua phi. dbi israel ndi can sting gaza rocket into phd bar. leather business shoesung israel palestine. esteemed throne after the check ticket covers the funeral. israel hamas ngifng tif this morning. room tenlifa dua phi. clia israel tigp works great clra and does people including. loather busmess shoss shop now. dgi israel ndi can sting gaza via rocket into thanh pho. not wipe after thdng news quit ctia abu harbeed islamic jihad cho. trudc according reuters problem. trung qudc sneaks now. where the covid virus. eung ddt irael palestine. the first year life israel continuing good girl and people including. after the meeting went out the center the dan mach copenhagen. dur ludn cold today know after dot. fgoogiea fgoo escalates israel. more than bac silndonia. israel slippers fly lrging gidm tir via clia two dém. transcribe sudt consider durt all the cudcs using now. odotetaan palveinta osafteessa hbopenbid pubmaticcor china. the palestine side clings the most. hamas small thing israel recognized. truréng antony blinken doesn stop talking chirc and working. usually all children are born with standard size said bee blinken. blinken khang dinh quan chirc skin and work leather business shoes. know how rockets the ashdod bar hit israel people. micro palestine van out méingay. hady amr quan chic palestine hom while out. timate tot unparoliiod adstabity. pay gas right now. and the list goes. room tenifa dua phi. durludn national rat takes the throne before the present day knows after dot not autonomous. gathering children emung aot climbing the ladder israel. don wipe after cia abu harbeed islamic jihad for chinese language now. dac sir hady amr. utimate contrt unparolisled adjstabity. know how use rockets ashdod bar hit israel people. bar gas right now,"Israel diệt chỉ huy Islamic Jihad, nguy cơ trả thù càng cao - Tuổi Trẻ Online - Google Chrome",hamas và phong trào hồi giáo jihad - google-haku - google chrome,948
