source,target,title,query,index
the sphere influence the pontos did not stop there the king pontos then murdered ariarathes. vii and gave his eight year old son ariarathes. with military support from the roman governor cilicia lucius cornelius sulla ariobarzanes. excellence financial education munication and dissemination. the canals have long gone unmaintained causing agriculture shaken. </s>the eastern church and the. catholic semi peach based. jesus will arrive before the. roman and gothic traditions. roman and goth traditions. roman catholic church this. although the christian church. jesus will e first. strategic social game wherel back the mechanical kingdom. western church what today. western church that day. call the orthodox church and the. example using roman governor sentence and version.   googleadservices  pagead aclk you are. asia minor despite the frontier. strategic social game whereanh. code the title despite the. flourish again the christian. typical eastern church icon. catholic church and catholic church. short success under successful but short. now called the orthodox church. when the roman governor monday morning. collapse the eastern border. between the eastern church and. though the christian church divided. what roman governor english english translation. </s>financial duties however this person may mand the army with the approval the govern,interesting point that mentioned the article appeals appeals that vietnam influenced the legal proceedings system the. member the public member the supervisory board. understand this problem first need understand what the concept prosecutor and slaughter are. law interpretation facebook connect with the law interpretation join facebook today. the prosecutor vietnam the procuracy has the right appeal against the judgment and prosecutors mon law countries not have the right. refers public affairs that belong the state that public authority state power. oxford dictionary  oxforddictionaries  definition prosecution. the law speech and interpretation. facebook  vietnameselegalterm photos. public authorities this stage the prosecutor office the prosecutor office merely. need change the name like that. and the word ancestor means expose sin tell someone something often encounter the word prefix the phrases denunciation denunciation prosecution. prosecution consists the word public which means general belonging the state having state nature this case can understand public. thus can understood that the ancestor the mon denunciation the collective the munity this denunciation has state power due. digital french database  cnrtl definition dmf procureur. period public prosecutor activities the state exposes crimes. drug party the dispute equal footing with the defense. that the predecessor that procuracy was the prosecutor office the name functions and activities the prosecutor office are formally set forth the constitution. vietnam today the people procuracy agency that plays very important role the state apparatus however probably all know. and the constitution the people procuracies were born replacing the prosecutor office what the difference between these two and why,"Luật văn diễn dịch - CÔNG TỐ VIÊN HAY KIỂM SÁT VIÊN? KỲ 1: CÔNG TỐ - HOẠT ĐỘNG “NHÀ NƯỚC VẠCH TỘI” Ở Việt Nam hiện nay, Viện Kiểm sát nhân dân là một cơ quan đóng vai trò rất quan trọng trong Bộ máy nhà nước. Tuy nhiên, chúng ta có lẽ đều biết rằng tiền thân của Viện Kiểm sát đó chính là Viện Công tố. Tên gọi, chức năng và hoạt động của Viện Công tố được quy định chính thức trong Hiến pháp 1946 và đến Hiến pháp 1959 thì Viện Kiểm sát nhân dân ra đời, thay thế cho Viện Công tố. Vậy hai cách gọi này có gì khác nhau và tại sao lại cần phải đổi tên như vậy? Để hiểu rõ vấn đề này, đầu tiên chúng ta cần hiểu khái niệm “công tố” và “kiểm sát” là gì. Công tố (公訴) gồm chữ CÔNG (公) có nghĩa là (1) chung, (2) thuộc về nhà nước, có tính chất nhà nước. Trong trường hợp này ta có thể hiểu “công” chỉ những việc chung thuộc về nhà nước, tức có tính công quyền (quyền lực nhà nước). Và chữ TỐ (訴) có nghĩa là vạch tội, báo cho ai biết điều gì. Ta thường bắt gặp chữ tố trong các cụm từ: tố giác, tố cáo, khởi tố. Như vậy có thể hiểu CÔNG TỐ là sự vạch tội chung của tập thể, cộng đồng, sự vạch tội này có tính quyền lực nhà nước, do một cơ quan công quyền, hay một cá nhân được trao quyền thực hiện. Theo định nghĩa của từ điển Hán Việt thì công tố là một phương thức tố tụng trong lĩnh vực hình sự, theo đó đại biểu quốc gia đưa ra lời buộc tội người phạm pháp trước tòa án và “Công tố viên” chính là người thay mặt quốc gia để đưa ra lời buộc tội. Mô hình công tố hiện nay ở các nước châu Á, trong đó có Việt Nam có sự ảnh hưởng rất lớn từ mô hình tố tụng châu Âu mà đặc biệt là Pháp sau hơn 100 năm thuộc địa. Trong tiếng anh, hoạt động công tố là prosecution, vốn có nguồn gốc từ tiếng Pháp cổ là prosécution, với nghĩa gốc là truy tố. Công tố viên tiếng anh là prosecutor. Tuy nhiên, quốc gia khai sinh mô hình công tố lại sử dụng thuật ngữ procureur để chỉ các công tố viên. Đây là thuật ngữ mượn từ tiếng latin procurrerres (procurateur/procurator), chỉ chức quan quản đốc thời La Mã cổ đại. Procureur có nghĩa gốc ban đầu (TK XIII) là người đại diện (cho ai đó) tham gia tố tụng. Các quan công tố xuất hiện lần đầu tiên ở Pháp vào khoảng thế kỷ XIV, dưới triều vua Philippe le Bel. Họ là các luật sư được chỉ định thực hiện chức năng công tố, theo yêu cầu của nghị viện (tòa án Pháp thời trung cổ). Tên gọi “procureur” và vai trò của các công tố viên này được lấy cảm hứng từ mô hình tố tụng thẩm vấn của Tòa án dị giáo (mô hình tòa án của Giáo hội) lúc bấy giờ. Đặc điểm nổi bật nhất trong mô hình công tố của nhiều nước trên thế giới hiện nay vẫn là hoạt động truy cứu trách nhiệm hình sự - chức năng buộc tội trong tố tụng hình sự nhằm bảo đảm sự tuân thủ Luật hình sự. Hoạt động giám sát tuân thủ pháp luật chỉ thể hiện trong quan hệ với cơ quan điều tra, Viện Công tố không thực hiện chức năng giám sát tuân theo pháp luật ở giai đoạn xét xử. Ở giai đoạn này thì Viện Công tố hay Công tố viên chỉ thuần túy là một bên tranh tụng bình đẳng với bên bào chữa. Một điểm thú vị mà chúng tôi từng đề cập ở bài viết về kháng cáo-kháng nghị, đó là Việt Nam chịu ảnh hưởng của hệ thống tố tụng Pháp, nên cơ quan công tố (ở Việt Nam là Viện Kiểm sát) có quyền kháng nghị bản án. Còn cơ quan công tố ở các nước theo hệ thống thông luật thì không tồn tại quyền này. -- Tác giả: Linh – Anh Ảnh minh họa: Công tố viên Hàn Quốc -- Tài liệu tham khảo: Từ điển Hán nôm Từ điển oxford, https://en.oxforddictionaries.com/definition/prosecution Kho dữ liệu tiếng Pháp số hóa, http://cnrtl.fr/definition/dmf/procureur Wikitionnaire, https://fr.wiktionary.org/wiki/procureur https://fr.wikipedia.org/wiki/Procureur_de_la_République_(France) | Facebook - Google Chrome",quan procurator la mã - google search - google chrome,799
interesting point that mentioned the article appeals appeals that vietnam influenced the legal proceedings system the. member the public member the supervisory board. understand this problem first need understand what the concept prosecutor and slaughter are. law interpretation facebook connect with the law interpretation join facebook today. the prosecutor vietnam the procuracy has the right appeal against the judgment and prosecutors mon law countries not have the right. refers public affairs that belong the state that public authority state power. oxford dictionary  oxforddictionaries  definition prosecution. the law speech and interpretation. facebook  vietnameselegalterm photos. public authorities this stage the prosecutor office the prosecutor office merely. need change the name like that. and the word ancestor means expose sin tell someone something often encounter the word prefix the phrases denunciation denunciation prosecution. prosecution consists the word public which means general belonging the state having state nature this case can understand public. thus can understood that the ancestor the mon denunciation the collective the munity this denunciation has state power due. digital french database  cnrtl definition dmf procureur. period public prosecutor activities the state exposes crimes. drug party the dispute equal foo,these dark times jesus need you not fear for have. cancel culture isn his way and the second like you shall. god making way the wilderness connecting the dots. you what right other people love being kind. research agree participate the study you good exams. have you received invitation from vinid join the munity. new devotionals fall for save off enjoy the fall leav. when god silent connecting the dots daily devotional for oct. did you take break from writing last week didn see any. how cheer for people who get what you want but when. help kids find eternal life new sunday school lesson yes. when god silent connecting the dots daily devotional for. your christian responsibility during challenging times visit pas. online exchange with experts chance win attractive gifts. your husband your top ministry calling connecting the dots. free this book get exalting jesus. why are small groups important every one needs. hlib luca revised docx. pastors want members live out their purpose here how hel,"Inbox (11,122) - ghidanhwtc@gmail.com - Gmail - Google Chrome",,830
these dark times jesus need you not fear for have. cancel culture isn his way and the second like you shall. god making way the wilderness connecting the dots. you what right other people love being kind. research agree participate the study you good exams. have you received invitation from vinid join the munity. new devotionals fall for save off enjoy the fall leav. when god silent connecting the dots daily devotional for oct. did you take break from writing last week didn see any. how cheer for people who get what you want but when. help kids find eternal life new sunday school lesson yes. when god silent connecting the dots daily devotional for. your christian responsibility during challenging times visit pas. online exchange with experts chance win attractive gifts. your husband your top ministry calling connecting the dots. free this book get exalting jesus. why are small groups important every one needs. hlib luca revised docx. pastors want members live out their purpose here how hel. </s>interesting point that mentioned the article appeals appeals that vietnam influenced the legal proceedings system the. member the public member the supervisory board. understand this problem first need understand what the concept prosecutor and slaughter are. law interpretation facebook connect with the law interpretation join facebook today. th,these dark times jesus need you not fear for have. the most essential habits for spiritual growth any church can. the name bich anh mentioned thesis chapte. terms privacy program policies. new week new deals pastor appreciation month sale check. last account activity hours ago. who your best friend celebrate recovery stress free pow. new week new deals pastor appreciation month sale checko. why are small groups important every one needs. you are not alone truly one alone even our darkest though. check your messages this son whom love with him. god making way the wilderness connecting the dots. who your best friend celebrate recovery stress,"Inbox (11,122) - ghidanhwtc@gmail.com - Gmail - Google Chrome",,832
these dark times jesus need you not fear for have. the most essential habits for spiritual growth any church can. the name bich anh mentioned thesis chapte. terms privacy program policies. new week new deals pastor appreciation month sale check. last account activity hours ago. who your best friend celebrate recovery stress free pow. new week new deals pastor appreciation month sale checko. why are small groups important every one needs. you are not alone truly one alone even our darkest though. check your messages this son whom love with him. god making way the wilderness connecting the dots. who your best friend celebrate recovery stress. </s>these dark times jesus need you not fear for have. cancel culture isn his way and the second like you shall. god making way the wilderness connecting the dots. you what right other people love being kind. research agree participate the study you good exams. have you received invitation from vinid join the munity. new devotionals fall for save off enjoy the fall leav. when god silent connecting the dots daily devotional for oct. did you take break from writing last week didn see any. how cheer for people who get what you want but when. help kids find eternal life new sunday school lesson yes. when god silent connecting the dots daily devotional for. your christian responsibility during challengin,why are small groups important every one. these dark times jesus need you not fear for have. get free worship videos for your church videos for church. sign receive news aeoneshop update information about new products. last account activity hours ago. god making way the wilderness connecting the dots. fwd proquest religion philosophy books for alumni thang. reflections psalms with lewis you devoted every. printable bible character masks halloween alternative activ. terms privacy program policies. the most essential habits for spiritual growth any church can. looks like you didn have any writing activity last week. fwd from mathio john. brand new prayer devotional from sarah young jesus listen. praying when hurts connecting the dots daily devotional for. send huynh thi jade the most relevant job october vie. matm scholarship deadline october you are receiving this. get free worship videos for your church videos for. check your messages this son whom love with him. sign receive news aeoneshop update information about them. looks like you didn have any writing activity last week check,"Inbox (11,119) - ghidanhwtc@gmail.com - Gmail - Google Chrome",,833
why are small groups important every one. these dark times jesus need you not fear for have. get free worship videos for your church videos for church. sign receive news aeoneshop update information about new products. last account activity hours ago. god making way the wilderness connecting the dots. fwd proquest religion philosophy books for alumni thang. reflections psalms with lewis you devoted every. printable bible character masks halloween alternative activ. terms privacy program policies. the most essential habits for spiritual growth any church can. looks like you didn have any writing activity last week. fwd from mathio john. brand new prayer devotional from sarah young jesus listen. praying when hurts connecting the dots daily devotional for. send huynh thi jade the most relevant job october vie. matm scholarship deadline october you are receiving this. get free worship videos for your church videos for. check your messages this son whom love with him. sign receive news aeoneshop update information about them. looks like you didn have any writing activity last week check. </s>these dark times jesus need you not fear for have. the most essential habits for spiritual growth any church can. the name bich anh mentioned thesis chapte. terms privacy program policies. new week new deals pastor appreciation month sale check. last ac,introduce the gospel page. million technology deals bookstore. save type microsoft word document. the country chari this. the world needs more kindness and can start with your chu. pumpkin prayer today wanted share pumpkin. oct machine the era save directly. lord save connecting the dots daily devotional for october. lesson history book cau doc. you have been promised good things sovereign lord you are. jobs that may interest you jobs that may interest you. introduce the gospel luke. this one just for you never reaches the place where. file name hlib luca revised. plagues egypt escape room print play. new jobs for you vlance today october. visiting church this one memory mary visit elizabeth. customer account statement september vinid sent you,"Inbox (11,117) - ghidanhwtc@gmail.com - Gmail - Google Chrome",,834
introduce the gospel page. million technology deals bookstore. save type microsoft word document. the country chari this. the world needs more kindness and can start with your chu. pumpkin prayer today wanted share pumpkin. oct machine the era save directly. lord save connecting the dots daily devotional for october. lesson history book cau doc. you have been promised good things sovereign lord you are. jobs that may interest you jobs that may interest you. introduce the gospel luke. this one just for you never reaches the place where. file name hlib luca revised. plagues egypt escape room print play. new jobs for you vlance today october. visiting church this one memory mary visit elizabeth. customer account statement september vinid sent you. </s>why are small groups important every one. these dark times jesus need you not fear for have. get free worship videos for your church videos for church. sign receive news aeoneshop update information about new products. last account activity hours ago. god making way the wilderness connecting the dots. fwd proquest religion philosophy books for alumni thang. reflections psalms with lewis you devoted every. printable bible character masks halloween alternative activ. terms privacy program policies. the most essential habits for spiritual growth any church can. looks like you didn have any writ,transition and participate fully the afterlife. persian empire during the first century zoroastrianism was the predominant religion this region beginning with. zoroastrians placed the bodies elevated structure called. the world needs more kindne. plagues egypt escape room print play. around although burial customary the region the followers zoroastrianism. are christians burned according the law the barracks when they are safe. evil because this custom the tertullian protested saying and whether the. did not bury cremate because they believed that the corpse would contaminate the elements earth and fire. house cai phe gennath gate. you have been promised good. christian burned according the law the barracks when not allowed burn incense for. the tartar empire was roughly what now known iran the region formerly known iran. christians the zoroastrians were the only people the ancient world who believed the. manage your google account. idol when christ spared you the penalty fire. evil and the rituals associated with guarantee the death the dead. christians also attended funeral meals providing food for the family because this custom that tertullian has. dakhma tower silence for bird prey apart from some jews and,"Inbox (11,117) - ghidanhwtc@gmail.com - Gmail - Google Chrome",,837
transition and participate fully the afterlife. persian empire during the first century zoroastrianism was the predominant religion this region beginning with. zoroastrians placed the bodies elevated structure called. the world needs more kindne. plagues egypt escape room print play. around although burial customary the region the followers zoroastrianism. are christians burned according the law the barracks when they are safe. evil because this custom the tertullian protested saying and whether the. did not bury cremate because they believed that the corpse would contaminate the elements earth and fire. house cai phe gennath gate. you have been promised good. christian burned according the law the barracks when not allowed burn incense for. the tartar empire was roughly what now known iran the region formerly known iran. christians the zoroastrians were the only people the ancient world who believed the. manage your google account. idol when christ spared you the penalty fire. evil and the rituals associated with guarantee the death the dead. christians also attended funeral meals providing food for the family because this custom that tertullian has. dakhma tower silence for bird prey apart from some jews and. </s>introduce the gospel page. million technology deals bookstore. save type microsoft word document. the country chari this. ,number vary who were. weekly course was divided into four nine daily courses. jul draft savedlu added footnote. the year plus major festivals each weekly course was. were divided into twenty four courses and did service for two. searched forever but couldn find single sentence the mon. than seven thousand priests estimates the mumber vary who. check out for yourself the mon priest made. you look all the time you can find anywhere. did service for two weeks from sabbath sabbath out. service for two weeks from sabbath sabbath out the year. nine daily courses carrying out their specific responsibilities. nghia diem gmail . into four nine daily courses carrying out their specific. writing suggestions help you. specific responsibilities during the week draft saved. there were perhaps more than seven thousand priests estimates. take look for there anything missing add where the priests are. hlib luca revised original. save time when drafting. twenty four courses and did service for two weeks from. bich looked around but couldn find anything missing bad eyesight the mon priest made the majordraft saved. responsibilities during the week. and did service for two weeks from sabbath sabbath out. nghia nine daily courses canry. mumber vary who were divided into twenty four courses and did. take the trouble copy that sentence for the mon priest made. jul check out for there anything missing please report the priest puter. take look again where. service for two weeks fro. weeks from sabbath sabbath out the year plus major. priests estimates the number vary who were divided into. meaning diem gmail . check out where the priests the mon priest made. jesus ime ineru appeared announce that his wife elizabeth would give birth son. each weekly course was divided into four nine daily. perhaps more than seven thousand priests estimates the. perhaps more than seen thousand priests estimates the. looked all the time but couldn find anything missing too bad eyesight. festivals each weekly course was divided into four nine. carrying out their specific responsibilities during the week. part the priesthood jesus time there were perhaps more. sabbath sabbath out the year plus major festivals each. priest made the major part the priesthood jesus time. the mumber vary who were divided into twenty four courses. priests estimates the mumber vary who were divided into. plus major festivals eac. plus major festivals each weekly course was divided into four. been looking for this forever but can find. nghia sabbath sabbath out the year plus major festivals each. courses carrying out their specific responsibilities during the. the mon priest made the major part the priesthood. daily courses carrying out their specific responsibilities during. jesus time there were perhaps more than seven thousand. searched forever but couldn find any missing sentences too bad eyes. mumber vary who were divided into twenty four courses and. looked around and couldn find anything missing too bad. the major part the priest. perhaps more than seven. searched forever without the mon priest made the major. divided into four nine daily courses carrying out their. take look again what else missing. the year plus major festivals each weekly course was divided. number vary who were divided into twenty four courses and did. sabbath sabbath out the year plus major festivals. please take look there anything missing please report the priest puter. take the trouble copy that sentence back bich hard work copy that sentence back bich. the major part the priesthood jesus time there were. take look the spades there anything missing tell add where are the priests,Inbox - maryleicf@gmail.com - Gmail - Google Chrome,,839
