source,target,title,query,index
last account activity hours ago. fall and free shipping are the air happy first day fall. paul planted the church fhpage duing. when say god got this but don fully believe connecti. drink slowly when the roman empire decided change the route gosave. what you want see heaven what you especially. suddenly when the roman empire decided change its route. time for fun time for fun view browser connecting with chil. start conversation with god things you need. bas relief the public roof theater the philippines. paul planted the church fhoage during. hlib luca revised original. terms privacy program policies. relief from the south portico the theater. the books that got through that hard year our top best. save type microsoft word document. god heals your broken heart connecting the dots daily devoti. start chat with god things remember when you. the books that got through that hard year our. steps bring kids closer christ all christian parents. during paul first roman imprisonment. god holiness and man sinfulness view this email your bro. embracing our calling god uses our strengths draw our. what the anointing what does mean anointed gotq. file name philippians translation. traditional date for the writing philippians. start conversation with god things remember when you. response his macedonian vision. few have challenged this eonelusion. ,bring fresh energy ideas your small groups equip your. embracing our calling god uses our strengths draw our. the books that got through that hard year our top best. start conversation with god things you need know. steps bring kids closer christ all christian parents. what you want see heaven what you especially. time for fun time for fun view browser connecting with chil. via messenger always via,"Inbox (11,073) - ghidanhwtc@gmail.com - Gmail - Google Chrome",,1391
bring fresh energy ideas your small groups equip your. embracing our calling god uses our strengths draw our. the books that got through that hard year our top best. start conversation with god things you need know. steps bring kids closer christ all christian parents. what you want see heaven what you especially. time for fun time for fun view browser connecting with chil. via messenger always via. </s>last account activity hours ago. fall and free shipping are the air happy first day fall. paul planted the church fhpage duing. when say god got this but don fully believe connecti. drink slowly when the roman empire decided change the route gosave. what you want see heaven what you especially. suddenly when the roman empire decided change its route. time for fun time for fun view browser connecting with chil. start conversation with god things you need. bas relief the public roof theater the philippines. paul planted the church fhoage during. hlib luca revised original. terms privacy program policies. relief from the south portico the theater. the books that got through that hard year our top best. save type microsoft word document. god heals your broken heart connecting the dots daily devoti. start chat with god things remember when you. the books that got through that hard year our. steps bring kids closer christ all christian parent,fwd invitation ttc anniversary thanksgiving service. websites learn english youtube vocab . taking break from the tech now seeking the approval. what you want see heaven what you especially. king king thank you very much wednesday. september newsletter you don need pretend any. will there pets heaven will wipe every tear from their. steps bring kids closer christ all christian parents. give your opinion and get coupon how can serve. what the direction your church guide your members towar. viou like omail velir broureor vou. vliou thie omail veur hroweor vouu. embracing our calling god uses our strengths draw our. the gifts rejection there time for everything and seaso. sep draft ing soon galati. god doesn care what you connecting the dots daily devot. god your anxiety slayer connecting the dots daily devotion. the roreen god lees. the day atonement yom kippur all like sheep have. start conversation with god things remember when you. man practical lessons from jesus ascension podcast. extended hours call sales till pst last chance. kings kings thank you very much. leaving nice guy behind god created man his own ima. the dorcen god uce. via messenger always via. bring fresh energy ideas your small groups equip your. time for fun time for fun view browser connectin. the day atonement yom kippur all like she. time deeper your study the bible read more insi,"Inbox (11,072) - ghidanhwtc@gmail.com - Gmail - Google Chrome",,1392
fwd invitation ttc anniversary thanksgiving service. websites learn english youtube vocab . taking break from the tech now seeking the approval. what you want see heaven what you especially. king king thank you very much wednesday. september newsletter you don need pretend any. will there pets heaven will wipe every tear from their. steps bring kids closer christ all christian parents. give your opinion and get coupon how can serve. what the direction your church guide your members towar. viou like omail velir broureor vou. vliou thie omail veur hroweor vouu. embracing our calling god uses our strengths draw our. the gifts rejection there time for everything and seaso. sep draft ing soon galati. god doesn care what you connecting the dots daily devot. god your anxiety slayer connecting the dots daily devotion. the roreen god lees. the day atonement yom kippur all like sheep have. start conversation with god things remember when you. man practical lessons from jesus ascension podcast. extended hours call sales till pst last chance. kings kings thank you very much. leaving nice guy behind god created man his own ima. the dorcen god uce. via messenger always via. bring fresh energy ideas your small groups equip your. time for fun time for fun view browser connectin. the day atonement yom kippur all like she. time deeper your study the bib,proverbs every child should know one the most. happy day thank you god for your business grand. starting tomorrow huge savings with lexham press flash sale. research agree participate the study good teacher. new jobs for you vlance today september. hlib giang revised docx sent from iphone. save off all mobile bundles and collections this month. plagues egypt escape room print play. god always near therefore holy brothers who sha. god isn colorblind connecting the dots daily devotional for. praying for job can make our plans but the lord determine. addition visitors today will see the. sunday roundup top proverbs for kids. when god silent connecting the dots daily devotional for oct. did you take break from writing last week didn see any. addition visitors today will see these. the blessing even when you not perfect christ the visi. god always near theretore holy brothers who sha. your christian responsibility during challenging times visit pas. online exchange with experts chance win attractive gifts. you have been promised good things sovereign lord you are. new jobs for you vlance today. september hot buys off explore genesis me. fwd study homework tung please send part homework. week deals pastor appreciation month check out this week. new jobs for you vlance today october. lord save connecting the dots daily devotional for october. let give him what you holding onto scared lord. you you what right other people love being kind. added visitors today will see remains limes. the world needs more kindness and can start with your chu. failed network error devotionals daily. did you get invitation from vinid join the. let give him what you holding onto scared. sunday roundup top proverbs for kids opinion. righten someone day and tell them hang there better. sneak peek early bird sale get max lucado the manger for,"Inbox (11,056) - ghidanhwtc@gmail.com - Gmail - Google Chrome",,1393
proverbs every child should know one the most. happy day thank you god for your business grand. starting tomorrow huge savings with lexham press flash sale. research agree participate the study good teacher. new jobs for you vlance today september. hlib giang revised docx sent from iphone. save off all mobile bundles and collections this month. plagues egypt escape room print play. god always near therefore holy brothers who sha. god isn colorblind connecting the dots daily devotional for. praying for job can make our plans but the lord determine. addition visitors today will see the. sunday roundup top proverbs for kids. when god silent connecting the dots daily devotional for oct. did you take break from writing last week didn see any. addition visitors today will see these. the blessing even when you not perfect christ the visi. god always near theretore holy brothers who sha. your christian responsibility during challenging times visit pas. online exchange with experts chance win attractive gifts. you have been promised good things sovereign lord you are. new jobs for you vlance today. september hot buys off explore genesis me. fwd study homework tung please send part homework. week deals pastor appreciation month check out this week. new jobs for you vlance today october. lord save connecting the dots daily devotional for october.,showering our children grace connecting the dots daily dev. you you what right other people love being kind. import philemon from new machine. online exchange with experts chance win. online exchange with experts chance win attractive gifts. did you take break from writing last week didn. the ultimate superhero made himself nothing taking the. add health balance your small groups this fall any church. undein god bless you and your family. when god silent connecting the dots daily devotional for oct. did you take break from writing last week didn see any. mental health the battle can lonely but doesn have. lib luca revised docx. research agree participate the study good exam bro,"Inbox (11,047) - ghidanhwtc@gmail.com - Gmail - Google Chrome",,1394
showering our children grace connecting the dots daily dev. you you what right other people love being kind. import philemon from new machine. online exchange with experts chance win. online exchange with experts chance win attractive gifts. did you take break from writing last week didn. the ultimate superhero made himself nothing taking the. add health balance your small groups this fall any church. undein god bless you and your family. when god silent connecting the dots daily devotional for oct. did you take break from writing last week didn see any. mental health the battle can lonely but doesn have. lib luca revised docx. research agree participate the study good exam bro. </s>proverbs every child should know one the most. happy day thank you god for your business grand. starting tomorrow huge savings with lexham press flash sale. research agree participate the study good teacher. new jobs for you vlance today september. hlib giang revised docx sent from iphone. save off all mobile bundles and collections this month. plagues egypt escape room print play. god always near therefore holy brothers who sha. god isn colorblind connecting the dots daily devotional for. praying for job can make our plans but the lord determine. addition visitors today will see the. sunday roundup top proverbs for kids. when god silent connecting the dots,the most essential habits for spiritual growth any church can. terms privacy program policies. last account activity hours ago. brand new prayer devotional from sarah young jesus listen. praying when hurts connecting the dots daily devotional for. add health balance your small groups this fall any church. fwd from mathio john. matm scholarship deadline october you are rec,"Inbox (11,046) - ghidanhwtc@gmail.com - Gmail - Google Chrome",,1395
the most essential habits for spiritual growth any church can. terms privacy program policies. last account activity hours ago. brand new prayer devotional from sarah young jesus listen. praying when hurts connecting the dots daily devotional for. add health balance your small groups this fall any church. fwd from mathio john. matm scholarship deadline october you are rec. </s>showering our children grace connecting the dots daily dev. you you what right other people love being kind. import philemon from new machine. online exchange with experts chance win. online exchange with experts chance win attractive gifts. did you take break from writing last week didn. the ultimate superhero made himself nothing taking the. add health balance your small groups this fall any church. undein god bless you and your family. when god silent connecting the dots daily devotional for oct. did you take break from writing last week didn see any. mental health the battle can lonely but doesn have. lib luca revised docx. research agree participate the study good exam bro. </s>proverbs every child should know one the most. happy day thank you god for your business grand. starting tomorrow huge savings with lexham press flash sale. research agree participate the study good teacher. new jobs for you vlance today september. hlib giang revised docx sent from ip,terms privacy program policies. the most essential habits for spiritual growth any church can. last account activity hours ago. fwd from math john forwarded message. praying when hurts connecting the dots daily devotional for. fwd proquest religion philosophy books for alumni thang. reflections psalms with lewis you devoted every,"Inbox (11,044) - ghidanhwtc@gmail.com - Gmail - Google Chrome",,1396
terms privacy program policies. the most essential habits for spiritual growth any church can. last account activity hours ago. fwd from math john forwarded message. praying when hurts connecting the dots daily devotional for. fwd proquest religion philosophy books for alumni thang. reflections psalms with lewis you devoted every. </s>the most essential habits for spiritual growth any church can. terms privacy program policies. last account activity hours ago. brand new prayer devotional from sarah young jesus listen. praying when hurts connecting the dots daily devotional for. add health balance your small groups this fall any church. fwd from mathio john. matm scholarship deadline october you are rec. </s>showering our children grace connecting the dots daily dev. you you what right other people love being kind. import philemon from new machine. online exchange with experts chance win. online exchange with experts chance win attractive gifts. did you take break from writing last week didn. the ultimate superhero made himself nothing taking the. add health balance your small groups this fall any church. undein god bless you and your family. when god silent connecting the dots daily devotional for oct. did you take break from writing last week didn see any. mental health the battle can lonely but doesn have. lib luca revised docx. rese,egnatia they proceed towards the strategic. the greetings there are also mentions sinvin and timothy sometimes pontoon writes. represents group people but the main author. serious objections have been made. the greetings there are also mentions sinevan and timothy sometimes pontoon writes. paul and silas left philippi and traveled westward. from the team perspective but was the. the greetings there are also mentions sinh van and timothy sometimes pontoon writes. population about two hundred thousand. the greetings there are also mentions sinevan and timothy sometimes floats write big. dispute that paul was the author thessalonians. the roman province macedonia. aegean sea modern day greece with. silvanus and timothy sometimes paul wrote. about the missionary team led. thessalonica was large port city the. there are real objections the claim that paul was the author thessalonians. the greeting also mentions. west the roman road known via egnatia they headed the capital city. the roman road known the via. there real objection the claim that paul was the author thessalonians. there serious objection the claim that paul was the author thessalonians. around missionary group led paul and silas left philippi and went. capital city the roman province macedonia. about missionary group led paul and silas left the philippines and went,1 Thessalonians - Word,thực sự phản đối - google search - google chrome,1398
egnatia they proceed towards the strategic. the greetings there are also mentions sinvin and timothy sometimes pontoon writes. represents group people but the main author. serious objections have been made. the greetings there are also mentions sinevan and timothy sometimes pontoon writes. paul and silas left philippi and traveled westward. from the team perspective but was the. the greetings there are also mentions sinh van and timothy sometimes pontoon writes. population about two hundred thousand. the greetings there are also mentions sinevan and timothy sometimes floats write big. dispute that paul was the author thessalonians. the roman province macedonia. aegean sea modern day greece with. silvanus and timothy sometimes paul wrote. about the missionary team led. thessalonica was large port city the. there are real objections the claim that paul was the author thessalonians. the greeting also mentions. west the roman road known via egnatia they headed the capital city. the roman road known the via. there real objection the claim that paul was the author thessalonians. there serious objection the claim that paul was the author thessalonians. around missionary group led paul and silas left philippi and went. capital city the roman province macedonia. about missionary group led paul and silas left the philippines and went. </s>terms ,represents group people but the main author. serious objections have been made. paul and silas left philippi and traveled westward. from the team perspective but was the. group people but the main author. the real objection the claim that paul was the author thessalonians. nodern day greece with. population about two hundred thousand. the roman road called via egnatia they headed the capital city. dispute that paul was the author thessalonians. the roman province macedonia. from the point view group people but the main author. aegean sea modern day greece with. silvanus and timothy sometimes paul wrote. about the missionary team led. the greeting also mentions sinvin and timothy sometimes pontoon writes. big port city the. thessalonica was large port city the. there are real objections the claim that paul was the author thessalonians. iwas the author thessalonians. scn the missionary group led paul and silas left philippi and went. the greeting also mentions. west the roman road known via egnatia they headed the capital city. erspective but was the. the roman road known the via. out two hundred thousand. tions have been made. philippi and traveled westward. oceeded towards the strategic. capital city the roman province macedonia. about missionary group led paul and silas left the philippines and went,1 Thessalonians - Word,viết từ góc độ của một tập thể - google search - google chrome,1401
represents group people but the main author. serious objections have been made. paul and silas left philippi and traveled westward. from the team perspective but was the. group people but the main author. the real objection the claim that paul was the author thessalonians. nodern day greece with. population about two hundred thousand. the roman road called via egnatia they headed the capital city. dispute that paul was the author thessalonians. the roman province macedonia. from the point view group people but the main author. aegean sea modern day greece with. silvanus and timothy sometimes paul wrote. about the missionary team led. the greeting also mentions sinvin and timothy sometimes pontoon writes. big port city the. thessalonica was large port city the. there are real objections the claim that paul was the author thessalonians. iwas the author thessalonians. scn the missionary group led paul and silas left philippi and went. the greeting also mentions. west the roman road known via egnatia they headed the capital city. erspective but was the. the roman road known the via. out two hundred thousand. tions have been made. philippi and traveled westward. oceeded towards the strategic. capital city the roman province macedonia. about missionary group led paul and silas left the philippines and went. </s>egnatia they proceed towards t,egnatia they proceed towards the strategic. the greetings there are also mentions sinvin and timothy sometimes pontoon writes. serious objections have been made. paul and silas left philippi and traveled westward. from the team perspective but was the. population about two hundred thousand. dispute that paul was the author thessalonians. from the point view group people but the main author. aegean sea modern day greece with. silvanus and timothy sometimes paul wrote. about the missionary team led. thessalonica was large port city the. there are real objections the claim that paul was the author thessalonians. strategy the roman province macedonia. the greeting also mentions. west the roman road known via egnatia they headed the capital city. the roman road known the via. around missionary group led paul and silas left philippi and went. capital city the roman province macedonia,1 Thessalonians - Word,thành phố có tính chiến lược - google search - google chrome,1404
egnatia they proceed towards the strategic. the greetings there are also mentions sinvin and timothy sometimes pontoon writes. serious objections have been made. paul and silas left philippi and traveled westward. from the team perspective but was the. population about two hundred thousand. dispute that paul was the author thessalonians. from the point view group people but the main author. aegean sea modern day greece with. silvanus and timothy sometimes paul wrote. about the missionary team led. thessalonica was large port city the. there are real objections the claim that paul was the author thessalonians. strategy the roman province macedonia. the greeting also mentions. west the roman road known via egnatia they headed the capital city. the roman road known the via. around missionary group led paul and silas left philippi and went. capital city the roman province macedonia. </s>represents group people but the main author. serious objections have been made. paul and silas left philippi and traveled westward. from the team perspective but was the. group people but the main author. the real objection the claim that paul was the author thessalonians. nodern day greece with. population about two hundred thousand. the roman road called via egnatia they headed the capital city. dispute that paul was the author thessalonians. the roman pr,population about two hundred thousand people this city pushes the gentiles worship the god. thessalonica major port the city. the statues and temples the greek and roman gods were also full people and famous for their worship. the city was filled with pagan worshipers. gentiles worship gods and gods. egnatia they proceed towards the strategic. important thessalonica the province macedonia. the greetings there are also mentions sinvin and timothy sometimes pontoon writes. silvanus and timothy sometimes pau. serious objections have been made. jewish synagogue and started teaching. thessalonica was major port city the aegean what now greece. population about two hundred thousand people this city full god worshipping pagans. from the point view group people. around group missionaries led. paul and silas left philippi and traveled westward. from the team perspective but was the. paul and silas left philippi and traveled. the west the roman road. gods and was well known for its emperor. thessalonica was major port city the aegean sea what now greece with. population about two hundred thousand. thessalonica was loyal caesar cesa and gave its citizens. dispute that paul was the author. population about two hundred thousand people faction. dispute that paul was the author thessalonians. from the point view group people but the main author. aegean sea modern day greece with. silvanus and timothy sometimes paul wrote. egnatia they proceed towards the str. about the missionary team led. important thessalonica the roman province macedonia. thessalonica was loyal caesar cesa and. the idols the temples the greek and roman gods were also full people and famous for their worship. the greeting also includes. was his custom paul pouble click show white space. idols the full pantheon greek and roman. thessalonica was large port city the. capital city the roman province. the west the roman road called. there are real objections the claim that paul was the author thessalonians. from the team perspective but was. population about two hundred thousand people this city full god worshiping pagans. the greeting also mentions. west the roman road known via egnatia they headed the capital city. the roman road known the via. worship thessalonica was loyal caesar. around the transmission group. capital city the roman province macedor. there are real objections. important thessalonica rome important thessalonica the roman province macedonia. idols temples greek and roman gods. was his custom paul found the local. around missionary group led paul and silas left philippi and went. thessalonica was loyal caesar cesa and gave the citizens this city. capital city the roman province macedonia. and had granted its citizens many privileges,1 Thessalonians - Word,roman province of macedonia— thessalonica. - google search - google chrome,1409
