source,target,title,query,index
send occurs when discs are inserted. occurs when intervertebral discs are inserted. choose location near you. squeeze and bulge rupture causing low back pain. </s>fixed with pain okay. fever significant problems with feeling. acpanied red signals for unexplained weight loss fever pain the buttocks and legs. acpanied redundant symptoms such unexplained weight loss fever significant problems with feeling with pain being. due mechanical problems such muscle joint strain the pain does not away and. pine disappeared with conservative treatment. attributed mechanical problems such muscle joint strain pain does not away with conservative treatment. </s>jobs account verification request thang thank you for regist. customer testimonial get year pletely free protection for. mrna bnt one better against delta view online. pastor rich villodas being rooted christ october register. proquest religion philosophy books for alumni dear ttc alumni. our daily bread uni. print print copies each for you dear forever. discover the freedom you have christ walking the spirit. experience the new manuconnect page sign now dear customer. free understanding the lord prayer echart rose visual bible study. best selling author the deeply formed life being rooted. study assignment lesson  docs google  document. thelab thelab what with phd part pastoring and church mir,articulation these diseases are the main cause. bee tight these diseases are mon causes osteoarthritis these conditions are mon causes angina adults. lilquang  soyte hanoi gov kham chua benh pho bien kien thuc. hoc lasset_publisher ivkx jltnbg content benh xuong khop thuong gap. older adults further testing find the cause . khop suc show show. the relationship between low back pain and dysmenorrhea. how prevent arthritis these conditions are mon causes lower back pain. hoc classet publisher ivkx jltnbg content benh. phu sau year old  soyte hanoi gov kham chu. phu sau year old joint. khop suc show off thuong thuc dau lung duoi nguyen nhan. phu sau year old  soyte hanoi gov kham chua,Task 1 - Health (No Index) - Word,"đau thắt lưng dưới và bệnh loãng xương, viêm khớp, thoái hoá khớp - google search - google chrome",34
articulation these diseases are the main cause. bee tight these diseases are mon causes osteoarthritis these conditions are mon causes angina adults. lilquang  soyte hanoi gov kham chua benh pho bien kien thuc. hoc lasset_publisher ivkx jltnbg content benh xuong khop thuong gap. older adults further testing find the cause . khop suc show show. the relationship between low back pain and dysmenorrhea. how prevent arthritis these conditions are mon causes lower back pain. hoc classet publisher ivkx jltnbg content benh. phu sau year old  soyte hanoi gov kham chu. phu sau year old joint. khop suc show off thuong thuc dau lung duoi nguyen nhan. phu sau year old  soyte hanoi gov kham chua. </s>send occurs when discs are inserted. occurs when intervertebral discs are inserted. choose location near you. squeeze and bulge rupture causing low back pain. </s>fixed with pain okay. fever significant problems with feeling. acpanied red signals for unexplained weight loss fever pain the buttocks and legs. acpanied redundant symptoms such unexplained weight loss fever significant problems with feeling with pain being. due mechanical problems such muscle joint strain the pain does not away and. pine disappeared with conservative treatment. attributed mechanical problems such muscle joint strain pain does not away with conservative treatment,diagnosis treatment skin and soft tissue infections. low back pain syndrome and joint fixation any. wornd hearn amzation wish the gro. lra choose the first method that most mon practice. issued together with decision byt. around adults the munity have had child sudden appearance after sudden appearance after. degenerative disease the lumbar spine. stabilizing the disease and requiring long term treatment biologic drugs are also available. diagnosis and treatment myasthenia gravis. diagnosis and treatment knee osteoarthritis. diagnosis and treatment synovial chondroma. basic also known dmards disease modifying antirheumatic. classics methotrexate sulfasalazine hydroxychloroquine have important role. microsoft word can doc. biological dmards anti tnf anti interleukin anti lymphocyte are matched. january the minister health infectious marrow culture,Microsoft Word - Can.doc - Google Chrome,"đau thắt lưng dưới và bệnh loãng xương, viêm khớp, thoái hoá khớp - google search - google chrome",35
diagnosis treatment skin and soft tissue infections. low back pain syndrome and joint fixation any. wornd hearn amzation wish the gro. lra choose the first method that most mon practice. issued together with decision byt. around adults the munity have had child sudden appearance after sudden appearance after. degenerative disease the lumbar spine. stabilizing the disease and requiring long term treatment biologic drugs are also available. diagnosis and treatment myasthenia gravis. diagnosis and treatment knee osteoarthritis. diagnosis and treatment synovial chondroma. basic also known dmards disease modifying antirheumatic. classics methotrexate sulfasalazine hydroxychloroquine have important role. microsoft word can doc. biological dmards anti tnf anti interleukin anti lymphocyte are matched. january the minister health infectious marrow culture. </s>articulation these diseases are the main cause. bee tight these diseases are mon causes osteoarthritis these conditions are mon causes angina adults. lilquang  soyte hanoi gov kham chua benh pho bien kien thuc. hoc lasset_publisher ivkx jltnbg content benh xuong khop thuong gap. older adults further testing find the cause . khop suc show show. the relationship between low back pain and dysmenorrhea. how prevent arthritis these conditions are mon causes lower back pain. hoc classet publish,arthritis  kcb content uploads. lasset publisher ivkx jltnbg content benh xuong khop thuong gap phu.  soyte hanoi gov kham chua benh pho bien kien thuc hoc,Task 1 - Health (No Index) - Word,"đau thắt lưng dưới và bệnh loãng xương, viêm khớp, thoái hoá khớp - google search - google chrome",54
arthritis  kcb content uploads. lasset publisher ivkx jltnbg content benh xuong khop thuong gap phu.  soyte hanoi gov kham chua benh pho bien kien thuc hoc. </s>diagnosis treatment skin and soft tissue infections. low back pain syndrome and joint fixation any. wornd hearn amzation wish the gro. lra choose the first method that most mon practice. issued together with decision byt. around adults the munity have had child sudden appearance after sudden appearance after. degenerative disease the lumbar spine. stabilizing the disease and requiring long term treatment biologic drugs are also available. diagnosis and treatment myasthenia gravis. diagnosis and treatment knee osteoarthritis. diagnosis and treatment synovial chondroma. basic also known dmards disease modifying antirheumatic. classics methotrexate sulfasalazine hydroxychloroquine have important role. microsoft word can doc. biological dmards anti tnf anti interleukin anti lymphocyte are matched. january the minister health infectious marrow culture. </s>articulation these diseases are the main cause. bee tight these diseases are mon causes osteoarthritis these conditions are mon causes angina adults. lilquang  soyte hanoi gov kham chua benh pho bien kien thuc. hoc lasset_publisher ivkx jltnbg content benh xuong khop thuong gap. older adults further testing find the cause . khop s,技肝油love and take place. 技肝油multilevel spondylosis affects many parts the column. erotic and takes place,"Thoái hóa cột sống thắt lưng: Nguyên nhân, triệu chứng, chẩn đoán và điều trị | Vinmec - Google Chrome",đau thắt lưng dưới do thoái hoá khớp cột sống - google search - google chrome,56
技肝油love and take place. 技肝油multilevel spondylosis affects many parts the column. erotic and takes place. </s>arthritis  kcb content uploads. lasset publisher ivkx jltnbg content benh xuong khop thuong gap phu.  soyte hanoi gov kham chua benh pho bien kien thuc hoc. </s>diagnosis treatment skin and soft tissue infections. low back pain syndrome and joint fixation any. wornd hearn amzation wish the gro. lra choose the first method that most mon practice. issued together with decision byt. around adults the munity have had child sudden appearance after sudden appearance after. degenerative disease the lumbar spine. stabilizing the disease and requiring long term treatment biologic drugs are also available. diagnosis and treatment myasthenia gravis. diagnosis and treatment knee osteoarthritis. diagnosis and treatment synovial chondroma. basic also known dmards disease modifying antirheumatic. classics methotrexate sulfasalazine hydroxychloroquine have important role. microsoft word can doc. biological dmards anti tnf anti interleukin anti lymphocyte are matched. january the minister health infectious marrow culture,central and connective tissue joint diseases reactive arthritis. evidence bacterial antigens the synovial plaques but not culture bacteria. diseases with genetic factors. reactive arthritis can range from transient monoarthritis severe multiple lesions. systemic symptoms may include fever fatigue and weight loss arthritis can mild severe hurt. hypertrophy and connective tissue joint diseases reactive arthritis. physical and physical symptoms. hla prevalence patients pared with for healthy individuals,Viêm khớp phản ứng - Rối loạn mô cơ xương và mô liên kết - Cẩm nang MSD - Phiên bản dành cho chuyên gia - Google Chrome,viêm khớp phản ứng - google search - google chrome,124
central and connective tissue joint diseases reactive arthritis. evidence bacterial antigens the synovial plaques but not culture bacteria. diseases with genetic factors. reactive arthritis can range from transient monoarthritis severe multiple lesions. systemic symptoms may include fever fatigue and weight loss arthritis can mild severe hurt. hypertrophy and connective tissue joint diseases reactive arthritis. physical and physical symptoms. hla prevalence patients pared with for healthy individuals. </s>技肝油love and take place. 技肝油multilevel spondylosis affects many parts the column. erotic and takes place. </s>arthritis  kcb content uploads. lasset publisher ivkx jltnbg content benh xuong khop thuong gap phu.  soyte hanoi gov kham chua benh pho bien kien thuc hoc,bac giang health department. spondylolisthesis can cause pain growth spines the vertebrae even reduced ability. mobility the patient soon understand the causes and symptoms. health department news details. what spondylolisthesis symptoms causes and methods. leadership through the ages. syt bacgiang gov chi tiet tin tuc asset_publisher cwbo wizqsq content thoai hoa cot song that lung trieu chung nguyen nhan. chi tiet tin tuc asset publisher cwbo wizqsq content thoi hoa cot song that lung trieu general. bac giang join hands. deployment conference using the notebook. summary the history the disease will the basis for finding cure avoiding dangerous plications later,"Thoái hóa cột sống là gì? Triệu chứng, nguyên nhân và phương pháp điều trị - Chi tiết tin tức - UBND Tỉnh Bắc Giang - Google Chrome","thoái hoá cột sống thắt lưng (spondylosis) là một bệnh mãn tính khi đĩa đệm và khớp bị thoái hóa, xương phát triển trên đốt của cột sống - google search - google chrome",130
bac giang health department. spondylolisthesis can cause pain growth spines the vertebrae even reduced ability. mobility the patient soon understand the causes and symptoms. health department news details. what spondylolisthesis symptoms causes and methods. leadership through the ages. syt bacgiang gov chi tiet tin tuc asset_publisher cwbo wizqsq content thoai hoa cot song that lung trieu chung nguyen nhan. chi tiet tin tuc asset publisher cwbo wizqsq content thoi hoa cot song that lung trieu general. bac giang join hands. deployment conference using the notebook. summary the history the disease will the basis for finding cure avoiding dangerous plications later. </s>central and connective tissue joint diseases reactive arthritis. evidence bacterial antigens the synovial plaques but not culture bacteria. diseases with genetic factors. reactive arthritis can range from transient monoarthritis severe multiple lesions. systemic symptoms may include fever fatigue and weight loss arthritis can mild severe hurt. hypertrophy and connective tissue joint diseases reactive arthritis. physical and physical symptoms. hla prevalence patients pared with for healthy individuals. </s>技肝油love and take place. 技肝油multilevel spondylosis affects many parts the column. erotic and takes place,limited lower extremity movement due affected nerves and other functions. spine have mental health problems such anxiety and depression. have spinal injury undergo spinal surgery smoke have job. first and last name. spondylolisthesis obesity overweight sedentary lifestyle and limited exercise. lumbar spondylosis causes symptoms. symptoms diagnosis and treatment. surname and joint name mon diseases. occupation requires doing repetitive movements and increasing pressure. vinmec a grows the node the column. benefit consumption the disease mon people who have relatives who have had dementia. joint pain mon diseases. live calcification these changes the waist will cause back pain,"Thoái hóa cột sống thắt lưng: Nguyên nhân, triệu chứng, chẩn đoán và điều trị | Vinmec - Google Chrome","thoái hoá cột sống thắt lưng (spondylosis) là một bệnh mãn tính khi đĩa đệm và khớp bị thoái hóa, xương phát triển trên đốt của cột sống - google search - google chrome",132
limited lower extremity movement due affected nerves and other functions. spine have mental health problems such anxiety and depression. have spinal injury undergo spinal surgery smoke have job. first and last name. spondylolisthesis obesity overweight sedentary lifestyle and limited exercise. lumbar spondylosis causes symptoms. symptoms diagnosis and treatment. surname and joint name mon diseases. occupation requires doing repetitive movements and increasing pressure. vinmec a grows the node the column. benefit consumption the disease mon people who have relatives who have had dementia. joint pain mon diseases. live calcification these changes the waist will cause back pain. </s>bac giang health department. spondylolisthesis can cause pain growth spines the vertebrae even reduced ability. mobility the patient soon understand the causes and symptoms. health department news details. what spondylolisthesis symptoms causes and methods. leadership through the ages. syt bacgiang gov chi tiet tin tuc asset_publisher cwbo wizqsq content thoai hoa cot song that lung trieu chung nguyen nhan. chi tiet tin tuc asset publisher cwbo wizqsq content thoi hoa cot song that lung trieu general. bac giang join hands. deployment conference using the notebook. summary the history the disease will the basis for finding cure avoiding dangerous plications lat,total for the month. inherent curvature the spine. spondylolisthesis can cause pain growth spines the vertebrae even reduced ability. mobility the patient soon understand the causes and symptoms. health department news details. what spondylolisthesis symptoms causes and methods. leadership through the ages. the first day cars workers load. the first day growth and development the cup presses the nerve now column. self declared establishment tthcin. meeting with the union for massage acupressure spinal stretching infrared radiation. total for the day. bac giang join hands. the patient life will spastic preventing the rope from being pulled too much. the brain grows and the cup presses the nerve now column. total for the week. summary the history the disease will the basis for finding cure avoiding dangerous plications later,"Thoái hóa cột sống là gì? Triệu chứng, nguyên nhân và phương pháp điều trị - Chi tiết tin tức - UBND Tỉnh Bắc Giang - Google Chrome",viêm khớp kéo dài dễ dẫn đến thoái hoá khớp do tuổi hơn - google search - google chrome,139
total for the month. inherent curvature the spine. spondylolisthesis can cause pain growth spines the vertebrae even reduced ability. mobility the patient soon understand the causes and symptoms. health department news details. what spondylolisthesis symptoms causes and methods. leadership through the ages. the first day cars workers load. the first day growth and development the cup presses the nerve now column. self declared establishment tthcin. meeting with the union for massage acupressure spinal stretching infrared radiation. total for the day. bac giang join hands. the patient life will spastic preventing the rope from being pulled too much. the brain grows and the cup presses the nerve now column. total for the week. summary the history the disease will the basis for finding cure avoiding dangerous plications later. </s>limited lower extremity movement due affected nerves and other functions. spine have mental health problems such anxiety and depression. have spinal injury undergo spinal surgery smoke have job. first and last name. spondylolisthesis obesity overweight sedentary lifestyle and limited exercise. lumbar spondylosis causes symptoms. symptoms diagnosis and treatment. surname and joint name mon diseases. occupation requires doing repetitive movements and increasing pressure. vinmec a grows the node the column. benefit,some exercises for patients with lumbar spondylosis. exercise stretch the back muscles the bent leg. home page regular medical examination and treatment. and reduce pain each person should practice these movements least times day. exercise stretch the back muscles the side the legs and arms. deep expertise dedicated international focus. militaryyen and charm and. not secure benhvien mot bai tap danh cho benh nhan thoai hoa cot song that lung htm. join hands prevent epidemic,Một số bài tập dành cho bệnh nhân thoái hóa cột sống thắt lưng - Google Chrome,điều trị thoái hoá khớp cột sống - google search - google chrome,149
some exercises for patients with lumbar spondylosis. exercise stretch the back muscles the bent leg. home page regular medical examination and treatment. and reduce pain each person should practice these movements least times day. exercise stretch the back muscles the side the legs and arms. deep expertise dedicated international focus. militaryyen and charm and. not secure benhvien mot bai tap danh cho benh nhan thoai hoa cot song that lung htm. join hands prevent epidemic. </s>total for the month. inherent curvature the spine. spondylolisthesis can cause pain growth spines the vertebrae even reduced ability. mobility the patient soon understand the causes and symptoms. health department news details. what spondylolisthesis symptoms causes and methods. leadership through the ages. the first day cars workers load. the first day growth and development the cup presses the nerve now column. self declared establishment tthcin. meeting with the union for massage acupressure spinal stretching infrared radiation. total for the day. bac giang join hands. the patient life will spastic preventing the rope from being pulled too much. the brain grows and the cup presses the nerve now column. total for the week. summary the history the disease will the basis for finding cure avoiding dangerous plications later. </s>limited lower extremity movement ,people with unscientific nutrition and sedentary lifestyles. overweight and obese people. some monly prescribed drugs are paracetamol tramadol efferalgan codeine opioids pain relievers diclofenac meloxic. effective circulation and blood circulation and also prevent plications such muscle atrophy paralysis effectively. people who have had traffic accident impact that causes the spine injured. according statistics vietnam more than people over the age have problems with calcification degeneration the columns. which women have higher incidence than men. corticosteroids epidural injection special cases. celecoxib etoricoxib oral topical non steroidal anti inflammatory drug eperisone tolperisone relaxant. massage acupressure spinal stretching infrared radiation hot press back erector muscle training have strengthening effect. have relatives with degenerative spine diseases,"Thoái hóa cột sống thắt lưng L4-L5: Nguyên nhân, dấu hiệu, điều trị | Bệnh viện Đa khoa Tâm Anh - Google Chrome",điều trị thoái hoá khớp cột sống - google search - google chrome,153
people with unscientific nutrition and sedentary lifestyles. overweight and obese people. some monly prescribed drugs are paracetamol tramadol efferalgan codeine opioids pain relievers diclofenac meloxic. effective circulation and blood circulation and also prevent plications such muscle atrophy paralysis effectively. people who have had traffic accident impact that causes the spine injured. according statistics vietnam more than people over the age have problems with calcification degeneration the columns. which women have higher incidence than men. corticosteroids epidural injection special cases. celecoxib etoricoxib oral topical non steroidal anti inflammatory drug eperisone tolperisone relaxant. massage acupressure spinal stretching infrared radiation hot press back erector muscle training have strengthening effect. have relatives with degenerative spine diseases. </s>some exercises for patients with lumbar spondylosis. exercise stretch the back muscles the bent leg. home page regular medical examination and treatment. and reduce pain each person should practice these movements least times day. exercise stretch the back muscles the side the legs and arms. deep expertise dedicated international focus. militaryyen and charm and. not secure benhvien mot bai tap danh cho benh nhan thoai hoa cot song that lung htm. join hands prevent e,rehabilitation artificial hip replacement. medlatec tin tuc phuong phap dieu tri viem cot song dinh khop hieu qua nhat. good results cases requiring surgery when people. most patients with ankylosing spondylitis not require surgical treatment and surgery doesn really give much. medicine still the main method treating ankylosing spondylitis with the effect reducing pain reducing inflammation and reducing stiffness. monly used treatment drugs are non steroidal anti inflammatory drugs although they act quickly they can cause some adverse reactions. specifically the methods currently used the treatment ankylosing spondylitis include. side effects are not good for the digestive tract. medicine still the main treatment method for ankylosing spondylitis which has the effect reducing pain reducing inflammation and reducing stiffness. suffers from severe joint pain damage that requires intervention. medical services medical specialties. monly used medications are non steroidal anti inflammatory drugs although they act quickly they can cause some side effects,3 phương pháp điều trị viêm cột sống dính khớp hiệu quả nhất | Medlatec - Google Chrome,điều trị viêm cột sống dính khớp - google search - google chrome,158
rehabilitation artificial hip replacement. medlatec tin tuc phuong phap dieu tri viem cot song dinh khop hieu qua nhat. good results cases requiring surgery when people. most patients with ankylosing spondylitis not require surgical treatment and surgery doesn really give much. medicine still the main method treating ankylosing spondylitis with the effect reducing pain reducing inflammation and reducing stiffness. monly used treatment drugs are non steroidal anti inflammatory drugs although they act quickly they can cause some adverse reactions. specifically the methods currently used the treatment ankylosing spondylitis include. side effects are not good for the digestive tract. medicine still the main treatment method for ankylosing spondylitis which has the effect reducing pain reducing inflammation and reducing stiffness. suffers from severe joint pain damage that requires intervention. medical services medical specialties. monly used medications are non steroidal anti inflammatory drugs although they act quickly they can cause some side effects. </s>people with unscientific nutrition and sedentary lifestyles. overweight and obese people. some monly prescribed drugs are paracetamol tramadol efferalgan codeine opioids pain relievers diclofenac meloxic. effective circulation and blood circulation and also prevent plications such musc,dieu tri viem cot song dinh khop hieu qua nhat. spondyloarthritis treatment spondylolisthesis bination measures. joint pain the case surgery when the patient suffers from. severe joint pain damage requiring rehabilitation intervention. injury artificial hip replacement  medlatec tin tuc phuong phap,Bệnh loãng xương (osteoporosis): Một số điều cần biết - Google Chrome,điều trị loãng xương - google search - google chrome,166
