source,target,title,query,index
and when the servant the man god was risen early and gone forth behold host passed the city both with. italy here close both islands any guesses what they look like. the way the word corso italian term for carriage way formerly applied races riderless horses encyclopedia international. has four faces you can see them the flagspot. now let take look the face the lion. but why the face the man missing don know why exactly but perhaps represents the face the pilot. image courtesy nasa earthobservatoryl. and here have riderless horse. rent them two pieces. and came pass they still went and talked that behold there appeared chariot fire and horses fire and. and came pass when the lord would take elijah into heaven whirlwind that elijah went with elisha from. the head feathers this eagle bare the name cape falcone falcon. father the chariot israel and the horsemen them and saw him more and took hold his own clothes and. bonifacio means handsome face which thought was interesting because faces are very important this study also the flag sardinia. involving elisha and his servant with the syrian army surrounding them. courtesy the general libraries the university texas austin. hope this study has shown you that really have friends high places and that the horses the bible are lot more interesting than. and elisha prayed and said lord pray thee,tell what you want find. esign pdf docs pde. csb holy land illust. csb holy land illustrated bible pdf foxit reader,BH CSB Holy Land Illustrated Bible.pdf - Foxit Reader,corsica mentioned in the bible - google search - google chrome,1764
tell what you want find. esign pdf docs pde. csb holy land illust. csb holy land illustrated bible pdf foxit reader. </s>and when the servant the man god was risen early and gone forth behold host passed the city both with. italy here close both islands any guesses what they look like. the way the word corso italian term for carriage way formerly applied races riderless horses encyclopedia international. has four faces you can see them the flagspot. now let take look the face the lion. but why the face the man missing don know why exactly but perhaps represents the face the pilot. image courtesy nasa earthobservatoryl. and here have riderless horse. rent them two pieces. and came pass they still went and talked that behold there appeared chariot fire and horses fire and. and came pass when the lord would take elijah into heaven whirlwind that elijah went with elisha from. the head feathers this eagle bare the name cape falcone falcon. father the chariot israel and the horsemen them and saw him more and took hold his own clothes and. bonifacio means handsome face which thought was interesting because faces are very important this study also the flag sardinia. involving elisha and his servant with the syrian army surrounding them. courtesy the general libraries the university texas austin. hope this study has shown you that really have f,received the vietnamese women prize. who just officially swing times. disappeared the island son from. hcm freely e back still lazy. october has just been found present chance. joint research associate bac lieu mitted anh. house must have roof. tto then fisherman fishing boat qng. female mander resuscitation deputy director market hospital. lost the waters son island. found fisherman fishing boat. joint research bac lieu mitted opening among the delegates there are,"Tin tức, video mới, nóng, nhanh trong 24h - Thời sự - Tuổi Trẻ Online - Google Chrome",salona mentioned in the bible - google search - google chrome,1765
received the vietnamese women prize. who just officially swing times. disappeared the island son from. hcm freely e back still lazy. october has just been found present chance. joint research associate bac lieu mitted anh. house must have roof. tto then fisherman fishing boat qng. female mander resuscitation deputy director market hospital. lost the waters son island. found fisherman fishing boat. joint research bac lieu mitted opening among the delegates there are. </s>tell what you want find. esign pdf docs pde. csb holy land illust. csb holy land illustrated bible pdf foxit reader. </s>and when the servant the man god was risen early and gone forth behold host passed the city both with. italy here close both islands any guesses what they look like. the way the word corso italian term for carriage way formerly applied races riderless horses encyclopedia international. has four faces you can see them the flagspot. now let take look the face the lion. but why the face the man missing don know why exactly but perhaps represents the face the pilot. image courtesy nasa earthobservatoryl. and here have riderless horse. rent them two pieces. and came pass they still went and talked that behold there appeared chariot fire and horses fire and. and came pass when the lord would take elijah into heaven whirlwind that elijah went with elisha fro,tell what you want find. csb holy land illust. csb holy land illustrated bible pdf foxit reader,BH CSB Holy Land Illustrated Bible.pdf - Foxit Reader,du lich da lat tháng 10 năm 2021 - google search - google chrome,1766
tell what you want find. csb holy land illust. csb holy land illustrated bible pdf foxit reader. </s>received the vietnamese women prize. who just officially swing times. disappeared the island son from. hcm freely e back still lazy. october has just been found present chance. joint research associate bac lieu mitted anh. house must have roof. tto then fisherman fishing boat qng. female mander resuscitation deputy director market hospital. lost the waters son island. found fisherman fishing boat. joint research bac lieu mitted opening among the delegates there are. </s>tell what you want find. esign pdf docs pde. csb holy land illust. csb holy land illustrated bible pdf foxit reader,gazara gazathites gazathites the. onet only exact search. they are more monly called the maccabean period they were restless and fond war and often hired themselves out. romans and about the same time was that gallia cisalpina was reduced the form roman province and. mentioned practically the same connection macc the reference without doubt the asiatic gauls galatians. copyright translation ment suggestion website problem suggestion. spain not much however can defeat successful from this the notice them rhetorical and the antiochus. are somewhat obscure subjects but the ancient authorities leave doubt the main facts macc difficult say. not secure classic net bible  dictionary php word dgauls. gath hepher gath rimmon gather gathrimmon gaulanitis gauls gaza gazabar. the context that they are mentioned being under tribute the romans and also from their mention connection with. iphone mobile net bible. occurred the defeat antiochus king asia mommsen argues that the reference the gauls the north italy from. are somewhat obscure subjects but the ancient authorities leave. romans and about the same time was that gallia cisalpi thessalonica crescens went galatia and titus dalmatia. for eis galatian the emigration the gauls from europe and their. classic net bible  verse php book chapter verse. for eis galatian the emigration the gauls from europe and their settlement the central region the peninsula asia minor. auxiliaries the asiatic kings. whether judas maccabeus referring the gauls europe the for demas deserted since loved the present age and went. tip use the study. gauls golz galatai galatia asia minor literally the gallia the east its inhabitants are called galli roman writers. whether judas maccabeus referring the gauls europe the gauls asia minor both became finally subject the. just the inhabitants ancient france are called galatai greek writers some manuscripts tim eis gallian read,NETBible: Gauls - Google Chrome,gallia mentioned in the bible - google search - google chrome,1768
gazara gazathites gazathites the. onet only exact search. they are more monly called the maccabean period they were restless and fond war and often hired themselves out. romans and about the same time was that gallia cisalpina was reduced the form roman province and. mentioned practically the same connection macc the reference without doubt the asiatic gauls galatians. copyright translation ment suggestion website problem suggestion. spain not much however can defeat successful from this the notice them rhetorical and the antiochus. are somewhat obscure subjects but the ancient authorities leave doubt the main facts macc difficult say. not secure classic net bible  dictionary php word dgauls. gath hepher gath rimmon gather gathrimmon gaulanitis gauls gaza gazabar. the context that they are mentioned being under tribute the romans and also from their mention connection with. iphone mobile net bible. occurred the defeat antiochus king asia mommsen argues that the reference the gauls the north italy from. are somewhat obscure subjects but the ancient authorities leave. romans and about the same time was that gallia cisalpi thessalonica crescens went galatia and titus dalmatia. for eis galatian the emigration the gauls from europe and their. classic net bible  verse php book chapter verse. for eis galatian the emigration the gauls from eur,csb holy land illustrated bible pdf foxit reader. tell what you want,BH CSB Holy Land Illustrated Bible.pdf - Foxit Reader,is gaul mentioned in the bible - google search - google chrome,1770
csb holy land illustrated bible pdf foxit reader. tell what you want. </s>gazara gazathites gazathites the. onet only exact search. they are more monly called the maccabean period they were restless and fond war and often hired themselves out. romans and about the same time was that gallia cisalpina was reduced the form roman province and. mentioned practically the same connection macc the reference without doubt the asiatic gauls galatians. copyright translation ment suggestion website problem suggestion. spain not much however can defeat successful from this the notice them rhetorical and the antiochus. are somewhat obscure subjects but the ancient authorities leave doubt the main facts macc difficult say. not secure classic net bible  dictionary php word dgauls. gath hepher gath rimmon gather gathrimmon gaulanitis gauls gaza gazabar. the context that they are mentioned being under tribute the romans and also from their mention connection with. iphone mobile net bible. occurred the defeat antiochus king asia mommsen argues that the reference the gauls the north italy from. are somewhat obscure subjects but the ancient authorities leave. romans and about the same time was that gallia cisalpi thessalonica crescens went galatia and titus dalmatia. for eis galatian the emigration the gauls from europe and their. classic net bible  verse ,after scolding want let. paul preaches rome under guard. paul preaches rome under guardet scolded and wanted let,Công-vụ các Sứ-đồ 28 | Kinh Thánh Tiếng Việt 1925 | Kinh Thánh Tiếng Việt - Kinh Thánh Online - Google Chrome,is sicily mentioned in the bible - google search - google chrome,1772
after scolding want let. paul preaches rome under guard. paul preaches rome under guardet scolded and wanted let. </s>csb holy land illustrated bible pdf foxit reader. tell what you want. </s>gazara gazathites gazathites the. onet only exact search. they are more monly called the maccabean period they were restless and fond war and often hired themselves out. romans and about the same time was that gallia cisalpina was reduced the form roman province and. mentioned practically the same connection macc the reference without doubt the asiatic gauls galatians. copyright translation ment suggestion website problem suggestion. spain not much however can defeat successful from this the notice them rhetorical and the antiochus. are somewhat obscure subjects but the ancient authorities leave doubt the main facts macc difficult say. not secure classic net bible  dictionary php word dgauls. gath hepher gath rimmon gather gathrimmon gaulanitis gauls gaza gazabar. the context that they are mentioned being under tribute the romans and also from their mention connection with. iphone mobile net bible. occurred the defeat antiochus king asia mommsen argues that the reference the gauls the north italy from. are somewhat obscure subjects but the ancient authorities leave. romans and about the same time was that gallia cisalpi thessalonica crescens went ,pde like. tell what you want find. csb holy land illust. csb holy land illustrated bible pdf foxit reader,BH CSB Holy Land Illustrated Bible.pdf - Foxit Reader,is sicily mentioned in the bible - google search - google chrome,1774
pde like. tell what you want find. csb holy land illust. csb holy land illustrated bible pdf foxit reader. </s>after scolding want let. paul preaches rome under guard. paul preaches rome under guardet scolded and wanted let. </s>csb holy land illustrated bible pdf foxit reader. tell what you want,province acquired the roman republic enpassing the island sicily. and second servile wars the second century the first century the. during the roman republic the island was the main source grain for the city. not logged talk contributions create account log. the province sicily within the roman. remain independent ally rome until its defeat during the. the conclusion the first punic war with carthage praetor was regularly. banditry under control began advancing. reanised with large roman colonies being established several major. the western part the island was brought under roman control. rome extraction was heavy provoking armed uprisings known the first. province the roman empire. and holding the women bondage. second punic war then the province included the whole the island. established after the end. sicily the island malta and the smaller island groups the egadi islands the. acareculi raroly mentioned litoran cources but arehaealesuand. the civil wars which brought the roman republic end sicily was. sicilia sılia classical latin ancient greek eikeaía was the first. island finally came under the control augustus was significantly. for most the imperial period the province was peaceful agrarian territory. had reanized the mercenaries and was able bring. response this the syracusan general hiero who. from wikipedia the free encyclopedia. roman governor verres was famously prosecuted for his corruption cicero. wikipedia  wiki sicilia_ roman_province. controlled sextus pompey opposition the second triumvirate when the. assigned the island from the kingdom syracuse under hieron. lipari islands ustica and pantelleria. fall the western roman,Sicilia (Roman province) - Wikipedia - Google Chrome,sicilia in the bible - google search - google chrome,1775
province acquired the roman republic enpassing the island sicily. and second servile wars the second century the first century the. during the roman republic the island was the main source grain for the city. not logged talk contributions create account log. the province sicily within the roman. remain independent ally rome until its defeat during the. the conclusion the first punic war with carthage praetor was regularly. banditry under control began advancing. reanised with large roman colonies being established several major. the western part the island was brought under roman control. rome extraction was heavy provoking armed uprisings known the first. province the roman empire. and holding the women bondage. second punic war then the province included the whole the island. established after the end. sicily the island malta and the smaller island groups the egadi islands the. acareculi raroly mentioned litoran cources but arehaealesuand. the civil wars which brought the roman republic end sicily was. sicilia sılia classical latin ancient greek eikeaía was the first. island finally came under the control augustus was significantly. for most the imperial period the province was peaceful agrarian territory. had reanized the mercenaries and was able bring. response this the syracusan general hiero who. from wikipedia the free encyclope,now after these things were finished paul purposed the spirit. you and have been prevented from obtaining far that may some fruit among. greeks and barbarians both the wise and the foolish for part. bible knowing jesus  topics rome. have been there must also see rome. you also even among the rest the gentiles under obligation both. jerusalem after had passed through macedonia and achaia saying afteri. not want you unaware brethren that often have planned e. eager preach the gospel you also who are rome,28 Bible verses about Rome - Google Chrome,sicilia in the bible - google search - google chrome,1776
now after these things were finished paul purposed the spirit. you and have been prevented from obtaining far that may some fruit among. greeks and barbarians both the wise and the foolish for part. bible knowing jesus  topics rome. have been there must also see rome. you also even among the rest the gentiles under obligation both. jerusalem after had passed through macedonia and achaia saying afteri. not want you unaware brethren that often have planned e. eager preach the gospel you also who are rome. </s>province acquired the roman republic enpassing the island sicily. and second servile wars the second century the first century the. during the roman republic the island was the main source grain for the city. not logged talk contributions create account log. the province sicily within the roman. remain independent ally rome until its defeat during the. the conclusion the first punic war with carthage praetor was regularly. banditry under control began advancing. reanised with large roman colonies being established several major. the western part the island was brought under roman control. rome extraction was heavy provoking armed uprisings known the first. province the roman empire. and holding the women bondage. second punic war then the province included the whole the island. established after the end. sicily the island malta and ,territory under roman control. csb holy land illust. tell what you want. csb holy land illustrated bible pdf foxit reader,BH CSB Holy Land Illustrated Bible.pdf - Foxit Reader,sicilia in the bible - google search - google chrome,1777
territory under roman control. csb holy land illust. tell what you want. csb holy land illustrated bible pdf foxit reader. </s>now after these things were finished paul purposed the spirit. you and have been prevented from obtaining far that may some fruit among. greeks and barbarians both the wise and the foolish for part. bible knowing jesus  topics rome. have been there must also see rome. you also even among the rest the gentiles under obligation both. jerusalem after had passed through macedonia and achaia saying afteri. not want you unaware brethren that often have planned e. eager preach the gospel you also who are rome. </s>province acquired the roman republic enpassing the island sicily. and second servile wars the second century the first century the. during the roman republic the island was the main source grain for the city. not logged talk contributions create account log. the province sicily within the roman. remain independent ally rome until its defeat during the. the conclusion the first punic war with carthage praetor was regularly. banditry under control began advancing. reanised with large roman colonies being established several major. the western part the island was brought under roman control. rome extraction was heavy provoking armed uprisings known the first. province the roman empire. and holding the women bon,csb holy land illustrated bible pdf foxit reader. tell what you want. merge and split pdfs,BH CSB Holy Land Illustrated Bible.pdf - Foxit Reader,sarmatia in the bible - google search - google chrome,1778
csb holy land illustrated bible pdf foxit reader. tell what you want. merge and split pdfs. </s>territory under roman control. csb holy land illust. tell what you want. csb holy land illustrated bible pdf foxit reader. </s>now after these things were finished paul purposed the spirit. you and have been prevented from obtaining far that may some fruit among. greeks and barbarians both the wise and the foolish for part. bible knowing jesus  topics rome. have been there must also see rome. you also even among the rest the gentiles under obligation both. jerusalem after had passed through macedonia and achaia saying afteri. not want you unaware brethren that often have planned e. eager preach the gospel you also who are rome,are you too busy for quiet times view this email your brow. another free book newman grammar assent you are una. the old rugged cross will cling the old rugged cross and. lazada received your order your order reque. every hair your head was made with love the lord words.  thedtl worldcat   thedtl worldcat . ask god for the impossible connecting the dots daily devotion. delivery date estimates updated load bills ecoupon laz. please read this message from prison fellowship ang. why need church family monday encouragement devotion. via messenger always via,"Inbox (11,056) - ghidanhwtc@gmail.com - Gmail - Google Chrome",,1785
are you too busy for quiet times view this email your brow. another free book newman grammar assent you are una. the old rugged cross will cling the old rugged cross and. lazada received your order your order reque. every hair your head was made with love the lord words.  thedtl worldcat   thedtl worldcat . ask god for the impossible connecting the dots daily devotion. delivery date estimates updated load bills ecoupon laz. please read this message from prison fellowship ang. why need church family monday encouragement devotion. via messenger always via. </s>csb holy land illustrated bible pdf foxit reader. tell what you want. merge and split pdfs. </s>territory under roman control. csb holy land illust. tell what you want. csb holy land illustrated bible pdf foxit reader,alpine mountain google search  google . africa the bible google search  google . alps mountain the bible google search  google . malta island the bible google search  google . cards from other devices. alps mountain google search  google . kinhthanh httlvn  doc kinh thanh dvi. illyricum the bible google search  google . salona the bible google search  google . your google account has. africa bible google search  google . dalmatia the bible google search  google . there may types browsing history. timothy vietnamese bible awe,Nhật ký - Google Chrome,egypt in the bible verses - google search - google chrome,1786
alpine mountain google search  google . africa the bible google search  google . alps mountain the bible google search  google . malta island the bible google search  google . cards from other devices. alps mountain google search  google . kinhthanh httlvn  doc kinh thanh dvi. illyricum the bible google search  google . salona the bible google search  google . your google account has. africa bible google search  google . dalmatia the bible google search  google . there may types browsing history. timothy vietnamese bible awe. </s>are you too busy for quiet times view this email your brow. another free book newman grammar assent you are una. the old rugged cross will cling the old rugged cross and. lazada received your order your order reque. every hair your head was made with love the lord words.  thedtl worldcat   thedtl worldcat . ask god for the impossible connecting the dots daily devotion. delivery date estimates updated load bills ecoupon laz. please read this message from prison fellowship ang. why need church family monday encouragement devotion. via messenger always via. </s>csb holy land illustrated bible pdf foxit reader. tell what you want. merge and split pdfs,territory under roman control. the state roman the days auguste,BẢN ĐỒ P 1438 (Last saved by user) - Word,olympia in the bible verses - google search - google chrome,1789
territory under roman control. the state roman the days auguste. </s>alpine mountain google search  google . africa the bible google search  google . alps mountain the bible google search  google . malta island the bible google search  google . cards from other devices. alps mountain google search  google . kinhthanh httlvn  doc kinh thanh dvi. illyricum the bible google search  google . salona the bible google search  google . your google account has. africa bible google search  google . dalmatia the bible google search  google . there may types browsing history. timothy vietnamese bible awe. </s>are you too busy for quiet times view this email your brow. another free book newman grammar assent you are una. the old rugged cross will cling the old rugged cross and. lazada received your order your order reque. every hair your head was made with love the lord words.  thedtl worldcat   thedtl worldcat . ask god for the impossible connecting the dots daily devotion. delivery date estimates updated load bills ecoupon laz. please read this message from prison fellowship ang. why need church family monday encouragement devotion. via messenger always via,the lycia and ucia. csb holy land illustrated bible pdf foxit reader. tell what you want. italio caucasus mis via,BH CSB Holy Land Illustrated Bible.pdf - Foxit Reader,memphis in the bible verses - google search - google chrome,1791
